chunk,Reasoning_type,Question,Answer,Difficulty,Context,A_start_end,similar_chunks,Cluster_labels,ID,Answer Relevancy Scores_gpt-4o,Faithfulness Scores_gpt-4o,Hallucination Scores_gpt-4o,Question Faithfulness Scores_gpt-4o,SE_penalized,Keywords
"Digging out the molecular connections between the active site of human lysosomal alpha-mannosidase and its pathophysiology Human lysosomal alpha-mannosidase (hLAMAN) is a paradigmatic example of how few missense mutations can critically affect normal catabolism in the lysosome and cause the severe condition named alphamannosidosis. Here we have made use of computational chemistry methods to unveil the molecular basis of 4 missense mutations in hLAMAN with pathological consequences. We have simulated for the first time the all-atom catalytic reaction mechanism of hLAMAN by means of quantum mechanics/molecular mechanics metadynamics.Second, we show how the catalytically inactive variant D74E presents a significant increase of the free energy barrier. Third, we have identified that the D159N and E402K mutations are connected with the active site movement.",Causal,How do missense mutations in human lysosomal alpha-mannosidase affect normal catabolism and cause alphamannosidosis?,Answer not available from the given context. ,Negative,['Human lysosomal alpha-mannosidase (hLAMAN) is a paradigmatic example of how few missense mutations can critically affect normal catabolism in the lysosome and cause the severe condition named alphamannosidosis.'],"[[0, 333]]","['Finally, we show that mutation R229W does not alter the balance between the hydrophilic and hydrophobic solvent accessible surface area in the protein, but does affect the active site dynamics. Our findings open up new opportunities for treatment of mannosidosis.Human lysosomal alpha-mannosidase (LAMAN, EC 3.2.1.24) belongs to the Zn 2+ -dependent aspartic glycosidase hydrolase family GH38. hLAMAN catalyzes the cleavage of end-terminal mannosidic linkages α(1→2), α(1→3), and α(1→6) from glycoproteins (Figure ). hLAMAN has a large globular domain (962 amino acids) with the active site centered in the helix core (Figure ). The total or partial loss of this enzyme activity by missense mutations is behind the diagnosis of the rare genetic disorder alpha-mannosidosis (MANSA). MANSA is grouped with other lysosomal storage disorders (LSDs), and, although it has a very low incidence (1 out of 500,000), this number could increase because of undiagnosed patients. MANSA is characterized by several symptoms as intellectual disability, unusual facial features, or skeletal anomalies, amongst others. Despite the remarkable severity of some of the symptoms in MANSA, there is no permanent cure yet. Brown marrow transplantation and enzyme replacement therapy -via administration of the recombinant enzyme (i.e. alpha Velmanase, Lamzede®) <ref', 'CV1Additionally, the distances dHa-Og and dC1-On in the D74E ER complex slightly increase 0.12 and 0.08 Å, respectively (Table and Figure ). Overall, these changes in the Zn 2+ -coordination sphere and in the puckering of the reactant end up in significant increase in the energy barrier of the catalyzed reaction by the D74E variant. Furthermore, we wanted to look for other mutations on hLAMAN that may affect the conformation of the active site. To do this, we computed bond-to-bond propensities in the wild-type hLAMAN using the server ProteinLens to detect distal regions in the enzyme connected with the movement of the active site. In Figure and Table , we highlight the 50 residues identified to have a significant correlation with the active site within a 95 % quantile score. Interestingly, the algorithm detected two out of 26 known sequence positions related to catalytically-deficient hLAMAN variants: D159 and E402.Mutations in these positions drive to inactive variants (D159N and E402K) that, although they can fold and reach the lysosome, cannot process oligosaccharides. Visual inspection of our atomic model for wild-type hLAMAN indicates that the change D \uf0ae N on position 159 (at 10 Å from the active site) will prevent the dual interaction of the aspartic carboxylate with the amide hydrogens of A161 and A162 in the enzyme variant (Figure ). More critical is the change in position 402, where the introduction of a lysine residue in the position of a glutamic acid creates an electrostatic repulsion with the R403 amidinium group (located on the same helix) and a change in the orientation of the side chain of Q444, residue located close to one of', 'violin plots. No significant differences were found between the three systems. The variant R229W shows a slightly larger hydrophobic SASA component (+1 nm 2 ) and lower hydrophilic SASA (-0.4 nm 2 ) when compared with the wild-type enzyme (Table ), but no major conformational changes were detected in the two mutated systems (Figures and). Thus, our computational data confirm that the mutation R229W does not change the hydrophilic patterning of the surface or the total conformation of the protein, but rather modifies the network of interactions of the active site with its first sphere environment (F377).On the one hand, we have found that the Zn 2+ -dependent hLAMAN follows an E5 \uf0ae 4 H5/ 1 S5 \uf0ae 1 S5 conformational itinerary, similar to the one observed in the Ca 2+ -dependent GH92 α-mannosidase. On the other hand, overall, in this work we have used different computational approaches to understand at the atomic level the impact that several mutations have on the biological role of hLAMAN. We have shed light on the molecular basis of the pathophysiology of 4 missense mutations in LAMAN. D74E shows a larger energy barrier, D159N and E402K may affect the conformation at the active site, and R229Wdoes not impact the SASA distribution in hLAMAN and its effect should be connected with the chemical dynamics of the active site. Overall, our findings open up new avenues for targeting hLAMAN with new tools that can be used for the screening of small organic molecules with the aim of modulating its enzyme activity. Further studies are ongoing within our research group.Figure 1 .1Figure 1. (A) Example of targeted oligosaccharides by hLAMAN at the lysosome. (B) Detail of the active site of hLAMAN (as grey cartoons) in the presence of the substrate BMA (C-atoms', 'recombinant enzyme (i.e. alpha Velmanase, Lamzede®) are the two current available therapies for handling alpha-mannosidosis.Disease-associated variants can have altered protein flexibility, substrate/cofactor binding or their posttranslational modification pattern. In MANSA, more than 130 pathogenic variants have been detected from which 54 are point mutations described to alter the normal intracellular processing and/or the 3D structure of the enzyme. As an example, the frequent R750W mutation (in more than 20% of MANSA patients) prevents the correct folding of the enzyme, and mutations like D74E, H200L or H200N alter totally the coordination sphere of the metal ion at the active site. Interestingly, out of these 54 mutations, 26 are known to have a significant loss of enzymatic activity (Table ). However, the molecular features that are responsible for preventing a full alpha-mannosidase activity still remain elusive. First, the absence of experimental structural models on hLAMAN undermines the development of fundamental knowledge of the molecular specifics behind these disabling mutations, and second, no all-atom catalytic reaction mechanism has been reported so far for this enzyme. In this work, we address these two challenges in order to unravel the structural features that connect enzyme activity and some of these disabling mutations. We first generated an all-atom molecular model for hLAMAN using the deep-learning structure from AlphaFold2 (Figure ). hLAMAN shows a very large sequence identity and structural similarity with both bovine LAMAN (bLAMAN, PDB id. 1O7D) and Drosophila melanogaster Golgi alpha-mannosidase II (GM-II, PDB id.', 'LAMAN (bLAMAN, PDB id. 1O7D) and Drosophila melanogaster Golgi alpha-mannosidase II (GM-II, PDB id. 3CZN) (see Figure and Section S1). The confidence obtained for the deeplearning model was extremely high for almost all residues in the structure of hLAMAN with exception of the N-terminal signal peptide (residues 1-49), which was thus removed in our simulations. We placed the substrate \uf061-D-mannopyranose-(1-6)-\uf062-D-mannopyranose (BMA) at the active site and ran classical molecular dynamics (MD) simulations on the \uf06ds-time scale to equilibrate, solvate and refine this complex (see Section S2). We applied distance restraints to preserve the key interactions for catalysis between the substrate BMA and both Asp196 and Asp319 residues. After equilibration, we gradually removed these constraints until we got a unrestrained system. As an outcome, we selected one snapshot of the final equilibrated system and ran quantum mechanics/molecular mechanics (QM/MM) metadynamics during 170 ps (Figure and Sections S3-S). The QM region definition included the coordination sphere of Zn 2+ (Asp196, Asp74, His72, and His445 side chains starting from the \uf062-carbon), the BMA substrate, and the side chain of the acid/base catalytic Asp319 (87 atoms in total, Figure ). We treated the QM region with the semiempirical tight-binding density functional theory DFTB3. Before simulating the enzyme-catalyzed reaction mechanism, we screened the puckering of the ring at the subsite -1 (-1 ring) in BMA for the enzyme-reactant (ER) complex (Figure and Section S3). We ran a QM/MM metadynamics to explore the conformational free energy']","['Quantum and theoretical chemistry', 'Quantum effects']",2914,1,1,0,0.800131627,0.675900745,['how']
"molecular descriptors, yet another modification of atom pairs, is proposed and examined in QSAR and QSPR applications. Traditional atom pairs are modified in a way of associating various atom pairs with values taken from quantum-chemical calculations.",Causal,Why are traditional atom pairs modified by associating them with values from quantum-chemical calculations in QSAR and QSPR applications?,Answer not available from the given context. ,Negative,['Traditional atom pairs are modified in a way of associating various atom pairs with values taken from quantum-chemical calculations.'],"[[119, 251]]","['ConclusionsIn the research, novel molecular descriptors were introduced by modifying traditional atom pairs to contain information from quantum chemistry. The biggest improvements in validation metrics were obtained when models performed regression tasks -in 5 out of 6 databases there was an improvement in mean values of metrics. U Mann-Whithney test confirmed that in 3 cases the results obtained in cross-validation folds were significantly different. In contrast to quantum chemical calculations of whole molecules and applying them as molecular descriptors, the generation of quantum atom pairs is a rapid and easy process.Although boosting standard atom pairs with quantum information, the number of quantum atom pairs is limited and further research to overcome the problem should be conducted.A possible solution could be the creation of a larger database of quantum properties that would contain molecules build of more chemical elements than QM9-extended-plus database.Other modifications of the quantum atom pairs could be achieved by calculating more than 1 .1a sum of the quantum properties of atom pairs present in the molecule -11 descriptors (sumQAP), 2. a sum of the histograms of the atom pairs -110 descriptors per molecule (hQAP), 3. a vector of quantum properties of atom pairs -11979 values (spQAP) Figure 1 :Figure 2 :12Figure 1: R of regression tasks modelling. The black lines represent the 95% confidence intervals.', ""IntroductionQuantitative structure-activity/property relationship (QSAR/QSPR) methods depend on the transformation of molecules' structures to numbers. Molecular descriptors are applied to conduct the transformation of chemicals to numerical representation. There are a lot of different molecular descriptors -some of them attempt to encode properties of the compound, others try to catch the complexity of the molecule etc. There are also molecular descriptors that rely on fragments of molecules eg. extended connectivity fingerprints (ECFP), atom pairs and topological torsion descriptors. In many cases, these types of descriptors transform molecules into vectors of the same length of either zeros or ones -called bits or vectors of the counts of each molecular fragment.The application of molecular descriptors is not limited only to QSAR/QSPR but also to the determination of similarity of molecules. The descriptors of continuous values may be gathered into a vector and the similarity as a Euclidean distance between two molecules can be computed. The bits representation vectors are the basis for calculating similarity coefficients, like the Tanimoto index.Since the introduction by Carhart et. al., the idea of atom pairs has been modified several times and applied to build various models. In this research novel molecular descriptors, yet another modification of atom pairs, is proposed and examined in QSAR and"", 'Quantum informed atom pairsTo enrich atom pairs with quantum-chemical properties, 1089 unique atom pairs of distance of up to 4 bonds were generated from QM9-extended-plus database. Based on the set of unique atom pairs, two different approaches to define quantum atom pairs (QAP) were undertaken.In the first definition, every atom pair was assigned with arithmetic means of quantum properties of all molecules containing the atom pair. In the case of multiple occurrences of an atom pair in the molecule, the property value was divided by the number of occurrences.Since there are 11 quantum properties in the quantum properties database, every atom pair was related with 11 values.The alternative definition was to generate 10 binned histograms out of the values of quantum properties of molecules containing specific atom pair, divided by the number of occurrences of the atom pair. As a result, 110 different values were assigned to atom pairs. The nature of modified atom pairs makes them highly dependent on the composition of the quantum properties database which impacts the applicability domain of QAP. Due to the narrow group of elements present in the QM9-extended-plus database, atom pairs are limited to C, O, N, F, S, Cl, and Br elements. The limitation transfers to the applicability domain. In the research molecules containing only atom pairs from the set generated from the QM9-extended-plus database were curated from experimental databases.From the aforementioned QAPs, three sets of molecular descriptors were generated: ', ""Results and discussionThe results indicate that in most cases QAPs provide enough information to yield predictions more accurate than the baseline. Among designed QAPs, spQAPs proved to be the most informative, thus this type of representation was investigated the most. It appears that in some cases enriching atom pairs with information derived from quantum chemistry improves the accuracy of the models relative to traditional atom pairs.Considering regression tasks, based on figures 1 and 2 representing R 2 and RMSE respectively, the overall impression is that the best models' performance is achieved with molecular descriptors, then spQAP and then unmodified atom pairs. Only in the case of predicting pIC50, the most informative molecular representation were atom pairs. Another exception was ionization energy, as Morgan fingerprints and RDKit fingerprints were better suited to create structure-property relationships.In order to gain more insight into the differences in metrics obtained with spQAP and atom pairs, the relative metrics were calculated as the ratio of metric value obtained with spQAP to the value obtained with atom pairs minus 1. The ratio was calculated for each cross validation fold and visualized in figures 3 and 4. The quantum modification of atom pairs caused an average value of R 2 increase from 0.5% to 6% and the RMSE decreased about 0.5% to 5% depending on the predicted property. In the case of predicting pIC50, the average decrease of R 2 was 2% and the RMSE increased by about 3%. tors and RDKit fingerprints. The phenomenon may result from the imbalanced nature of the BBBP and ClinTox datasets. Although ROC AUC is widely used in evaluating classifiers, there are reports that it may be misleading when the dataset is imbalanced. To complement the results, an U Mann-Whithney test was applied to assess whether the results of metrics vary"", 'Towards quantum informed atom pairs In the following research, a new modification of traditional atom pairs is studied.The atom pairs are enriched with values originating from quantum chemistry calculations. Random forest machine learning algorithm is applied in modelling 10 different properties and biological activities based on different molecular representations and evaluated in repeated cross-validation. The predictive power of modified atom pairs -quantum atom pairs are compared to the predictive powers of traditional molecular representations known and widely applied in cheminformatics. Root mean squared error, R 2 , the area under the receiver operation curve and balanced accuracy are used to evaluate the predictive power of applied molecular representations. The research shows that while performing regression tasks, the quantum atom pairs provide better fitting to the data than their precursors.']","['Quantum and theoretical chemistry', 'Quantum effects']",2965,1,1,0,0.916598134,0,['why']
"weights belong to elements that are rarely encountered in nature, which do not form large deposits, and which have, as a consequence, been little studied"" .As elements populate the space through combinations with others, we wondered how distributed the combinations of elements were.",Causal,Why have elements that do not form large deposits and are rarely encountered in nature been little studied?,Answer not available from the given context. ,Negative,"['weights belong to elements that are rarely encountered in nature, which do not form large deposits, and which have, as a consequence, been little studied.']","[[0, 283]]","['Chemical space: provider of order and similarityIn the 1860s chemists ordered elements by their atomic weights. Mendeleev, in his second 1869 publication about the system, discussed the pros and cons of selecting other properties as ordering criterion, e.g. electrochemical properties, relative affinities and valency . Mendeleev settled on atomic weight, mainly based upon its invariability across all substances containing a particular element. Compounds were central for atomic weight determinations, which resulted from finding the smallest common weight of a large set of compounds containing the reference element. Similarity among elements was addressed through chemical resemblance, which for Meyer was captured through common valency in compounds. Mendeleev commented upon physical properties such as optical, electrical or magnetic ones and vapour densities , but discarded them for their variability over compounds of the same element. He was after a property related to the essential presence of an element in its compounds, which moved him to analyse chemical properties such as acidity or alkalinity of oxides. However, they were ruled out because of the several amphoteric oxides. Mendeleev ended up taking substance composition as the proxy for similarity, which boils down to the valency, selected by Meyer. ""Thus the fluorine group contains elements which preferentially combine with a single atom of hydrogen, the oxygen group with two, the nitrogen group with three, and the carbon group with four atoms of hydrogen or chloride"" , Mendeleev claimed. Thus, compounds provided order and similarity to the system.', 'Diversity of the chemical space: combinations of elementsBy a combination we mean the elements present in a compound and arranged in lexicographic order, e.g. HOS for H 2 SO 4 . We found 3,022 combinations and analysed the distribution of their sizes (number of elements). Was the space populated with compounds of several elements? Or with substances of just few elements? For 60 elements, there are 1.15 × 10 18 possible combinations (Methods). We found that chemists reported compounds of few elements: from two up to eight. Moreover, about three quarters of the combinations were of three up to five elements (Figure ). The differences between experimental and theoretical number of combinations across the different sizes (Figure ), show that there was still plenty of opportunity to populate the space with new compounds within the observed range.To assess whether the space was also concentrated on some few combinations, we analysed the percentage of chemical space spanned by combinations weighted by their compounds (Figure ). The left hand side of the plot shows that combinations associated to one compound only, account for about 13% of the space. The right hand side shows the most frequent combinations: CHO and CHNO, which account for 8% and 7.5% of the space, respectively. We found that 37% of the combinations (1,120) account for 80% of the compounds and only 172 combinations spanned about half of the space. Strikingly, only 6% of the combinations gathered 50% of the reported substances. The top-20 of these combinations (Figure ) account for 30% of the space and their compositions show that the most populated combinations are based on organogenic elements including C, H, O, N, Cl, S, Br; which are among the elements with most compounds (Figure <ref', 'Er and Yb, which were separated one year later into the current Er, Ho and Tm; and Sc and a Yb, respectively . In 1907 the 1879 Yb was found to be a mixture of the current Lu and Yb . Moreover, there was confusion between erbium and terbium on the basis of their spectra and it is now known that Di, reported by Mendeleev as a chemical element, is a mixture of Pr and Nd. Therefore, we excluded Er, Yt and Di from our analysis and all the remaining study is based on our findings for the aforementioned 60 elements.To know the extent of the chemical space populated by the different elements, we counted the number of compounds containing each element (Figure ; Supplementary, Table ), where the enormous amount of O, H, C and N compounds is evident. Were O compounds absent, only 26% of the space would remain. If H substances were also removed, the available space would be 11.4%. By ignoring compounds containing O, H or C, the spanned space would be only 6% of that of 1869, which drops to 5% if N substances were disregarded. The importance of these organogenic elements contrasts with the percentage of space spanned if other quartets of elements were deleted. For example, removing halogen compounds would have much less dramatic effects, as 64% of the space would remain. Disregarding elements with few compounds such as Ta, Ce, Th and La would allow access to 96% of the space.Thus, the chemical space was rather unevenly explored by 1869, oxygen and hydrogen being the elements with most compounds. Chemists were aware of this, as Mendeleev wrote: ""The most widely distributed substances in nature possess the smallest atomic weights"" and ""The higher atomic weights belong to elements that are rarely encountered in nature, which do not form large deposits,', 'half of the formulae of 85% of the elements, they can be replaced by their most similar element. Hence, the chemical space by 1869 made most of the elements to be dissimilar from each other. In such a space of tiny similarities, chemists, nevertheless, were able to recognise several of them. Was it the result of chemical genius? Or a consequence of the organogenic bias of the space?To assess whether deep knowledge of the space was needed to gauge simi-larities among elements, or, on the contrary, whether partial knowledge sufficed to detect similarities, we took random samples of the formulae in the space of different sizes and analysed how often the similarities given by the whole formulae in the space (Figure ) were present in the samples (Methods). After analysing the 9,752 formulae spanning the space, we found that there are stable similarities, still evident in tiny portions of the space, e.g. Br→Cl, Na→K, O→S, Cl→Br, S→O, K→Na, Se→S, As→P (shown at the top of Figure ). For example, Br→Cl is a similarity often observed with even 10% of the space (about 970 formulae). In contrast, similarities that are only evident by considering large portions of the formulae are Zn→Mg, Cs→Na, Ca→Ba and those at the bottom of Figure . For instance, Ru→Mo only appears in more than half of the samples if the formulae analysed account for more than 95% of the known ones. Figure shows that most of the stable similarities occur for main group elements, while transition metal ones require deep knowledge of the space. This is a consequence of the small number of formulae associated to transition metals, formulae that are easily discarded by random sampling (Supplementary, Table ). Moreover, by taking less than half of the formulae (4,876), about the same proportion of similarities is obtained; mainly', 'including C, H, O, N, Cl, S, Br; which are among the elements with most compounds (Figure ). Notoriously, top-20 combinations are C and H based. The minor metallic span of the space is evident through the most populated metal combination: CHAgNO, which only gathers 0.8% of the space (Figure ). This is consistent with recent results on composition and growth of the chemical space .The number of combinations per element follows a similar trend to that of compounds per element shown in Figure (Supplementary, Figure ; Spearman correlation of 0.99). The question arising is on the ratio between the number of compounds and of combinations for each element. We calculated it (Figure , inset) and found that organogenic elements have much more compounds than combinations, when compared with other elements. C has six times more compounds than combinations and H, O and N, 4.6, 3.8 and 3.9, respectively. For La and Ta, each one of their combinations correspond to a single compound.We wondered whether compounds of an element are concentrated in few of its combinations or spread over them. Figure shows that organogenic elements concentrate most of their compounds in very few combinations: H, C, N and O gather three quarters of their compounds in about 1% of their combinations. This contrasts with the spread of other elements such as V and Au, which concentrate three quarters of their compounds in an ample range of combinations; 60% of V combinations and 67% of Au ones.To explore the role of C combinations and to contrast them with some non-C combinations, we analysed how often some molecular fragments appear over time in known substances. The fragments studied were sulphate and nitrate anions as typical inorganic non-C ensembles. Carbonate anion was studied as']","['Unclassified', 'Unclassified']",3716,1,1,0,0.931905988,0.522038093,"['why', 'have', 'elements', 'that']"
"type=""bibr"" target=""#b27"">[28] and integrated tempering sampling (ITS), as well as some strategies of combining two enhanced sampling methods, such as ITS-MTD method developed by Gao et. al., ITS-US and ITS-TAMD methods developed by us. Recently, the enhanced sampling methods were combined with AIMD simulations to solve some issues in heterogeneous catalysis. It's worth mentioning that we have provided a dynamic computational strategy by combining ITS method and AIMD simulation for the temperature-dependent thermodynamics of CO diffusion on Ru(0001) surface. Although the enhanced sampling method indeed significantly improves the sampling efficiency, the computational cost is still awfully expensive for achieving a converged sampling. Limited thermodynamic information only at three temperature was gave in our previous ITS enhanced AIMD simulations. Therefore, we have been aware of that such enhanced AIMD based dynamic computational strategy is still too expensive to face the realistic issues in catalysis. Further reducing the cost in calculation of system's energy and force is necessary.Construction of the accurate global potential energy surface (PES) could avoid the expensive direct ab initio calculations. Actually, an accurate PES is essential for the theoretical research in chemical reaction dynamics. In the past few decades, development of fitting techniques of ab initio electronic structure data has made the construction of accurate global PESs possible for multidimensional molecular systems. More recently, the artificial neural network (NN) methods have",Causal,Why is the computational cost still considered high despite the significant improvement in sampling efficiency by the enhanced sampling methods?,Answer not available from the given context. ,Negative,"['Although the enhanced sampling method indeed significantly improves the sampling efficiency, the computational cost is still awfully expensive for achieving a converged sampling.']","[[565, 743]]","['the efficiency and reliability of the dynamic computational strategy based on NN PES and MD simulations, which is expected as a powerful tool for the statistical thermodynamics and kinetics calculation in catalysis, in conjunction with the proper enhanced sampling approaches when necessary.', ""higher than the common static computational strategy. Catalytic processes generally involve breaking and formation of chemical bonds, clearly implies the necessity of employing ab initio electronic structure methods, instead of the more economical classical force fields, in the simulations, to provide a reasonably accurate description of the complicated electronic/chemical interactions. ab initio MD (AIMD) simulation is thus an appropriate choice for studies of catalysis, however, AIMD simulation achieves a reasonable length to provide meaningful thermodynamics is still challenging. Therefore, the most important aspect for using dynamic computational strategy in catalysis is to overcome the limitation of time scales in AIMD simulations. On one hand, proper enhanced sampling approaches could be introduced to allow an accelerated search in the phase space and thus fast thermodynamic properties evaluation. On the other hand, development of an efficient and accurate strategy to replace the direct ab initio calculations on system's energy and force is another approach to achieve a converged sampling more efficiently.Various enhanced sampling strategies have been developed so far for accelerating phase space sampling, including but not limited to the approaches of umbrella sampling (US), replica exchange, simulated tempering, transition path sampling, 21 metadynamics (MTD), adaptive biasing force, temperature accelerated molecular dynamics (TAMD), and integrated tempering sampling (ITS),"", 'As a favorable alternative and complement of experimental techniques, computational tools on top of ab initio calculations have played an indispensable role in revealing the molecular details, thermodynamics and kinetics in catalytic reactions.The static computational strategy, which recovers the reaction thermodynamics and kinetics based on the calculations of a few stationary geometries at zero temperature and some ideal statistic mechanics models, is the most popular approach in theoretical catalysis due to its simplicity. In comparison, the ab initio molecular dynamics (AIMD) is a well-tested approach to provide more precise descriptions of catalytic processes, however, experiencing a significantly expensive computational cost in the direct ab initio calculation of potential energy and gradients. Here we proposed a highly efficient dynamic computational strategy for the calculation of thermodynamic and kinetic properties in heterogeneous catalysis on the basis of neural network potential energy surface (NN PES) and MD simulations. Taking CO adsorbate on Ru(0001) surface as the illustrative model catalytic system, we demonstrated that our NN-PES-based MD simulations can efficiently generate the reliable smooth two-dimensional potentialof-mean-force (2-D PMF) surfaces in a wide range of temperatures (from 300 to 900 K), and thus temperature-dependent thermodynamic properties can be obtained in a comprehensive investigation on the whole PMF surface rather than a rough estimation using ideal models based on a few optimized geometries. Moreover, MD simulations offer an effective way to describe the surface kinetics such as the CO adsorbate onsurface movement, which goes beyond the most popular static estimation based on calculated free energy barrier and transition state theory (TST). By comparing the results obtained in the dynamic and static approaches, we further revealed that the dynamic strategy significantly', 'DiscussionIn the computational investigation on catalysis, the static computational strategy is the most common approach, in which the limited stationary states at zero temperature are localized and subsequently based on the partition functions of ideal models to obtain the thermodynamics at the realistic experimental conditions. Therefore, the reliability of static computational strategy depends on whether the ideal models are deviated from the realistic conditions. In comparison, MD simulations is a well-tested approach to obtain the thermodynamics as well as the kinetics of the target system by going beyond ideal models. The reliability of the dynamic computational strategy in statistical thermodynamics depends on whether the converged sampling can be achieved.The dynamic computational strategy based on AIMD simulations has been used to face some issues in heterogeneous catalysis. However, the expensive computational cost in AIMD simulations greatly limited its wide applications. The NN PES provides an accurate and efficient computational approach by avoiding most expensive ab initio calculations. Therefore, a dynamic computational strategy by combination of NN PES and MD simulations has been proposed here for efficient evaluation of temperature-dependent thermodynamics for heterogeneous catalysis. We have constructed a 6-D NN PES for CO adsorbate on Ru(0001) surface, which can fully reproduce the potential energy and gradients at ab initio level.Base on it, converged sampling by MD simulation has been carried out for the temperaturedependent thermodynamics of CO adsorption and diffusion on the surface. Benefit from our highly efficient dynamic computational strategy, the temperature-dependent thermodynamics have been obtained from a total of 3.5×10 3 ns long MD simulations at each of seven temperatures, that is 300 ∼ 900 K.We obtained the', 'ConclusionIn summary, we have proposed an efficient dynamic computational strategy for catalysis based on NN PES MD simulations. The 6-D NN PES for a model system of heterogeneous catalysis, that is CO adsorbate on Ru(0001) surface, has been constructed. Based on this, longtime MD simulations have been carried out for the temperature-dependent thermodynamics of adsorbate adsorption and movement on surface. The smooth and reliable 2-D PMF surfaces at seven different temperatures (from 300 to 900 K) have been obtained, and abundant temperature-dependent thermodynamic properties have archived. To the best of our knowledge, this is the first report of NN PES MD simulations on temperature-dependent thermodynamics for a chemisorbed molecule on transition metal surface.The temperature-dependent thermodynamics as well as the diffusion kinetics for adsorbate on-surface adsorption and movement have been explored by this dynamic computational strategy. We are unexpected to find that the calculated free energy difference and diffusion barrier between the two stable binding sites (top and hcp) increase other than reduce along with the temperature raising, contrary to the common intuition. In addition, our dynamic computational strategy provides an efficient approach to evaluate the reaction kinetics directly, and also provides a benchmark to evaluate the applicable of TST that is the most common computational tool for obtaining reaction kinetics in theoretical catalysis. Our results also showed that there is significant deviation for TST in on-surface diffusion kinetics.Our dynamic computational strategy also provides a chance to evaluate the reliability of common static computational strategy. Our results indicated there is significant deviation of static computational strategy, although the static computational strategy performs a right variation tendency with temperature change in qualitative for']","['Quantum and theoretical chemistry', 'Unclassified']",434,1,1,0,0.907546792,1.11E-16,['why']
"Figure 2 :2Figure 2: The r SE e structures of the six OCS complexes obtained with B2PLYP corrections. Note: the r(C-Ar) with the 18 O isotopologue excluded is 3.5598(3) Å. Figure 3 :3Figure 3: SAPT decomposition of the interaction energies of the six studied OCS complexes. Energies obtained at the r SE e structures.  we have opted to base this analysis on experimentally observed results. The substitution of r 0 and B 0based values for r SE e and B SE e -derived ones, respectively, causes only a negligible difference in the binding energies of at most 40 J/mol. For a comparison of D E values based on r 0 , r SE e , and r DFT e An interaction energy surface of the He• • •OCS dimer calculated with SAPT is shown in Fig. 4. The energy surfaces of the other dimers differ only quantitatively. The two adjusted parameters are the C••Rg distance and S-C••Rg angle. The OCS monomer was held at the equilibrium bond length. He angle ( • ) C••He distance ( Å) Figure 4 :4Figure 4: SAPT interaction energy surface of the He•••OCS complex. Energies in kJ/mol. Blue contours represent binding (spacing 0.025 kJ/mol), red represent repulsion (spacing 1 kJ/mol).",Causal,Why does substituting r 0 and B 0 based values with r SE e and B SE e -derived values cause only a negligible difference in the binding energies?,Answer not available from the given context. ,Negative,"['The substitution of r 0 and B 0based values for r SE e and B SE e -derived ones, respectively, causes only a negligible difference in the binding energies of at most 40 J/mol.']","[[391, 566]]","['of the third constant would lead to a decreased quality of the fit. It could be argued, that all experimentally available information should be used in the fit, and that any associated decrease in the quality of the fit reflects the errors in either the ∆B DFT e or the fit itself. We have considered this issue, and prefer to remain consistent with previous work. As mentioned above, the equilibrium structure of the OCS monomer is kept rigid and linear. The bond lengths of Morino and Matsumura 1are used for all r 0 and r SE e structures.Unlike in the previous work, the initial fit reported here takes into account all available isotopologue data. This structure is used as the r SE e in the following text. The BLYP functional predicts a 43 mÅ longer separation.In the lightest two complexes, some of the DFAs yield negative frequencies when anharmonic corrections are applied to the (positive) harmonic frequencies. Two negative frequencies can be observed in the BLYP results for Ne• • •OCS, one can be observed in both B2PLYP and B3LYP results for the He• • •OCS complex. The weakly bound intermonomer mode is always one of those problematic degrees of freedom. For the Ne• • •OCS complex the B2PLYP and B3LYP corrections are comparable and the r SE e structures differ by less than 3 mÅ. However, the CCSD(T) results for the parent isotopologue are inconsistent with the DFT calculations.The story is similar in the He• • •OCS complex. The B2PLYP-based r SE e follows the trend in bond lengths of the rare gas group, but the obtained angle is significantly different. On the other hand, the anharmonic frequencies obtained with BLYP do not have negative artefacts, and the angle in the BLYP structure of the He complex is more consistent with the rest of the dataset. However, the intermonomer separation obtained with BLYP is 3.7514(3) Å, which is longer than Kr• • •OCS and therefore unrealistic.The CCSD(T) structure has an angle similar to the BLYP', ""B2PLYP e results and all other results is due to the significant underprediction of the centrifugal distortion constants: for instance, in the He• • • OCS complex, B2PLYP and second-order vibrational perturbation theory predict a D B2PLYP J of 79.05 kHz, while the experimental value is 438.63 kHz.Predicting accurate centrifugal distortion constants is a difficult task. In diatomics, the predicted D J 's from wavefunction theory (CCSD(T)/aug-cc-pVTZ) and density functional theory (B3LYP/augcc-pVTZ) are comparable, within 10% of experimental values. The agreement worsens significantly for the polyatomic CH 2 PCl: CCSD(T)/cc-pVQZ results are within 25% of the experiment, while upon application of second-order vibrational perturbation theory, or single-hybrid DFAs, the deviation from experiment increases. Therefore, the disagreement between the binding energies from the supermolecular and Lennard-Jones approach reflects the innacurate D B2PLYP J as opposed to an invalidity of the Lennard-Jones model.The deformation energies for all complexes are negligible when compared to the overall binding energies. In the rare gas complexes, the OCS deformation energies are in the 1-3 J/mol range. For these complexes, the O-C-S angle bends towards the rare gas atom by at most 0.2 • . In the Hg• • •OCS the deformation energy is slightly higher at 18 J/mol, and the O-C-S bend reaches 0.3 • . While it would seem that the deformation of the OCS monomer increases with increasing binding energy, this is not true for OCS complexes in general. The CS 2 • ••OCS complex has an interaction energy of ∼8 kJ/mol, but the OCS molecule is deformed by less than 0.1 • at a similar level of theory. The zero point energy differences show no particular trends, with the lowest difference calculated for Xe• • •OCS (0.196 kJ/mol) and the highest for He• • •OCS (0.442"", 'Table 2 :2Interaction (E int ) and binding (D E ) energies of the OCS complexes, in kJ/mol, calculated using SAPT, MP2+δ(T), from literature. An experimental estimate obtained with a Lennard-Jones fit and the diatomic approximation is included for comparison. For a further set of D E values, see the Supporting information.ComplexSAPT Lit. CCSD(T) E int @ r SE e E intMP2+δ(T) E int @ r e D E @ r e D E @ r 0 ExperimentHe••OCS -0.510-0.519-0.478-0.035-0.152Ne••OCS -0.964-0.975-0.709-0.381-0.518Ar••OCS-2.491-2.653-2.434-2.007-1.943Kr••OCS -3.079-3.249-3.314-2.871-2.536Xe••OCS -3.665--4.025-3.827-3.158Hg••OCS -5.015--4.570-4.148-3.157', '. The calculated MP2+δ(T) binding energies D E are in a good agreement with the experimental values using the Lennard-Jones model for complexes up to Kr. This agreement breaks down with in heavier complexes likely due to relativistic effects. The minor disagreement in the interaction energies compared to previous CCSD(T) literature data can be explained by basis set incompleteness in the literature results. The deformation of the OCS monomer from its equilibrium structure upon complexation is predicted to be minimal, with the largest bend of 0.3 • predicted for Hg• • •OCS. The mass-dependent r (2) m structures of the Xe and Ne complexes differ significantly from the r SE e structures. The bond lengths and angles in the OCS monomer are distorted in the r ([1,2]) m fits, especially the position of the O-atom. However, with the OCS monomer constrained to its equilibrium geometry, the mass-dependent structures are likely the most accurate structures ever obtained for the two complexes. The 43 mÅ difference in the monomer separation in the MP2+δ(T) and r (2) m structures can be partially explained by the lack of diffuse functions in the cc-pwcVnZ basis sets: upon augmentation the difference drops to 15 mÅ. The closest agreement with the r (2) m structure could be obtained by adding the 4-th order relativistic correction (+δ 4 rel ) to the MP2+δ(T) results, highlighting the importance of relativistic effects. However, this procedure cannot be generally recommended, as the scalar relativistic effects are double-counted. The inclusion of diffuse functions into at least 4-ζ basis sets is a more systematic way of converging towards experimental structures.', 'Binding and interaction energiesThe overall binding energy of a complex (D E ) can be defined as the experimentally observable change in the energy upon binding of the monomers. Ignoring basis set and size consistency errors, it can be thought of as the difference of the zero-point corrected energy of the complex from the sum of the zero-point corrected energies of the relaxed monomers. Alternatively, it can be thought of as a sum of the interaction energy (E int ), the deformation energy (∆E D ) and the change in the zero-point energy (∆E ZPE ). The interaction energy is widely used as a benchmark quantity for computational methods, as calculating E int requires no geometry optimisation, but just a handful of single-point energy calculations.As a first look on the trends in the interaction energies in this set, we have applied the SAPT decomposition to the B2PLYP-based r SE e geometries. The contribution of the SAPT components of the interaction energy is shown in Fig. . The interaction with the rare gases is completely dispersion dominated, with electrostatic contribution increasing slightly down the group. The sole exception is the non-rare gas Hg••OCS complex, where the interaction contains a significant induction contribution. This is likely a consequence of the charge transfer from OCS into the empty p-shell of Hg. The SAPT interaction energies are compared to the counterpoise-corrected MP2+δ(T) interaction energies at the optimized geometries in Table . Literature counterpoise-corrected CCSD(T)/aug-cc-pVTZ values of E int for the Ne 8 and Ar 38 complexes, along with a CCSD(T)/aug-cc-pVQZ value for the He and Kr complexes are also shown in Table . For the lighter two complexes, the']","['Spectroscopy', 'Optical spectroscopy']",58,1,1,0,0.871575972,0.604540839,['why']
"(a). During periods of low areal current density, both the anode and the cathode show relatively low acoustic activity indicating low bubble formation, corroborating the data obtained in the voltage fluctuation measurements. However, when the current density is increased above the 200-300 mA cm-2   Figure 7 .7Figure 7. (a) The acoustic hit rate for both the anode and cathode at varying areal current densities. (b) the evolution of the cumulative energy across the course of the test for both the anode and cathode. Replication at University College London (UCL), of the Performance of the Capillary-Fed Electrolysis Cell, as reported in Nature Communications 2022, 13, 1304 (DOI: 10.1038/s41467-022-28953-x) by the University of Wollongong (UOW) For acoustic emission testing carried out at University College London (UCL) a different setup (as detailed in Section 2.2 of the manuscript) was utilised. In order to ensure that the data obtained from these tests was valid and matched data recorded at the University of Wollongong (UOW), previously reported experiments were repeated and the data compared. Figure SI 1 (a) shows a polarization curve obtained from the cell operating at 80 o C following the procedures outlined in Ref [1]. Figure SI 1 (b) shows a comparison of the data obtained in this work (measured at UCL) with the data reported previously in Ref [1]. The test was repeated at 85 o C with the results shown in Figure SI 2.",Causal,Why do both the anode and cathode show relatively low acoustic activity during periods of low areal current density?,Answer not available from the given context. ,Negative,"['During periods of low areal current density, both the anode and the cathode show relatively low acoustic activity indicating low bubble formation, corroborating the data obtained in the voltage fluctuation measurements.']","[[5, 224]]","['Figure 5 .5Figure 5. Standard deviation (\uf073) of voltage as a function of current density, at room temperature (23 o C), of: (a) the cell, (b) the anode, and (c) the cathode, of a capillary-fed water electrolysis cell with a Pt/C/Nafion/CFP cathode (0.5 mg cm -2 Pt) and NiFeOx/PTFE/Ni mesh anode sandwiched in a zero-gap arrangement with a 8 µm PES membrane that fed 6 M KOH electrolyte to the electrodes from a reservoir at the base of the cell. (b). A similar trend is observed at the anode as the cathode; namely, at lower current densities there is limited acoustic activity, indicating low bubble formation, which gradually increases as the areal current density is increased. If the number of hits recorded at the anode (Figure6(b)) is compared to the number of hits recorded under the same conditions at the cathode (Figure6(a)), fewer hits are observed at each current density, suggesting lower acoustic activity indicating lower bubble formation. These results correlate with the data obtained from voltage fluctuation experiments, which indicated that bubble formation was more prevalent at the cathode than the anode. Figure 6 .6Figure 6. Acoustic emission data obtained from (a) cathode side and (b) anode side as current density (blue bars) (right axis) is increased and acoustic results (red dots) show the hit amplitude (left axis) and rate. Note that there are no acoustic hits in the current rest periods.', 'approximately 1500 s the number of acoustic hits increased more significantly. It is also observed that while there are hits just above the 25 dB threshold across the course of the experiment, increasing numbers of hits at higher acoustic amplitudes were observed as the current density increased.Notably, no acoustic activity is observed during any of the rest steps even at higher current densities, this indicated that the acoustic behavior is related to the operation of the electrolysis and not to any background effects. Tests were also repeated with the transducer in the same location but acoustically decoupled from the cell; no hits were detected during this test, ruling out any possible electromagnetic interference effects.This result suggests a change in behavior as the current density is increased, in line with the results observed from voltage fluctuation measurements. More acoustic activity is attributable to the formation of bubbles.The same experiment was repeated with the transducer placed on the anode of the electrolyser, these results are shown in Figure  In order to compare the acoustic activity at the anode and cathode at all current densities studied, the hit rate (number of hits per second) was calculated for all areal current values on both electrodes, the data from these calculations are shown in Figure range there is an increase in the rate of increase of acoustic hits per second with increasing current density, suggesting more bubble formation; this is a similar trend to that observed with the voltage fluctuation experiments. This increase in acoustic activity is observed with both the anode and the cathode. At current densities above ca.. 75 mA cm - the hit rate for the cathode is always higher than that observed at the anode, indicating more prevalent bubble formation at the cathode. At higher', 'that observed at the anode, indicating more prevalent bubble formation at the cathode. At higher current densities, above the 200-300 mA cm -2 range, this difference in acoustic activity increases further with a higher gradient observed with the cathode relative to the anode (Figure (a)). This again matches well with results obtained from voltage fluctuation experiments. This difference between the higher acoustic activity observed with the cathode relative to the anode, particularly at current densities above 200-300 mA cm -2 is more clearly observed by studying the cumulative energy of the acoustic hits (Figure (b)). Thus far, the focus has been on the number of hits recorded, which gives a good indication of the acoustic activity but does not include all information. By looking at the cumulative energy, this not only takes into account the total number of hits but other factors associated with each hit such as the duration and frequency of each hit. Based on the cumulative energy the performance of the two electrodes is relatively similar, albeit with the cathode showing slightly higher energy, until approximately 1500 s. At this point, where the current density is increased beyond 200 mA cm - prevalent at the cathode and for higher current densities above ca. 200 mA cm -2 the effect is initially larger on the cathode than the anode.', ""Electrolysis Cell using the Acoustic Emission TechniqueIn addition to the voltage fluctuation measurements, acoustic emission testing was employed to monitor bubble formation on the anode and cathode sides of the cell separately.Although this work was conducted on a cell with a slightly different layout, as outlined in Section 2.1.1, results from both set-ups were found to match closely (See Figure SI 5).The results obtained from acoustic emission testing are summarized in Figure . The use of the highly acoustically attenuating EPDM gasket between the two halves of the electrolyser allowed for the acoustic effects from each of the electrodes to be effectively isolated from one another. However, the crossover between electrodes was shown to be minimal.Constant current steps (60 s) of increasingly high areal current density were conducted with 120 s rests between each value. The acoustic emission was monitored across the course of the experiment. The results in Figure indicated that every time an acoustic event (a 'hit') was detected, it was above the chosen threshold value of 25 dB. The amplitude of each hit is indicated in each plot.For the cathode (Figure (a)) very few acoustic hits were observed at low current densities (e.g. Only two hits were observed across the 1 min, 10 mA cm -2 period), this is an indication of exceptionally low bubble formation with very limited acoustic activity. This trend for low amounts of bubble formation at low areal current densities continued across the first few current densities tested, although notably as the current density increased there was an increase in the number of hits occurring in each constant current step. After approximately 1500 s the number of acoustic hits increased more significantly. It is also observed"", ""ConclusionsIn this work, we have detected and analyzed the incidence of gas bubble formation during operation, of the cathode and anode of a high-performing capillary-fed water electrolysis cell.A voltage fluctuation and an acoustic emission technique were adapted and applied in combination, while applying current densities of up to 1 A cm -2 to the cell. Very similar resultswere obtained for the two techniques, with little bubble formation observed up to 0.17-0.20 A cm -2 . At higher current densities, up to around 0.6 A cm -2 , bubbles were formed predominantly at the cathode. Given that commercial alkaline electrolysers typically operate at current densities up to 0.6 A cm -2 , this suggests that minimizing bubble formation at the cathode offers the key opportunity for further performance improvements in the capillary-fed cell. The cathode and anode produced bubbles at similar rates at still higher current densities, to 1 A cm-2. Even at 1 A cm -2 , the rate of bubble formation on the electrodes was substantially lower than in conventional, 'bubbled' electrolysis cells. In the course of this work, the previously reported high electrochemical performance of the capillary-fed cell was independently confirmed.    IndependentFigure 1 .1Figure 1. Exploded view of the transparent, acrylic second-generation test cell with its bottom cut off.""]","['Energy', 'Renewable energy sources']",1819,1,1,0,0.931204624,-2.22E-16,['why']
"and improving efficiency, but also planning the sustainable disposal strategies. In the future, the developed methodology may find an application in the related fields, where electrolyte/active interface play a crucial role. For example, understanding challenges facing the established Li technology (batteries and capacitor) or emerging technologies like Zn-metal batteries, where dendrite formation still limit their application, or photo-electro-chemical sensing with plasmonic/semiconducting heterostrcutures. Fig. 1 :1Fig. 1: Overview of the operando photo-electrochemical setup and of the main findings of the present work. a Schematic illustration of the multi-modal experimental setup. Photoelectrochemical (PEC) properties of a photoactive thin film under illumination and immersed in an electrolyte solution are probed by use of a potentiostat in a standard 3-electrode configuration. Two large-area X-ray detectors permit the simultaneous measurement of both TS and SAXS signals from the film surface in a grazing incidence geometry. Schematic drawings of a CuBi2O4 electrodes b and the degradation mechanisms when only immersed in the electrolyte c, and under illumination and external bias d, respectively.",Causal,Why does dendrite formation limit the application of Zn-metal batteries?,Answer not available from the given context. ,Negative,"['For example, understanding challenges facing the established Li technology (batteries and capacitor) or emerging technologies like Zn-metal batteries, where dendrite formation still limit their application.']","[[225, 513]]","['formation of new phases. Yet, the operando X-ray scattering investigations were restricted only to few electrochemical studies, while the technique has never been applied to monitor the surface of photoactive films in a PEC cell. In this work, we close this gap. We develop an operando grazing-incidence X-ray scattering approach that allows to assess the evolution of structural processes at the surface of a photoactive film in a PEC cell during operation, as shown in Figure and Figure . We use a high-energy X-ray probe and a large-area detector to collect the TS signal at grazing-incidence angle with enhanced surface sensitivity. Simultaneously, we use a second largearea detector to collect the SAXS signal. We apply the technique to monitor operando the structural evolution of a copper bismuth oxide film as a model system. CuBi2O4 has recently emerged as a promising PEC material due to its favorable electronic properties, namely a suitable bandgap of 1.6-1.8 eV , p-type conductivity, and a very cathodic onset potential of ca. 1 V vs. RHE (Reversible Hydrogen Electrode). However, the achievable photocurrents from bare CuBi2O4 electrodes are limited by the poor charge carrier mobility and the short carrier diffusion length and decay rapidly in steady-state conditions while at the same time no hydrogen is produced, thus indicating that the measured photoactivity likely restrict to a photocorrosion process. It has been suggested that CuBi2O4 electrodes might degrade similarly to Cu2O during operation, i.e. via consumption of the photogenerated electrons to the reduction of the Cu 2+ cations to either Cu + or Cu 0 . However, this hypothesis lacks of experimental evidence. Here we', 'IntroductionPhoto-electrochemical (PEC) water splitting is currently one of the most promising approaches for the conversion of solar energy into hydrogen gas (H2), which can be then transported and used on demand as a green energy carrier. In a PEC cell, a semiconductor is immersed in an electrolyte and the charge carriers are generated under light illumination at the semiconductor-electrolyte interface, effectively combining light absorption and catalysis in a single device. One major challenge to this approach is the intrinsic low stability of most semiconductors which rapidly degrade when in contact with the electrolyte during PEC measurements. Common degradation pathways include the dissolution of the photoabsorbing material into the electrolyte, phase transformations due to the reduction/oxidation of the metallic species under applied bias and/or illumination, loss of the semiconductor layer from the electrode surface, and the morphological restructuring of the electrode surface. Such complex degradation mechanisms cause the decline of its PEC performances. For example, Cu2O photocathodes reduce during operation to the inactive metallic Cu phase and concurrently oxidize to release Cu 2+ ions into the electrolyte. BiVO4 photoanodes dissolve into stoichiometric Bi and V species leading to a progressively reduced thickness of the photoabsorbing layer, while the surface of metal nitride electrodes passivates due to the formation of a metal oxide layer, which prevents the efficient charge transport at the semiconductorelectrolyte interface. Understanding the mechanisms underlying photocorrosion constitutes the fundamental prerequisite to improve the durability of PEC', 'at the Cu K-edge of films (Figure ) and inductively coupled plasma mass spectroscopy (ICP-MS) of electrolyte solution Figure .The XANES data show the presence of 1.5 % and 12 % of metallic Cu inside the CuBi2O4 electrode after 40 minutes and 4 hours of chronoamperometry at 0.5 V vs RHE, respectively. The ICP-MS measurements display a steady increase in the concentration of Cu species in solution both, before and during the chronoamperometry. However, no Bi ions could be detected in the electrolyte. While ICP-MS does not provide information over the oxidation state of the detected Cu species, the Pourbaix diagram of Cu indicates that the most stable copper species at the electrolyte pH of 5.7 and the OCP potential of the CuBi2O4 electrode (~ 0.5V vs. RHE) is Cu 2+ .[7a] Moreover, SEM/EDX images, Figure , clearly show the presence of BiPO4 structures which grows on top of the CuBi2O4 film as multiple branches, with single branches growing even up to few micrometers in length. Figure schematically illustrates both the chemical species and structural modifications detected in electrolyte and at the surface of the electrode as a result of either the reduction or the dissolution of the pristine CuBi2O4 material under applied external bias and illumination. Therefore, unlike hypothesized in the literature, our results reveal that the formation of metallic Bi rather than metallic Cu is the most prominent outcome of the photo-electrochemical degradation of CuBi2O4 by cathodic photocorrosion. However, ex situ characterizations do not reveal the degradation time scales. Operando structural characterization by X-ray scattering. While the ex-situ characterization permits to identify various changes of the electrode, it is not possible to pinpoint which phenomena are responsible for the abrupt', 'SummaryIn this work, we show an operando high-energy X-ray scattering method to investigate the photocorrosion mechanisms and relative time scales on photo-electrochemically active CuBi2O4 electrodes. We measure TS and SAXS simultaneously in grazing incidence to reveal structural modification close to the CuBi2O4-electrolyte interface. We show that under illumination and applied bias the CuBi2O4 electrodes quickly undergo a cathodic photocorrosion process which determines the formation of a segregating metallic Bi phase. This process takes place on a time scale of only few minutes after beginning of the chronoamperometry and correlates with a decrease of around one order of magnitude in the observed photocurrents. Moreover, additional degradation processes occur on slower time scales: formation of metallic Cu and dissolution in the electrolyte as an effect of both anionic photocorrosion and acidic dissolution. The two phenomena cause a steady release of Cu 2+ ions in solution as well as the crystallization of BiPO4 branched structures at the surface of the electrode due to the interaction of the releasing Bi 3+ ions with the phosphate species in the electrolyte. The formation of an insulating BiPO4 layer is likely responsible for the slow decrease in the measured photocurrents at intermediate and later stages of the chronoamperometry.In summary, our study shows that the high-energy X-ray scattering can probe structural information ranging from atomic to nanometer length scales in a realistic experimental environment, thus allowing to simultaneously correlate chemical and morphological modification of the film electrode with changes of photocurrent. Understanding how photoactive electrodes degrade under operation conditions is the first step towards new strategies for increasing the long-term stability and improving efficiency, but also planning the sustainable disposal strategies. In the future, the', 'underlying photocorrosion constitutes the fundamental prerequisite to improve the durability of PEC electrodes by establishment of appropriate mitigation strategies. Moreover, as there will be a limited lifetime of PEC electrodes, i.e., after operation they will need to be disposed as waste, insights into their degradation on various time scales will enable development of sustainable disposal approaches. The in situ and operando methods hold the promise to provide systematic insights into the photocorrosion phenomena by monitoring the PEC material under relevant timescales and operating conditions, i.e. under applied bias and illumination. So far, techniques such as ambient pressure x-ray photoelectron spectroscopy (APXPS), inductively coupled plasma mass spectroscopy (ICP-MS) and in-situ UV-Vis spectroscopy have been used to assess the photocorrosion mechanism of Cu2O, WO3, BiVO4 and n-GaP photoelectrodes under realistic working conditions. Additionally, X-ray absorption (XAS), Fourier-transform infrared (FTIR) and Raman spectroscopies have been used to monitor in-situ/operando the catalytically active sites and reaction intermediates during the oxygen evolution reaction (OER). Aforementioned methods benefit from enhanced surface sensitivity, allowing to monitor the oxidation states of metal ions at the surface of the electrodes and their dissolution into the electrolyte, but they are limited to the determination of the local atomic environment. X-ray scattering, including total scattering with pair distribution function analysis (TS-PDF) and small-angle scattering (SAXS), is sensitive to morphological and structural changes ranging from the atomic up to nanometer length scales. Thus, it permits to probe local atomic structures as well as the restructuring of the electrode surface and the formation of new phases. Yet, the operando X-ray scattering investigations were restricted only to']","['Energy', 'Photovoltaics']",3950,1,1,0,0.801983623,0,['why']
"is very restrictive. However, the energy difference between the QM and MM energy scans must be corrected by the functional form for low errors to be achieved. Therefore, although we use errors in potential energy scans as a guide to performance, they cannot be relied upon as a measure of the accuracy of a force field. Therefore, we now investigate the performance of the QUBE force field in MD simulations.",Causal,Why can't errors in potential energy scans be relied upon as a measure of the accuracy of a force field?,Answer not available from the given context. ,Negative,"['Therefore, although we use errors in potential energy scans as a guide to performance, they cannot be relied upon as a measure of the accuracy of a force field.']","[[159, 319]]","['Ten structures were extracted from a MD simulation employing the OPLS-AA/M force field, and QUBE non-bonded parameters were computed for each snapshot. The standard deviation of the charge distribution across the ensemble is just 0.02 e, supporting previous observations that the underlying DDEC atoms-in-molecule charges are relatively independent of conformation. It is important to test whether these system-specific force field parameters translate into more accurate protein interactions and dynamics. In this regard, although the conformational preferences of the peptides tested in the previous section are promising, it is not known whether the torsional parameters will continue to be appropriate for use with proteins. As the non-bonded parameters vary with the system studied, the transferability of torsional parameters cannot be readily assumed. To assess this we begin by studying MD simulations of the proteins ubiquitin and GB3.The J coupling errors for ubiquitin and GB3 are summarized in Table . With an overall RMSE of 1.54 Hz, the error using the QUBE force field for ubiquitin is higher than that of OPLS-AA/M, which has an RMSE of 1.12 Hz, but lower than OPLS-AA and OPLS-AA/L with errors of 1.84 Hz and 1.70 Hz respectively. 1 GB3 follows the same trend with an RMSE of 1.10 Hz for the QUBE force field, compared to the error for OPLS-AA/M of 0.90 Hz, whilst OPLS-AA and OPLS-AA/L both have an error of 1.46 Hz. 1 The J coupling results suggest that whilst the transfer of torsional parameters from dipeptides to proteins may cause some issues, the QUBE force field remains more accurate than OPLS-AA and OPLS-AA/L. This is promising when we consider that OPLS has been in development for many years with multiple iterations and parameter adjustments performed.The 3 J(H α , H β ) coupling term is the main contributor to the J coupling', 'Development and Validation of the QUBE Protein Force Field Molecular mechanics force field parameters for macromolecules, such as proteins, are traditionally fit to reproduce experimental properties of small molecules, and thus they neglect system-specific polarization. In this paper, we introduce a complete protein force field that is designed to be compatible with the QUantum mechanical BEspoke (QUBE) force field by deriving non-bonded parameters directly from the electron density of the specific protein under study. The main backbone and sidechain protein torsional parameters are re-derived in this work by fitting to quantum mechanical dihedral scans for compatibility with QUBE non-bonded parameters. Software is provided for the preparation of QUBE input files. The accuracy of the new force field, and the derived torsional parameters, are tested by comparing the conformational preferences of a range of peptides and proteins with experimental measurements. Accurate backbone and sidechain conformations are obtained in molecular dynamics simulations of dipeptides, with NMR J coupling errors comparable to the widely-used OPLS force field. In simulations of five folded proteins, the secondary structure is generally retained and the NMR J coupling errors are similar to standard transferable force fields, although some loss of the experimental structure is observed in certain regions of the proteins. With several avenues for further development, the use of system-specific nonbonded force field parameters is a promising approach for next-generation simulations of biological molecules.', 'emerges is that this first generation quantum mechanical bespoke force field is an improvement over legacy OPLS-AA and OPLS-AA/L force fields, but is out-performed by the most recent OPLS-AA/M force field for simulated dynamics of folded proteins in their native state. While we have previously shown that DDEC charges are not too dependent on small conformation changes, 28 further investigation is needed to establish the utility of QUBE for protein folding simulations.Hence, although we have outlined our roadmap to future improvements, a natural question is: where can the QUBE protein force field be used now (especially given the higher cost of parameterization compared to transferable force fields)? Importantly, it has been shown previously that the use of system-specific force field charges leads to improvements in binding energetics of small molecules, and reproduction of the QM electrostatic potential for both small molecules 27 and proteins. Therefore, although simulated protein backbone dynamics is an important test, we envisage the QUBE small molecule and protein force field being particularly important for the study of intermolecular interactions in the condensed phase.Indeed, QUBE was originally developed to provide, by construction, a compatible protein and small molecule force field for computer-aided drug design, where an accurate surface electrostatic potential of the protein is crucial. In this regard, the absolute binding free energies between the L99A mutant of T4 lysozyme and six benzene analogs have been recently computed using QUBE with a mean unsigned error of 0.85 kcal/mol, which compares very favorably with OPLS-AA/M (1.26 kcal/mol). Although further work is required to establish this accuracy across a significantly wider range of protein-ligand complexes, the promise of these initial biomolecular simulation', 'Torsional Parameter FittingThe final backbone torsional parameters and associated errors in the recreation of the QM energy scans are given in Section S3.2 of the Supporting Information. For the alanine and glycine scans, the error for the QUBE force field evaluated using eq 5 is 1.25 kcal/mol compared to 0.93 kcal/mol for OPLS-AA/M, which is a reasonable level of agreement. For proline and serine, the errors remain comparable to OPLS-AA/M.For the sidechain torsional parameters (Section S3.3), the mean error in the recreation of the QM potential energy scans for the QUBE force field is 1.29 kcal/mol, compared to 1.12 kcal/mol for OPLS-AA/M. Particularly high errors occur for both the χ 1 and χ 2 glutamic acid scans, and the glutamine χ 2 scan. For glutamic acid, the error is also high for the OPLS-AA/M force field parameters, but the rotamer populations remained close to the experimental data, and this may be due to a problem with the functional form used in classical force fields. The OPLS-AA/M error in the potential energy scan for glutamine is roughly half that of the QUBE force field. However, as we will show, the accuracy of the glutamine dipeptide MD simulations is good, and so no further refinement was made to the sidechain torsional parameters in this work.Although a low error in the reproduction of the QM potential energy surface is clearly the desired result, this does not necessarily correspond to accurate non-bonded force field parameters. The degree to which torsional parameters can improve the fit between MM and QM scans depends not only on the accuracy of the non-bonded, and bond and angle, parameters, but also on the shape of the energy difference between the QM and MM scans.The functional form used in classical MM force fields is very restrictive. However, the energy difference between the QM and MM energy scans must be', 'that facilitates the derivation of small organic molecule force field parameters, and also allows the user to derive the positions of off-site charges to model anisotropic electron density and to fit dihedral parameters to QM torsion scans. QUBE force fields have been derived for 109 small organic molecules, and yield mean unsigned errors of 0.024 g/cm 3 , 0.79 kcal/mol and 1.17 kcal/mol in computed liquid density, heat of vaporization and free energy of hydration. These results are competitive with standard transferable force fields, which have been extensively fit to properties such as these.To achieve our goal of employing the QUBE force field in computer-aided drug design applications, we require a compatible protein force field. Since the non-bonded parametrization strategy employed in QUBE is very different to that used in the standard biomolecular force fields (e.g. AMBER, OPLS, CHARMM), there is no reason to believe that they are compatible. However, by implementing the atoms-in-molecule non-bonded parameter derivation methods in the ONETEP linear-scaling density functional theory (DFT) software, we have shown that it is feasible to derive these charges and Lennard-Jones parameters for entire proteins. In this way, the number of fitting parameters is substantially reduced, and we have a consistent parametrization approach that can be applied to both small and large molecules, including entire biomolecular assemblies. Since, in this approach, all non-bonded parameters are derived from a single QM calculation, both the charge and Lennard-Jones parameters naturally include the native state polarization effects of the environment. Importantly, we have shown that protein charges derived using DDEC electron density partitioning recreate the underlying QM electrostatic potential with high accuracy,']","['Quantum and theoretical chemistry', 'Unclassified']",349,1,1,0,0.924296189,2.22E-16,['why']
"as in whole cell or crude cell lysate format (Fig. ). For CitB, a whole cell reaction platform was shown to affect benzylic C-H hydroxylation in an efficient manner. However, whole cell reactions were not effective for ClaD, leading us to perform reactions using filtered crude cell lysate. Both of these reaction platforms provide an operationally-simple method for preparing and using NHI biocatalysts in a manner that is amenable to preparative-scale reactions, avoiding arduous protein purification steps. Analytical-scale reactions revealed that CitB and ClaD each selectively hydroxylate compounds with a variety of steric and electronic properties (Fig. ). Introducing bulky, electron-withdrawing or electron-donating groups at either the C5 or C6 position did not prevent productive reactions with CitB. However, ClaD demonstrated limitations in its ability to accept larger groups, such as phenyl substituents at C5 and C6. The complementarity of substrate scopes between CitB and ClaD is also observed in the substitution at C4. For CitB, the formyl group at C4 can be substituted with alternative electronwithdrawing substituents such as a nitro group (25) or imine (24). However, substrates with greater steric bulk at C4, such as ketone substrates, were generally not hydroxylated by CitB. In contrast, ClaD can productively react with a variety of ketones (see 9, 27-30). The importance of this C4 substituent is also highlighted by the lack of reaction observed with 2,5-dimethylresorcinol (23). Based on preliminary analysis of models of these biocatalysts, we anticipate that a hydrogen bond acceptor is critical at the C4 position to achieve a catalytically active conformation of the substrate-enzyme complex. Current efforts are focused on obtaining engineered enzyme",Causal,"Why were whole cell reactions not effective for ClaD, leading to the use of filtered crude cell lysate?",Answer not available from the given context. ,Negative,"['However, whole cell reactions were not effective for ClaD, leading us to perform reactions using filtered crude cell lysate.']","[[166, 290]]","['subsequent hydrolysis to the benzyl alcohol. These results capture the challenge in accomplishing this seemingly simple benzylic hydroxylation in the presence of redox-sensitive aldehyde and phenolic groups, as well as the advantages provided by biocatalytic benzylic C-H hydroxylation. Next, the reactivity of benzylic alcohol 17 was investigated under aqueous conditions. Gratifyingly, upon gentle heating in the presence of thiophenol, alcohol 17 was quantitatively transformed into thioether 20 through an anticipated o-QM intermediate (18-19). These experiments provided evidence for o-QM formation under remarkably mild conditions compared to previous reports for the generation of o-QMs from ortho-hydroxy benzylic alcohols. Evidence that CitB is sufficiently robust to perform preparative-scale reactions and provide access to o-QMs under mild conditions spurred further investigation of this chemoenzymatic strategy for benzylic functionalization, including studies with the homologous NHI enzyme, ClaD. To investigate the substrate scope of CitB and ClaD, a panel of substrates was synthesized possessing an ortho-cresol core (Fig. ). This panel was designed to define the electronic and steric parameters of substrates that undergo a productive reaction with the NHI biocatalysts. Compounds 9, 16, and 23-42 were subjected to analytical-scale reactions with CitB and ClaD, using standard conditions for α-KGdependent non-heme iron oxygenases. These analyticalscale reactions were performed in vitro with purified enzyme (Supporting Information, Fig. ), as well as in whole cell or crude cell lysate format (Fig. ). For', ""RESULTS AND DISCUSSIONToward developing a chemoenzymatic method for benzylic C-H functionalization, we tested the feasibility of biocatalytic C-H hydroxylation, coupled with o-QM formation and derivatization with a model substrate (see 16, Fig. ) that captures the conserved methyl resorcinol core of CitB and ClaD's native substrates. This model compound maintained the redox-sensitive aldehyde moiety and hydroxyl groups present in the citrinin biosynthetic intermediate (7). This model compound, 16, was completely consumed in 3 h upon exposure to 0.4 mol % CitB in the presence of α-KG, an iron(II) source and sodium ascorbate in 50 mM TES buffer at pH 7.5 (Fig. ). From this reaction, a single benzylic alcohol product (17) was isolated in 82% yield without any evidence of oxidation of either the aldehyde or the resorcinol core. This result demonstrated that CitB could function on a non-native substrate with the robustness needed for preparative-scale synthesis with precise chemo-and site-selectivity. As a comparative measure, we subjected substrate 16 to several chemical oxidation conditions and did not observe conversion to desired benzylic alcohol 17 (see Supporting Information, Table ). For example, attempts to oxidize 16 with DDQ resulted in over-oxidation to the bisaldehdye and exposure of 16 to MnO2 40 or Ag2O 41 resulted in no observed reaction. Efforts to perform a benzylic hydroxylation with K2S2O8 or cerium ammonium nitrate led to decomposition of the substrate. Radical bromination with AIBN/NBS resulted in aromatic bromination and did not generate the desired benzylic halide for subsequent hydrolysis to the benzyl alcohol. These results"", 'Figure 4 .4Figure 4. A. General scheme for CitB and ClaD-catalyzed benzylic hydroxylation and in situ functionalization with thiophenol. B. Preparative scale reaction isolated yields for CitB-catalyzed hydroxylation and functionalization. Reaction conditions: 2.5 mM substrate, [ a ]45 mg/mL CitB wet cell pellet or [ b ]10% v/v ClaD clarified cell lysate, 50 mM TES pH 7.5, 5 mM α-ketoglutaric acid (α-KG), 8 mM sodium ascorbate (NaAsc), 0.1 mM ferrous sulfate (FeSO4), 30 °C, 100 rpm shaking, 3 h. [ c ] PhSH was added directly to reaction mixture after conversion to benzylic alcohol and incubated at 40 °C, 3 h, 100 rpm shaking. C. Thermodynamic analysis of C6-methyl (green) and C6-nitro (blue) substrates. Structures represent the starting material, benzylic alcohol product, o-QM, and thiophenol adducts (left to right).The energies are mass balanced with a truncated 2-His-1-Asp non-heme iron system (see Supporting Information Fig.S86). Geometry optimizations and frequency calculations were performed at B3LYP 6-311++G** and 6-31G** for iron. Figure 5 .5Figure 5. One-pot NHI biocatalyst-initiated o-QM generation and diversification. A. Yields of one-pot Michael addition reactions. B. Yields of one-pot IEDDA reactions. C. One-pot functionalization of cysteine-containing peptide. D. One-pot chemoenzymatic synthesis of (-)-xyloketal D (15). HPLC yields determined by analysis of isolated product standard curves.', 'of the substrate-enzyme complex. Current efforts are focused on obtaining engineered enzyme variants that do not require substrates bearing a hydrogen bond acceptor, such as an aldehyde, for a productive reaction to occur. To probe the substrate scope of our biocatalysts beyond resorcinol substrates, phenolic compounds 39 and S5 (see Supporting Information) were subjected to CitB hydroxylation conditions. Phenol 39 was converted to the corresponding benzylic alcohol; however, the position of the hydroxyl group proved to be important for catalysis as phenol S5 was not oxidized by either CitB or ClaD. These results motivated us to synthesize an additional panel of phenolic substrates to further assess the scope of NHI biocatalytic hydroxylation (40-42). In the case of CitB, increasing the steric bulk at the C5 position increased the conversion of substrates to hydroxylated products except for 2-naphthyl substrate 42, which demonstrated decreased conversion, possibly reflecting the steric limitations of the CitB active site. ClaD was unable to hydroxylate phenolic substrates 40-42.As a next step in the evaluation of the synthetic utility of the NHI dioxygenase-catalyzed benzylic C-H hydroxylation, we performed reactions on preparative-scale using whole cell (CitB) and crude cell lysate (ClaD) conditions (Fig. ). This method enabled routine performance of reactions on >500 mg scale without the requirement for protein purification. Isolation and characterization of C5-substituted benzylic alcohol products 17 and 46-48 was achieved with yields that corresponded to starting material consumption. For example, benzylic alcohol 17 was isolated in 82% yield. However, poor isolated yields were obtained for substrates with C6-substituents, despite nearly complete consumption of starting material (see 49-53). Further analysis of the crude product mixture from these reactions revealed a second product, in which a molecule of', 'type=""bibr"" target=""#b35"">[36] We anticipated that the relatively simple reaction requirements of α-KG-dependent non-heme iron oxygenases would provide distinct advantages in developing a widely applicable and practical approach to biocatalytic benzylic C-H hydroxylation and subsequent o-QM generation.Our search for biocatalysts for selective benzylic C-H hydroxylation led us to two homologous fungal NHI oxygenases (sharing 54% sequence identity): (1) CitB, from Monascus ruber and (2) ClaD, native to Penicillium crustosum. Cox and coworkers demonstrated through in vivo experiments that CitB performs a benzylic hydroxylation in the biosynthesis of the mycotoxin citrinin (8, Fig. ). ClaD was shown by Li and coworkers to perform a similar transformation in the biosynthesis of peniphenones and penilactones (Fig. , 9-11). We envisioned employing CitB and ClaD as general catalysts for benzylic hydroxylation of ortho-cresol substrates. We anticipated that, following benzylic C-H bond oxidation, an o-QM intermediate (see 12-14 Fig. ) could be accessed and intercepted with a variety of nucleophiles or dienophiles to form benzylic C-O, C-N, C-S, and C-C bonds in a biomimetic fashion. Here, we demonstrate this approach with two biocatalysts, but we anticipate this chemoenzymatic platform could be executed with a plethora of wild-type enzymes to access more diverse substrates and complementary selectivity.']","['Unclassified', 'Unclassified']",3672,1,1,0,0.873222553,0.692692453,"['why', 'leading']"
"and LOD: 5 ppb), which is superior to those of fluorescence detection materials reported so far, including porous materials, small molecule probes and inorganics. Furthermore, its fluorescence quenching mechanism has been demonstrated to be a synergistic effect of static quenching and energy transfer quenching by a combined theoretical and experimental study, including time-resolved photoluminescence measurements, UV-vis absorption spectroscopy, and density functional theory calculations. As a chemically stable material, JUC-557-nanosheet preserves strong luminescence and sensitive recognition even under harsh conditions (such as strong acid with pH = 1 or strong base with pH = 14), and allows trace detection of various analytes via a handheld UV lamp. Therefore, these findings pave the way for developing stable ultrathin COF nanomaterials for highly sensitive and selective molecular detection. chemistry, making them easily be modified to create ideal functionalized materials. Theoretically, the high designability of construction in COFs is more accessibly designed as a monitor of molecular recognition via increasable adsorption sites and adjustable fluorescence for targeted analytes. For instance, Wang group reported a thioether-functionalized COF with multifunctionality, COF-LZU8, for the selective detection and facile removal of mercury(II). Qiu et al. developed a sp 2 carbon-conjugated fluorescent COF, termed TFPT-BTAN-AO, which shows a fast response time and a low detection limit suitable for detection of UO 2 2+",Causal,What causes the fluorescence quenching mechanism in JUC-557-nanosheet to be effective?,Answer not available from the given context. ,Negative,"['Furthermore, its fluorescence quenching mechanism has been demonstrated to be a synergistic effect of static quenching and energy transfer quenching by a combined theoretical and experimental study, including time-resolved photoluminescence measurements, UV-vis absorption spectroscopy, and density functional theory calculations.']","[[163, 493]]","['ConclusionIn summary, we have successfully obtained a carbazole-based sp 2 carbon COF nanosheet, JUC-557nanosheet, with a thickness about 2.5 nm by exfoliating the corresponding pristine bulk powder. Owing to the synergistic effect of the AIE-molecular rotors (PE) and ACQ-based chromophore units (carbazole), JUC-557-nanosheet demonstrates high absolute quantum yields (up to 23.0%) in both solid-state and solution. Also, electron-rich carbazole and electron-deficient cyan are uniformly distributed and exposed on the channel wall, rendering efficient combining with the analytes for detection. Therefore, JUC-557nanosheet as a sensitive fluorescence sensor exhibits an excellent molecular recognition toward the essential element in the human body (Fe 3+ with K a of 1.98 \uf0b4 10 4 M -1 and LOD of 706 ppb), radioactive contaminant (I 2 with K a of 2.10 \uf0b4 10 5 M -1 and LOD of 302 ppb), explosive (TNT with K a of 4.38 \uf0b4 10 5 M -1 and LOD of 129 ppb), and especially toxic nitro-compounds (such as NB with K a of 6.18 \uf0b4 10 6 M -1 and LOD of 5 ppb), which is far superior to previous fluorescence detection materials, including COFs, MOFs, POPs, small molecule probes, and inorganics. Due to its high chemical stability, JUC-557nanosheet exhibits a good luminescence and sensitive molecule recognition even under extreme conditions, such as in strong acid with pH = 1 or strong base with pH = 14. Moreover, JUC-557-nanosheet can be assembled into visual detection equipment, allowing easy optical trace detection of various analytes. Finally, the molecular recognition mechanism was investigated by a combined theoretical and experimental studies, including TRPL measurements, UV-vis absorption spectroscopy, and DFT calculations. Our study thus promotes the development of stable fluorescence COF nanosheets as novel versatile sensing platforms that could be integrated with electronic devices for environment monitoring.', 'Fluorescence detection under harsh conditionsDue to the highly-chemical stability of JUC-557-nanosheet, we further studied its fluorescence sensing and selective recognition for NB under harsh conditions, such as strong acidic (pH = 1) and strong alkali (pH = 14) solutions (H 2 O vs. EtOH = 9: 1). As shown in Supplementary Figs. 97-100, the fluorescence quenching percentages (100% in pH =1 and 98% in pH =14, respectively) and K a values (9.18 × 10 6 M - 1 at pH = 1 and 5.22 × 10 6 M -1 at pH = 14, respectively) were almost unchanged in such harsh chemical environment. On the contrary, the fluorescence intensity of most of imine-linked carbazole-based COFs, such as BCTB-PD COF, BCTB-BCTA COF, and BCTA-TP COF, declined significantly under these harsh conditions because of protonation or deprotonation of imine-linked frameworks. In addition, luminous MOFs are usually unstable in water, strong acidic and alkaline environments. Therefore, these results indicate that such functional COF materials would be an excellent candidate for chemically stable fluorescent indicators.', 'Despite the rapid development of fluorescence detectors over the past decade, it still remains a considerable challenge to exploit a highly stable, sensitive, and selective fluorescence platform for molecular recognition. In this study, we report a stable carbazole-based sp 2 carbon fluorescence covalent organic framework (COF) nanosheet, termed JUC-557-nanosheet. Owing to the synergistic effect of AIE-and ACQ-based chromophores in JUC-557-nanosheet, this architecture shows high absolute quantum yields (up to 23.0%) in solid state and the dispersed in various solvents and excellent sensing performance toward specific analytes, such as iodine (K a : 2.10 \uf0b4 10 5 M -1 and LOD: 302 ppb), 2,4,6trinitrotoluene (K a : 4.38 \uf0b4 10 5 M -1 and LOD: 129 ppb), and especially nitrobenzene (K a : 6.18 \uf0b4 10 6 M -1Sensitive and selective detection of various analytes has been widely applied in many scientific and technological fields, such as life science, environmental monitoring, and public security. Therefore, there is a growing demand for convenient, low-cost, real-time, and highly-efficient methods based on portable and wearable sensors. Among these sensors, optical sensor is a cost-effective and fast detection pathway for transmitting signals in intricate situations. Progress in material science and chemistry has led to several distinct classes of optical materials, e.g., molecular probes, supramolecules, amorphous polymers, and metal-organic frameworks (MOFs), which have remarkably promoted the advancement of detection of chemical and biological analytes. <ref type=""bibr""', 'which shows a fast response time and a low detection limit suitable for detection of UO 2 2+ in H 2 O. Nevertheless, because of the scarcity of a suitable linkage that combines fluorescence with stability, most fluorescent COFs are chemically fragile, and stable COFs are less illuminating. Therefore, exploring highly stable and fluorescent COF materials for chemical detection still remains a great challenge.Herein, we design a carbazole-based COF nanosheet connected by sp 2 carbons, termed JUC-557nanosheet, which is exfoliated from its bulk COF (JUC-557, JUC = Jilin University China). Due to the complementary characteristic of phenyl ethylene (PE) as an aggregation-induced emission (AIE) group and carbazole as an aggregation-caused quenching (ACQ) chromophore in the same framework, JUC-557-nanosheet was proven to have high absolute quantum yields of ~ 23.0% in both solid-state and solution. Therefore, JUC-557-nanosheet as a sensitive fluorescence probe exhibits an excellent molecular recognition toward specific cations and anions as well as iodine (I 2 ) and toxic nitro-compounds, bringing forth I 2 with an association constant (K a ) of 2.10 \uf0b4 10 5 M -1 and limit of detection (LOD) of 302 ppb, 2,4,6-trinitrotoluene (TNT) with K a of 4.38 \uf0b4 10 5 M -1 and LOD of 129 ppb, and especially nitrobenzene (NB) with K a of 6.18 \uf0b4 10 6 M -1 and LOD of 5 ppb, which is much better than those optical detection materials reported until now, including fluorescence porous materials, small molecule probes and inorganics. Furthermore, a combined theoretical and experimental study, including time-resolved photoluminescence (TRPL) measurements, UV-vis absorption spectroscopy, and density functional theory (DFT) theoretical calculations, explains the fluorescence quenching mechanism of JUC-557nanosheet. Due to its', 'such as other COFs (K a : ~ 8.5 × 10 3 M -1 ), MOFs (K a : ~ 1.83 × 10 2 to 2.02 × 10 5 M -1 ), and amorphous porous organic polymers (POPs, K a : ~ 7.04 × 10 2 to 2.56 × 10 4 M -1 , Fig. and Supplementary Table ). Meanwhile, the detection ability of JUC-557-nanosheet for NB (K a : 6.18 × 10 6 M -1 ) is higher than all optical detection materials reported as yet, such as MOFs (K a : ~ 220 to 4.47 × 10 6 M -1 ), POPs (K a : ~ 1.16 × 10 2 to 7.50 × 10 5 M -1 ), and even small molecule probes (K a : ~ 3.62 × 10 3 to 7.86 × 10 5 M -1 ) and inorganics (K a : ~ 9.00 × 10 2 to 1.45 × 10 5 M -1 , Fig. and Supplementary Table ). Also, the LOD of JUC-557-nanosheet was calculated to be 4.05 × 10 -11 M (5 ppb) and 5.71 × 10 - 10 M (129 ppb) for NB and TNT, respectively. Notably, the quenching rates did not decrease even after ten cycles of tests for both NB and TNT (Fig. and Supplementary Fig. ), and the fluorescence quenching was still obvious at titration concentration of only 5 × 10 -9 M for TNT and 5 × 10 -8 M for NB, respectively (Supplementary Figs. ), demonstrating the excellent stability and sensitivity of JUC-557-nanosheet for the detection of these nitro-compounds. As shown in Supplementary Figs. and, the TRPL spectroscopy exhibited that the lifetime of JUC-557-nanosheet did not change visibly (τ 0 /τ ≈ 1)']","['Metal organic frameworks', 'Sensing and detection']",3111,1,1,0,0.985746017,0,['what']
"Singlet fission in heterogeneous lycopene aggregates We have prepared lycopene aggregates with negligible scattering in an acetone-water suspension. The aggregates exhibit highly distorted absorption, extending from the UV up to 568 nm, as a result of strong excitonic interactions. We have investigated the structural organization of these aggregates by resonance Raman and TEM, revealing that the lycopene aggregates are not homogeneous, containing at least five different aggregate species. Transient absorption measurements upon excitation at 355, 515, and 570 nm, to sub-select these different species, reveal significant differences in dynamics between each of the aggregate types. The strong excitonic interactions produce highly distorted transient electronic signatures, which do not allow an unequivocal identification of the excited states at times shorter than 60 ps. However, these experiments demonstrate that all the lycopene aggregated species form long-living triplets via singlet fission.",Causal,Why do the strong excitonic interactions produce highly distorted transient electronic signatures in the lycopene aggregates?,Answer not available from the given context. ,Negative,"['The aggregates exhibit highly distorted absorption, extending from the UV up to 568 nm, as a result of strong excitonic interactions. ', 'The strong excitonic interactions produce highly distorted transient electronic signatures, which do not allow an unequivocal identification of the excited states at times shorter than 60 ps.']","[[149, 282], [688, 879]]","['coupled H-aggregates in carotenes , where there is a main blue-shifted absorption, along with a weak red-shifted peak arising from Herzberg -Teller coupling (considered as a forbidden transition for H-aggregates) . Note that from these Raman spectra, we can only determine the minimum number of species present in the sample, and cannot exclude the existence of any number of minor species we do not detect. Transmission electron microscope (TEM) images of lycopene aggregates appear to indicate at least two different aggregate morphologies (figure ) -a crystal-like rod structure (length 2 \uf06dm and diameter 100 nm) and a more irregular geometry (diameter 50-200 nm). This is the first time that small, stable lycopene assemblies in solution have been characterized by TEM at high concentration (ca. 10 4 M). Small rod-like structures have been found for three different H-aggregates of zeaxanthin . It was proposed that the OH groups on the terminal rings of zeaxanthin and lutein facilitate the organization of these aggregates . The lack of any such groups in lycopene should thus increase the possibility of different types of association. The observed crystal-like morphologies are disordered, and do not allow a prediction to be made about the symmetry of the unit cell. TEM images do not contain enough information to determine whether each structure contains one single lycopene organization, or there are several sub-domains within the same aggregate. A more systematic data presentation is given in Figure , where the same three datasets are plotted in the form of time-gated spectra and compared with evolution-associated difference spectra (EADS) -the latter resulting from a global fit of the data using a sequential', 'ResultsThe absorption spectrum of monomeric lycopene in n-hexane exhibits three sharp bands, located at 442.4, 470.4 and 501.7 nm, respectively, corresponding to the 0-2, 0-1 and 0-0 vibronic levels of the S0\uf0aeS2 electronic transition (figure 1, solid blue line). These absorption transitions redshift with increasing polarizability of the environment, the 0-0 transition reaching 543 nm in carbon disulfide (figure 1, dotted blue line) . Lycopene aggregates (red curve in figure ) display a very different absorption spectrum, featuring a pronounced band peaking at 355 nm with a shoulder around 375 nm, then two bands at ca 414 & 481 nm, and a very redshifted band at 568 nm. A long absorption tail extending up to 700 nm is also visible. Lycopene aggregates, prepared by different protocols or formed naturally in chromoplasts, lead invariably to similar spectral features, as previously observed in tomato chromoplasts , lycopene films , and lycopene crystalloids .There is a consensus that these features are due to excitonic interactions , but no clear description of the origin of these bands has been proposed. The peak at 355 nm is an unmistakable signature of lycopene forming strong excitonic interactions in H-type aggregates, whereas the bands with small blue or red shifts (481 & 514 nm) and the largely redshifted 568 nm band remain controversial. Resonance Raman scattering spectroscopy is a highly sensitive tool to investigate multiple species in a complex matrix. In the resonance condition, when the energy of the incident light matches the electronic transition', 'DiscussionThe data from resonance Raman measurements shows that the \uf06e1 frequency shifts with different excitation wavelengths, indicating that strong excitonic coupling between lycopene molecules affects the vibrational frequencies. From the analysis of the \uf06e1 and \uf06e2 regions, we observe that the sample contains at least four, and probably five species of lycopene aggregates. These observations are further supported by the complicated dynamics of femtosecond-to-nanosecond transient absorption. While it is, in principle, conceivable that a single type of aggregate or crystal could exhibit the number of evolutionary steps observed, it is hard to see how so many steps would result in the rise and fall of so many bands at more or less the same wavelengths. A more plausible explanation is that multiple types of aggregate are present in the sample with similarly (but not identically) positioned spectral bands, exhibiting overlapping dynamics. 2. Vibrational cooling of the hot S1 state, typically occurring in monomeric carotenoids on a sub-ps timescale , which manifests itself as a narrowing and blue-shift of the IA band peaking at ca, 570 nm in lycopene monomers. We have already hypothesized three coexisting moieties with at least five (S2, hot S1, S1, S*, T1) interconnected excited states. This is more than enough to over-parametrize the datasets that are satisfactorily described by the 8 time constants (five in the fs-ns range plus three in the ns-µs range).The electronic signatures for the excited states are highly distorted from the well-characterized signatures for monomeric or weakly-interacting carotenoids. It is reasonable that the excited states experiment a similar degree of aggregation-associated spectral distortion as that seen for the ground states in the absorption spectrum. However, based on the lifetimes obtained it is tempting to propose a tentative', 'absorption spectrum. However, based on the lifetimes obtained it is tempting to propose a tentative assignment as follows: \uf03c 500 fs EADS to S2-like state, ca. 1p EADS to hot-S1-like state, 10-11ps EADS to S1-like state, 46-60ps EADS to S*-like state, which would then be the parent state for triplets, and the ca 550 ps EADS to interacting triplet states. It is clear that in order to better understand the spectroscopic properties of lycopene aggregates, it is necessary to design an alternative experimental protocol where each aggregate type can be observed selectively. This would allow us to propose more sophisticated models than the current linear scheme. The selective purification of each species of lycopene aggregate would clearly be ideal, but this may well turn out to be extremely complex given the number of different aggregate types formed here and reported in the literature. An alternative would be to use time-resolved resonance Raman spectroscopy, which should be sensitive enough to separate and distinguish the different excited states involved. Indeed, the selectivity of resonance Raman spectroscopy, and its sensitivity to the different arrangements of lycopene aggregates in their ground state, is illustrated very clearly in Figure . Whatever the case, the presence of several aggregation-domains, within the large lycopene aggregates observed by TEM, remains the best hypothesis to explain the obtained spectroscopic data.Figure 1\uf07c1\uf07cFigure 1\uf07cRoom temperature absorption spectra of monomeric lycopene in n-hexane (solid blue line), in CS2 (dotted blue line), and lycopene aggregates in acetone: water 1:1 suspension (solid red line).', 'of carotenoid aggregate species. We have chosen lycopene as the study case, since the assignments found in the literature are contradictory (J-aggregates , H-aggregates , and a mixture of H-and J-aggregates ). The lycopene molecule has a flat structure, in contrast to bulkier carotenoids with twisted terminal rings or keto groups, which allows close contact between the conjugated chains of neighbouring molecules (3.3 Å) , and may permit several structural organizations. We have produced lycopene aggregates in stable acetone-water suspension with low scattering, allowing us to perform spectroscopic measurements in the UV region of the spectrum -which had proved inaccessible using crystalloid films or lycopene nanoparticles . We characterize their absorption and morphology, and, using resonance Raman, we demonstrate the presence of different types of aggregate in the sample, and assess their configuration. We then use femtosecond-to-microsecond transient absorption spectroscopy, revealing the process of singlet fission in action in the UV-region with unprecedented resolution.']","['Spectroscopy', 'Optical spectroscopy']",79,1,1,0,0.879458492,0,['why']
"at 622 nm (see also Supporting Information Figure ). This feature was not observed in our previous transient absorption measurements due to the large ESA at the same detection wavelength (𝜆3) but appears in these 2DES spectra due to the resolution of the 𝜆1 axis.We previously postulated the existence of a hidden SE feature in our previous work and this data shows that this feature indeed exists.To determine the decay timescales associated with the diagonal 600 nm peak in Figure (a)-(f), the associated region of the 2DES data was integrated (see also Supporting Information Figure ) and plotted as a function of t2 and fit to decaying exponentials. From these data, two timescales were recovered, 2.5 ± 0.4 ps and 13.8 ± 1.0 ps. These timescales are in agreement with our previously reported results for this system at room temperature , with the shorter timescale corresponding to vibrational relaxation and the longer timescale to the lifetime of the excited state.https://doi.org/10.26434/chemrxiv-2023-lpsms ORCID: https://orcid.org/0000-0001-9692-5312 Content not peer-reviewed by ChemRxiv. License: CC BY-NC-ND 4.0 Due to low signal, a reliable timescale could not be extracted from the ESA feature at 𝜆1 = 606 nm and 𝜆3 = 625 nm, however, that signal is also gone at long t2 times. The 2DES experiments at 77 K used a laser pulse with a central wavelength of 529 nm (see Supporting Information Figure ). This pulse is overlapped with the primary absorption feature in the 77 K spectrum. As the spectral bandwidth of this pulse did not span the entire transition, there is some shaping of the features in the 2DES spectrum due to a convolution of the absorption with the laser pulse. This means that the maxima of the features in Figure do not",Causal,Why was the feature at 622 nm not observed in previous transient absorption measurements but appears in these 2DES spectra?,Answer not available from the given context. ,Negative,['This feature was not observed in our previous transient absorption measurements due to the large ESA at the same detection wavelength (𝜆3) but appears in these 2DES spectra due to the resolution of the 𝜆1 axis.'],"[[53, 263]]","['means that the maxima of the features in Figure do not necessarily correspond to the peaks of the transitions but correspond to the combination of the laser pulse and the spectra. Figure (a)-(f) displays representative 2DES surfaces at 77 K for various t2 delays.The change in temperature from 295 K to 77 K and the associated dimerization of TD1-Cu significantly changes the observed signal. At 295 K, the 2DES measurements are dominated by the GSB on the diagonal at 600 nm (Figure ) and all features disappear on the order of tens of picoseconds. At 77 K, we observe two closely spaced narrow diagonal peaks at 528 nm and 539 nm (Figure (a)-(f)). These correspond to GSBs from two excitonic energy levels. A crosspeak also appears at 𝜆1 = 528 nm and 𝜆3 = 539 nm, associated with energy transfer between the higher to the lower state. The crosspeak appears due to electronic coupling in the dimer. All features observed in the 2DES spectra at 77 K persist to the maximum experimental delay of 400 ps, while at 295 K, the signal has fully decayed within the first 100 ps, highlighting the presence of much longer-lived excited state in the TD1-Cu dimer compared to its room temperature monomer counterpart.The two diagonal peaks at 539 nm and 528 nm in the 77 K 2DES spectra arise from the GSB of two closely positioned electronic transitions originating from the triplet ground state of the dimer.Based on EPR measurements, the ligand spin in the dimer is quenched due to strong https://doi.org/10.26434/chemrxiv-2023-lpsms ORCID: https://orcid.org/0000-0001-9692-5312 Content not peer-reviewed by ChemRxiv. License: CC BY-NC-ND 4.0 antiferromagnetic coupling, while the spins on the Cu metal centers pair, resulting in a signal typical of a Cu(II) dimeric', 'fs and 480 fs timescales observed for the crosspeak and the diagonal peak at 539 nm, respectively, correspond to vibrational relaxation in the lower energy transition.1111', 'using the CCD corresponds to the 𝜆3 axis in the 2DES plots, the 𝜆1 axis is generated from the Fourier transform of the delay between the pump pulses t1. Each 2DES plot corresponds to a single point along the population time, t2. In Figure , the strong feature that appears on the diagonal at 600 nm in panel (a) is associated with a ground state bleach (GSB) of the primary π to π* transition shown in the room temperature (295K) absorption spectrum (Figure ). A second ground state bleach (GSB) feature associated with an electronic transition at 581 nm appears on the diagonal in Figure (see also Supporting Information Figure ), coinciding with the shoulder observed in the 295 K absorption spectrum. However, due to its proximity to the edge of the laser spectrum, the associated signal is weak. In Figure , an excited-state absorption (ESA) feature is observed as an off-diagonal peak at 𝜆1 = 606 nm and 𝜆3 = 625 nm. Although this signal is extremely weak, it exhibits a blue shift in its peak as the population time increases (Supporting Information Figure ) consistent with our previous findings . An off-diagonal ESA peak is present at 𝜆1 = 578 nm and 𝜆3 = 600 nm associated with transitions to higher lying π states. This feature was hidden in our previous transient absorption measurements due to the large GSB at the same detection wavelength (𝜆3) but appears in these 2DES spectra due to the resolution of the 𝜆1 axis. In addition, a positive feature associated with stimulated emission (SE) is observed along the diagonal at 622 nm (see also Supporting Information Figure ). This feature was', 'while the spins on the Cu metal centers pair, resulting in a signal typical of a Cu(II) dimeric species with a spin triplet. These GSB features are associated with the peak in the 77 K steady-state absorption spectrum (Figure ) near 525 nm and a broad shoulder on the low energy side. The signal corresponding to these GSBs persists throughout the entire experimental delay of 400 ps. Notably, the off-diagonal crosspeak between these two states is present from the beginning of the experiment, providing evidence of strong excitonic coupling between these states. This crosspeak also persists beyond the maximum experimental delay. The inset presents the level structure for the dimer.The decay timescales for the two diagonal peaks as well as the crosspeak in the 77 K 2DES data were determined by integrating the corresponding regions (Figure and Figure ) for all t2 delay times. The integrated trace of the GSB at 528 nm has a biexponential decay with timescales of 240 ± 70 fs and 1.8 ns ± 300 ps. Similarly, the lower energy state at 539 nm also displays a biexponential decay profile with a fast decay component of 480 ± 60 fs, followed by a long timescale of 1.7 ns ± 500 ps. Unlike the diagonal features, the crosspeak signal rises during the early population times with a timescale of 165 ± 70 fs. The higher energy diagonal peak has a corresponding but oppositely signed sub-250 fs timescale. These timescales are associated with an energy transfer process between the two states resulting from excitonic coupling. Following the rise in the signal from the fast energy transfer, the crosspeak then undergoes a biexponential decay with timescales of 460 ± 80 fs and 1.5 ns ± 300 ps. The 460 fs and 480 fs timescales observed for the crosspeak and the diagonal peak at 539 nm, respectively,', 'change between the 200 K and 175 K traces. These spectra were acquired using a laser pulse centered at 600 nm, covering a spectral range of 570 nm to 633 nm. A brief description of the experimental setup is provided here (additional details can be found in Section 2 of the Supporting Information). The 2DES measurements were collected using a home-built femtosecond pump-probe geometry 2DES setup. A 1kHz regenerativeamplifier laser system, Coherent (Libra), was used to power a home-built single-pass noncolinear optical parametric amplifier (NOPA). The NOPA output was compressed using a prism compression line and later split to generate pump and probe pulses. The pump pulse was passed through a pulse shaper, FASTLITE Dazzler, to provide controllable variable time delay between two collinear pump pulses. This delay between the two pump pulses is called t1 or the coherence time, and the delay between the pump pulses and the probe is called t2 or the population time. The spot size of the pump and probe beams at the sample position was approximately 80 µm. The NOPA output was centered at 600 nm and 529 nm for the room temperature (295 K) and 77 K measurements respectively (see Figure in the Supporting Information). Second harmonic generation signal generated with a BBO revealed a temporal width of sub-45 fs and sub-40 fs for the pulses used for the room temperature and 77 K measurements, respectively, which was complemented by polarization gated frequency resolved optical gating (PG-FROG) using a nonresonant sample (see Figures and in the Supporting Information). After the sample position, the probe was focused onto a spectrometer (SpectraPro HRS-300) and detected on a CCD (PIXIS 400, Princeton Instruments). The detection frequency axis collected using the CCD corresponds to the 𝜆3 axis in the 2DES plots, the 𝜆1 axis is generated from the']","['Spectroscopy', 'Optical spectroscopy']",224,1,1,0,0.948091873,-2.22E-16,['why']
" They have established that the ET rate constant remains virtually independent up to 9 methylene unit containing linkers and then falls off exponentially with a decay coefficient for electron tunnelling, ß =1.03 ±0.02 per methylene unit for longer alkyl thiol spacer and this value of ß is very close to the value estimated from cyclic voltammetry, indirect laser induced temperature jump method, electrochemical impedance measurement and potential modulated electro reflectance techniques for redox active moiety attached to thiol SAM on Au. Several groups have reported ET control of chemical reactions by controlling the chain length of the SAM. Collman and co-workers have shown that the selectivity of O2 reduction by a model complex of cytochrome c oxidase (CcO) chemically attached to thiol modified Au electrode follows same kinetics as found in-vivo in which selectivity depends on the rate of ET to the active site. In the case of mononuclear Fe-porphyrins, where additional redoxcentres are absent, the selectivity of electrochemical O2 reduction is limited by the rate of ET from the electrode to the active site. Most recently reactivity of iron-porphyrins on SAM covered Au could be switched between O2 reduction to monooxygenation by controlling the ET rate. Thus control of ET is evolving as a tool for reaction engineering. Recently, from experimental findings and theoretical modelling, it has been established that for short-chain alkyl thiol, namely methanethiol and propane thiol, SAM formation on Au surfaces take place via",Causal,Why does the ET rate constant remain virtually independent up to 9 methylene unit containing linkers and then falls off exponentially?,Answer not available from the given context. ,Negative,"['They have established that the ET rate constant remains virtually independent up to 9 methylene unit containing linkers and then falls off exponentially with a decay coefficient for electron tunnelling, ß =1.03 ±0.02 per methylene unit for longer alkyl thiol spacer and this value of ß is very close to the value estimated from cyclic voltammetry, indirect laser induced temperature jump method, electrochemical impedance measurement and potential modulated electro reflectance techniques for redox active moiety attached to thiol SAM on Au.']","[[0, 542]]","['target=""#b14"">[15] Among various electrochemical methods available, cyclic voltammetry and chronoamperometry have been widely used to study the ET kinetics across the SAM. The structure of Au-thiol interfaces in thiol coated nanoparticles (3D SAMs) and thiol SAM on Au surfaces (2D SAMs) are different. High resolution crystal structure and the quantification of H2 gas produced during SAM formation clearly indicates that the Au-thiol interface in SAM coated nanoparticles contains thiolates. Recently, is has been shown that the valance state of Authiol interface contains Au (0)-thiyl with Au-d orbital dominated interactions in contrast to the Au-s orbital interactions present in the Au (I)-thiolate compounds. In general ET across Au-SAM can be viewed as non-adiabatic with a sharp decrease in electron tunnelling probability with increasing the length of the spacer between the electrode (donor) and the redox active moiety (acceptor) i.e., the chain length of the SAM. Ulstrup and co-workers have determined the interfacial ET from Au (111) to Azurin attached by alkanethiol of differing chain length. They have established that the ET rate constant remains', ""Fig.6:The dependence of tilt angle and tilt direction with respect to the chain length of the alkyl thiol SAM on Au. The values are taken from earlier reports.  ConclusionIn conclusion, ET between Au-SAM electrode and a covalently attached Fc moiety shows thiol SH/SD isotope effect. Several Au-SAM interfaces with varying chain length of the thiol are demonstrated to show KIE on ET rates. KIE is confirmed using both CA and Laviron's approach. In the case of N3C11SH/D-C8SH/D modified Au electrode (substantial through space tunneling), a normal KIE on ET is seen which changes to an inverse in the case of N3C16SH/D-C16SH/D SAM (substantial through bond tunneling). These observations compel invoking of quantum effect on ET from the vibrations originating from the Au-(H)SR interface which shift dramatically on H/D substitution. The results clearly suggest that further detailed investigation of these useful interfaces is required. ASSOCIATED CONTENT Supporting InformationThe Supporting Information is available free of charge on the ACS Publication website. Synthesis of linkers, their characterization, detailed experimental methods, additional electrochemical and SERS data (PDF)A = ħ 2 E s k B T Scheme 1 :1Scheme 1: Schematic representation of ET from Au electrode to ethynyl ferrocene (EtnFc) covalently attached to the mixed SAM of different chain length."", 'IntroductionLong range electron transfer (ET) has a crucial role in numerous biological processes ranging from photosynthesis to aerobic respiration. Apart from the energy transfer processes in biology like respiration and photosynthesis, key biological transformations like monooxygenation is rate limited by ET. In addition to the biological processes, manoeuvring the ET between the electrode and molecular materials is key to molecular electronic devices. Long range ET, its mechanism and factors that intrinsically controls it are of interest to the scientific community. Self-assembled monolayers (SAMs) of organic thiols on coinage metals like Au, Ag, Cu and Pt has been evolved to be a convenient model system for investigating ET through molecular closed-packed films as these systems are modular and amenable to chemical modifications. In particular, self-assembled of organothiol monolayers on Au electrodes are extensively used due to the thermodynamic stability of Au-S bond and the inertness of Au towards oxidation. The kinetics of ET between the electrode and a redox active moiety through SAM can be monitored by electrochemical, photochemical and temperature jump techniques. Among various electrochemical methods available, cyclic voltammetry and', 'ResultsCyclic voltammograms of EtnFc attached on the N3C11SH-C8SH self-assembled monolayers (SAMs) modified Au electrode shows an E1/2 at 300 mV at 1 Vps scan rate in pH 7 phosphate buffer at room temperature (Fig. ). The ET rate from the Au electrode to the covalently bound EtnFc across the SAM has been determined using chronoamperometry. Chronoamperometry is a very useful tool for the determination of apparent ET rate (kapp) from an electrode to a redox active species bound to various SAMs modified electrode. In CA experiments, the faradaic current decays according to the following exponential relationship. i = kapp Q exp (-kappt) ………………………………….. (1)  where Q denotes the amount of charge passed during this redox transformation. The CA current decay comprises two types of processes, one for the overall capacitive current decay and the other is due to the faradaic current decay of the attached redox active moiety. The charging current decays very much faster than the faradaic current. This helps to determine the kapp of ET from the electrode to the attached redox active species by simply choosing the appropriate time scale of decay. The plot of Ln(i) vs. time is linear and its slope yields the value of kapp. Chronoamperograms of N3C11SH-C8SH SAM-modified Au electrodes demonstrate a complete decay of charging currents within 0.2 ms time scale (Fig. ) whereas the faradaic currents decay completely at 7.5 ms when EtnFc covalently bound to it (Fig. ). The ET rate from the modified Au electrode to the EtnFc in pH 7 phosphate buffer is determined from the slope of the corresponding semilogarithmic plot of Ln(i) vs. time and is found to be 1030 s -1 which reduced to 575 s -1 when EtnFc bound N3C11SD-C8SD', ""alkyl thiol, namely methanethiol and propane thiol, SAM formation on Au surfaces take place via non-dissociative pathway. Simultaneously, it has been reported that SAM formed from solution deposition methods on gold and silver surfaces consists of both thiol and thiolate with ratios varying between 1:3 to 1:2.5 (Scheme 1). A ~400 cm -1 shift in the \uf06eS-H mode and >15 cm -1 shift in \uf06eCS mode was observed upon deuteration of the thiol proton in the surface enhanced Raman spectroscopy (SERS). X-ray photoelectron spectroscopy data indicate the presence of both thiol and thiolates in these SAM-modified Au/Ag surfaces. The same techniques show the lack of protonated thiols on Au/Ag nanoparticles.In this manuscript, the interfacial ET rate from Au electrode to the ethynyl ferrocene (EtnFc) covalently attached through alkyl thiol SAM of different chain length (Scheme 1) is determined by electrochemical techniques like cyclic voltammetry (CV) using Laviron's formalism(k 0 ) and chronoamperometry (CA) (kapp) of both in their protonated (R-SH) and deuterated (R-SD) variety. The data clearly show the presence of a kinetic isotope effect (KIE) on the measured tunnelling rates which varies with the chain length of the SAM.""]","['Quantum and theoretical chemistry', 'Quantum effects']",2871,1,1,0,0.878220651,2.22E-16,['why']
"at intermediate and later stages of the measurement. This behavior likely results from the onset of BiPO4 deposition at the surface of the electrode, which leads to a local increase of the surface compactness. The value of 𝑛 does not saturate at 40 min, suggesting that the restructuring of the surface may further extend to later times. We additionally analyze GISAXS data obtained during measurements of the open circuit potential (OCP) under chopped light illumination (Figures S21-S28), and account for the transmitted and reflected X-ray intensities by the electrode film. We attribute the dominant change in intensities to a slight, reversible change of incident angle by ±0.0003° upon illumination, while we observe no change in electrode porosity as a result of the OCP measurement.Discussion of photocorrosion mechanism. Our operando X-ray scattering experiments, together with ex-situ XANES and ICP-MS, allow us to outline the multiple reaction pathways and their respective time scales determining the overall photocorrosion process of CuBi2O4 films during PEC operation (Figure6). Figure 6 :6Figure 6: Schematic summary of the multiple reaction pathways and relative time scales determining the degradation of CuBi2O4 electrodes both before and during the chronoamperometry. 4 3 -3+ 8h + ⇌ Cu 2+ (aq.) + 2BiPO 4 + 2O 2. (eq. 3)",Causal,Why does the onset of BiPO4 deposition at the surface of the electrode lead to a local increase of the surface compactness?,Answer not available from the given context. ,Negative,"['This behavior likely results from the onset of BiPO4 deposition at the surface of the electrode, which leads to a local increase of the surface compactness.']","[[53, 209]]","[' The GISAXS intensity from the CuBi2O4 film is clearly distinguishable and shows a characteristic power law decay 𝐼#𝑞 !"" $ ~ 𝑞 !"" #$.& for 0.015 ≤ 𝑞 !"" ≤ 0.08 Å -1 , i.e. on a length scale ranging between 8 and 40 nm. Such scattering is typical for a porous materials with fractal structure and revealed that the electrode pores reach down to 8 nm in size, i.e. much smaller to what could be determined by simple inspection of SEM micrograph in Figure . Furthermore, the GISAXS signal from the reference samples of FTO and bare silica do not display the power law decay observed for the CuBi2O4 electrode, therefore confirming that the porosity is indeed located in the CuBi2O4 layer.Insight into the photodegradation process -ex situ. We measure ex-situ the structural changes of CuBi2O4 electrodes after photodegradation. To this end, we investigate two CuBi2O4 electrodes which were treated with either a 24 h immersion in the electrolyte solution and in the absence of applied bias, or with a 4 h chronoamperometry at 0.5 V vs RHE and under illumination. In Figure the respective TS patterns are compared against a pristine CuBi2O4 film pattern. For the treated electrodes, we observe the emergence of a hydrated crystalline BiPO4 phase (space group P3121), which clearly forms even without applied bias and in the dark by a prolonged immersion of the electrode in the electrolyte. The electrode treated with the chronoamperometry additionally displays intense Bragg\'s reflections characteristic of metallic Bi (space group R-3m) as well as traces of metallic Cu phase (space group Fm-3m), both as a result of cathodic photocorrosion. This is further supported by X -ray absorption near edge spectroscopy (XANES) at the Cu K-edge of films (Figure ) and inductively', 'Operando X-ray scattering elucidates the photocorrosion mechanism of CuBi2O4 films The surface sensitivity of Total Scattering of atomic Pair-Distribution Function (TS-PDF) and Small Angle X-ray Scattering (SAXS) enables studying the interplay between the structural changes and photoelectrochemical performance of photocathodes. CuBi2O4 undergoes photocorrosion to Bi and Cu, and further dissolves releasing Cu ions in the electrolyte and forming BiPO4. The rapid formation of Bi correlates with an abrupt drop of photocurrents.ABSTRACT. CuBi2O4 has recently emerged as a promising photocathode for photoelectrochemical (PEC) water splitting. However, its fast degradation under operation currently poses a limit to its application. Here, we report a novel method to study operando the semiconductor-electrolyte interface during PEC operation by surface-sensitive high-energy Xray scattering. We find that a fast decrease in the generated photocurrents correlates directly with the formation of a metallic Bi phase. We further show that the slower formation of metallic Cu, as well as the dissolution of the electrode in contact with the electrolyte, further affect the CuBi2O4 activity and morphology. Our study provides a comprehensive picture of the degradation mechanisms affecting CuBi2O4 electrodes under operation and poses the methodological basis to investigate the photocorrosion processes affecting a wide range of PEC materials.', ""fit to the data and Figure the evolution of structural parameters. In the first 8 minutes of operation the amplitude of the scattering signal (I(qx,y min)) at low-q values quickly increases and reaches a maximum after 20 min, thus indicating that the bulk porosity increases during the initial stage of CA. This result likely comes from the consumption of CuBi2O4 electrode material and the growth of small metallic Bi deposits. The exponent 𝑛 of the power law 𝑞 #' , obtained from the fit, measures the ruggedness or dimensionality of the surface. During the CA, 𝑛 varies between 2 and 3, which are typical values for non-smooth interfaces probed at low q. After a steeper decline at the beginning of the CA, 𝑛 slowly increases, indicating that the contribution of compact deposits to the total GISAXS signal We found that the abrupt drop of the photocurrents occurring during the first few minutes of the chronoamperometric tests (Figure and Figure ) is dominated by the consumption of CuBi2O4 and the concurrent formation of metallic Bi at the surface of the electrode. This results from a cathodic photocorrosion process, in which the photogenerated electrons are consumed for the reduction of lattice Bi 3+ ions into Bi 0 , which segregates and crystallizes as a metallic Bi phase (eq. 1).cathodic photocorrosion (fast): Bi 3+ + 3e -⇌ Bi 0 (eq. 1) (e -= photogenerated electrons)The quick formation of metallic Bi is not limited by use of a LED illumination but was also determined for a CuBi2O4 electrodes undergoing chronoamperometry under simulated solar radiation (Figure and Table )."", 'at the Cu K-edge of films (Figure ) and inductively coupled plasma mass spectroscopy (ICP-MS) of electrolyte solution Figure .The XANES data show the presence of 1.5 % and 12 % of metallic Cu inside the CuBi2O4 electrode after 40 minutes and 4 hours of chronoamperometry at 0.5 V vs RHE, respectively. The ICP-MS measurements display a steady increase in the concentration of Cu species in solution both, before and during the chronoamperometry. However, no Bi ions could be detected in the electrolyte. While ICP-MS does not provide information over the oxidation state of the detected Cu species, the Pourbaix diagram of Cu indicates that the most stable copper species at the electrolyte pH of 5.7 and the OCP potential of the CuBi2O4 electrode (~ 0.5V vs. RHE) is Cu 2+ .[7a] Moreover, SEM/EDX images, Figure , clearly show the presence of BiPO4 structures which grows on top of the CuBi2O4 film as multiple branches, with single branches growing even up to few micrometers in length. Figure schematically illustrates both the chemical species and structural modifications detected in electrolyte and at the surface of the electrode as a result of either the reduction or the dissolution of the pristine CuBi2O4 material under applied external bias and illumination. Therefore, unlike hypothesized in the literature, our results reveal that the formation of metallic Bi rather than metallic Cu is the most prominent outcome of the photo-electrochemical degradation of CuBi2O4 by cathodic photocorrosion. However, ex situ characterizations do not reveal the degradation time scales. Operando structural characterization by X-ray scattering. While the ex-situ characterization permits to identify various changes of the electrode, it is not possible to pinpoint which phenomena are responsible for the abrupt', 'SummaryIn this work, we show an operando high-energy X-ray scattering method to investigate the photocorrosion mechanisms and relative time scales on photo-electrochemically active CuBi2O4 electrodes. We measure TS and SAXS simultaneously in grazing incidence to reveal structural modification close to the CuBi2O4-electrolyte interface. We show that under illumination and applied bias the CuBi2O4 electrodes quickly undergo a cathodic photocorrosion process which determines the formation of a segregating metallic Bi phase. This process takes place on a time scale of only few minutes after beginning of the chronoamperometry and correlates with a decrease of around one order of magnitude in the observed photocurrents. Moreover, additional degradation processes occur on slower time scales: formation of metallic Cu and dissolution in the electrolyte as an effect of both anionic photocorrosion and acidic dissolution. The two phenomena cause a steady release of Cu 2+ ions in solution as well as the crystallization of BiPO4 branched structures at the surface of the electrode due to the interaction of the releasing Bi 3+ ions with the phosphate species in the electrolyte. The formation of an insulating BiPO4 layer is likely responsible for the slow decrease in the measured photocurrents at intermediate and later stages of the chronoamperometry.In summary, our study shows that the high-energy X-ray scattering can probe structural information ranging from atomic to nanometer length scales in a realistic experimental environment, thus allowing to simultaneously correlate chemical and morphological modification of the film electrode with changes of photocurrent. Understanding how photoactive electrodes degrade under operation conditions is the first step towards new strategies for increasing the long-term stability and improving efficiency, but also planning the sustainable disposal strategies. In the future, the']","['Energy', 'Photovoltaics']",3958,1,1,0,0.889385181,0,['why']
"In particular, 2D COFs are a family of novel crystalline materials comprised of covalently-linked layers stacked via noncovalent long-range interactions such as van der Waals (vdW) forces, London-dispersion forces, and aromatic interactions. 10 2D COFs can be designed to a highly periodic atomic framework and give the uniaxial stacking of 2D macromolecular frameworks on an atomic level. 11, 12 Furthermore, stacking interactions in these materials are essential to control their electronic properties 13 , stability 14 , crystallinity , and porosity . The tunability of 2D COFs offers unique architectures that provide a wide array of electronic properties given their spatial stacking and interlayer interactions. 17 Moreover, their nanoporous and layered arrangement leads to an ultra-high surface area, offering a large number of binding sites for molecular sensing, 18 gas storage, 19 and catalytic reactions. Traditionally, 2D COFs are formed by dynamic covalent linkages, such as imine and arulhydrazone bonds. These exhibit relatively poor π-delocalization and low stability, impeding their usage as conductors or semiconductors. However, their organic structure-and consequently, their electronic properties-can be modified or designed using the vast tools of organic synthesis. In recent years, researchers have been able to promote electron delocalization by generating conductive 2D COFs with electroactive organic building blocks and through chemical doping. However, a technique that has not been widely explored for the modification of 2D COF electronic structures is intercalation. Intercalation is the process of inserting guest species into the interlayer gap of 2D materials. It has been shown to provide methods to change layered",Causal,Why are stacking interactions in 2D COFs essential for controlling their properties?,Answer not available from the given context. ,Negative,"['Furthermore, stacking interactions in these materials are essential to control their electronic properties, stability, crystallinity, and porosity.']","[[394, 554]]","['intercalated bilayer 2D COFs, we find that twenty-four of our materials are conductors in at least one of their spin channels, while the rest are semiconductors or insulators with a bandgap ranging from 0.2 to 3.24 eV. In terms of photocatalysis, our absolute spin-polarized band edge alignment shows that all of our semiconducting materials have a band alignment suitable for hydrogen reduction through photoexcited electrons, and one of our materials (Ni-01a) has a band alignment suitable for oxygen evolution photocatalysis. Within the semiconductor COFs, we find three (Cr-03, Ti-03, and V-03) that have direct bandgaps that fall within the visible range; therefore, they are ideal for optoelectronics. Finally, we explore the spintronic properties of our materials, where we observe that eighteen of them (Co-03, Cr-01a, Cr-01b, Cr-04a, Cu-01a, Cu-01b, Fe-04b, Fe-05, Ni-03, Ni-04a, Ni-04b, Ni-05, Sc-01a, Sc-01b, Sc-04b, Ti-01a, Ti-02, and Ti-05) present half metal behavior, five of them (Co-04a, Co-04b, Cr-02, Mn-04a, and V-01a) have appropriate band alignments for their use as half semiconductors, and eleven of them (Cu-02, Fe-01a, Fe-01b, Mn-01a, Mn-01b, Sc-02, Ti-04a, Ti-04b, V-02, V-04b and V-05) have potential application as bipolar magnetic semiconductors. However, bilayer BMSs present large gaps within their band structure below the VBM, which inhibits the movement of electrons within the material. To remedy this issue and as proof of concept, we added another fully intercalated COF layer to the V-05 structure, which provided more intermediate electronic density levels while preserving its bipolar magnetic semiconducting character. In general, this work provides a new architecture of isolated bilayer and trilayer TM-intercalated 2D COFs, which have the potential to be used in a wide array of fields, including catalysis, optoelectonics, and spintronics.', 'Figure . Scheme of the atomic structure and density of states for pristine (left) and intercalated (right) 2D COFs. Atomic structures for pristine and intercalated 2D COFs are shown in ""perspective"" and ""top"" views for each structure. The DOS illustration shows how TM intercalation promotes carbon p-orbital and transition metal d-orbital interactions, potentially reducing the bandgap from insulating to semiconducting. For visualization aid, DOS projections are not to scale. Oxygen projection is not plotted since oxygen orbitals generally do not show important contributions to the DOS near the Fermi energy for these particular structures. Atom colors in the structures correspond to the colors shown in the DOS projections.Here, we specifically deal with transition metal intercalation in an isolated, freestanding triazine-benzene-boroxine 2D COF bilayer, a material which-to the best of our knowledge-has not been conceptualized in the past. Our main hypothesis is that by controlling the intercalated d-block elements and concentrations, we will be able to modify their interlayer interactions (by promoting interactions between the COF π-orbitals and TM d-orbitals), which can lead to fine-tuning their electronic and magnetic behavior. Such changes include, for example, modifying the 2D COF\'s natural insulating behavior to that of a semiconductor, by promoting the appearance of available states near the Fermi level via COF p-orbital and TM d-orbital interactions. This is illustrated in Figure . Furthermore, electron confinement in two spatial dimensions is known to drastically change the electronic properties of materials when they are reduced from bulk to 2D. ', ""Exquisite Control of Electronic and Spintronic Properties on Highly Porous Covalent Organic Frameworks (COFs): Transition Metal Intercalation in Bilayers Two-dimensional covalent organic frameworks (2D COFs) are crystalline organic porous materials that are stacked in a layered fashion. In general, these materials have excellent structural tunability, which can be achieved through the various tools of organic synthesis. Their layered and porous nature makes them attractive candidates for electronics, optoelectronics, and catalysis. However, their application is still limited due to relatively poor π-delocalization. In this paper, we computationally explore a novel 2D COF architecture, consisting of only two crystalline atomic layers comprised of benzene, boroxine, and triazine rings. We study the intercalation of first-row transition metals in the bilayer to enhance and fine-tune their electronic behavior. Furthermore, we perform a systematic study to understand the magnetic behavior of the intercalated transition metals. We found that the concentration and position of transition metals in the structure can drastically change the 2D COFs' electronic and magnetic features. Furthermore, based on their spin-polarized electronic properties, we highlight potential applications in the fields of optoelectronics, photocatalysis, and spintronics."", 'into the interlayer gap of 2D materials. It has been shown to provide methods to change layered materials\' electronic band filling and Fermi level 22 ; and can even induce exotic properties such as superconductivity and enhance spin-orbit coupling gap opening in topological insulators 25 . Particularly, using transition metals as intercalants in 2D materials has resulted in interesting property-tuning mechanisms for electronic/optoelectronic, spintronic, magnetic, and topological insulator materials. Although transition metal intercalation has been extensively explored for other 2D materials 28 , in the particular field of 2D COFs, this mechanism has not been widely studied, with only a few publications on the matter. In the past, computational simulations have been carried out for intercalation in ""bulk"" 2D COFs, i.e. structures with periodic boundary conditions, where layers repeat ""infinitely"" in the z-direction. This previous work predicted intercalation to be an excellent tool for modifying and enhancing COFs\' electronic properties.', 'IntroductionWe report a first-principles computational analysis of transition metal (TM) intercalation in two-dimensional (2D) triazinebenzene-boroxine bilayer Covalent Organic Frameworks (COFs), providing a mechanism to tailor their electronic and magnetic properties. Due to the wide range of spin-polarized bandgaps and band alignments observed in these structures, we believe these materials have the potential to perform as two-dimensional porous optoelectronic, catalytic, and spintronic devices. Analysis of different magnetic states reveals that these structures can be stable in ferromagnetic (FM), ferrimagnetic(FiM), antiferromagnetic(AFM), and non-magnetic(NM) arrangements, depending on the type and amount of TMs intercalated in the bilayer COF. In turn, their magnetic structure affects their potential electronic/spintronic properties, which we use to our advantage for fine-tuning their electronic structure.COFs are polymeric porous materials that form extended network structures connected by organic linkers. These materials enable the integration of organic, light-element (e.g. C, H, N, B, O) building blocks with strong covalent bonds-which would typically result in amorphous solids-however, due to the dynamic covalent chemistry and slower reaction kinetics, one can obtain 2D or 3D crystalline periodic materials. 1, In COFs, the faces and edges of their monomer units are exposed to pores, resulting in high surface area. Their structural, physical, and chemical features include tunable porosity, low density, high crystallinity, and strong covalent bonds. These properties establish these materials as an ideal platform for applications including gas storage 3, 4 , sensors 5 , catalysis 6 , energy storage 7, 8 , and optoelectronics. In particular, 2D COFs are a family of novel crystalline materials comprised of']","['Unclassified', 'Unclassified']",3754,1,1,0,0.950104793,-2.22E-16,['why']
"(vibrational and orientational) components, then uses the solvent's optical dielectric constant (ε ∞ ) to describe the fast processes while the static dielectric constant (ε 0 ) describes the total polarization response, including both nuclear and electronic contributions. In this way, nonequilibrium PCMs describe the change in electronic polarization following a sudden change in the charge distribution of the solute, corresponding to vertical electronic excitation or vertical ionization. In contrast, the state-relaxed algorithm is targeted at equilibrium solvation where all polarization mechanisms are fully relaxed in the excited state, as appropriate for the description of emission.",Causal,Why do nonequilibrium PCMs describe the change in electronic polarization following a sudden change in the charge distribution of the solute?,Answer not available from the given context. ,Negative,"['In this way, nonequilibrium PCMs describe the change in electronic polarization following a sudden change in the charge distribution of the solute, corresponding to vertical electronic excitation or vertical ionization.']","[[274, 493]]","['B. Equilibrium state-specific solvationElectrostatic interactions between the electronic ground state of the solute and the continuum solvent are described by a reaction-field operator, R0 . The total electronic energy in the ground state isE 0 = Ψ 0 | Ĥvac + R0 |Ψ 0 (2)in which Ĥvac is the vacuum (gas-phase) Hamiltonian.The subscript ""0"" in R0 indicates that the ground-state wave function is used to polarize the medium. In a ground-state self-consistent reaction-field (SCRF) calculation, the energy that is variationally minimized is not actually E 0 but rather the free energy G 0 = E 0 -W 0 , whereW 0 = 1 2 Ψ 0 | R0 |Ψ 0(3)is the work required to polarize the continuum. A ground-state SCRF calculation therefore corresponds to minimization of a functional G 0 [Ψ] that is given by G 0 = Ψ 0 | Ĥvac + 1 2 R0 |Ψ 0 .(4)We will now extend this idea to state-specific solvation of an excited-state wave function |Ψ k , starting with an equilibrium approach in which the polarization of the medium is fully relaxed with respect to the excited-state charge distribution, using the solvent\'s static dielectric constant (ε 0 ) to represent all possible polarization mechanisms for the medium. This approach should be valid in the long-time limit after excitation, whereas the case of a sudden (vertical) excitation requires a nonequilibrium approach, as developed in Section II C. For equilibrium solvation on excited state k, one must solve the statespecific Schrödinger equation( Ĥvac + Rk )|Ψ k = E k |Ψ k .(5)(Our notation for excited-state PCM calculations follows that used in a recent review. <ref type=""bibr""', 'not offer a realistic description of singlet fission in solution, where polarization-induced charge localization is observed in solvents with dielectric constants as small as ε 0 = 3, but not in vacuum (ε 0 = 1).kFIG. 2 :2FIG.2: Flowchart for the RAS-SF + PCM procedure, illustrating the ptSS procedure (purple arrows) versus the equilibrium state-relaxed procedure (green arrows). Step 1 of the ptSS approach involves an SCRF calculation using the ground-state eigenvector of the CI Hamiltonian (illustrated with a gray box, as in Fig.1). In step 2, excited-state eigenvectors are computed from the CI Hamiltonian using a frozen reaction field for the ground state ( R0), then corrected using the perturbation Rf k -Rf 0 . In this approach, all of the CI eigenvectors can be corrected at once and only a single CI calculation is required in step 2. Alternatively, the fully-relaxed equilibrium procedure corresponds to a SCRF calculation in the presence of reaction-field Rk , solving the state-specific Schrödinger equation [Eq. (5)] one state at a time to obtain fully-relaxed energies E k .', 'C. Perturbative state-specific solvationWe next describe a nonequilibrium approach to statespecific solvation that is appropriate for modeling vertical excitation energies. The nonequilibrium formalism recognizes that nuclear (vibrational and orientational) degrees of freedom within the (implicit) solvent do not respond quickly enough to remain in equilibrium with a vertical electronic transition, and indeed this is the sense in which the excitation is ""vertical"". There is also an electronic component to the solvent\'s polarization response, however, and it ought to remain in equilibrium with the solute. The total polarization in the ground state is thus partitioned into ""slow"" (nuclear) and ""fast"" (electronic) components,R0 = Rs 0 + Rf 0 .(11)Operationally this means that the ground-state polarization charge σ 0 (generated by R0 ) is partitioned as σ 0 = σ s 0 + σ f 0 , where 16σ s 0 = ε 0 -ε ∞ ε 0 -1 σ 0 (12a) σ f 0 = ε ∞ -1 ε 0 -1 σ 0 .(12b)The solvent\'s optical dielectric constant (ε ∞ ), which has been called the ""dielectric constant for induced polarization"", is used to describe electronic polarization.Considering the equilibrium expression for E k in Eq. ( ), where Rk = Rs k + Rf k , a corresponding nonequilibrium expression is obtained by instead using Rs 0 + Rf k as the reaction-field operator for excited state k, corresponding to a state-specific polarization charge density σ k = σ s 0 + σ f k . This substitution affordsE noneq k = Ψ k | Ĥnoneq k |Ψ k(13)whereĤnoneq k = Ĥvac + Rs 0 + Rf k(14)is a state-specific Hamiltonian for', ""State-specific solvation for restricted active space spin-flip (RAS-SF) wave functions based on the polarizable continuum formalism The restricted active space spin-flip (RAS-SF) formalism is a particular form of single-reference configuration interaction that can describe some forms of strong correlation at relatively low cost, and which has recently been formulated for the description of charge-transfer excited states. Here, we introduce both equilibrium and nonequilibrium versions of a state-specific solvation correction for vertical transition energies computed using RAS-SF wave functions, based on the framework of a polarizable continuum model (PCM). Ground-state polarization is described using the solvent's static dielectric constant and in the nonequilibrium solvation approach that polarization is modified upon vertical excitation using the solvent's optical dielectric constant. Benchmark calculations are reported for well-studied models of photo-induced charge transfer including naphthalene dimer, C2H4 • • • C2F4, pentacene dimer, and perylene diimide (PDI) dimer, several of which are important in organic photovoltaic applications. For the PDI dimer, we demonstrate that the charge-transfer character of the excited states is enhanced in the presence of a low-dielectric medium (static dielectric constant ε 0 = 3) as compared to a gas-phase calculation (ε 0 = 1). This stabilizes mechanistic traps for singlet fission and helps to explain experimental singlet fission rates. We also examine the effects of nonequilibrium solvation on charge-separated states in an intramolecular singlet fission chromophore, where we demonstrate that the energetic ordering of the states changes as a function of solvent polarity. The RAS-SF + PCM methodology that is reported here provides a framework to study charge-separated states in solution and in photovoltaic materials."", ""A recently-developed variant of RAS-SF allows analysis of charge-transfer (CT) states, which were previously inaccessible to the theory. The new method can compute not just CT states but also electronic couplings, * herbert@chemistry.ohio-state.edu using a diabatic framework that may facilitate more indepth understanding of photophysical processes such as artificial or biological light-harvesting. The position of CT states in the excitation manifold is often sensitive to polarization effects, even in low-dielectric environments such as organic photovoltaic materials. Therefore some treatment of the surrounding medium is likely necessary in order to make contact with experiments.In the present work, we augment the RAS-SF methodology to include solvent polarization based on dielectric continuum theory, within the framework of the polarizable continuum model (PCM). Specifically, we introduce both equilibrium (state-relaxed) and nonequilibrium versions of the RAS-SF + PCM formalism, in order to account for differential polarization upon electronic excitation of the solute. The nonequilibrium continuum approach separates the medium's polarization response into fast (electronic) and slow (vibrational and orientational) components, then uses the solvent's optical dielectric constant""]","['Energy', 'Photovoltaics']",4062,1,1,0,0.973653908,0,['why']
"and cathode of a 2-electrode capillary-fed cell during water electrolysis, it was necessary to introduce a reference electrode into the system. This was done by preparing a transparent, acrylic, second-generation test cell of the same type described previously, and then cutting off its bottom, as depicted in Figure . The transparency of the cell allowed for viewing inside during operation; however, little could be observed, requiring the need for the more advanced techniques reported here.The cell was then assembled in a zero-gap configuration, with a cathode and anode sandwiched tight up against opposite sides of a fast-wicking polyethersulfone (PES) separator membrane with 8 m average pore diameter ('8 m PES'). The bottom end of the PES separator extended out the bottom of the cell, as shown in the exploded view in Figure . until it had a net loading of 0.5 mg cm -2 Pt. The cathode was prepared using the preparative procedure of Hodges and co-workers, which was based on one previously reported by Masel and colleagues. The cathode is designated in this work as: 'Pt/C/Nafion/CFP'. It was maintained in direct electrical contact with a perforated Ni bipolar plate and a gas-tight cathode compression bolt, by screwing in the compression bolt, as shown in Figure . After assembly of the cell, a torque of 25 N cm was applied to the compression bolt to compress the Ni bipolar plate against the cathode, which was then, in turn, compressed against the PES separator.The anode comprised a NiFeOx layer that was electrodeposited to incorporate PTFE particulates, onto a fine Ni mesh anode as described by Hodges et al.; 10 this procedure was based on previous work by Benedetti and co-workers. <ref type=""bibr""",Causal,Why was it necessary to introduce a reference electrode into the system during the assembly of the water electrolysis cell?,Answer not available from the given context. ,Negative,"['during water electrolysis, it was necessary to introduce a reference electrode into the system.']","[[0, 143]]","[""Figure 2 .2Figure 2. Schematic of arrangement of the second-generation test cell in Figure 1 in a 'reservoir beaker' containing 6 M KOH. Image (a) and (b) schematically illustrate three electrical circuits that were created by connecting three potentiostat channels to the cell. (a) The circuit denoted 'Ch#1 (cell)' shows the 4-wire connection of the first potentiostat channel to the compression bolts of the cell; this connection was used to drive water electrolysis in the cell. (b) The circuit denoted 'Ch#2 (anode)' shows the connection of the second potentiostat channel to the reference electrode and the anode compression bolt, while the circuit denoted 'Ch#3 (cathode)' shows the connection of the third potentiostat channel to the reference electrode and the cathode compression bolt. The latter two electrical circuits were used to monitor the anode and cathode respectively. (P = power lead, S = sense lead). Figure 3 .3Figure 3. Photograph showing an alternative adaption of the transparent, acrylic secondgeneration test cell for this study. A 6 cm wide cavity was drilled from the top of one half-cell into the reservoir cavity of the cell. A Hg/HgO reference electrode was then placed in the cavity so that its end was immersed in the liquid in the reservoir."", ""et al.; 10 this procedure was based on previous work by Benedetti and co-workers. The anode is designated here as 'NiFeOx/PTFE/Ni mesh'. The anode Ni mesh electrode was spot welded to its perforated Ni bipolar plate as previously described. The Ni bipolar plate was maintained in direct electrical contact with a gas-tight anode by screwing in a compression bolt, as shown in Figure . After assembly of the cell, a torque of 25 N cm was applied to the compression bolt to compress the Ni bipolar plate and attached welded anode against the PES separator.The 8 µm PES had previously been shown to be capable of supplying liquid electrolyte to the electrodes at a sufficient rate to operate the cell continuously and at high current density. The 8 \uf06dm PES separator membrane has a mildly asymmetric pore profile across its thickness. One side has fewer and smaller pores (the 'gloss' side) than the other side (the 'matt' side). As conventional alkaline electrolysis cells are generally known to produce smaller bubbles of hydrogen than oxygen, the gloss side of the separator membrane was placed facing the hydrogen-generating cathode with the matt side facing the oxygen-generating anode.The cell, thus assembled, was then placed on a stand in a large beaker that was onethird filled with aqueous 6 M KOH (which we called a 'reservoir beaker'). This allowed the bottom end of the 8 \uf06dm PES separator membrane to dip into the KOH solution while the rest of the cell remained above the liquid level. Figure schematically illustrates this arrangement. water electrolysis within the cell; that is, it formed the primary electrochemical system during operation of the"", ""ConclusionsIn this work, we have detected and analyzed the incidence of gas bubble formation during operation, of the cathode and anode of a high-performing capillary-fed water electrolysis cell.A voltage fluctuation and an acoustic emission technique were adapted and applied in combination, while applying current densities of up to 1 A cm -2 to the cell. Very similar resultswere obtained for the two techniques, with little bubble formation observed up to 0.17-0.20 A cm -2 . At higher current densities, up to around 0.6 A cm -2 , bubbles were formed predominantly at the cathode. Given that commercial alkaline electrolysers typically operate at current densities up to 0.6 A cm -2 , this suggests that minimizing bubble formation at the cathode offers the key opportunity for further performance improvements in the capillary-fed cell. The cathode and anode produced bubbles at similar rates at still higher current densities, to 1 A cm-2. Even at 1 A cm -2 , the rate of bubble formation on the electrodes was substantially lower than in conventional, 'bubbled' electrolysis cells. In the course of this work, the previously reported high electrochemical performance of the capillary-fed cell was independently confirmed.    IndependentFigure 1 .1Figure 1. Exploded view of the transparent, acrylic second-generation test cell with its bottom cut off."", 'within the cell; that is, it formed the primary electrochemical system during operation of the cell. uptake by the KOH electrolyte, the beaker headspace was maintained and filled with an inert Ar atmosphere.An adaption of the above cell arrangement could, alternatively, be used, albeit with caveats. A transparent, acrylic second-generation cell of the above type was modified by drilling a 6 mm wide hole from the top of the cell to the electrolyte reservoir cavity as shown in Figure . A Hg/HgO reference electrode was then introduced into the resulting cavity, such that its active end was immersed in the liquid electrolyte in the reservoir. The electrical connections were then made as described above, with the cell or its contents maintained under an inert Ar atmosphere.A disadvantage of this alternative arrangement was that even moderate evaporation during an experiment could change the molarity of the KOH electrolyte, thereby changing the area-specific resistance (ASR) between the electrodes and altering the cell performance.Nevertheless, the cell could be used successfully if experiments were carried out quickly and carefully. A set-up similar to this, with the reference electrode holes excluded, was used for all acoustic emission testing. In accordance with the voltage fluctuation technique described previously, 10 the standard deviation, \uf073, of the voltage data at each of the anode and cathode was calculated over the last 10 s of each 20 s step period and plotted against the respective current density. Low values of \uf073 were typically associated with bubble-free gas generation (e.g. less than \uf073 ~0.2 mV), while higher values (e.g. more than \uf073 ~0.2 mV) were consistent with bubble formation.For acoustic emission studies, all electrochemical tests were conducted using an Interface 5000 potentiostat (Gamry, U.S.A.) with the electrical connections set-up as shown in Figure <ref type=""figure""', ""recently, a novel class of 'bubble-free' electrolysis cell, known as a capillary-fed cell, has been developed. In such cells, the gases are produced in bulk form directly from the liquid electrolyte that lightly, but completely, coats the electrodes. A thin, wicking separator between the electrodes draws the alkaline liquid electrolyte up to the electrodes from a reservoir at the base of the cell. The electrodes, which are sandwiched tightly against opposite sides of the separator in a zero-gap configuration, draw small amounts of liquid electrolyte laterally out of the separator causing them to be completely covered with only a thin layer of the liquid electrolyte. The gas formed on the electrode surface can then migrate through the thin layer of liquid electrolyte into an adjoining gas chamber, without forming gas bubbles. The outcome of this arrangement is that the energy efficiency of the cell is significantly improved. Indeed, a capillary-fed water electrolysis cell has been reported that requires only 40.4 kWh to produce 1 kg of hydrogen under the standard operating conditions employed in many commercial alkaline electrolyzers. This supersedes the efficiency target of <42 kWh kg -1 set by the International Renewable Energy Agency (IRENA) for the year 2050. While the above capillary-fed cell is essentially bubble-free at low current densities, some gas bubbles are produced at higher current densities. This is likely because one or both electrodes become overhydrated; that is the layer of liquid electrolyte on the surface of the electrodes becomes too thick. For example, water is produced at the oxygen-generating anode in alkaline electrolysis cells. At higher current densities the quantity of water produced in the capillary-fed alkaline cell may conceivably thicken the liquid layer on the anode, slowing the migration of the oxygen gas product""]","['Energy', 'Renewable energy sources']",1776,1,1,0,0.802705729,1.11E-16,['why']
"Kinetic ModelingTo characterize the SF in these systems, we fit the concentrations extracted from the TA deconvolution with the SF model shown in Fig. . We model SF as a single process from S 1 to 2×T 1 , without explicitly including the 1 (TT), consistent with our spectral deconvolution result. This SF model can be described as a system of differential equations:d[S 1 ] dt = -k S 1 [S 1 ] -k SF [S 0 ][S 1 ] -k ISC [S 1 ],(4)d[T 1 ] dt = -k T 1 [T 1 ] + 2k SF [S 0 ][S 1 ] + k ISC [S 1 ],(5)where TIPS-Tn 8 mM lation, the maximum amount the ground-state population could change in the singlet lifetime was <1%, so the ground-state concentration was treated as a constant ([S 0 ] = 8 mM). The ISC rate constant, k ISC , was initially assumed to be negligible compared with the pseudo-first-order rate constant of SF at this concentration, k SF [S 0 ], and was set to zero. Singlet-singlet annihilation was ignored since there was no power dependence at the excitation powers used here (supplementary material Fig. ). Triplet-triplet annihilation or triplet fusion was also ignored.S 1 T 1 S 1 fit T 1 fit (b) k SF =(2.7±0.6)x10 9 M -1 s -1 k SF =(2.6±0.6)x10 9 M -1 s -1 k ISC =0 s -1For TIPS-Pn, the singlet decay rate constant, k S 1 , was determined as the rate constant from ) and ( ). Note that the energy levels are not to scale.rate constant, k T 1 , was fixed to 1/9 µs -1 , using the decay time of TIPS-Pn in toluene observed by Schaberle et al.. These authors suggested that the T 1 lifetime may be much longer in a lowoxygen environment, but 9 µs is still substantially longer",Causal,Why were triplet-triplet annihilation or triplet fusion ignored in the singlet fission model?,Answer not available from the given context. ,Negative,"['Triplet-triplet annihilation or triplet fusion was also ignored. ', 'Singlet-singlet annihilation was ignored since there was no power dependence at the excitation powers used here (supplementary material Fig. ).']","[[1020, 1084], [876, 1019]]","['with the trend in the modeled data due to an increasing triplet population. The magnitude of this increase in the experimental data over 8 ns is about 2.3% of the GSB magnitude, which is approximately equivalent to 0.041 mOD. An upper bound of 0.049 mOD T 1 absorption is therefore a reasonable estimate.For TIPS-Tn, SF begins to produce the same amount of triplet excitons as the upper limit of ISC at a concentration of 2.1 mM. At 8 mM, this rate of ISC would account for 22% of triplets formed by 8 ns. So as with TIPS-Pn, the assumption of negligible ISC when fitting the bimolecular SF rate constant is potentially invalid. Refitting the deconvoluted concentrations of the 8 mM TA with an ISC rate constant of 8.50 × 10 6 s -1 , gives a bimolecular SF rate constant of (2.0 ± 0.6) × 10 9 M -1 s -1 (supplementary material Sec. S4. 3.3, Fig. 6(d)). Using this adjusted rate at 0.05 mM results in 2.7×10 -10 M of triplets formed due to SF, which is still substantially lower than the limit of detection, so an upper bound of 118 ns for ISC is still valid. As with TIPS-Pn, the 8 mM TIPS-Tn S 1 population decays faster and fits slightly better than without ISC. Given that 8.50 × 10 6 s -1 is an upper bound on the ISC rate constant, the range of bimolecular SF rate constants can now be considered to be between 1.4 × 10 9 M -1 s -1 (lower bound of T 1 concentration, upper bound of ISC) to 3.2×10 9 M -1 s -1 (upper bound of T 1 concentration, no ISC), or (2.3±0.9)×10 9 M -1 s -1 .We again note that, as for TIPS-Pn, the adjusted value of the SF rate constant does not affect the previously determined upper bound for the ISC rate constant. These results especially highlight the necessity to consider ISC when quantifying SF, even if it is assumed to be slow, as without doing so, the SF rate constant could potentially be overestimated.', 'T 1 lifetime may be much longer in a lowoxygen environment, but 9 µs is still substantially longer than the timescales here, so this value had no effect on the fit. Finally, the initial S 1 concentration, [S 1 ](0), and the bimolecular singlet fission rate constant, k SF , were fit to the S 1 and T 1 kinetic data, respectively. The fitted concentrations are shown in Fig. (a), where the shaded gray region represents the range of possible kinetics that fit the triplet concentration. These rate constants are summarized in Table . ) and ( ) for TIPS-Pn and TIPS-Tn. The S 1 lifetimes, τ S 1 , were determined from the rate constant of a single exponential fit to the 0.05 mM GSB TA kinetics, minus the ISC and SF rate constants. The T 1 lifetimes, τ T 1 were taken from literature. The ISC rate constant, k ISC , was either fixed to zero or determined as in Sec. III C, and the SF rate constant, k SF was fit to the 8 mM TA data. The rise in triplet concentration of TIPS-Pn can be reproduced well by this SF model (Fig. ).τ S 1 τ T 1 τ ISC k ISC k SF (ns) (µs) (ns) ×10 6 (s -1 ) ×10 9 (M -1 s -The singlet kinetics fit reasonably, with some small deviations which we attribute to solvent reorganization. The bimolecular SF rate constant was fit as (2.7±0.6)×10 9 M -1 s -1 . At the concentration here this value corresponds to a pseudo-first-order rate constant of (2.2 ± 0.5) × 10 7 s -1 , or time constant of 48±10 ns. The lower bound of the SF rate constant corresponds to the fit to the lower bound of the triplet concentration, which comes from the upper bound of the triplet basis spectrum. Correspondingly, the upper bound of the SF rate constant comes from the upper bound of the triplet basis', 'FIG.4. Jablonski diagram of the photophysical processes considered in this study. This system can be represented by the kinetic model described by Eqs. (4) and(5). Note that the energy levels are not to scale. and Dover et al. 15 noted the presence of excimer formation in TIPS-Tn in toluene solutions, and Dover et al. established a much more comprehensive model of SF in these systems. We therefore additionally fit the 8 mM TIPS-Tn kinetics to the model and rate constants by Dover et al. (supplementary material Sec. S4.3.2), and found that the Dover model overestimates the decay of the S 1 state for the 8 mM solution, and also significantly underestimates triplet formation. Most of the S 1 decay in this model ( Figure 55Figure5shows close-up views of the experimental and modeled TA data for the 0.05 mM TIPS-Pn solution around the T 1 peak absorbance at 504 nm, normalized to the GSB. The modeled data have had artificial noise added, generated from a Gaussian distribution with standard deviation 1 FIG. 6 .16FIG. 6. Concentrations of S 1 and T 1 for 0.05 mM and 8 mM TIPS-Pn and TIPS-Tn from experimental TA data and kinetic model. The 0.05 mM samples [(a) and (c)] show the deconvoluted TA data (exp) with the predicted maximum amount of triplet formation (model), using the upper bound of the ISC rate constants and the lower bound of the bimolecular SF rate constant. The 8 mM samples [(b) and (d)] show the full range of deconvoluted concentrations from the uncertainty in the T 1 basis spectrum (exp) and fits using Eqs.', 'initial S 1 concentration.To determine the SF contribution to this maximum possible triplet formation at 0.05 mM, we used the SF model described by Eqs. ( ) and ( ), with k SF set to the lower bound of the fit to the 8 mM data (2.1 × 10 9 M -1 s -1 ), and k ISC set to 0. As with the 8 mM sample, the excited-state concentration was significantly smaller than 0.05 mM (<1%), so we treated [S 0 ] as constant. This model gave a maximum of 2.6 × 10 -10 M of T 1 formed after 8 ns for a 0.05 mM sample (0.14% of the initial S 1 concentration). This concentration corresponds to a maximum absorption of about 0.004 mOD, which is well below the possible threshold of our TA spectrometer (supplementary material Fig. ), and still leaves 3.7 × 10 -9 M of T 1 that could be due to ISC.If we allow an ISC rate constant of 3.08 × 10 6 s -1 (or a time constant of 325 ns) on top of the contribution from SF, 3.7 × 10 -9 M of T 1 are produced from ISC, and we obtain a total T 1 concentration of reach the 4.0 × 10 -9 M, or 0.057 mOD T 1 absorption limit, at 8 ns. The actual ISC rate constant therefore must be lower than (or equal to) this value, as a higher value would result in a level of triplet formation that would be observable above the noise level in the TA data.We therefore give the ISC rate constant an upper bound of 3.08 × 10 6 s -1 , i.e., the characteristic time scale of ISC in TIPS-Pn must be longer than 325 ns. This corresponds to a ISC quantum yield of ≤5.6% at 0.05 mM. The 8 ns time window we use in this study is significantly shorter than this time constant, and we note that ISC could possibly be shown to be even slower with a longer time-window TA experiment. equal to the experimental data. Even with this noise, there is a slight observable trend with time in the modeled data corresponding to an increase in T 1', 'target=""#b7"">8 Given the solubility of TIPS-Pn in toluene is similar to chloroform, we expect that aggregation was absent in the solutions studied here.For TIPS-Tn, the singlet decay rate constant, k S 1 , was fixed to 1/12.7 ns -1 (taken from the relaxation lifetime of the singlet excited state in the dilute solution in Sec. S4.1 of the supplementary material) minus the ISC and SF contributions (k ISC and k SF × 0.05 mM). The triplet decay rate constant was fixed to 1/80 µs -1 , taken from the lifetime used by Dover et al.. Again, the triplet lifetime is substantially longer than the timescales measured here, and has little effect on the fit.The resulting kinetic model fits are shown in Fig. , where again the shaded gray region represents the range of possible kinetics that fit the triplet concentration. This model is able to capture the behavior of TIPS-Tn reasonably well. The triplet formation kinetics are reproduced well, and the singlet decay has some small discrepancies, which, as with TIPS-Pn, we attribute to solvent reorganization or the presence of some additional S 1 deactivation pathways. The bimolecular SF rate fits to (2.6 ± 0.6) × 10 9 M -1 s -1 . At 8 mM this value corresponds to a pseudo-first-order rate constant of (2.1 ± 0.5) × 10 7 s -1 , or a time constant of 51±11 ns. The full range of fitted values corresponding to the upper and lower limits of T 1 concentrations are given in Table of the supplementary material. Dover et al. previously fit a pseudo-first-order SF rate constant for TIPS-Tn of 3.18×10 8 s -1 at 300 mM, which is equivalent to a bimolecular SF rate of 1.06×10 9 M -1 s -1 . 15 This value is only slightly lower than the rate constant fit here. However, both Stern et al.  ) is due to excimer formation, rather than SF. Only about 3% of singlet excitons undergo SF']","['Energy', 'Photovoltaics']",3990,1,1,0,0.831206051,0,['why']
"I. INTRODUCTIONSinglet fission (SF) is a process in which a chromophore in the singlet excited state, S 1 , combines with a nearby ground-state chromophore, S 0 , to produce two independent triplet excitons, T 1 . It is generally described as proceeding via a spin-correlated triplet-pair intermediate, with overall singlet character:S 0 + S 1 ---- 1 (TT) ---- 1 (T...T) ----T 1 + T 1 ,(1)where (TT) is an electronically coupled and spin-coherent triplet pair, and 1 (T...T) is a triplet pair that maintains spin coherence, but has lost electronic coherence, and thus behaves chemically and spectroscopically like free triplets. The generation of two triplet excitons from one singlet exciton, and hence a single photon, could increase the efficiency of solar cells beyond the detailed-balance limit, and hence has attracted significant recent attention. However, sizeable improvements to solar-cell efficiency using SF have not been achieved to date, so there are continuing efforts to increase the efficiency of SF as well as the ""harvestability"" of the triplet excitons. But for SF to be optimized, it is important to be able to accurately identify and characterize the process, including distinguishing SF from other photophysical processes that result in triplet excitons.Another process that forms triplet excitons from singlet excitons is intersystem crossing (ISC):the radiationless transition between two electronic states of different spin multiplicities. Triplet formation",Causal,Why could the generation of two triplet excitons from one singlet exciton potentially increase the efficiency of solar cells?,Answer not available from the given context. ,Negative,"['The generation of two triplet excitons from one singlet exciton, and hence a single photon, could increase the efficiency of solar cells beyond the detailed-balance limit, and hence has attracted significant recent attention.']","[[629, 854]]","['and the bimolecular rate constant would no longer be applicable. Using the rate constants fit to a system with aggregates would overestimate the rates at more dilute, diffusion-limited concentrations. The underestimation of triplet excitons at 8 mM by the Dover model is partially explained by the underestimation of SF and overestimation of excimer formation: if excimers predominantly result from aggregates and are absent at lower concentrations, then collisions at 8 mM are more likely to result in SF, and more triplet formation.Additionally, the presence of aggregates would explain the fast rate of triplet fusion at high TIPS-Tn concentration. If SF at 300 mM occurs on an aggregated pair of TIPS-Tn molecules, then the triplets are not well separated spatially and can recombine quickly. However, in a dilute solution with no aggregates, in which SF occurs during transient collisions, the molecules may diffuse away before the triplets recombine. Therefore the triplet fusion rate would be lower and a more significant amount of triplets would be observed. We note that the presence of aggregates at 300 mM does not affect the main conclusion of the study by Dover et al., i.e., that the excimer is a trap state rather than an intermediate. However, for the remainder of this study, we revert to the much simpler model shown in Eqs. ( ) and ( ) to describe SF in this system.As mentioned previously, we neglect the reverse SF process, triplet fusion, in this model. This assumption is justified in TIPS-Pn, as fusion is energetically uphill. For both TIPS-Pn and TIPS-Tn, the model fits well without triplet fusion, and so presumably it plays only a minor role. The other assumption made here is that the ISC rate is negligible compared to SF, but, as we show below, this assumption may not necessarily be the case.', 'Pitfalls of quantifying intersystem crossing rates in singlet-fission chromophore solutions Singlet fission (SF), a process that produces two triplet excitons from one singlet exciton, has attracted recent interest for its potential to circumvent the detailed-balance efficiency limit of single-junction solar cells. For the potential of SF to be fully realized, accurate assignment and quantification of SF is necessary. Intersystem crossing (ISC) is another process of singlet to triplet conversion that is important to distinguish from SF to avoid either over-or under-estimation of SF triplet production. Here, we quantify an upper bound on the rate of ISC in two commonly studied SF chromophores, TIPS-pentacene and TIPStetracene, by using transient absorption spectroscopy of solutions of varying concentrations in toluene. We show that SF in solutions of these acenes has previously been misidentified as ISC, and vice versa. By determining a bimolecular SF rate constant in concentrated solutions in which SF dominates over ISC, we distinguish triplet formation due to SF from triplet formation due to ISC, and show that the characteristic time scale of ISC must be longer than 325 ns in TIPS-pentacene, while it must be longer than 118 ns in TIPStetracene. We additionally note that no excimer formation is observed in the relatively dilute (up to 8 mM) solutions studied here, indicating that previous excimer formation observed at much higher concentrations may be partially due to aggregate formation. This work highlights that an accurate quantification of ISC is crucial as it leads to accurate determination of SF rate constants and yields.', 'on two commonly studied SF chromophores: 6,13-bis(triisopropylsilylethynyl) pentacene (TIPS-Pn) and 5,12-bis(triisopropylsilylethynyl) tetracene (TIPS-Tn).Several studies have previously reported ISC rates for TIPS-Pn that are inconsistent with experimental data. These rates correspond to time constants ranging from ns to µs, with some predicting observable quantities of triplets on timescales over which triplets have not been observed. These studies have often dismissed SF in dilute solutions and attributed triplet formation to ISC. For TIPS-Pn, we extend the work by Dvořák et al. to quantify diffusion-limited SF in dilute solutions, and show that SF can lead to observable quantities of triplet excitons for dilute solutions on ns time scales. We quantify an upper bound of the rate constant of ISC in TIPS-Pn and show that, conversely, discounting ISC can lead to an overestimate of SF.We also quantify the SF rate constant and the upper bound of the ISC rate constant in TIPS-Tn, and show that ISC is potentially faster, and even more important to consider for this molecule than for TIPS-Pn. We additionally note that excimer formation is not observed in dilute solutions of TIPS-Tn, even when SF is observed, and therefore suggest that previously observed excimer formation may be due to aggregate formation in concentrated solutions.', 'states of different spin multiplicities. Triplet formation through ISC can be described as a simple unimolecular process:S 1 ----T 1 .(2)ISC is distinct from SF in that it only relies on one chromophore rather than two, results in at most one triplet per singlet exciton, does not involve observable intermediate species (such as triplet pairs), and is often considered to be much slower than SF (times scales of ns, compared to ps or fs).Generally ISC and SF are distinguished by their time scale and the amount of triplets observed.Again, SF is generally thought to be faster, and should result in a triplet yield (per singlet exciton) greater than 100%, whereas ISC is slower, and should give a triplet yield less than 100%. However, determining yields of triplets can be complex, and triplet production can easily be over-or underestimated. Additionally, SF is not always completely efficient, and can occur with a yield below 100%. Finally, SF, particularly in solution and in disordered solid-state systems is not necessarily always fast. A recent study by Dvořák et al. showed that SF in TIPS-Pn solutions occurs by diffusive encounters, and so can be very slow in dilute solutions. SF has also been shown to be limited by exciton diffusion to SF-favorable sites in disordered acenes, and so can be considerably slow in disordered solids or systems with substantial singlet migration. In this study, we show that SF can be misidentified as ISC and vice versa, and demonstrate the need to take precaution in the assignment and interpretation of photophysical processes in SF-capable systems, particularly using optical spectroscopy. We focus on two commonly studied SF chromophores: 6,13-bis(triisopropylsilylethynyl) pentacene (TIPS-Pn) and', 'is due to excimer formation, rather than SF. Only about 3% of singlet excitons undergo SF to form T 1 . Additionally, a maximum T 1 yield of only 1.25% is observed, because most of the triplets formed rapidly undergo triplet fusion. A significant amount of excimer formation is predicted by the Dover model at 8 mM (34%), but, as discussed previously, the TA data fits well to just two components (S 1 and T 1 ) without additional absorption or emission that could be due to excimers. It is possible that the spectral component we assign to T 1 could instead be due to excimers, but, as we show in Fig. of the supplementary material, the spectral shape is consistent with previously assigned T 1 basis spectra. Additionally, the excimer state is emissive, but there is an absence of any obvious emission features in the basis spectrum that correspond to the excimer emission characterized by Dover et al.. Instead, we attribute the discrepancy between the Dover model and the TA data in this study to the concentrations of TIPS-Tn used. Both Dover et al. and Stern et al. used concentrations of 300 mM, 37.5 times higher than the 8 mM samples used here. We observed that agitation is required to dissolve 8 mM solutions of TIPS-Tn in toluene, and therefore propose that at a concentration of 300 mM TIPS-Tn may only be partially soluble, and consequently that aggregation may begin to occur at that concentration.Excimer formation may be facilitated by these aggregates, and is therefore absent at more dilute concentrations. Aggregate formation would explain why the decay of the S 1 state at 8 mM is overestimated by the Dover model. If SF or excimer formation were due to aggregates rather than, or in addition to, collisions between molecules, then the pseudo-first-order SF rate constants at 300 mM would not scale linearly with concentration, and the bimolecular rate constant would no longer be applicable. Using the rate constants fit to a']","['Energy', 'Photovoltaics']",3964,1,1,0,0.935815079,0,['why']
"of the saddle point and relative potential energy of the dihedral scan is shown in figure . The orange-highlighted bonds in figure indicate the dihedral angle that is being scanned, which includes several atoms involved in the reaction corresponding to this saddle point. This scan reveals that the structure found by Sella (the structure at zero degrees) is not the lowest-energy conformer for this reaction. This is not surprising, as our saddle point optimization algorithm tends to converge to the saddle point that is geometrically closest to the initial structure, and this may not be the lowest energy conformer.Figure shows how the total number of gradient evaluations required to perform the entire scan (in green) and the number of gradient evaluations per scan step (in red) scale as a function of the number of scan steps used. For this scan, between 12 and 360 steps were used, which corresponds to a dihedral angle step size of between 30°and 1°. Though the total number of gradient evaluations tends to increase with the number of steps used in the scan, the relationship is not perfectly linear. One possible explanation for this is that larger steps in the scan will tend to perturb the unconstrained degrees of freedom more, therefore requiring more gradient evaluations to converge. The upper limit of this plot indicates that when 360 1°steps are used, only 1.61 gradient evaluations are required per grid point. This is very close to the theoretical lower limit of 1 gradient evaluation per step (the dashed red line), in which each step of the scan converges in a single gradient evaluation. Such performance is only possible due to our use of null-space SQP constrained optimization, which projects the gradient to ",Causal,Why does the saddle point optimization algorithm tend to converge to a saddle point that is not the lowest energy conformer?,Answer not available from the given context. ,Negative,"['This is not surprising, as our saddle point optimization algorithm tends to converge to the saddle point that is geometrically closest to the initial structure, and this may not be the lowest energy conformer.']","[[410, 619]]","['Iterative Hessian diagonalization in nonredundant internal coordinatesTo optimize the geometry of a molecule to a first order saddle point, some information about the curvature of the potential energy surface is required. This information is contained within the Hessian matrix, some (or all) of which must be known to step towards a saddle point. Optimization to a first order saddle point requires stepping uphill on the potential energy surface in the direction of the reaction coordinate and downhill in all other directions. We define the reaction coordinate as the direction in which the curvature is smallest (most negative or least positive), which is by construction the leftmost eigenvector of the Hessian matrix. Therefore it is at least necessary to know this eigenvector to step towards a first order saddle point.For molecular saddle point optimization, it is common to evaluate the full Hessian matrix at least once at the beginning of optimization. Many electronic structure theory methods such as Hartree-Fock and DFT have efficient analytical Hessian implementations. Additionally, transformation of Cartesian Hessians into internal coordinates is straightforward. When using a level of theory for which efficient analytical second derivatives are not available, the Hessian matrix is usually evaluated in full using finite difference. For computationally expensive levels of theory or for very large molecules, the evaluation of the initial Hessian matrix may become more costly than all subsequent geometry optimization steps. Even when using levels of theory with efficient analytical second derivatives, evaluation of the Hessian matrix will eventually dominate the overall cost of optimization as system sizes grow larger due to the higher computational scaling of Hessian evaluations relative to gradient evaluations. For this reason, saddle point optimization methods which do not require full', ""have disabled this feature in our calculations, as leaving it enabled would result in longer optimization trajectories; instead, these calculations are allowed to crash and are therefore omitted from figure 6c. While this feature improves the robustness of the optimization algorithm implemented in Q-Chem, it does so at the cost of longer trajectories for these pathological systems. In this scenario, our optimization algorithm will instead automatically reconstruct a new internal coordinate system, rather than falling back on Cartesian optimization. This results in a robust optimization algorithm similar to Q-Chem, without the additional cost of switching to a Cartesian optimization scheme.We note that while each of the four alternative algorithms resulted in some of the structures failing to converge, we do not consider this to be an appropriate metric for comparison, as the molecules in the test set were specifically chosen to be those that converge in Sella with its default parameters. Consequently, any structures that would It is common in computational studies of molecules to perform scans over specific internal coordinates. These scans are a series of constrained optimizations, which are straightforward when the goal is to minimize the energy with respect to the unconstrained degrees of freedom, e.g., when the scan is done on a minimum energy structure.However, special care must be taken for saddle point scans to ensure that the scan trajectory preserves the structure of the reacting region of the molecule and does not fall into a different saddle point geometry. Our algorithm's implementation of null-space SQP saddle point optimization provides an easy and effective way to scan coordinates.Figure depicts a full 360°scan of a dihedral angle of a 5-exo-tet cyclization reaction saddle point. The geometry of the saddle point and relative potential energy of the dihedral scan is shown in figure <ref"", ""Figure 5 :5Figure5: A scatter plot and histogram depicting the number of gradient evaluations required to converge to a saddle point against the number of atoms in each molecule in the 500molecule benchmark set. Green dots correspond to molecules with no linear bending angles, yellow to molecules with at least one linear angle at the beginning of optimization but without the need for dummy atoms, black dots correspond to molecules with at least one linear angle at the beginning of optimization that required a dummy atom, and red dots correspond to molecules that required a new set of internal coordinates be constructed during optimization due to a previously valid angle becoming linear. Figure 6 :6Figure 6: A benchmark comparing the effective number of gradient evaluations of our saddle point optimization algorithm as implemented in Sella using its default parameters against a) Sella with full diagonalization of the Hessian, b) NWChem's Z-matrix saddle point optimization algorithm, c) Q-Chem's redundant internal coordinates saddle point optimization algorithm, and d) Psi4's redundant internal coordinate saddle point optimization (optking).The color scheme is identical to that of figure 5. For Sella, the effective number of gradient evaluations is the number of geometry optimization steps plus the number of Hessian diagonalization iterations, while for NWChem, Q-Chem, and Psi4 it is the number of geometry optimization steps plus a factor of 3n to account for analytical evaluation of the full Hessian."", ""routine to be extremely tight. The majority of the structures require more gradient evaluations to converge when the Hessian matrix is calculated in full as compared to the partial diagonalization that is performed using Sella's default parameters. Notably, the red data points, which represent structures for which the internal coordinate system is reconstructed midway through optimization, experience a more significant increase in the number of gradient evaluations compared to other structures. This is to be expected, as the Hessian will be evaluated in full at least twice throughout the course of the optimization. For the data points which lie below the line, full diagonalization actually results in an overall reduction in the number of gradient evaluations required to reach convergence. It is likely that for these structures, the initial Hessian diagonalization failed to fully converge the true leftmost eigenvector of the Hessian matrix. This would The color scheme is identical to that of figure 5. For Sella, the effective number of gradient evaluations is the number of geometry optimization steps plus the number of Hessian diagonalization iterations, while for NWChem, Q-Chem, and Psi4 it is the number of geometry optimization steps plus a factor of 3n to account for analytical evaluation of the full Hessian.result in an optimization trajectory which initially moves away from the closest saddle point, thereby slowing convergence and possibly resulting in convergence to a different structure entirely.Figures , and 6d compare the performance of our algorithm that that of NWChem, Q-Chem, and Psi4 42 respectively. Each of these programs implements a saddle point optimization algorithm in a basis of internal coordinates that requires full"", 'a saddle point optimization algorithm in a basis of internal coordinates that requires full evaluations of the Hessian matrix, either analytically or through finite difference. For these codes, the effective number of gradient evaluations is taken to be the number of geometry optimization steps plus a factor of 3n to account for evaluation of the Hessian matrix in full. We note that the cost of evaluating the Hessian matrix using analytical methods -such as coupled-perturbed Hartree-Fock or density functional perturbation theory -is generally lower than the cost of 3n gradient evaluations. However, when analytical Hessians are not available, the actual cost of evaluating the full Hessian matrix will be at least 3n, rising to 6n if central finite difference is used. Based on the result in figure , NWChem, Q-Chem, and Psi4 all show comparable performance to Sella when the Hessian is fully diagonalized. NWChem shows the overall worst performance, likely due to its use of a minimal Z-matrix internal coordinate basis rather than a redundant internal coordinate basis. Nonredundant internal coordinate systems such as the Zmatrix approach necessarily omit some chemically relevant degrees of freedom from the coordinate system, which can have a deleterious impact on optimization performance.As with figure , several of the data points lie below the line, indicating that Sella converges more slowly for these points. This is again likely due to a failure of the diagonalization algorithm to correctly identify the lowest curvature mode, a problem that can be ameliorated by tightening the diagonalization convergence criterion γ.When bending angles become linear mid-optimization, Q-Chem will by default automatically switch to a Cartesian coordinate optimization in order to avoid crashing.We have disabled this feature in our calculations, as leaving it enabled would result in']","['Quantum and theoretical chemistry', 'Theoretical methods']",2482,1,1,0,0.893098924,-2.22E-16,['why']
"Updates on Hydrogen Value Chain: A Strategic Roadmap A strategic roadmap for non-carbonized fuels is a global priority, and the reduction of CO2 emissions is a key focus of the Paris Agreement to mitigate the effects of rising temperatures. In this context, hydrogen (H2) is a promising non-carbonized fuel, but the pace of its implementation will depend on the engineering advancements made at each step of its value chain. To accelerate its adoption, various applications of hydrogen across industries, transport, power, and building sectors have been identified, where it can be used as a feedstock, fuel, or energy carrier and storage. However, widespread usage of hydrogen will depend on its political, industrial, and social acceptance. It is essential to carefully assess the hydrogen value chain and compare it with existing solar technologies. The major challenge to widespread adoption of hydrogen is its cost as outlined in the roadmap for hydrogen. It needs to be produced at the levelized cost of hydrogen (LCOH) of less than $2/kg to be competitive with the established process of steam methane reforming. Therefore, this review provides a comprehensive analysis of each step of the hydrogen value chain, outlining both the current challenges and recent advances.",Causal,"Why does the widespread usage of hydrogen depend on its political, industrial, and social acceptance?",Answer not available from the given context. ,Negative,"['However, widespread usage of hydrogen will depend on its political, industrial, and social acceptance.']","[[640, 742]]","[""Hydrogen productionHydrogen production has gained an enormous momentum over the last few years and will certainly play a major role in the energy transition. The reasons behind the growing importance of H2 for our modern economy are: 1) decarbonization of energy production, in particular electricity, 2) sustainable alternative to fossil energy carriers (in particular natural gas), and 3) the lack of cost-effective energy storage of intermittent renewable energy (mostly produced in the form of electricity).There are three main families of hydrogen production technologies that are categorized by their 'carbonintensity' i.e., the amount of CO2 and CO2-equivalents emitted during production of hydrogen. These are described in the following sub-sections in descending order of carbon-intensity."", 'IntroductionDecarbonization, strive for net zero emissions, and work to reduce our carbon footprint. These crucial actions are indispensable in addressing the climate change challenges. By embracing decarbonization strategies and adopting sustainable practices, we can alleviate the detrimental impacts of greenhouse gas emissions and protect the well-being of the planet and future generations.Paris agreement in 2015 introduced the ""national low-carbon strategy"" and has emerged as a vital instrument. This ambitious roadmap not only serves as a guiding light but also forms the bedrock for our collective endeavor to foster a low-carbon economy. The strategy framework delineates a path that advocates for the adoption of energy-efficient and the utilization of renewable energy sources.Hydrogen (H2) is expected to play a significant and central role in our future society, particularly within the current efforts to transition to a low-carbon economy. The main reasons why H2 is becoming such an important commodity are:• H2 is a clean energy source, producing no greenhouse gas (GHG) emissions when used in fuel cells to produce electricity. This makes it an attractive alternative to fossil fuels. • H2 is a versatile energy carrier that can be used in a variety of applications, from fuel cells for transportation to power/heat/electricity generation and industrial processes, e.g., fertilizers. • H2 can be used as an energy storage medium, allowing excess energy from intermittent renewable sources such as solar and wind to be stored efficiently and used when needed. • The development of a H2 infrastructure which encompasses production, storage, and transportation, would create new jobs and economic opportunities in the energy sector. • The use of H2 in transportation and other applications can support the efforts reducing GHG emissions, thereby mitigating the impact of climate change.As', ""Hydrogen in industryInterestingly, according to IEA, industry is the second-largest global source of CO2 emissions (related to the energy sector, after the combustion of fossil fuels), exceeding 8.4 Gt in 2020. In particular, three heavy industries, i.e. chemicals (production of primary chemicals i.e., ethylene, propylene, benzene, toluene, ammonia, and methanol), steel, and cement, account for nearly 60% of all energy consumption and about 72% of all the industrial CO2 emissions. Electrifying industry has been a viable option for years, but it has two challenges. Firstly, the cost of electricity per unit energy (MWh) is higher than fossil fuels, making it less appealing for businesses. Secondly, industrialized countries such as Germany, Poland, the US, and the Netherlands produce electricity with high carbon intensity (>300 g CO2/kWh) , making electrification ineffective in reducing industry's carbon footprint.In densely populated countries like the Netherlands, the electricity grid is near its maximum transport capacity, causing congestion problems. Large off-takers and electricity producers joining the network without a planned expansion worsen the situation. Hence, hydrogen is seen as a potential substitute for electrification. In industry, there are two primary methods for utilizing hydrogen. The first is to generate heat, primarily high-temperature heat. The second is to use it as a chemical reagent in processes such as the Haber-Bosch process for obtaining ammonia.If heat is the main input needed by a particular industry, then in principle hydrogen can directly substitute fossil fuels such as natural gas and coal. However, current developments have pointed to potential challenges about the combustion of hydrogen:• Handling hydrogen safely"", 'the efforts reducing GHG emissions, thereby mitigating the impact of climate change.As described previously, the H2 value chain consists of three primary areas: production, storage, and distribution (transport) that enable end-user consumption. Figure depicts the layout of the aforementioned fields and their interconnectivity. Yet, each stage faces unique barriers to overcome. Experts from different fields are exploring solutions to provide timely technological transfer options.Figure . Scheme outlining the hydrogen value chain fields, interconnection, and roles. Copyright 2023, TÜV SÜD.The global market demands certain maturity of emerging technologies to deliver them to the end users. Within the hydrogen economy context, the different aspects of the value chain should achieve technological readiness level (TRL) 7 or higher, to make H2 and its infrastructures economically (and politically) attractive.The following sections will showcase each category of the H2 value chain, including the main associated challenges.', 'ConclusionsIn order to attain the energy transition, value chain, techno-economic studies, and life cycle assessment are key tools to develop and implement synergistically evolving technologies, such as green hydrogen. Such technologies must be developed with productivity and stability as indicators. At the same time, development of hydrogen technologies should surpass their technical challenges to be able to provide reliable and competent prototype, ready and safe for the end-user. One of the major challenges is to lower the LCOH to 2$/kg to become competitive with fossil sources. Moreover, the performance of the present state-of-the-art green hydrogen production is below par behind the 10% efficiency requirements set by industry. Therefore, extensive works are urgently required to move forward the advancement of renewable energy technologies. Figure 4 .4Figure 4. Global electrolysis capacity (MW/year) becoming operational annually, 2014-2023, historical and announced.Dark blue stands for total and light blue stands for largest project. Copyright 2022, IEA. Figure 3 .3Figure 3. Schemes of (a) alkaline water electrolyzer (AWE), (b) proton exchange membrane water electrolyzer (PEMWE) and (c) solid oxide electrolysis cell (SOEC). Copyright 2022, SciOpen.']","['Energy', 'Renewable energy sources']",1625,1,1,0,0.851017642,0,"['why', 'industrial', 'and']"
"Lewis acid was requires with TMSOTf being optimal producing a moderate yield and mixture of alkene isomers in the initial CH2Cl2 solvent. Modulation of the solvent showed that many non-polar or etherial solvents provided similar results, while MeCN led to extensive decomposition and an intractable mixture of products. PhCl and PhCF3 provided the best reactivity, with the former providing a single regioisomer. Further optimization of the reaction in both solvents found a significant concentration effect with 0.025M in PhCF3 (Table , Entry 10) affording a single exo-cyclic product in 72% isolated yield. With the optimized conditions in hand, we examined the substrate scope with both carbohydrate and benzannulated ortholactones 1. With carbohydrate derived ortholactones (1a-1d), we found that good yields of the spiroketal coupled products were achieved when C-5 substitution was present. Indeed, spiroketals with CH2OAc (3a), methyl esters (3b) and CH3 groups (3c) could be formed with high chemical efficiency. Xylal derived ortholactone (1d) provided the spiroketal product (3d) in more moderate yield, likely due to the decreased stability of the ortholactone starting material (1d). When benzannulated ortholactones (1e-1k) were utilized, good to excellent reactivity was observed with high yields of the spiroketal product (3e-3j) being obtained. Ortholactones containing phenyl (1e) and 1-napthyl (1f) were particularly efficient with the corresponding spiroketal being isolated in 87% and 90% yields, respectively. Further substitution could be tolerated with both bromo (3g-3i) and methoxy (3h) spiroketals being produced, alongside the thymol derived analog 3j. When 2-methoxy substituted ortholactone (1k) was utilized, the spiroketal product was isolated as the isomerized internal alkene (4k). Interestingly, this isomerization provided only one of the two possible endo-cyclic isomers with the alkene proximal to",Causal,Why did the use of MeCN as a solvent lead to extensive decomposition and an intractable mixture of products?,Answer not available from the given context. ,Negative,"['Modulation of the solvent showed that many non-polar or etherial solvents provided similar results, while MeCN led to extensive decomposition and an intractable mixture of products.']","[[138, 319]]","['isomerization provided only one of the two possible endo-cyclic isomers with the alkene proximal to the spiroketal center formed. Additionally, we examined further substitution on the allylsilane moiety, with Please do not adjust margins Please do not adjust margins CH2OTIPS containing silane 2b providing moderate yield of the spiroketal 5. This fragment coupling reaction provided a single regio and stereoisomer of spiroketal 5, albeit with reduced efficiency. Of note, is the stereochemical outcome of the reactions, with the axial-axial form produced regardless of the stereogenicity from the ortholactone or allylsilane portions. Due to the Isomerization that was observed in the reaction of 1k, we investigated the origin of this with different substrates. With the parent benzofused spiroketal 3e, we examined whether isomerization occurred through prolonged reaction times in the spiroketalization step. Extended reaction times and substoichiometric amounts of TMSOTf, however led to slow and unselective isomerization, alongside extensive decomposition. Interestingly, when we resubjected the spiroketals to TMSOTf in chlorobenzene, a very rapid and highly selective migration of the alkene was observed to provide the Δ 2,3 isomer as the only observable product. Following the identification of these isomerization conditions, we examined the generality of this reaction and a range of endo-cyclic spiroketals 4e-4j were isomerized in a similar manner (Scheme 3).', 'Lewis Acid Mediated Coupling of Silyloxyallylsilanes and Ortholactones: A Convergent, Fragment-Coupling Approach to Functionalized Spiroketals A convergent, fragment-based coupling approach to the formation of spiroketals has been developed. This approach combines the spiroketal forming step with a fragment coupling utilizing ortholactones as double electrophiles with silyloxyallylsilanes. We also discoved a rapid and regioselective isomerization of the exocyclic sprioketals to their endo-cyclic forms.Spiroketals are an important functional group in many natural products that possess potent medicinal properties. 1 As a result, they have increasingly become targets of interest by the pharmaceutical industry, 2 with ivermectin, 3 and tofogliflozin licensed as therapeutics (Scheme 1A). In many cases, the barrier to advancing the clinical development of complex spirocyclic natural products, such as the spongistatins, 5 is the availability of compound from either natural or synthetic sources. As a result, new modular and convergent methods for spiroketal formations are needed. Many of the commonly utilized methods for spiroketal synthesis rely on generating a linear molecule containing two pendent alcohols with a central ketone, dithiane, or surrogate, followed by cyclization to form the ketal moiety (Scheme 1B). 1e-f,7 While these methods are competent methods to synthesize these molecules, they can lead to long linear-step counts and problems diversifying the structure. Notable developments for the convergent synthesis of spiroketals include anion relay approaches, 8 π-Lewis acidic cyclization of dihydroxyalkynes using gold catalysis, 9 Ferrier-C-H oxidation sequences, 10 chiral', ""acid mediated anomeric stereocontrol, and iridium catalysed enone addition and Hemiketalization/π-allyl cyclizations. We embarked on a research program to develop a convergent strategy whereby the spiroketalization step is also the fragment coupling step. Such an approach could lead to streamlined synthetic routes and facile structural diversification through the development of a more convergent approach. Specifically, we reasoned that ortholactones 1 could be used as bimodal electrophiles, reacting with bis-nucleophilic silyloxy allylsilanes 2 under acidic conditions to directly form a spiroketal group (Scheme 1C). This research was inspired by Markó's reports that unsubstituted ortholactones could react with silyloxyallylsilanes to form spiroketals (Scheme 1D). The ortholactones they utilized were formed via a strongly alkylative process from δ-valerolactone or γ-butyrolactone, however this reaction is neither functional group tolerant nor general (Scheme 1E). To circumvent these issues, we have developed a palladium catalyzed aerobic Wacker-type reaction of functionalized dihydropyrans and have demonstrated their reactivity towards in situ generated TfOH. The synthesis of benzofused ortholactones can be achieved using orthoquinone methine and electrocyclization techniques. We began examining the reaction of D-glucal derived ortholactone 1a with the simple silyloxyallyl silane 2a. We discovered that a stoichiometric amount of Lewis acid was requires with TMSOTf being optimal producing a moderate yield and mixture of alkene"", 'Scheme 3: Regioselective Isomerization of Exocyclic Olefin SpiroketalsWe were intrigued by the origin of the selectivity in this process. Related systems reported by Markó observed significant amounts of unselective exo-to endo-isomerization in the absence of an alkoxysilane or low temperatures. This was proposed to be caused by adventitious TfOH protonating the exocyclic alkene leading to a thermodynamic mixture of endoisomers. To investigate this isomerization further, DFT studies were conducted to find the ground-state energies of possible intermediates (Scheme 4). The ground-state energies of the exocyclic (3e), the Δ 2,3 endocyclic (4e) and the Δ 3,4 isomer (5e) were calculated and the two endocyclic isomers (4e and 5e) were found to be within 0.2 kcal/mol with the exocyclic alkene is 3.2 kcal/mol less stable. These results highlight that although the endocyclic isomer is favoured, little if any selectivity would be observed at equilibrium. Additionally, the energy of the protonated alkene intermediate 6e was prohibitively high (+41.4 kcal/mol). We therefore examined a Lewis acid mediated pathway that proceeds via binding to the phenolic oxygen and ring opening. The ensuing oxocarbenium ion 7e (+25.4 kcal/mol) can undergo a triflate mediated isomerization to form the conjugated Δ 2,3 isomer 8e (+10.2 kcal/mol) before ring closure and TMS release to form 4e (-3.2 kcal/mol). This mechanism provides a significant thermodynamic driving force for a single regioisomer and is consistent with the experimental data. Geometries/frequencies calculated using B3LYP/6-31+G(d) and single point energies calculated using C-PCM (Chlorobenzene)-B3LYP/6-311++G(2d,2p).In conclusion, we have developed a strategy to form spiroketals as the fragment coupling step. This approach provides a range of spiroketal products inaccessible through previous methods. This study exemplifies the use of', 'of spiroketal products inaccessible through previous methods. This study exemplifies the use of ortholactones as precursors for double electrophilic reactivity. We also demonstrated a selective isomerization reaction to form a single regioisomer of endo-cyclic spiroketal alkenes.Scheme 2 :2Scheme 2: Substrate Scope']","['Catalysis', 'Homogeneous catalysis']",1538,1,1,0,0.882520339,0,['why']
"Although several product pathways are available in the self-reaction of HO2, it is well established that the H2O2 + O2 channel dominates on the electronic triplet state, namely, HO2 + HO2 → H2O2 + O2 ΔH(0K) = -38.3±0.10 kcal mol -1 (R1). R1 is of great significance in many situations, including combustion and Earth's atmosphere.This reaction significantly affects the concentrations of HOx radicals in the troposphere, and is the main source of H2O2 in the atmosphere. HOx and H2O2 are widely recognized as important species in both combustion and atmosphere. In combustion, R1, a hydrogen abstraction reaction, is a key chain termination step that inhibits ignition. The accuracy of the kinetics for R1 is important for the performance of the combustion modeling as well as engine simulations. Ample theoretical and experimental investigations have been carried out for R1 to investigate its mechanisms and kinetics over a wide range of temperatures and pressures. <ref type=""bibr""",Causal,Why does the H2O2 + O2 channel dominate in the self-reaction of HO2?,Answer not available from the given context. ,Negative,"['Although several product pathways are available in the self-reaction of HO2, it is well established that the H2O2 + O2 channel dominates on the electronic triplet state, namely, HO2 + HO2 → H2O2 + O2 ΔH(0K) = -38.3±0.10 kcal mol -1 (R1).']","[[0, 237]]","[""Figures 6a and 6bIn R1a or R1b, v1 and v2 are both spectator modes, which are not involved in hydrogen abstraction and thus have no effects on R1a. However, a counterexample occurs in R1b. As shown in Figure , the fundamentally excited v3 (a spectator mode in R1b) has significant enhancement effects on the reactivity of R1b at Ec < 5.0 kcal mol -1 . Enhancing the reactivity by exciting a spectator mode was first observed in our previous work on the radical-radical reaction OH + HO2 → H2O + O2.We attributed the special mechanism to increased dipole caused by the excited OH, which makes the attraction between OH and HO2 stronger. Recently, Tian et al. reported a novel dynamical behavior that the excited low-frequency umbrella bending mode of ammonia has enhancement effects on reactivity of F( 2 P) + NH3 → HF + NH2 reaction, much more efficiently than the highfrequency stretching modes in the entire energy range of Ec, which is related to the stronger attraction induced by the excited bending mode. These unexpected results indicate that the interaction between reactants plays a significant role in the barrierless reaction, and may lead to some unique mode-specific dynamics. Figure shows the interaction potential at different H-O (in HOO') bond distances. Clearly, the attractive interaction increases with the elongation of the H-O (in HOO') bond distance. At RHO = 1.19 Å (corresponds to the outer turning point of v3 = 1), the depth of the well is increased by roughly 3.0 and 5.6 kcal mol -1 relative to that at RHO = 1.08 Å (v1 = 0) and RHO = 0.97 Å (equilibrium bond distance), respectively. The deepening of the RC well increases the chance of capturing the reactants and thus enhances the reactivity of R1b. This can be proved by Figures"", ""Figures S4a and S4cThe initial vibrational states of one reactant HOO' are set as the ground state (GS, all v=0), v1 = 1, v2 = 1, and v3 = 1, respectively, without rotational energies. v1, v2, and v3 represent the vibrational quanta of OO' stretch, bending, and HO stretch motion of HO2, respectively. The other reactant HOO was kept at the ground vibrational state, without rotational energies. Experimentally, R1aand R1b can be distinguished by the oxygen isotopic substitution: HO O + HOO → O O + H2O2or HO OH + O2.  Figure presents the potential energies along two representative trajectories: Figure for the direct mechanism and Figure for the complex-forming mechanism. In the direct mechanism, the system undergoes a barrier and the product is formed via a direct hydrogen abstraction mechanism in a very short time. However, in the complex-forming mechanism, the strong attraction between reactants leads to a much longer residence time around RC than that in the direct one, particularly at low Ec. Thus, the system has enough time to adjust the relative orientation between reactants until the reaction occurs. Consequently, the reactivity is higher. In addition, one can see that the energies of PESH are in excellent agreement with the direct ab initio calculations for these points along the two trajectories. Returning to the discussion of mode-specificity, as shown in Figure , the excited HO stretch (v3) of HOO' can significantly enhance the reactivity of R1a in the entire energy range. This is because v3 has a strong coupling with the reaction coordinate at TS1, and depositing energy directly into the"", ""has a strong coupling with the reaction coordinate at TS1, and depositing energy directly into the breaking bond is beneficial for the transfer of the H atom. The excitations of OO' stretch (v1) and HOO bend (v2) show negligible influence on the reactivity of R1a. This is not surprising."", 'type=""bibr"" target=""#b19"">[20] Interestingly, it has been found that the rate coefficients of R1, denoted hereafter as k1 (in the unit of cm 3 molecule -1 s -1 if not specified otherwise), show a minimum around 700-800 K. Further, the effect of pressure on k1 is significant at low temperatures, but vanishes at temperatures above 600 K.The aforementioned unique temperature-and pressure-dependent behaviors are related to the properties of R1 potential energy surface (PES), which governs the reaction mechanism, kinetics, and dynamics. Indeed, there exists a relatively stable intermediate between the two HO2 radicals, namely the H2O4 intermediate (the HO2 radical dimer) on the triplet state surface, whose energetics and spectroscopic characterization have also been scrutinized extensively by theory and experiment. As shown in Figure , our calculations show that another high-energy pathway via H2OO + O2 leads to the same products H2O2 + O2. To the best of our knowledge, it is the first time that this reaction path is reported. All these features make the PES of R1 complicated. There is no PES for the title reaction, which limits our understanding for its kinetics and dynamics.The PES, as a central role in physical chemistry, governs the nuclear dynamics that is related to molecular spectroscopy, energy transfer, chemical reactivity, and many other properties. Thanks to the advance in computing power and quantum chemistry, it', 'from the reactants HO2 + HO2 to the same products H2O2 + O2. One first forms the oxywater (H2OO) and O2 via the transition state TS2, which is 15.11 kcal mol -1 higher than the reactant asymptote at the UCCSD(T)-F12a/AVTZ level. Then H2OO, not stable, can convert to its isomer H2O2 easily with an isomerization barrier (TS3) of 6.64 kcal mol - 1 . This isomerization process has been reported at various theoretical levels. This channel (via TS2, H2OO, TS3 to H2O2) has never been reported in the literature, although it is negligible due to its much high barrier even at temperatures up to 2000 K. The dominant channel is barrierless.At the UCCSD(T)-F12a/AVTZ level, a doubly hydrogen-bonded complex well (RC, -12.29 kcal mol -1 ) is formed before reaching a hydrogen abstraction transition state (TS1, -0.30 kcal mol -1 ).RC and TS1 have been calculated at various levels. Here only the recent high-level results by Zhou et al. are included for comparison. The energies of RC and TS1 were -12.77 and -4.21 kcal mol -1 , respectively, at CASPT2/AVTZ/CBS. The characteristics of RC by Zhou et al. were similar to the current computations. For TS1, the energy deviation between the two methods is quite large, -3.91 kcal mol -1 , due to the significant differences in the TS1 geometries. For example, the forming and breaking bond distances, respectively, are 1.340 and 1.088 Å at the UCCSD(T)-F12a/AVTZ level, compared to 1.266 and 1.132 Å by Zhou et al. In addition, as shown in Table , the imaginary frequency of TS1 is i1884 cm -1 , significantly lower']","['Quantum and theoretical chemistry', 'Unclassified']",612,1,1,0,0.723979459,0.614520492,['why']
"SiMe 3 ) 3 Yb] (100 mg, 0.09 mmol) were dissolved in 1 mL of THF to afford a dark green solution. Dark green single crystals of 1@Yb were grown over two days at -35 °C from slow vapor diffusion of Et 2 O into the THF solution.cryptand)][(C 5 H 4 2. EPR Spectroscopy2.1 Continuous-wave EPR MeasurementsContinuous-wave (CW) electron paramagnetic resonance (EPR) spectra of solution samplesof 1 (Figs. 1b and S2) were recorded on either a Bruker EMX 300 or a Bruker ElexSys E580(2mg,0.002mmol)and[K(2.2.2-2 Synthesis of single crystals of 1@Yb (2% doping level): In an argon atmosphere glovebox, [K(2.2.2-cryptand)][(C 5 H 4 SiMe 3 ) 3 Y]",Causal,Why were dark green single crystals of 1@Yb grown from the THF solution?,Answer not available from the given context. ,Negative,['Dark green single crystals of 1@Yb were grown over two days at -35 °C from slow vapor diffusion of Et 2 O into the THF solution.'],"[[98, 248]]","['prepared accordingand silver atoms (31) by pulsed or CW EPR methods give similar T 1 values to those found here in a molecular anion, however such studies are limited to the melting point of the matrices used, which is always well below room temperature. It is a challenge to produce a pure 2 S state within a molecule and the next target to increase coherence times must be to engineer both the electronic structure of the metal ion and the vibrational modes of the ligand. in hydrocarbon matrices. Magn. Res. Chem. 33, S98-S106 (1995). 31. Michalik, J. & Kevan, L. Temperature dependence of electron spin-lattice relaxation of radiationproduced silver atoms in polycrystalline aqueous and glassy organic matrices. Importance of relaxation by tunnelling modes in disordered matrices. J. Magn. Reson. 31, 259-270, (1978). a School of Chemistry, The University of Manchester, Oxford Road, Manchester, M13 9PL, UK. b Photon Science Institute, The University of Manchester, Oxford Road, Manchester, M13 9PL, UK. c Department of Chemistry, University of California, Irvine, California, 92697-2025, United States. to literature procedures. Magnetically dilute complex 1@Yb was obtained by recrystallization from a solution mixture that contained the appropriate amounts of isostructural [K(2.2.2cryptand)][(C 5 H 4 SiMe 3', 'analogue [K(2.2.2-cryptand)][Yb(Cp¢) 3 ] 5, and therefore it can be doped into 5 to yield a paramagnetically dilute crystalline sample. The studies described below were performed on both frozen solutions of 1 and on single crystals of 1@5 at a doping level of approximately 2%. Probing the spin dynamics of 1 with pulsed EPR methods, echo-detected field-swept EPR (EDFS; see Supplementary Information) spectra (19) of 1 in THF are entirely consistent with CW-EPR; these spectra persist up to temperatures limited only by thawing of the solvent. In order to investigate the spin dynamics of 1 at higher temperatures, we studied a single crystal of 1@5 which gives identical g and A Y parameters to the frozen THF solution of 1, and confirms the assignment of the principal directions of g z and g x,y with respect to the molecular structure (Figs. 2a, S3 and S4). For a single crystal of 1@5, we find spin echoes between 5 and 300 K (Fig. ).Relaxation measurements show that T 1 is approximately 10 -20 ms below 10 K, but remains as long as 1 μs at 300 K, while T m varies between 2 and 0.4 μs in the same temperature range (Fig. ; Tables and). T 1 and T m are very similar between frozen solution and single crystal measurements,showing that the spin dynamics of 1 are independent of the phase of the sample; this is also remarkable because the THF (C 4 H 8 O) solvent is rich with 1 H nuclear spins. Furthermore, T 1 and T m are also largely independent of molecular orientation or which nuclear spin m I transition is monitored (see different observer positions in Fig. ). T 1 has a Raman-like dependence on temperature above 20 K (T 1 = C -1 T - n ; C = 1.3(3)×10 -8 μs -1 K -n , n = 3.16(5A z Y = -93.86, A x,y', ""single crystals of 1@Yb (Fig. ) were collected with a Bruker ElexSys E580 instrument operating at ca. 9.7 GHz and varied temperatures, and equipped with a goniometer that allowed controlled crystal rotation. An identical setup was used to measure the same crystal by echo-detected pulsed-EPR methods (see 2. ). We note that molecules pack in the crystal in different ways, being classified in two groups: A and B, whose C 3 axes (that is the axis perpendicular to the plane made by the centroids of the three Cp' ligands bound to Y 2+ ) are orthogonal. As such, we have chosen to rotate the crystal around the C 3 axis of one of such molecules, in order to access such an orientation that molecules B would have their C 3 axis parallel to the static B 0 field (Fig. ), while molecules A remained aligned with C 3 perpendicular to B 0 . This allowed determination of both g z and g x,y components at the same time (Table , main text). Spectra were simulated using the EasySpin software.  "", '2.1). Crystals were indexed by X-ray crystallography to determine the precise orientation of the crystallographic axes. Similarly to 1 and its Yb analogue, compound 1@Yb crystallises in a Monoclinic (P2 1/C ) space group. Its single crystal unit cell parameters: a = 16.22 Å, b = 24.79 Å, c = 14.04 Å, α = 90°, β = 90.57°, γ = 90°, and V = 5344, are similar to those of 1 (a = 15.8992(9) Å, b = 24.2949(14) Å, c = 13.7571(8) Å, α = 90°, β = 91.0257(8)°, γ = 90°, V = 5313.1(5) Å 3 ), 6 and diamagnetic host [K(2.2.2-cryptand)][(C 5 H 4 SiMe 3 ) 3 Yb] (a = 15.9471(5) Å, b = 24.2284(8) Å, c = 13.8243(5) Å, α = 90°, β = 91.1563(4)°, γ = 90°, and V = 5340.2(3) Å 3 77 Fig. S2 .S2Fig. S2. Experimental (black) and simulated (red) fluid solution X-band CW-EPR spectra for 1 (10 mM in THF) at 295 K and 9.40 GHz. Simulation parameters: g iso = 1.991; A iso ( 89 Y) = 102 MHz.', '3 BFig. S4 .3S4Fig. S4. EDFS road-map (angular dependence profile) for single crystal 1@Yb following stepwise rotation (10 deg. increments) around C 3 of molecules A, recorded at 200 K and 9.755 GHz (X-band). At positions highlighted in red, B 0 is perpendicular to C 3 of molecules A and B; the observed double resonance EPR signal is simulated with g x,y = 1.986, and A x,y ( 89 Y) = 100.8 MHz. At positions highlighted in blue, B 0 is along the C 3 axis of molecules B, and nearly perpendicular to C 3 of molecules A. Simulation of the data provides g z = 1.999, g x,y = 1.986, A z = 98.6 and A x,y = 100.8 MHz (see Fig.2aand Table1in the main text). 3 AFig. S5 .3S5Fig. S5. Normalized Hahn echo signal intensities as a function of the inter-pulse delay 2t, for 1@Yb (single crystal) at B 0 = 349 mT (OP2 in Fig. 2a; B 0 ^C3 ) and selected temperatures. Fig. S6 .S6Fig. S6. Normalized Hahn echo signal intensities as a function of the inter-pulse delay 2t for 1@Yb (single crystal) at B 0 = 352.6 mT (OP4 in Figure 2a; B 0 ^C3 ) and 100 K. The rate of relaxation varies with the pulse length, with more selective (longer) pulses being more effective in suppressing proton modulations.']","['Quantum and theoretical chemistry', 'Quantum computing']",3275,1,1,0,0.852918993,-2.22E-16,['why']
"the oligomer is mediated by electrostatic interactions between positively charged regions of pMLKL and negatively charged phosphatidylinositol phosphate-rich domains of the membrane. While it seems clear from a number of studies that the membrane association of pMLKL oligomers are important for membrane permeabilization , the mechanism of membrane permeabilization induced by pMLKL oligomers is not completely understood. It is unclear how pMLKL oligomers impact membrane packing, whether other chemical transformations that pMLKL undergo impact membrane association and the presence of the oligomers induces further phosphatidylinositol recruitment to the protein binding site.In parallel to its plasma membrane recruitment via canonical RIPK3/RIPK1 activity during necroptosis, vesicular trafficking of MLKL plays a critical role in its cellular localization.MLKL can mediate endosomal trafficking involving constitutive generation of vesicles that can fuse with lysosomes or the plasma membrane irrespective of phosphorylation by RIPK3 and this phenomenon is further enhanced after phosphorylation. Furthermore, trafficking that results in the removal of pMLKL from the plasma membrane may lead to delay in membrane permeabilization and cell death during necroptosis. Motivated by lipids' role in numerous membrane-related transformations, our laboratory has investigated the role of lipids in necroptosis, specifically during membrane permeabilization.We found that saturated very long chain fatty acids (VLCFAs) accumulated during necroptosis via activation of fatty acid biosynthesis and elongation. We also showed that VLCFAs have a higher propensity to disturb membrane packing in",Causal,Why do saturated very long chain fatty acids (VLCFAs) accumulate during necroptosis?,Answer not available from the given context. ,Negative,['We found that saturated very long chain fatty acids (VLCFAs) accumulated during necroptosis via activation of fatty acid biosynthesis and elongation.'],"[[1458, 1607]]","['that the membrane binding of pMLKL is enhanced after its fatty acylation.It is important to note that similar to what we have observed for modification with C20 alkFA, MLKL and pMLKL can also be acylated by C16 alkFA during necroptosis (Figure ). However, we believe that modifications by C16 FA and VLCFAs contribute to membrane permeabilization differently during necroptosis. We previously showed that VLCFAs interact with membranes and disrupt their integrity in model liposomes and molecular dynamics simulations. Based on the modest increases of VLCFAs during necroptosis, we proposed that the incorporation of VLCFAs into proteins can facilitate their recruitment to defined membrane domains and allow high local concentrations of these lipids at the membrane and perturb membrane integrity . Translocation of pMLKL oligomers to the plasma membrane is driven by electrostatic interactions between the oligomer interface and negatively charged phosphatidylinositol phosphate (PIP)-rich membrane domains. Several PIP species are known to be actively involved in cell signaling cascades, both in endogenous processes as well as in mechanisms of action of viruses and other pathogens. Protein-lipid interactions can alter lipid patterns on the membrane via electrostatic interactions or amino acid insertion into the bilayer. In turn, lateral lipid sorting alters the local mechanical and structural properties of the membrane. Binding of pMLKL oligomers to defined regions of the plasma membrane and further rearrangement of the local lipid distribution at their binding site', 'DISCUSSIONS/CONCLUSIONSThere are multiple signaling pathways that can be activated in response to TNF-α activation. This activation, in the presence of low caspase-8 activity and low activity of the of the cellular inhibitor of apoptosis antagonists, results in the activation of necroptotic signaling, activation of RIPK3, and phosphorylation of MLKL in necroptosomes. A recent study illustrated that downstream to its phosphorylation, MLKL translocates to the plasma membrane via Golgi-, actin-and microtubule-dependent trafficking, a new rate-limiting factor in necroptosis. Upon binding to the plasma membrane, pMLKL oligomers induce membrane permeabilization which does not appear to occur via the formation of regularly-structured membrane pores . Based on these observations and others , it is likely that other transformations that pMLKL might undergo contribute to membrane permeabilization or the mechanism that stabilizes pMLKL oligmers at the plasma membrane.We have previously studied the involvement of lipids in necroptosis and showed that saturated VLCFAs were upregulated via activated biosynthesis and mediate membrane permeabilization. Our results suggested that these VLCFAs might be incorporated into proteins during necroptosis and targeted to certain membrane regions as a result of specific protein-bilayer interactions, allowing high local concentrations of these VLCFAs on the plasma membrane. In this work, we investigate the role of VLCFAcylation during necroptosis and present two key findings.First, we show that pMLKL and MLKL are acylated by a representative saturated', 'SIGNIFICANCENecroptosis is a well-characterized form of caspase-independent regulated cell death that is involved in numerous diseases. A hallmark of necroptosis is the membrane permeabilization and rupture that is mediated by mixed linage kinase like protein (MLKL). This membrane rupture is linked to the inflammatory properties of necroptosis and is critical for disease states involving this process. It is established that electrostatic interactions between phosphatidyl inositol phosphates and phosphorylated MLKL (pMLKL) oligomers facilitate the membrane recruitment of pMLKL. In efforts to understand how lipids might contribute to necroptosis, we previously showed that saturated very long chain fatty acids (VLCFAs) accumulate and that they are functionally involved in this process. Our results also indicated that protein fatty acylation by VLCFAs can be a mechanism by which VLCFAs contribute to this process. Here we define the scope of protein acylation by saturated VLCFAs during necroptosis. First we show that, although there is an overall decrease in acylation, some proteins, including MLKL and pMLKL, are exclusively acylated during necroptosis. Reducing the levels of VLCFAs decreases the membrane recruitment of MLKL and pMLKL and rescues from cell death, suggesting that acylation by VLCFAs contributes to membrane localization of pMLKL and subsequent membrane permeabilization. Acylation of MLKL and pMLKL occur downstream of phosphorylation and oligomerization and appear to be S-linked. Second, we show that disruption of clathrin-mediated endocytic pathway results in a strong rescue in cell viability during necroptosis, likely by removal of pMLKL from the plasma membrane. Altogether, we show for the first time that MLKL and pMLKL can be acylated during necroptosis. We also show that disruption of endocytosis presents a promising strategy to delay membrane permeabilization and cell death during necroptosis', 'key findings.First, we show that pMLKL and MLKL are acylated by a representative saturated VLCFA during necroptosis. We have also shown that the acylation of pMLKL occurs downstream to MLKL phosphorylation and plasma membrane localization, suggesting that the acylation takes place at the plasma membrane. MLKL consists of three domains: the 4-helix-bundle which mediates the interactions with the membrane; the brace domain, and the pseudokinase domain that is phosphorylated by RIPK3. This phosphorylation is critical for membrane recruitment during necroptosis. Recently, it has been suggested that the 4-helix-bundle also contributes to the membrane recruitment and binding, in addition to the phosphorylation of the pseudokinase domain. The 4-helix-bundle domain has two predicted sites for palmitoylation (Cys18 and Cys24, SwissPalm 41 ). Our results suggest that the acylation of pMLKL and MLKL is S-linked and, in part, mediated by ZDHHC5, a member palmitoyl transferase family, indicating the acylation of 4-helix-bundle domain during necroptosis. The integral ZDHHCs undergo an autoacylation step on the cytosolic DHHC motif. The acylated enzyme intermediate then transfers the acyl group to its substrate. As one of the few plasma membrane-localized ZDHHC members, ZDHHC5 mediates the acylation of substrate at the plasma membrane and their plasma membrane recruitment , supporting our findings that of pMLKL and MLKL are acylated at the plasma membrane during necroptosis. Several studies have suggested increased binding of fatty acylated proteins to phosphoinositide lipids. As such, it is possible that the membrane binding of pMLKL is enhanced after its fatty acylation.It is important', 'the plasma membrane and further rearrangement of the local lipid distribution at their binding site allows high concentration of fatty acids that covalently modify pMLKL. Acylation of pMLKL oligomers would allow the local recruitment of VLCFAs to membrane regions that already possess different mechanical and structural properties, which facilitates their membrane disruption action.Second, we define the scope of protein VLCFAcylation during necroptosis using state-ofthe-art quantitative proteomics methods. Overall, we observe a decreased number of proteins are modified by a representative VLCFA during necroptosis. Pathway analysis conducted using proteins that show different levels of VLCFAcylation during necroptosis highlighted the enrichment of proteins belonging to the endocytic and lysosomal pathways. Previous studies have shown that pMLKL can associate with ESCRT proteins and flotillins which is suggested to result in the removal of pMLKL containing regions from the plasma membrane and their degradation. In parallel, flotillin association of pMLKL can result in its removal from the plasma membrane via exosomes. Based on these observations, it is clear that vesicular trafficking is key for maintenance of pMLKL and MLKL at the plasma membrane. We show that inhibition of clathrin-mediated endocytosis resulted in a strong rescue from cell death during necroptosis and decreased the levels of membrane bound pMLKL, whereas the whole cellular MLKL levels remained unchanged, suggesting that the inhibition of endocytosis pathway enhances the removal of pMLKL from the plasma membrane and preserves plasma membrane integrity. These results suggest for the first time that targeting endocytosis could be a way to delay membrane permeability during necroptosis. Overall, our results provide novel findings on the role of protein acylation by VLCFAs']","['Biomedical engineering and technology', 'Regenerative medicine']",714,1,1,0,0.91833248,0,['why']
"Benchmark setsFor the initial tests and determination of the empirical parameters τ (msRRHO cut-off) and ν scal (DFT frequency scaling factor) we employ the benchmark set of Li, Bell and Head-Gordon (LBH). This LBH set consists of 39 organic molecules ranging from ethane (small-est) to n-octane (largest) and is shown in the supporting information. For cross-validation we extended this set by 23 For the heat capacities, we additionally test the temperature dependence in a typical range of 200-1500 K, while for entropies only the value at 298 K is considered. For this a subset of the LBH molecule set is used, as described in Ref. . Note that the numerical values and errors for entropy and C p are similar and thus, the conclusions for the temperature dependence of the latter should also apply for the entropy.Furthermore, in Sec. 4.4 we present a case study for 25 pharmaceutical (Clinical Drug) molecules, denoted CD25. There are no experimental entropy values available for this set, but differences between the ensembles (e.g., gas phase versus implicit solvation) and different PES employed to calculate the entropy can be studied theoretically. We suggest this set also as a challenging test for other approaches. Results",Causal,Why was the LBH set of molecules chosen for the initial tests and determination of empirical parameters?,Answer not available from the given context. ,Negative,"['For the initial tests and determination of the empirical parameters τ (msRRHO cut-off) and ν scal (DFT frequency scaling factor) we employ the benchmark set of Li, Bell and Head-Gordon (LBH). ', 'This LBH set consists of 39 organic molecules ranging from ethane (smallest) to n-octane (largest) and is shown in the supporting information.']","[[0, 205], [206, 349]]","['Benchmarking absolute entropyRecently, Head-Gordon et al. published the LBH set containing 39 organic molecules and their experimental gas-phase entropies, which provides an excellent reference for the evaluation of absolute entropies. For a more thorough evaluation the set was extended by the AS23 molecules. Entropy values for the two sets were calculated for four combinations of theory levels. These are S msRRHO contributions obtained with either B97-3c or B3LYP-D3/def2-TZVP and the conformational entropies calculated at GFN-FF or GFN2-xTB level and with τ and ν scal values as described above. Parity plots for the different levels of theory with reference to the experimental data are given in Fig. and the corresponding statistical data are provided in Tab. 2.The excellent performance of our approach is obvious from both Tab. 2 and the parity plots (Fig. ). To the best of our knowledge, the RMSD of 0.79 cal mol -1 K -1 calculated at the B97-3c+S conf (GFN-FF) level refers to the best performance of a theoretical method for this benchmark set ever reported in the literature. For comparison, the best performing method discussed in Ref. 6, (UM-VT, a DFT based MF approach) has a RMSD of 1.24 cal mol -1 K -1 . For the combined LBH+AS23 set the errors are slightly larger (RMSDof 1.1-1.3 cal mol -1 K -1). Yet, all of the four tested method combinations are well below the targeted chemical accuracy of 3 cal mol -1 K -1 . A similar performance on a set of 128 experimental absolute entropies was reported by Guthrie 32 using B3LYP/6-31G**, with an RMSD of 1.29 cal mol -1 K -1 . Larger, flexible molecules in this set are identical with the ones in the LBH+AS23 set. However, Guthries benchmark set is mainly composed from rather rigid', 'Calculation of absolute molecular entropies and heat capacities made simple We propose a fully automated composite scheme for the calculation of molecular entropies efficiently, accurately and numerically stable by a combination of DFT, semiempirical quantum chemical (SQM) and force-field (FF) levels. A modified rigidrotor-harmonic-oscillator (msRRHO) approximation and the Gibbs-Shannon formula for extensive conformer ensembles (CEs) are applied and efficiently account for effects of anharmonicity. CEs of systematically increasing quality are generated by a modified metadynamics search algorithm and extrapolated to completeness. Variations of the rovibrational entropy over the CE are accounted for by a Boltzmann population average for the first time consistently. The proposed procedure was extensively tested with two standard DFT methods (B97-3c and B3LYP) and at GFN-SQM/FF levels for the conformation term in comparison with experimental gas phase entropies and heat capacities. Excellent performance is observed with mean deviations <1 cal mol -1 K -1 (about <1-2%) for the total molecular entropy. Even for extremely flexible linear alkanes (C 14 H 30 -C 16 H 34 ), unprecedentedly small errors of about 3 cal mol -1 K -1 are obtained.For 25 typical drug molecules, the conformational entropy depends weakly to strongly on the underlying theory level revealing the complex potential energy surfaces as main source of error. The approach is systematically expandable and moreover can be applied straightforward together with continuum solvation models.', 'similar, but mostly larger molecules ranging from cyclohexane (smallest) to n-dodecane (largest). This set is termed AS23 (Absolute Entropy) from now on and is described also in the Supporting Information. The corresponding experimental gas phase reference entropies and C p (T ) values are taken from Refs. 78,79. Studies are available in the literature presenting much larger collections of experimental reference data, e.g., in Ref.55. However, these databases contain mostly small, rather rigid systems (e.g., substituted aromatic compounds) which are not in the focus of our study. Nonetheless, thecombined LBH and AS23 sets should sufficiently representative for benchmarking absolute entropies. To show possible limitations of our approach a set of maximally flexible linear alkanes (up to C 18 H 38 ) is investigated separately. Table 1 :1Contributions to the total molecular entropy for n-decane and tamiflu. RRHO and msRRHO values correspond to the B97-3c level of theory, S conf and S msRRHO were calculated at the GFN2-xTB level. Relative contributions are given in percent next to the respective contribution.S cal mol -1 K -1n-decanetamifluof the entropy results from the vibrational, rotational, and translational degrees of freedom (DOF), as commonly obtained by standard quantum mechanical frequency calculations employing the RRHO approximation. Contributions from translational and rotational DOF', '13,14) depend less strongly on the ensemble partition function than the entropy. Hence, it is sufficient to calculate C p and enthalpies [H(T )-H(0)] only for a single converged ensemble without extrapolation. The performance of our approach was evaluated on a subset of the LBH benchmark with 44 experimental heat capacities for linear and branched alkanes at different temperatures between 300 and 500 K. For reference, we again compare with the UM-VT results provided in Ref.6. Parity plots for the comparison with experimental data are shown in Fig.6and the corresponding statistical data are given in Tab. 3. Figure 6 :6Figure 6: Parity plots for calculated and experimental heat capacities for a subset of the LBH set. Method combinations of B97-3c and B3LYP-D3/def2-TZVP C p,msRRHO values with GFN2-xTB and GFN-FF C p,conf values are shown. UM-VT values were taken from Ref. 6. Figure 7 :7Figure 7: (a) Heat capacities calculated for n-octane in the temperature range 300 to 1500 K and (b) temperature dependence of the conformational heat capacity shown for octane and other example molecules from the AS23 and CD25 sets. (ms)RRHO values correspond to the B97-3c level and CE were obtained at the GFN2-xTB level.', 'Benchmarking heat capacityHeat capacities and enthalpies (see Eqs.  Excellent performance is achieved for all assessed methods with RMSDs and SDs (much) smaller than 0.7 cal mol -1 K -1 . In Fig. , virtually all data points are within an error range of1 cal mol -1 K -1 .The choice of the theoretical level used for the msRRHO calculations seems to be less important as both B97-3c and B3LYP perform well. Looking at the corresponding mean deviations B97-3c tends to slightly overestimate C p while B3LYP shows the opposite trend. This is attributed to the choice of the frequency scaling factor and the cut-off value τ , which were adjusted for the computation of entropies. Accordingly, the results could be seen as further evidence for the conceptional validity of this treatment.At ambient temperature absolute values of heat capacities are smaller than absolute values for entropies. The corresponding conformational contributions are mostly not the accuracy bottleneck for the heat capacities but can be significant at lower temperatures. For example in the LBH subset, the largest C p,conf values are obtained only for the most flexible systems (n-heptane, n-octane) and even then it accounts only to about 2-3 cal mol -1 K -1 . However, it should be noted that the errors in the standard RRHO treatment will quickly exceed the desired 3 cal mol -1 K -1 range.']","['Quantum and theoretical chemistry', 'Theoretical methods']",2559,1,1,0,0.860433978,-2.22E-16,['why']
"Hydrogen transportThe existence of a transport and storage infrastructure for hydrogen could kickstart the consumption of hydrogen for all three types of consumers (in particular for mobility and the built environment). Up to this day, the amount of hydrogen consumed outside of industrial facilities is significantly low (mainly used as a reagent in research laboratories, in some captive MDV fleets, and the few available HRS worldwide before 2010). In this context, the development of the (trans)national hydrogen transport networks anywhere has not been felt by stakeholders in the hydrogen sector.",Causal,How could the existence of a transport and storage infrastructure for hydrogen kickstart the consumption of hydrogen?,Answer not available from the given context. ,Negative,['The existence of a transport and storage infrastructure for hydrogen could kickstart the consumption of hydrogen for all three types of consumers (in particular for mobility and the built environment).'],"[[0, 219]]","['Transport of hydrogen in the existing natural gas infrastructureThe most popular method of transporting hydrogen nowadays is via the use of tube trailers, which is merely a trailer that carries a bundle of tubes and supplies gases to a particular consumer. The main disadvantage of transporting hydrogen via tube trailers is the high cost of transported hydrogen: a single tube trailer can only carry approximately 400 kg of hydrogen, and the limitation lies in the weight of the steel tubes used as well as in the maximum allowable storage pressure in tube trailers (250 bar in the U.S.). One of the proposals that has recently gained significant attention in the hydrogen world is to repurpose the existing natural gas transmission and distribution infrastructure. Transporting hydrogen in a network that has already been commissioned would bring significant advantages including 1) a short(er) time horizon for the development of a large-scale hydrogen transport infrastructure, 2) significantly lower capital expenditures (CAPEX) of the transport system for hydrogen, and 3) to bring freedom and certainty to stakeholders on both the consumption and production sides of hydrogen, so that they can develop projects where they deem it best suited to their interests.The retrofitting of the existing natural gas infrastructure to accommodate hydrogen comes with challenges of its own. As a first example, there could be competition with natural gas. The International Energy Agency (IEA) predicts that natural gas will continue to play a role in the global energy mix, both in the lead up to 2050 and potentially beyond. This implies that hydrogen and natural gas could compete with one another for access to the transport infrastructure; in principle, this could be solved by physically blending hydrogen in the natural gas, albeit blending', 'Hydrogen shipping and hydrogen carriersHydrogen transportation is a crucial component in establishing a global hydrogen economy. While pipeline transport is practical for short distances, the transportation of hydrogen across oceans is necessary for long distances. The development of hydrogen shipping using various carriers, including compressed gas, liquefied hydrogen, and ammonia, presents an opportunity for countries to access clean energy sources that may not be available locally. However, several challenges need to be addressed, such as safety, cost-effectiveness, and competition with existing supply chains.This type of transportation is known as hydrogen shipping and can be accomplished using various hydrogen carriers (Table ). Table . Hydrogen carriers with description, potential windfalls, and challenges. Hydrogen carrier Description Potential windfalls Challenges Liquid hydrogenHydrogen is liquefied and transported using tankers to an import terminal. From there, it is transported furtherThe advantage of this approach is that the LNG trade is already established worldwide. Therefore, byThe primary challenge of liquid hydrogen is boil-off losses caused by imperfect insulation and quantum effects.inland either as a liquid or in a gaseous state.learning from the existing LNG supply chain, the transportation of liquid hydrogen could be further developed.', ""Hydrogen in mobilityMobility has been the most discussed application of hydrogen in the past decades. Since the surge in interest by US-based car manufacturers to develop hydrogen cars in the 1990's, hydrogen has ever since been promoted as a substitute for gasoline and diesel (and to a lesser extent, for liquefied petroleum gas, LPG, and liquefied natural gas, LNG). As is the case for industrial end-users looking for a substitute to fossil-fuel combustion, hydrogen could be used in an internal combustion engine (ICE), although the vehicle would probably need to be adjusted to fze the hydrogen consumption. The other main applications for extracting energy from hydrogen are proton exchange membrane (PEM) fuel cells, considered mainly due to their higher efficiency (~50%) with respect to ICEs (~30%); the operation of PEM fuel cells has already been extensively covered in the literature. There are several kinds of mobility applications including LDVs (light-duty vehicles i.e., passenger cars), MDVs (medium-duty vehicles e.g., vans, public transport buses), and HDVs (heavy-duty vehicles like long-haul trucks and coaches).Regarding LDVs, fuel cell vehicles have existed in the market for longer than a decade, with Japanese and Korean car manufacturers being the most prominent in the market. The main challenge with respect to LDVs is the availability of hydrogen refueling stations (HRSs), although the current support for hydrogen-based mobility has accelerated the HRS market, from 330 stations available in 2017 to 540 in 2020. Besides the infrastructure availability, the cost of the LDVs fuel cell and hydrogen as fuel are considered a challenge to be overcome by the development of both suitable transport and storage infrastructure. Undeniably, the governmental policies aimed at abating carbon emissions in mobility are"", 'Hydrogen consumptionThe consumption of hydrogen to produce either (mechanical) work or heat is an important step of the value chain. Although the consumption of hydrogen has been generally associated with the operation of fuel cells, hydrogen can also be burned as any other gaseous fuel to produce heat in a boiler or stovetop as well as combustion engines for cars. Hydrogen consumption is generally divided into the types of end-users:1. Industry 2. Mobility 3. Built environment', ""principle, this could be solved by physically blending hydrogen in the natural gas, albeit blending also comes with its own set of risks (increased flammability of the mixture compared to pure natural gas) and challenges.Furthermore, compatibility of the natural gas infrastructure with hydrogen can also present a difficult challenge. The development of gas transport infrastructure was historically done in view of two types of gas to deliver: 1) the transport of 'town gas' i.e., gasified coal that consists of a mixture of carbon monoxide and hydrogen, in urban settlements, and 2) the natural gas (either low caloric or high caloric) that holds little to no hydrogen. As such, it is not expected that hydrogen would be compatible with the existing assets in the natural gas transport infrastructure, in particular looking at the transmission grid (in many countries it consists of large-diameter pipelines with a nominal operating pressure upwards of 50 bar) and being mindful of pressure-induced phenomena such as permeation, leaks, or hydrogeninduced embrittlement.There are several past and ongoing projects to prove the extent to which the assets of the natural gas infrastructure can be reused for hydrogen or hydrogen blends and to which extent they would need to be replaced or maintained more often (both of which would result in increased hydrogen transport costs). Research in this topic has converged so far to the knowledge that the existing natural gas infrastructure can carry hydrogen blends up to 20-30% without serious modifications, while blending higher hydrogen percentages as well as carrying 100% hydrogen need more research.""]","['Energy', 'Renewable energy sources']",1678,1,1,0,0.823939121,0,['how']
"IntroductionThe last century has yielded enormous insights into the beginnings of the universe and the fundamental properties of matter, yet the age-old question of how life emerged on Earth remains unanswered. There has been a lot of progress in identifying likely prebiotic pathways for generating the amino acid and nucleotide building blocks of life, as well as strategies for their polymerization. However, mechanisms for oligonucleotides to autonomously selfreplicate, which would involve a templated synthesis followed by spontaneous dissociation of the product from the template, have not been forthcoming. This dearth arises from the intrinsic thermodynamic problem inherent in the templated synthesis where the product forming on the oligonucleotide template strand binds far more tightly than the shorter, unligated substrates due to the ""connection Gibbs energy"". This product inhibition is significant even in small oligonucleotide replication cycles like the",Causal,Why have mechanisms for oligonucleotides to autonomously self-replicate not been forthcoming?,Answer not available from the given context. ,Negative,"['However, mechanisms for oligonucleotides to autonomously selfreplicate, which would involve a templated synthesis followed by spontaneous dissociation of the product from the template, have not been forthcoming. ', 'This dearth arises from the intrinsic thermodynamic problem inherent in the templated synthesis where the product forming on the oligonucleotide template strand binds far more tightly than the shorter, unligated substrates due to the ""connection Gibbs energy"". ', 'This product inhibition is significant even in small oligonucleotide replication cycles like the']","[[403, 614], [615, 875], [876, 972]]","['Minimizing Product Inhibition in DNA Self-Replication: Insights for Prebiotic Replication from the Role of the Enzyme in Lesion-Induced DNA Amplification', ""This product inhibition is significant even in small oligonucleotide replication cycles like the cross-catalytic and autocatalytic systems for hexamer synthesis reported by von Kiedrowski. Consequently, the field of prebiotic chemistry has mostly abandoned the idea of autonomous oligonucleotide replication after von Kiedrowski's seminal work and instead has focused on scenarios where the local environment is modulated allowing for changes in the template:product duplex stability and therefore turnover of the replication cycle. Environmental changes including variations in pH, salt concentrations, viscosity, and temperature have led to cycles of hybridization and dissociation of RNA or DNA duplexes and have been proposed as drivers of prebiotic nucleic acid self-replication. All of these scenarios can be rationalized to some extent based on intrinsic temperature cycles and chemical gradients expected on early Earth. Yet, the question of how fragile oligonucleotides could have sustained these slow cyclical processes for many generations of replication remains unclear, making the question of oligonucleotide self-replication far from settled in any prebiotic theory.A strategy that has also been considered to avoid product inhibition in general nonenzymatic oligonucleotide self-replication, is the introduction of oligonucleotide modifications that destabilize the interaction between the template and the growing complement. For example,"", 'type=""bibr"" target=""#b34"">35, We attributed the facile self-replication to the destabilizing influence of the abasic group on the stability of the product duplex. Moreover, the temperature where exponential self-replication was observed was tunable by varying the stability of the template:fragment complexes through the introduction of mismatches in addition to the destabilizing abasic group, revealing that self-replication was intrinsically linked to the stability of the DNA complexes formed throughout the catalytic cycle. This method of lesioninduced DNA amplification (LIDA) has proven general for amplifying a variety of 18mer sequences, usually requiring the introduction of only one abasic nucleotide into one of the four fragments. Because of its sequence generality, LIDA represents a useful model system for understanding autonomous oligonucleotide self-replication. Nevertheless, our efforts to perform nonenzymatic self-replication using abasic destabilizing groups and rapid chemical ligation methods yielded poor results, suggesting that the enzyme was playing a more substantial role in our rapid self-replicating system beyond simply catalyzing the formation of the phosphodiester linkage.To elucidate the role of the enzyme and identify principles for self-replication that can inform the design of autonomous, nonenzymatic oligonucleotide replication, here we utilize a kinetic model of cross-catalysis to identify the important kinetic and thermodynamic parameters in our ligase chain reaction of abasic site-containing strands. Remarkably, we find that the enzyme influences product inhibition by reducing the stability difference between the intermediate complex and the', 'Self-replication of nucleic acids in the absence of enzymes such as polymerases or ligases represents an important and poorly understood step in the origin of life. In fact, the self-replication of nucleic acids remains strongly hindered by product inhibition, even when enzymes are present.Studying one of the few successful examples of enzymatic DNA self-replication based on a simple ligation chain reaction can shed light on how this fundamental process may have originally evolved.Previously, our group reported lesion-induced DNA amplification (LIDA), which is an isothermal ligase chain reaction. It was proposed that the lesion, a destabilizing abasic group, played an important role in reducing product inhibition. However, using abasic groups in non-enzymatic ligation cycles did not yield appreciable amplification. In order to identify the unknown factors that overcome product inhibition in LIDA, we have performed a detailed kinetic and thermodynamic analysis of the process, employing isothermal titration calorimetry (ITC) and global fitting of PAGE fluorescence data to characterize the individual steps of the amplification process. We found that in the absence of an enzyme, the ligated product binds four to five orders of magnitude more tightly to the template than to the shorter unligated strands of the intermediate complex. In the presence of T4 DNA ligase, this stability gap was reduced by two orders of magnitude, such that the intermediate and product complexes were roughly equal in stability. Thus, the ligase helps overcome product inhibition by reducing the affinity difference between the DNA product duplex and the intermediate complex. Furthermore, kinetic simulations showed that the stability of the intermediate complex, as well as the rate constant of ligation, significantly impacts the rate of self-replication, suggesting that catalysts that stabilize the intermediate complex might be a route to', 'type=""bibr"" target=""#b29"">[30] For example, spontaneous ligation by non-heritable 2\'-5\'-linked oligonucleotides was demonstrated to weaken the overall duplex stability. . However, such methods of incorporating destabilizing groups have not been used in a successful self-replication system based on chemical ligation strategies.One area of great success in the quest to identify self-replicating nucleic acids, however, is in ribozymes: RNA sequences on the order of 66-76 nucleotides (nt) with sequence-dependent catalytic function. In 2009, the Joyce lab identified a ribozyme that catalyzes the formation of phosphodiester bonds and used it to generate a self-replicating oligonucleotide system that exhibited sigmoidal growth indicative of exponential self-replication. Yet these replicating systems are not a model of general oligonucleotide replication as they require specific RNA sequences to confer this catalytic property. Interestingly, the most facile replicators in the selfreplicating ribozyme system did have destabilizing modifications between the template and the complementary fragments in the form of a U:G wobble pair. These results suggested that destabilizing mismatches could facilitate replication.Previously our lab discovered an isothermal ligase chain reaction that exhibited rapid, exponential amplification of 18mer sequences using a common DNA ligase and four fragment sequences, one of which contained a model abasic lesion in place of a complementary nucleotide at the 5\'-phosphate terminus (Figure ). We attributed the facile']","['Catalysis', 'Enzymatic catalysis']",1092,1,1,0,0.967793388,0,['why']
"overlap between the previously obtained solutions and the current target state. The minimization of the VQD cost function ensures the mutual orthogonality of the computed eigenstates. Thus, the algorithm entails sequential calculations of the states. Importantly, these approaches do not guarantee resolving the full energy spectrum of the Hamiltonian, especially for near-degenerate states. Essential feature of the VQE-based approaches is the need to design the ansatz that effectively differentiates each eigenstate of the Hamiltonian from other states.In the classical quantum chemistry, the evaluation of excited states is also challenging . Among popular wavefunction-based approaches is the equation-of-motion coupled-cluster (EOM-CC) ansatz . In the complete many-body limit (i.e., when up to N -electron excitations are included), EOM-CC becomes identical to full configuration interaction (FCI)-the exact solution in the given one-electron basis set. In the case of the truncated many-electron basis, EOM-CC is superior to CI due to the incorporation of correlation through a similarity transformation, which also makes the method size intensive. Quantum adaptations of the EOM ansatz (qEOM) have been implemented and tested . In contrast to the standard EOM-CC, the reference wavefunction of its quantum counterpart comes from the groundstate VQE calculation with the UCC (unitary coupled-cluster) ansatz . UCC framework is Hermitian, provides an",Causal,Why does the minimization of the VQD cost function ensure the mutual orthogonality of the computed eigenstates?,Answer not available from the given context. ,Negative,"['The minimization of the VQD cost function ensures the mutual orthogonality of the computed eigenstates. ', 'Thus, the algorithm entails sequential calculations of the states.']","[[80, 183], [184, 250]]","['VI. SUMMARY AND CONCLUSIONSIn this contribution, we presented the implementation of the Davidson algorithm and its variational variant within the quantum version of EOM-CC for computing electronically excited states. We tested the method, named qEOM-UCCSD/Davidson and qEOM-UCCSD/Davidson/Variational, on four systems: H 2 /6-31G, H 4 /STO-3G, LiH/STO-3G, and H 2 O/STO-3G(FC) showing good agreements with the energies obtained from EOM-VQE .The Davidson implementation of the qEOM-UCCSD algorithm provides the advantage over the qEOM and EOM-VQE by reducing the working Hilbert space significantly. The classic Davidson method iteratively interacts with the outcome from the quantum devices and provides feedback to grow the ansatz (vector space) to prepare desired quantum states.The implementation provides several advantages compared to the currently available excitedstate methods in quantum computing. First, qEOM-UCCSD/Davidson significantly reduces the computational demand for classical diagonalization step, because the dimension of the resulting subspace Hamiltonian only spanned by a few guess vectors. In the case of its variational variant, the Davidson algorithm provides the certain electronic configurations that are expected to contribute to the target excited states. Therefore, it introduces a significantly smaller number of variational parameters resulting in a significantly reduced searching space.In addition, similarly to the classical variant, the presented Davidson algorithm produces the excited state of the desired spatial or spin symmetry (in the case of the closed-shell references). The qEOM-UCCSD/Davidson can target the specific group of transitions by defining suitable subspace vectors and can be extended to target higher-energy states or specific transitions . Apart from the advantages of using', 'ground-state energies. Many applications (e.g., spectroscopy, photochemistry), require going beyond ground-state calculations and computing excited states. The development of quantum algorithms for molecular excited states is more challenging compared to the ground-state algorithms. The existing quantum algorithms for excited states often require a large number of qubits and gate operations, which precludes their application to larger systems. This is because the excited states often have more complex wavefunctions (open-shell, multi-configurational) even when the corresponding ground states are well behaved. Furthermore, in contrast to the ground state (which is unique in the sense that it is the lowest-energy state), there are many excited states, so the quantum algorithms should be capable of targeting a specific state (or states)e.g., the lowest energy states or states in a particular energy range, states of a particular symmetry/spin, states of a particular character, etc.The success of the VQE algorithm for ground-state calculations has inspired extensions to excited states, leading to variational quantum deflation (VQD) , subspace-search VQE (SSVQE) , and other algorithms . The underlying framework of all VQE-based methods is variational principle. The VQE-based methods for excited states employ supplementary constraints, so that the resulting algorithms look for a minimum-energy state orthogonal to the previously computed states. For example, the central element of VQD is the penalty terms in the cost function (which is subject to minimization). The penalty terms quantify the overlap between the previously obtained solutions and the current target state. The minimization', 'ansatz . UCC framework is Hermitian, provides an upper bound for the energy, and is size extensive by construction.However, the price paid for the variational bound is that the originally proposed qEOM ansatz does not satisfy the killer condition that ensures the ground-state cannot be de-excited. Mukherjee and co-workers proposed a unitary transformation of the EOM projection operators to address the killer condition issue of the UCC theory . Asthana et al. have implemented this technique on quantum devices. The algorithm, named EOM-VQE , yields more accurate excitation energies (EEs), ionization potentials (IPs), and electron affinities (EAs) than originally proposed qEOM .The qEOM procedure leverages classical and quantum computing resources. Specifically, the Hamiltonian matrix is measured on a quantum computer within a given many-electron basis, and the resulting matrix is subsequently diagonalized on a classical computer. Although the measurement processes of the Hamiltonian can potentially benefit from quantum architecture, for the entire calculation to be effective, one also needs a cost-efficient algorithm for the diagonalization step done on a classical computer. In classical electronic structure calculations, the diagonalization is accomplished through iterative determination of only a few eigenvalues using the Davidson algorithm <ref', 'on a quantum device and then solves the eigenvalue problem of Eq. ( ) on a classical computer. Thus, qEOM also needs classical machines to diagonalize the measured matrix. The number of matrix elements to measure on quantum computers and the dimension of the matrix to diagonalize on classical computers depend on the level of correlation treatment and the one-electron basis set. By restricting the excitation levels to singles and doubles, the quantum computer is required to measure about N ∼ n occ × n vir + n 2 occ × n 2 vir matrix elements and the classical computer is required to diagonalize N × N matrix, which scales as O(N 3 ). Although the dimension of the matrix M can considerably be reduced by utilizing the sparsity and symmetries of the Hamiltonian, the scaling quickly reaches the intractable regime as the system size increases.Eqs. ( ) and (22), which are the working equation of qEOM with the self-consistent manifold operator, are the same as in the standard EOM-CC method except for the form of the effective Hamiltonian. In the standard EOM-CC calculation, we iteratively determine only a few eigenvalues using the Davidson algorithm instead of explicit diagonalization of the entire matrix M . Here, we present the implementation of this idea within the qEOM method (we focus on the standard Davidson algorithm for low-lying states, but it can be extended to compute interior states or states of a particular character ).In order to compute J excited states, qEOM-UCC/Davidson starts with generating a set of appropriate L orthonormal guess vectors, {|b i ⟩} L≥J i=1 . Then, we measure the matrix elements of H in the given guess vector space and build the subspace Hamiltonian using a quantum', 'C. Solving qEOM-UCCSD on quantum computers using a Davidson-like procedureSimilar to the classical electronic-structure calculations, the quantum version of EOM (qEOM) protocol computes ground state before solving the EOM problem by using variational quantum eigensolver (VQE) with the choice of an appropriate ansatz, such as unitary coupled-cluster (UCC) and Hardware-efficient ansatz . As discussed in the previous section, we use the UCC ansatz with singles and doubles (qEOM-UCCSD)T = T1 + T2 = ia θ a i a † a a i + 1 4 ijab θ ab ij a † a a i a † b a j ,(23)where {θ} represents the set of variational parameters (same as the cluster amplitudes {t} in classical simulations). The ground-state wavefunction in Eqs. ( ) -( ) is replaced with the VQE-UCCSD ground-state wavefunction. The ground-state VQE minimizes the expectation value of the Hamiltonian with respect to the variational parameters{θ a i , θ ab ij } E 0 (θ a i , θ ab ij ) = min θ a i ,θ ab ij ⟨Ψ V QE (θ a i , θ ab ij )| Ĥ|Ψ V QE (θ a i , θ ab ij )⟩.(24)In order to compute electronic excitation energies on quantum devices, the qEOM ansatz is applied to the ground-state VQE wavefunction (ground-state VQE circuit with optimized parameters). qEOM measures the matrix elements of H of Eq. ( ) on a quantum device and then solves the eigenvalue problem of Eq. ( <ref type=""formula""']","['Quantum and theoretical chemistry', 'Quantum computing']",3379,1,1,0,0.883518478,2.22E-16,['why']
"to the optimization of the run parameters in a conventional conformer search run (see CREST documentation and source code ). Note that the MD runs are by default initiated with random numbers and hence the details of the obtained CE vary stochastically. For larger, very flexible molecules with a complicated PES this can amount to stochastic variations of 2-5% for S conf (see also Section 4.4 for discussion).The general workflow for the computation of S conf in CREST is outlined in Fig. Ideally, the PES employed for the initial conformational search and the one used for automatic S conf calculation should be the same. Here, we employ the GFN2-xTB tight-binding method and the recent general force-field GFN-FF and compare the results. The latter speeds-up the CREST calculations by a factor of 10-30 for typical cases with 50-100 atoms. The S msRRHO value is always computed with B97-3c and a frequency scaling factor ν scal of 0.97, or B3LYP-D3/def2-TZVP with a frequency scaling factor ν scal of 0.98. Test calculations employing GFN2-xTB in this step yield somewhat less accurate results without reducing the overall computational times significantly. In all frequency calculations, a S msRRHO cut-off value of τ = 25 cm -1 was employed. τ and ν scal (for the DFT methods)were adjusted to perform equally well in combination with both GFN-FF and GFN2-xTB.CREST is essentially a driver for the xtb program which is used for all GFN calculations.For the DFT calculations, TURBOMOLE 7.4 is used throughout.",Causal,Why does employing the GFN-FF method speed up the CREST calculations compared to other methods?,Answer not available from the given context. ,Negative,"['Here, we employ the GFN2-xTB tight-binding method and the recent general force-field GFN-FF and compare the results. ', 'The latter speeds-up the CREST calculations by a factor of 10-30 for typical cases with 50-100 atoms.']","[[625, 741], [742, 843]]","['that the conformer-rotamer ensembles (CRE) obtained from CREST are sufficiently complete and the energies E i are accurate. If this is really the case for very flexible molecules (e.g. long alkanes) can be tested by comparison of computed and experimental entropies and heat capacities (see Sec. 4.2 and 4.3). Note that our approach works with any (on-the-fly computed) PES and hence, at least in principle, the errors introduced by the underlying method for the PES and the other approximations to the entropy problem could be decomposed.The CREST algorithms were originally developed to generate rotamer containing ensembles and the related nuclei-exchange information for the simulation of NMR spectra . Hence, it seems straightforward not only to identify rotamers, but to extend the algorithm to automatically compute the proper degeneracy number g i . However, as mentioned above, conformer ensembles (CE) must be free from the indistinguishable rotamers to be compatible with entropy calculations. Therefore, g i are treated as unity in the usual case.The only exception here are symmetrical molecules that can form ""enantiomeric"" (i.e., in principle distinguishable) conformers through rotation of bonds. A typical case is the gauche conformer of n-butane. These geometrical enantiomers are degenerate and would be falsely classified as rotamers in our previous implementation. Effectively, this introduces a factor of g i = {1, 2} instead of g i in the degeneracy, depending on if the formation of a geometrical enantiomer is possible. Our new apprach considers this problem for the first time in a correct and automated way. Inserting this into the standard entropy expression for degenerate states leads toS conf = R ln g i e -E i β + g i (E i β)e -E i β g i e -E i β .(10)The correct S msRRHO entropy is a population average over the', ""CREST ensemble obtained with the GFN methods after refining (re-optimizing) itrestart for new lowest conformernoestimates? convergedyes• calculate • extrapolateS conf S'S conf S'+ S msRRHO1. The metadynamics (= S conf,final geometry optimization sorting conformers rotamers estimate S conf,est = -RΣ i p i log p i biased potential energy surface to exclude old conformers S msRRHO Figure 1: Schematic representation of the workflow used for the computation of S conf . See text for details.procedure From the CEs two sets of structures are extracted via a combined principle component analysis (PCA) 68,69 and k-Means clustering 70,71 approach, using dihedral angles as geometrical descriptors. The first set of structures, which always consists of 36 structures, is used as input for further metadynamic simulations. The other set consists out of a number of structures that depends on the molecular flexibility and current ensemble size. This second ensemble is used to generate a global bias potential in the metadynamics simulations and, in contrast to the initial MTD simulation, is not updated with new bias structures. The idea here is to apply this new unchanged bias similar to a global potential used in classical umbrella sampling 72 or basin-hopping algorithms 73,74 to efficiently block entire energy basins of the PES and direct the conformational search to new minima. For better differentiation, this is referred to as static metadynamics simulation (sMTD). The ensemble obtained by sMTD is merged with the previous ensemble and a preliminary conformational entropy S conf,est is determined. If no change (within a 2 % threshold) in S conf,est"", 'Algorithmic and technical detailsThe conformational entropy calculation as described above is performed with the recently published CREST program. A special run type was implemented for this purpose, where the focus is set to an extensive sampling around the global and low-lying local minima.Ideally the calculation of S conf should be conducted from the already known global minimum conformer, e.g., obtained from another conformational search with default settings in CREST. The enantiomer degenaracy number g i is obtained automatically as described in detail the Supporting Information. For the msRRHO part, any quantum chemical method or even force-fields can be applied. Here, we use the composite DFT method B97-3c and the well-known B3LYP-D3 functional in a standard def2-TZVP basis.  Note that for large systems step two could in principle also be conducted at a low theory level (SQM or FF). However, because step three is usually the computational bottleneck, it is recommended to take S msRRHO from a more accurate DFT treatment. In general, this partitioning allows systematic improvements of the scheme because the different contributions can in principle be calculated at any level of theory.If no low-lying conformers (relative energy <1-2 kcal/mol at ambient temperature) are found in the first step, the entropy run is not necessary and the plain S msRRHO value can be taken. The default setup for the metadynamics bias potentials in the entropy mode and further technical settings were empirically determined on a few test cases similar to the optimization of the run parameters in a conventional conformer search run <ref type=""bibr""', 'MTD) simulations ""static"" metadynamics (sMTD)is designed to work fully automatic and to provide intermediate ensembles for entropy extrapolation as described above. For the input structure, the run time t of the biased MD is determined automatically from a covalent and non-covalent flexibility measure (see Sec. 4.4 and the Supporting Information). To create an initial structural ensemble, 24 metadynamics (MTD) simulations are conducted with several different bias parameters as in the default CREST runtype. The structural ensemble obtained from this step is later used as the reference to calculate S conf (0) (see Eq. 15). Structures are sorted according to their relative energy, structural Cartesian RMSD, and rotational constants to distinguish between unique conformers and degenerate rotamers, as described in Ref.56. conf , an extrapolation as described in Sec. 3.1 is conducted. This new algorithm in CREST can also be used for normal conformer search with the keyword --v4. with the respective DFT methods. In such cases, we suggest to use the S msRRHO value obtained for the lowest DFT conformer and corresponding S conf from the GFN ensemble. If the lowest GFN and DFT conformer structures agree qualitatively, this approximation seems to be reasonable according to our experience.A problem may appear if the rather approximate PES used in CREST (here GFN2-xTBor GFN-FF) is substantially different from the DFT PES (here B97-3c or B3LYP-D3/def2-TZVP). This is indicated by different lowest-energy conformers and significant energeticre-ordering of the CREST ensemble obtained with the GFN methods after refining (re-optimizing)', 'better description of the PES. The modular partition of the absolute value into ro-vibrational and configurational parts enables a convenient replacement of the different methods, which provides a starting point for future studies. This also includes the extension to implicit solvation models that will allow to investigate molecular entropy differences between the gas-phase and solution or between different solvents.Molecular symmetry numbers are automatically determined for each conformer entering S msRRHO and should be also included in the DFT frequency evaluation. The few simple steps required for the calculation of the absolute entropy are 1. Run CREST in default mode on a starting structure to find the lowest conformer 2. Optimize the geometry of this conformer with DFT, compute the Hessian matrix from the DFT structure and use the HO vibrational frequencies to calculate S msRRHO 3. Run CREST in entropy mode on the lowest-energy conformer and employ the DFT reference structure for S msRRHO , resulting in S conf 4. Compute S = S msRRHO + S conf']","['Quantum and theoretical chemistry', 'Theoretical methods']",2557,1,1,0,0.836733163,0,['why']
"due to the structural similarity and therefore, expected NGA behavior. To examine the possibility of NGA by using the 9,9'-(9-oxo-9H-fluorene-2,7-diyl)-bis(9Hcarbazole-3,6-dicarboxylic acid, H4FBCDC) as linker a computational study on the mechanical properties of the ligand was conducted and compared with the H4BBCDC ligand. Subsequently, the fluorenone based ligand was synthesized and incorporated into DUT-140(Cu), a MOF isoreticular to DUT-49. The adsorption properties of DUT-140(Cu) were investigated and NGA behavior was observed upon adsorption of methane at 111 K. To enable the fluorescence detection and to avoid paramagnetic fluorescence quenching, DUT-140(Zn) was synthesized by post synthetic metal exchange. The influence of the mechanical stress and linker deformation on fluorescence properties was further investigated in desolvation experiments.",Causal,Why was the fluorenone based ligand synthesized and incorporated into DUT-140(Cu)?,Answer not available from the given context. ,Negative,"[""To examine the possibility of NGA by using the 9,9'-(9-oxo-9H-fluorene-2,7-diyl)-bis(9Hcarbazole-3,6-dicarboxylic acid, H4FBCDC) as linker a computational study on the mechanical properties of the ligand was conducted and compared with the H4BBCDC ligand. "", 'Subsequently, the fluorenone based ligand was synthesized and incorporated into DUT-140(Cu), a MOF isoreticular to DUT-49.']","[[71, 326], [327, 449]]","['CONCLUSIONIn brief, three new MOF materials DUT-140(M) (M = Cu, Co, Zn) were successfully synthesized. As predicted by mechanical considerations of the H4FBCDC ligand, the metal-organic framework DUT-140(Cu) shows intrinsic flexibility as well as negative gas adsorption property with an ΔnNGA = 5.45 mmol/g. The contraction of the opphase can be induced by adsorption of hydrocarbons like methane or butane as well as carbon dioxide. Adsorption experiments also confirm the assumption that the use of the H4FBCDC linker leads to a more rigid network since the adsorption of nitrogen does not trigger the phase transformation.UV/Vis investigations of DUT-140(Cu) showed a distinct change in the absorption spectrum which could be attributed to an excitation from the carbazole moiety to the fluorenone part by DFT calculations. Since this excitation is highly affected by the deformation of the linker, it can be concluded that the fluorescence spectrum also should change under the given conditions due to the structural transformation.The fluorescence properties of the fluorescent linker could be unveiled by an exchange of the metal node to a zinc paddlewheel. However, the stiffening of the metal-organic framework did not lead to the desired increased resistance to desolvation stress for DUT-140(Zn), indicating the metal node to be the main limiting factor, leading to amorphization during desolvation in such highly porous framework materials, even under mild supercritical conditions.In situ fluorescence studies provide clear evidence that a fluorescence change is caused by structural decomposition of the metal-organic framework and revealed the importance of the fine interplay of linker rigidity and metal node stability for the investigation of structural contraction by solvent desorption.Overall, fluorenone moieties are valuable functional building blocks for the detection of structural', 'Figure 2 .2Figure 2. Deflection of H 4 FBCDC ligand at 0.00 nN (a) and 0.03 nN (b) compressive strain. Colour code: grey: carbon, blue: nitrogen, red: oxygen. Hydrogen atoms are omitted for clarity. 3.5). The crystal structure of the DUT-140(Cu) was determined by means of synchrotron single crystal X-ray diffraction at MX BL14.3 beamline of the Bessy II light source. DUT-140(Cu) crystallizes in cubic space group Fm 3 m (No 225) with lattice parameter a = 46.14 Å and is isostructural to DUT-49. Detailed analysis of the ligand molecule in the crystal structure shows elongated thermal ellipsoids even for carbazole moiety, indicating disorder that can be caused by vibration of the molecule in the direction perpendicular to the carbazole plane. Since the symmetry of the fluorenone backbone is lower than the symmetry of the corresponding position in the space group, the fluorenone moiety is disordered over four positions.', 'Experimental investigation of desolvated DUT-140(Cu)As the theoretical calculations of the mechanical properties of H4FBCDC predict the potential for NGA, the ligand was synthesized in a similar six step approach used for the synthesis of recently reported elongated versions of H4BBCDC. The carbazole was converted to dibutyl-9H-carbazole-dicarboxylate over four steps and the obtained dicarboxylate was used as starting material in an Ullman-coupling reaction with 2,7-dibromofluorenone. After the following hydrolysis and purification, the H4FBCDC ligand was obtained in 28% yield over six steps. All compounds have been analyzed by H-and C-NMR as well as by mass spectroscopy and IRspectroscopy as shown in supplementary information chapter 2.Combination of H4FBCDC with copper(II)nitrate in N,N-Dimethylformamide (DMF) yields the framework with a composition [Cu2(FBCDC)] (H2O)x(DMF)y, denoted as DUT-140(Cu). The MOF was synthesized using two different synthesis routes yielding crystalline powders with an average particle size of 14 µm and single crystal sample with crystals up to 100 µm (supporting information chapters 3.1 and 3. The material has a hierarchical pore system with three different voids (11 Å, 16 Å, 24 Å). The phase purity of DUT-140(Cu) was confirmed by PXRD (supporting information, chapter 3.3). The activated powder sample of DUT 140(Cu), was subjected to physisorption experiments using nitrogen at 77 K and methane at 111 K as probe molecules (Figure ). The low-pressure range of nitrogen isotherm, shown in Figure , displays superimposing steps up to p/p0 = 0.1 indicating the consecutive filling of the pores before reaching saturation. The desorption branch shows no', 'Integration of Fluorescent Functionality into Pressure Amplifying Metal-Organic Frameworks The flexibility of soft porous crystals, i.e., their ability to respond to external stimuli with structural changes, is one of the most fascinating features of metal-organic frameworks (MOFs). In addition to breathing and swelling phenomena of flexible MOFs, negative gas adsorption (NGA) and pressure amplification (PA) is one of the more recent discoveries in this field, initially observed in the cubic DUT-49 framework. In recent years the structural contraction was monitored by physisorption, X-ray diffraction, NMR and EPR techniques, providing only limited information about the electronic structure of the ligand. In this work we designed a new ligand with a fluorescent core in the linker backbone and synthesized three new MOFs, isoreticular to DUT-49, denoted as DUT-140(M) (M -Cu, Co, Zn) crystalizing in space group Fm 3 m . DUT-140(Cu) can be desolvated and is highly porous with an accessible apparent surface area of 4870 m 2 g -1 and a pore volume of 2.59 cm 3 g -1 . Furthermore, it shows flexibility and NGA upon adsorption of subcritical gases. DUT-140(Zn), synthesized using post-synthetic metal exchange, could only be studied with guests in the pores. In addition to the investigation of the adsorption behavior of DUT-140(Cu) spectroscopic and computational methods were used to study the light absorption properties.', ""In silico investigations of DUT-140The contraction/reopening mechanism responsible for NGA in DUT-49 is related to a deformation of the BBCDC linker, further denoted as ligand buckling. In previous work, a method was developed to allow an investigation of the mechanical properties of ligands, which directly reflect the switchability and the probability of NGA in frameworks isoreticular to DUT-49. This was achieved by calculating stress-strain curves for the single ligand using density functional theory (DFT) methods. Therefore, simulations were performed also for H4FBCDC ligand before synthetic efforts were made.The mechanical properties of the H4FBCDC were determined by simulated compression of the linker at the carbazole nitrogen's (orange arrows, Figure ) using the accurate tight-binding quantum chemical method, GFN2_xtb. From these calculations stress applied to the linker can be determined and the mechanical stability in addition to the response of network induced pressure can be explored as shown for H4BBCDC (blue) and H4FBCDC (orange) in Figure . Initially increasing the compressive strain to both linkers results in an elastic response up to a certain point, defining the maximal stress. After reaching this point, the linker itself starts to buckle (Figure ). This step in the stress strain curve is a common feature of all ligands, used for the synthesis of NGA materials. As derived from the graph in Figure the maximum stress for each linker is reached at approximately 0.014 compressive strain. The H4FBCDC ligand""]","['Metal organic frameworks', 'Catalytic applications']",1348,0.833333333,1,0,0.94158677,0,['why']
"where Ep > 100 mV, the intercept of the Ep vs. log () plot and the determined  value yields the standard ET rate (k 0 ).  The cyclic voltammograms of EtnFc attached to the N3C16SD-C12SD and N3C16SD-C16SD modified Au electrodes are obtained with varying scan rates (Fig. ). The  values obtained from the slope of the Ep vs. ln () plot of N3C16SD-C12SD (Fig. ) and N3C16SD-C16SD (Fig. ) are 0.45 and 0.64, respectively. These calculated  values along with the intercepts from the Ep vs. log () (Fig. and) yields standard rate of ET (k 0 ) of 10.9 s -1 and 9.2 s -1 , for N3C16SD-C12SD and N3C16SD-C16SD modified Au electrode, respectively. Note that, there is no H/D exchange happens in the case of N3C16SD-C12SD and N3C16SD-C16SD SAM during the entire timescale of experiments (Fig. and). A comparison of the apparent rate constant (kapp) and standard ET rate (k 0 ) from the Au electrode to the EtnFc bound to different protonated and deuterated mixed self-assembled monolayers is presented (Table ). The KIE obtained from the standard ET rate (k 0 ) is found to be 1. SAM shows an inverse KIE (Fig. ). The ET rate determined in both potential step chronoamperometry and Laviron's treatment shows that the deuterated SAM have a higher rate of ET than the corresponding protonated one which in contrast to the other constructs. The KIE determined from the ET rates obtained from Laviron's formalism (zero overpotential) and from chronoamperometry at lowest overpotential applied, are very close to each other (Table ). Overall both kapp (CA) and k 0 (Laviron's methods) established a substantial",Causal,Why do the deuterated self-assembled monolayers have a higher rate of electron transfer than the corresponding protonated ones?,Answer not available from the given context. ,Negative,"['The ET rate determined in both potential step ', ""chronoamperometry and Laviron's treatment shows that the deuterated SAM have a higher rate of ET than the corresponding protonated one which in contrast to the other constructs.""]","[[1112, 1335], [1112, 1335]]","[""relative to water. Kinetic isotope effect (KIE) for this construct is found to be 1.79 in aqueous medium and 2.02 for the same in organic medium.  K app =1030 s -1 K app =575 s -1 K app =16.75 s -1 K app =34 s -1K app =53.5 s -1 K app =32 s -1 K app =6.35 s -1 K app =19.5 s -1C16SH/D) modified Au electrode. The cyclic voltammograms of EtnFc attached on the N3C16SH-C12SH and N3C16SH-C16SH SAMs modified Au electrode are measured at 1 Vps scan rate in pH 7 phosphate buffer at room temperature (Fig. ). A reversible CV is obtained in all these cases. The potential of the Fc/Fc + varies slightly with the chain length of the thiol due to changes in the micro solvation environment of the Fc + . The separation between the anodic (Ea) and cathodic processes (Ec) indicates different tunneling rates across thiols of different chain length. These rates of ET are determined using both chronoamperometry as well as using Laviron's treatment. These two SAMs reveal the same time scale of charging current decay (Fig. ) as the N3C11SH-C8SH SAM but their faradaic current decays completely at 250 ms and 500 ms for N3C16SH-C12SH and N3C16SH-C16SH respectively (Fig. ). In comparison to the protonated variants the deuterated SAM shows a complete decay of faradaic current at 300ms and 100 ms for N3C16SD-C12SD and N3C16SD-C16SD respectively (Fig. ) and corresponding charging current decays have been shown in Fig. . The apparent ET rate, kapp from the modified Au electrode to the bound EtnFc moiety is determined from the slope of the Ln(i) vs. time plot and is found to be 53.5 s -1 for N3C16SH-C12SH SAM which upon deuteration decreases to 32 s -1 . (Fig. <ref"", '61 for EtnFc attached to N3C16SH/D-C12SH/D modified Au electrode. Interestingly in the case of N3C16SH/D-C16SH/D mixed SAM an inverse KIE is detected with a value of 0.25. To further confirm the fact that tunneling is faster in y = -53.773x + 352.24 R²deuterated SAM, H/D exchange is performed in-situ (Fig.S7).With increasing, the time of incubation of the EtnFc bound deuterated SAM in H2O, the \uf044Ep value increases indicating a decrease in ET rate upon deuterium exchange with proton. Note that, any defect in the SAM upon incubation would have made the ET faster not slower. The KIE for the ET from the modified Au electrode to the EtnFc moiety attached to it is also calculated from the respective kapp values for these two different mixed SAMs. The KIE value is found to be dependent on the applied overpotential and in contrast to the N3C11SH/D-C8SH/D mixed SAM, the N3C16SH/D-C12SH/D mixed SAM, show opposite trends in change of KIE with overpotential. (Fig.S11) With increasing overpotential, the KIE gets more prominent with lowest KIE value obtained at lowest overpotential. Table 1 :1Comparison of kapp and k 0 of ET for EtnFc bound different mixed self-assembled monolayers on Au with both in protonated (blue) and deuterated (red) version. Reported values of the same (whenever applicable) mentioned in {} with italics style. the N3C11SH/D-C8SH/D and N3C16SH/D-C12SH/D SAM exhibit normal isotope effects on kET, N3C16SH/D-C16SH/D Fig 5 :5Fig 5: Tafel plot for (A)N3C11SH-C8SH (B) N3C16SH-C12SH and (C) N3C16SH-C16SH SAM-modified Au electrodes. The corresponding rates are calculated using chronoamperometric techniques.', 'ResultsCyclic voltammograms of EtnFc attached on the N3C11SH-C8SH self-assembled monolayers (SAMs) modified Au electrode shows an E1/2 at 300 mV at 1 Vps scan rate in pH 7 phosphate buffer at room temperature (Fig. ). The ET rate from the Au electrode to the covalently bound EtnFc across the SAM has been determined using chronoamperometry. Chronoamperometry is a very useful tool for the determination of apparent ET rate (kapp) from an electrode to a redox active species bound to various SAMs modified electrode. In CA experiments, the faradaic current decays according to the following exponential relationship. i = kapp Q exp (-kappt) ………………………………….. (1)  where Q denotes the amount of charge passed during this redox transformation. The CA current decay comprises two types of processes, one for the overall capacitive current decay and the other is due to the faradaic current decay of the attached redox active moiety. The charging current decays very much faster than the faradaic current. This helps to determine the kapp of ET from the electrode to the attached redox active species by simply choosing the appropriate time scale of decay. The plot of Ln(i) vs. time is linear and its slope yields the value of kapp. Chronoamperograms of N3C11SH-C8SH SAM-modified Au electrodes demonstrate a complete decay of charging currents within 0.2 ms time scale (Fig. ) whereas the faradaic currents decay completely at 7.5 ms when EtnFc covalently bound to it (Fig. ). The ET rate from the modified Au electrode to the EtnFc in pH 7 phosphate buffer is determined from the slope of the corresponding semilogarithmic plot of Ln(i) vs. time and is found to be 1030 s -1 which reduced to 575 s -1 when EtnFc bound N3C11SD-C8SD', ""to be 53.5 s -1 for N3C16SH-C12SH SAM which upon deuteration decreases to 32 s -1 . (Fig. & 2B) In case of N3C16SH-C16SH SAM, a kapp value of 7.5 s -1 is determined from the slope but surprisingly upon deuteration the apparent ET rate, kapp increases to 19.5 s -1 . (Fig. & 2D) These values of kapp for protonated variants are in close agreement with the previous reports on the systems. (Table ) The kapp of ET from the N3C11SH-C10SH is estimated to be 540 s -1 .(Fig. , Table ) Thus, the kapp reduces from 1030 s -1 to 540 s -1 and 7.5 s -1 as the chain length is increased from C8SH to C10SH and C16SH reproducing previous data on similar systems. The kET shows a normal H/D isotope effect in the case of N3C11SH-C8SH/N3C16SH-C12SH but is inverse in the case of N3C16SH-C16SH.The heterogeneous ET rate constant at zero overpotential (the standard rate constant, k 0 ) from the electrode to a redox active species either chemically bound or adsorbed onto it can also be determined by Laviron's approach. This method is mainly based on Butler-Volmer approach with the separation between cathodic and anodic peak potential (\uf044Ep) at different scan rates (\uf06e) as the only experimental requirement. Transfer coefficient (\uf061) is an important parameter used in this approach which indicates the symmetry of the energy barrier during the redox process. The value of \uf061 is 0.5 for the ideal case but may vary from 0.5. Transfer coefficient \uf061 can be determined from the slope of the plot of cathodic (Epc) and anodic (Epa) peak potential vs. ln (\uf06e). At higher scan rates where \uf044Ep > 100 mV, the intercept of the \uf044Ep vs. log (\uf06e) plot and the determined \uf061 value yields"", ""Modified electrodes with EtnFc clicked on N3C11SH/D-C8SH/D and N3C11SH-C10SH SAM show a high rate of ET and the prerequisite for applying Laviron's approach (\uf044Ep > 100 is only observed for the very high scan rates. Alternatively, EtnFc bound N3C16SH/D-C12SD and N3C16SH/D-C16SH/D modified Au electrodes show much larger \uf044Ep at slow scan rates and are amenable to Laviron's treatment. The scan rate dependent cyclic voltammograms of EtnFc bound to N3C16SH-C12SH and N3C16SH-C16SH SAM-modified Au electrodes are done in pH 7 phosphate buffer (Fig.S9). Using the slope of the Ep vs. ln (\uf06e) plot, the value of \uf061 has been calculated as 0.49 and 0.50 for N3C16SH-C12SH and N3C16SH-C16SH modified Au electrodes (Fig.3A and C), respectively. The difference in cathodic and anodic peak potential (\uf044Ep) for the N3C16SH-C12SH and N3C16SH-C16SH modified Au electrodes, against log (\uf06e) is linear. (Fig.3B and D) With the intercept and the \uf061\uf02c the value of k 0 estimated to be 17.62 s -1 and 2.30 s -1 , for N3C16SH-C12SH and N3C16SH-C16SH modified Au electrodes, respectively. Fig 3 :3Fig 3: Peak potential (Ep) vs. ln (\uf06e) plot for EtnFc attached to the (A) N3C16SH-C12SH SAM and (C)N3C16SH-C16SH SAM modified Au electrode. B and D represent corresponding \uf044Ep vs. log (\uf06e) plot for the same respectively. Fig 4 :4Fig 4: Peak potential (Ep) vs. ln (\uf06e) plot for EtnFc attached to the deuterated N3C16SD-C12SD mixed self-assembled monolayer(A) and N3C16SD-C16SD mixed self-assembled monolayer (C). B and D represent corresponding \uf044Ep vs. log (\uf06e) plot for the same respectively.""]","['Quantum and theoretical chemistry', 'Quantum effects']",2890,1,1,0,0.721612169,1.220263236,['why']
"that the Hamiltonian for the standard EOM-CC is the similarity transformed Hamiltonian H. The advantage of the standard, single-reference EOM-CC compared to the general case described in the previous section is that it satisfies the killer condition by construction and that the secular equation of Eq. ( ) becomes an eigenvalue problemM r k = ω k0 r k . (17)Because H is non-Hermitian, its left eigenstates are not Hermitian conjugates of its right eigenstates, and need to be found by solving the left eigenproblem (this additional step is required for computing properties within the EOM framework).The quality of EOM-CC results depends on the quality of the ground-state CC wavefunction. Because the CC equations are derived by projection technique, E CC is not a variational bound to the exact ground-state energy and can diverge in the strongly correlated regime, when the single Slater determinant is not a good approximation to the exact ground state.Variational formulation of the CC theory solves this problem , but is impractical on classical computers because the resulting equations do not truncate. Therefore, it is tempting to consider variational implementation of the CC theory on a quantum device, expecting efficient state preparation, but this is even more challenging because the exponential ansatz of the CC theory is non-unitary.There exist a unitary version of the coupled-cluster theory, UCC 62|Ψ 0 ⟩ = |Φ U CC ⟩ = e T -T † |Φ 0 ⟩ = e σ|Φ 0 ⟩, (18)where T is the cluster operator of Eq. ( ) and T † is a particle-hole de-excitation operator with respect to |Φ 0 ⟩. This ansatz",Causal,"Why does the standard, single-reference EOM-CC method satisfy the killer condition by construction?",Answer not available from the given context. ,Negative,"['The advantage of the standard, single-reference EOM-CC compared to the general case described in the previous section is that it satisfies the killer condition by construction and that the secular equation of Eq. ( ) becomes an eigenvalue problem.']","[[0, 354]]","['transformation conserves the eigenspectrum of the original Hamiltonian Ĥ.Solving Eqs. ( ) is tractable because the infinite Taylor series generated by the exponential ansatz truncate naturally due to the Slater rules (when bra and ket determinants differ by more than double excitations).The EOM-CC ansatz is built on the ground-state CC theory to describe excited states |Ψ k ⟩ = Rk |Ψ CC ⟩ = Rk e T |Φ 0 ⟩,(13)where Rk denotes the projection operator that generates the k th excited state from the ground-state CC wavefunction. In the single-reference EOM-CC theory, Rk consists only of particle-hole excitations manifold with respect to |Φ 0 ⟩. Explicitly,Rk = R 1 k + • • • + R N k , Rµ k = 1 (µ!) 2 i 1 •••iµ a 1 •••aµ (r a 1 •••aµ i 1 •••iµ ) k â † a 1 âi 1 • • • â † aµ âiµ . (14)This choice of the operators means that R and T commute, leading to the eigenvalue problem for the similarity transformed Hamiltonian H.H Rk |Φ 0 ⟩ = E k Rk |Φ 0 ⟩.(15)Eq. ( ) means that the k th excitation energy can be obtained by the commutator of Eq.(2) acting on |Φ 0 ⟩ (and not |Ψ 0 ⟩)[ H, Rk ]|Φ 0 ⟩ = ω k0 Rk |Φ 0 ⟩. (16)Note that the Hamiltonian for the standard EOM-CC is the similarity', 'B. Choice of the ground-state ansatz: CC versus UCCThe CC theory is designed to compute many-body wavefunctions, typically for the ground state. The standard CC theory represents the many-body wavefunction as an exponential ansatz acting on the reference Slater determinant|Φ 0 ⟩ |Ψ 0 ⟩ = |Ψ CC ⟩ = e T |Φ 0 ⟩, T = T1 + • • • + TN ,(10)where Tµ represents a µ-fold particle-hole excitation operators (the cluster operator) for N electron system (the subscript denotes the number of particle-hole pairs to be created in|Φ 0 ⟩). Explicitly, Tµ = 1 (µ!) 2 i 1 •••iµ a 1 •••aµ t a 1 •••aµ i 1 •••iµ â † a 1 âi 1 • • • â † aµ âiµ ,(11)where the i 1 • • • i µ and a 1 • • • a µ are occupied and unoccupied spin-orbital indices in |Φ 0 ⟩.In practice, the cluster operator is truncated at a particular level yielding a specific model such as CCSD, CCSDT, etc. The main advantage of the exponential ansatz over linear parameterization (such as in CI) is that the truncated CC theory is size extensive.In the standard CC theory, one solves the equations derived by projecting the Schrödinger equation on the manifold of the excited Slater determinants:⟨Φ 0 | H|Φ 0 ⟩ = E CC , ⟨Φ ab••• ij••• | H -E CC |Φ 0 ⟩ = 0,(12)which amounts to satisfying the the Schrödinger equation in the subspace of the full Hilbert space. Here H ≡ e -T Ĥe T is the similarity transformed Hamiltonian (non-Hermitian) and E CC is the CC energy (typically, the ground-state energy). Note that the similarity transformation conserves the eigenspectrum of the original Hamiltonian Ĥ.Solving Eqs. ( <ref', 'ansatz . UCC framework is Hermitian, provides an upper bound for the energy, and is size extensive by construction.However, the price paid for the variational bound is that the originally proposed qEOM ansatz does not satisfy the killer condition that ensures the ground-state cannot be de-excited. Mukherjee and co-workers proposed a unitary transformation of the EOM projection operators to address the killer condition issue of the UCC theory . Asthana et al. have implemented this technique on quantum devices. The algorithm, named EOM-VQE , yields more accurate excitation energies (EEs), ionization potentials (IPs), and electron affinities (EAs) than originally proposed qEOM .The qEOM procedure leverages classical and quantum computing resources. Specifically, the Hamiltonian matrix is measured on a quantum computer within a given many-electron basis, and the resulting matrix is subsequently diagonalized on a classical computer. Although the measurement processes of the Hamiltonian can potentially benefit from quantum architecture, for the entire calculation to be effective, one also needs a cost-efficient algorithm for the diagonalization step done on a classical computer. In classical electronic structure calculations, the diagonalization is accomplished through iterative determination of only a few eigenvalues using the Davidson algorithm <ref', 'and T † is a particle-hole de-excitation operator with respect to |Φ 0 ⟩. This ansatz satisfies the condition of unitary operator,U † = U -1 , giving rise to U U † = 1 (e σ) † = (e T -T † ) † = e T † - T = e -σ = (e σ) -1 . (19)With the unitary ansatz, the energy of UCC (E U CC ) is an upper bound of the exact groundstate energy. The UCC theory results in the Hermitian effective Hamiltonian e -σ Ĥe σ ≡ H.(By using tilde instead of a bar, we distinguish the UCC effective Hamiltonian H from the non-Hermitian H of the standard CC theory). The UCC formalism is Hermitian, variational, and size-extensive, however, unlike H, the Baker-Campbell-Hausdorff series of H does not terminate naturally making it unfeasible for classical computers. To overcome this problem, several approximations to the UCC ansatz have been developed .Alternatively, the classically untractable UCC equations can be efficiently implemented on quantum devices because Ĥe σ|Φ 0 ⟩ can be transformed into a polynomial number of terms that act on the initial qubit state through Trotterization 66,67 and Jordan-Wigner transformation , which can be simulated in polynomial time 69 on quantum devices.Following earlier work , we use UCC as the ground-state ansatz on top of which we build the EOM ansatz, giving rise to EOM-UCC. Specifically, we derive and utilize the effective Hamiltonian presented in Ref. 32 to develop the excited-state algorithms for quantum solvers.The unitary operator σ and the projection operator Ôk ({ Êµ } or { Êµ } ∪ { Ê † µ }) do not commute. Therefore, EOM-UCC does not satisfy the', 'C. Solving qEOM-UCCSD on quantum computers using a Davidson-like procedureSimilar to the classical electronic-structure calculations, the quantum version of EOM (qEOM) protocol computes ground state before solving the EOM problem by using variational quantum eigensolver (VQE) with the choice of an appropriate ansatz, such as unitary coupled-cluster (UCC) and Hardware-efficient ansatz . As discussed in the previous section, we use the UCC ansatz with singles and doubles (qEOM-UCCSD)T = T1 + T2 = ia θ a i a † a a i + 1 4 ijab θ ab ij a † a a i a † b a j ,(23)where {θ} represents the set of variational parameters (same as the cluster amplitudes {t} in classical simulations). The ground-state wavefunction in Eqs. ( ) -( ) is replaced with the VQE-UCCSD ground-state wavefunction. The ground-state VQE minimizes the expectation value of the Hamiltonian with respect to the variational parameters{θ a i , θ ab ij } E 0 (θ a i , θ ab ij ) = min θ a i ,θ ab ij ⟨Ψ V QE (θ a i , θ ab ij )| Ĥ|Ψ V QE (θ a i , θ ab ij )⟩.(24)In order to compute electronic excitation energies on quantum devices, the qEOM ansatz is applied to the ground-state VQE wavefunction (ground-state VQE circuit with optimized parameters). qEOM measures the matrix elements of H of Eq. ( ) on a quantum device and then solves the eigenvalue problem of Eq. ( <ref type=""formula""']","['Quantum and theoretical chemistry', 'Quantum computing']",3401,1,1,0,0.831062371,1.698974299,"['why', 'single-reference']"
"and the bulk-like interior regions of the slab. Supposing that the two regions were to afford very different VIEs, it is conceivable that averaging over the entire slab simulation might mask differences between bulk and interfacial Fig. : VIE distributions for I -(aq) and SCN -(aq), partitioned into bulk and interfacial contributions according to distance of the ion from the GDS. Also shown are results from an isotropic simulation representing ""true bulk"". Strong similarities between bulk and interfacial VIE distributions suggest that similar VIEs reported in Table are not simply artifacts of averaging over a slab that contains both interfacial and bulk-like regions.VIEs, pushing the mean value closer to that obtained in the isotropic simulation.To account for this possibility, we performed much longer (1 ns) simulations for I -(aq) and SCN -(aq), so that we can carefully dissect the averaging based on the position of the ion relative to the GDS. In what follows, we partition the periodic slab simulation data into an ""interfacial part"" and a ""bulk part"", with the former defined to be those snapshots where the ion resides within a specified distance of the GDS. The VIE distribution can then be partitioned into interfacial and bulk contributions, and we will examine the sensitivity of this partition to the distance cutoff that is used to define the interfacial region.Figure presents the partitioned VIE distributions for both I -(aq) and SCN -(aq), obtained from 200 snapshots each separated in time by 5 ps. This is much better averaging than what is reported in Table , and is necessary in order to obtain good statistics for cases where the interfacial region is defined narrowly, e.g., GDS -1 Å. We also consider partitions in which GDS -3 Å and also GDS -5 Å is used to separate the bulk and interfacial regions.",Causal,Why might averaging over the entire slab simulation mask differences between bulk and interfacial VIE distributions?,Answer not available from the given context. ,Negative,"['Supposing that the two regions were to afford very different VIEs, it is conceivable that averaging over the entire slab simulation might mask differences between bulk and interfacial ', 'Fig. : VIE distributions for I -(aq) and SCN -(aq), partitioned into bulk and interfacial contributions according to distance of the ion from the GDS. ', 'Also shown are results from an isotropic simulation representing ""true bulk"". ', 'Strong similarities between bulk and interfacial VIE distributions suggest that similar VIEs reported in Table are not simply artifacts of averaging over a slab that contains both interfacial and bulk-like regions.']","[[48, 382], [48, 382], [383, 460], [461, 675]]","['in which GDS -3 Å and also GDS -5 Å is used to separate the bulk and interfacial regions. Results from an isotropic simulation in a cubic unit cell serve as a fixed point of reference for bulk aqueous solution, and in every case the peak position from the isotropic simulation matches exactly with the bulk-like part of the periodic slab data. For SCN -(aq), the peak of the VIE distribution is also exactly the same when the data are restricted to the interfacial region, no matter how narrowly defined, whereas for I -(aq) the interfacial VIE peak is shifted to 0.2 eV lower in energy in the interfacial region, for each of the three aforementioned definitions of the interfacial layer. That shift, however, is smaller than the width of either the bulk or the interfacial VIE distribution. We therefore conclude that interfacial VIE distributions are essentially indistinguishable from their bulk counterparts, for both I -(aq) and SCN -(aq).C. Analysis of Short-Range Structure. We have documented that two solvation shells of explicit water molecules is enough to provide converged VIEs when appropriate boundary conditions are employed, and that VIEs computed for anions at the air/water interface differ from their bulk counterparts (if at all) by a shift that is comparable to (or smaller than) the inhomogeneous broadening of the VIE distribution. This implies that any shift in the VIE for X -(aq) between the bulk and interfacial environments is hardly distinguishable from thermal fluctuations. Taken together with the rapid convergence of the VIE with respect to explicit water, this would seem to suggest that the short-range ion-water hydrogen bonding around X -(aq) might not be that different at the air/water interface as compared to the bulk aqueous environment. That hypothesis is explored in this section, by examining various structural parameters extracted from the MD simulations.Figure shows the time evolution of', ""data from Fig. are replotted as twodimensional scatter plots, comparing the distributions of d GDS and the VIE (Fig. ), as well as n HB versus VIE (Fig. ). In the former case, there is a cluster of data near d GDS = 0, consistent with the surface propensity of I -(aq), however the corresponding VIEs are spread over a range that is not dissimilar from the spread of the entire data set. This is consistent with the similarity between bulk and interfacial VIE distributions that was documented in Fig. . It is difficult to see any correlations at all in the n HB versus VIE data. While transient fluctuations in the hydrogen-bond network are no doubt the origin of the inhomogeneous broadening of the VIE distribution, it is not so simple as saying that fewer hydrogen bonds to the ion implies a larger or smaller VIE, especially with a metric that discretizes the ion's hydra- tion shell into an integer number of hydrogen bonds.In previous MD simulations of halide ions A -(aq) at the air/water interface, Jungwirth and Tobias reported that the larger halides exhibit distinctive differences in terms of how their ion-water hydrogen bonds are oriented with respect to the surface normal, when compared to the same ions in bulk water. In that work, orientation with respect to the surface normal vector r ⊥ was measured in terms of the angle it makes with r XO , examiningcos Θ AO⊥ = r AO • r ⊥ r AO • r ⊥ .We have analyzed our I -(aq) and SCN -(aq) simulations in the same way, examining the distribution of cos( ΘAO⊥ ), where ΘAO⊥ denotes the average value of Θ AO⊥ considering each of the n HB anion-oxygen vectors r AO around the ion. (For SCN -, we take A = N.) Distributions of cos( ΘAO⊥ ) are plotted in Fig. ,"", 'and theoretical VIEs is complicated by the fact that the experiments may sample both bulk and interfacial ions, and the periodic slab calculations definitely sample both environments. Values reported in Table represent averages over the entire simulation cell, and certain ions (such as NO - 3 ) move readily between the bulk-like interior of the slab and the air/water interface. As such, it is not obvious which (if any) of the theoretical values should be compared directly to experiment, for a given ion, although this ambiguity is largely mitigated by the close agreement between isotropic and slab VIEs. Agreement with experiment is comparable to the best available periodic DFT calculations, which reported a mean absolute error of 0.1 eV using range-separated hybrid functionals. The present calculations, however, are free of issues related to the use of periodic electronic structure for ionization or redox processes. Having validated the accuracy of our computational protocol with respect to experimental data, we next turn to the most interesting aspect of the calculations, namely, the similarity between VIEs computed for isotropic versus slab simulations, for the same ion. These differences are < 0.3 eV for each of the ions in our data set, and often much smaller. For I -(aq) and SCN -(aq), both of which exhibit significant surface propensity, <ref type=""bibr""', 'of surface-active ions. VSFG experiments demonstrate that both ions have significant effects on the O-H stretching band of water. Halides ions were considered extensively in the very earliest studies of interfacial ion partitioning, 1,7 but SCN -(aq) at the air/water interface has also been considered in numerous studies. The latter ion has also been considered in the context of Hofmeister ""salting-out"" effects on proteins. For I -(aq), our DFT/PEqS calculations afford a VIE of 8.07 ± 0.28 eV in bulk simulations where there is no interface, as compared to 8.14±0.31 eV using snapshots extracted from the periodic slab calculations. (Uncertainties represent one standard deviation and characterize inhomogeneous broadening.) Both values are consistent with the experimental VIE, 7.93 eV. In case of SCN -(aq), bulk and slab simulations afford VIEs of 8.28 ± 0.27 eV and 8.44±0.29 eV, respectively, as compared to an experimental VIE of 8.17 eV. For both ions, the difference in the average VIE in the bulk versus the slab simulation is less than the half-width of the VIE distribution obtained upon thermal sampling.That said, interfacial VIEs reported in Table represent averages over the entire periodic slab, and both I -(aq) and SCN -(aq) visit both the interfacial and the bulk-like interior regions of the slab. Supposing that the two regions were to afford very', ""exhibit significant surface propensity, the difference between isotropic and slab VIEs is 0.1 eV and 0.2 eV, respectively. Note that for I -(aq), experimental VIEs are reported corresponding to either of two different spin-orbit states of the ionized species. Calculations reported here do not include spin-orbit coupling so we use [VIE( 2 P 1/2 ) + 2 VIE( 2 P 3/2 )]/3 as an estimate of the spinorbit-free experimental VIE. Convergence tests in Fig. suggest that two solvation shells of explicit water molecules, with nonequilibrium Poisson boundary conditions, is sufficient to afford converged VIEs, even for multiply-charged anions. This observation strongly suggests that the electronic structure of these aqueous ions depends only on short-range interactions. The similarity between VIEs computed in isotropic versus slab simulations suggests, in turn, that the short-range ion-water interactions might be very similar in both environments. This hypothesis is investigated in Section 3 C. Before that, we dissect the matter of bulk versus interfacial VIEs in more detail by considering the full ensemble distribution of VIEs, for two different anions that exhibit surface propensities: I -(aq) and SCN -(aq).B. Bulk Versus Interfacial VIEs. We next consider how an ion's position relative to the interface impacts its VIE, focusing specifically on I -(aq) and SCN -(aq). Both ions exhibit significant surface propensity and have become canonical examples of surface-active ions. VSFG experiments demonstrate that""]","['Quantum and theoretical chemistry', 'Theoretical methods']",2718,1,1,0,0.954526864,1.11E-16,['why']
"is not just protein-protein interactions that determine structure, but also interactions with the water model. In particular, the balance between electrostatic and dispersive interactions has been shown to be crucial. Interactions between the QUBE force field and the TIP3P water model may be responsible for some of the instabilities in structure that we have observed, and development of a QUBE water model may lead to improved dynamics and computed free energies of hydration. An advantage of using a parametrization scheme that depends almost entirely on QM data is that alterations to the parametrization strategy or functional form can be readily inserted into the existing workflow. There is future scope for improvement in the choice of exchange-correlation functional used to derive non-bonded parameters, for example through the use of hybrid functionals, or the choice of electron density partitioning methods, 66 or the addition of off-center charges to model electron anisotropy effects. More fundamentally, we have the opportunity to investigate improvements to the functional form of the force field itself, for example, by adding higher order dispersion terms beyond the dipole-dipole interaction or by altering the short-range repulsion term. A future QUBE polarizable force field is also envisaged and, towards this goal, the derivation of accurate atoms-in-molecule atomic polarizabilities is under investigation. As presented in the Results section, the general picture that emerges is that this first generation quantum mechanical bespoke force field is an improvement over",Causal,Why might interactions between the QUBE force field and the TIP3P water model be responsible for observed instabilities in structure?,Answer not available from the given context. ,Negative,"['Interactions between the QUBE force field and the TIP3P water model may be responsible for some of the instabilities in structure that we have observed, and development of a QUBE water model may lead to improved dynamics and computed free energies of hydration.']","[[218, 479]]","['Molecular Dynamics SimulationsFigure shows the steps required to set up a QUBE protein force field for a MD simulation. As in Section 2.1, the ONETEP linear-scaling DFT software is used to compute the ground state electron density of the five proteins, and assign the charge and Lennard-Jones parameters from the partitioned atomic electron densities. Consistent with the QUBE small molecule approach, every atom in the protein is assigned bespoke non-bonded parameters derived from the quantum mechanical electron density. To model polarization effects in the condensed phase, the electron density is computed first in vacuum, then using an implicit solvent model with a dielectric constant of 80. The iPol approach used in AMBER ff15ipq is then employed, with all non-bonded parameters set halfway between their vacuum and condensed phase values. The purpose of this approach, as well as overcoming issues associated with closing of the electronic band gap in large system sizes, is to account for electrostatics and induction in the condensed phase in an effective manner using a fixed point charge force field. Typical computational requirements for a QM calculation on a small protein (≈ 1000 atoms) are approximately 2000 cpuhrs. In order to provide a consistent and computationally efficient approach to assigning the non-bonded parameters, we recommend minimizing the experimental structure using a standard transferable force field in explicit water prior to the DFT calculation. In this study, we used the OPLS-AA/M force field for the initial minimization. Following non-bonded parameter assignment, bond, angle and torsion parameters were assigned as described in Section 2 based', 'Development and Validation of the QUBE Protein Force Field Molecular mechanics force field parameters for macromolecules, such as proteins, are traditionally fit to reproduce experimental properties of small molecules, and thus they neglect system-specific polarization. In this paper, we introduce a complete protein force field that is designed to be compatible with the QUantum mechanical BEspoke (QUBE) force field by deriving non-bonded parameters directly from the electron density of the specific protein under study. The main backbone and sidechain protein torsional parameters are re-derived in this work by fitting to quantum mechanical dihedral scans for compatibility with QUBE non-bonded parameters. Software is provided for the preparation of QUBE input files. The accuracy of the new force field, and the derived torsional parameters, are tested by comparing the conformational preferences of a range of peptides and proteins with experimental measurements. Accurate backbone and sidechain conformations are obtained in molecular dynamics simulations of dipeptides, with NMR J coupling errors comparable to the widely-used OPLS force field. In simulations of five folded proteins, the secondary structure is generally retained and the NMR J coupling errors are similar to standard transferable force fields, although some loss of the experimental structure is observed in certain regions of the proteins. With several avenues for further development, the use of system-specific nonbonded force field parameters is a promising approach for next-generation simulations of biological molecules.', 'which would be problematic if the charges show strong conformation dependence. However, Manz and Sholl have demonstrated that DDEC charges are transferable between different conformations of a molecule (as measured by their ability to recreate the QM electrostatic potential), and they conclude that the charges are suitable for the construction of flexible force fields. Furthermore, it should be noted that atoms-in-molecule electron density partitioning lends itself naturally to the derivation of both off-site charges to model electron anisotropy (such as lone pairs and σ-holes) and atomic polarizabilities, though we have not yet investigated a fully polarizable force field.In keeping with our goal of deriving force field parameters directly from QM, rather than fitting to experiment, we have supplemented the atoms-in-molecule non-bonded parameters with harmonic bond and angle parameters derived directly from the QM Hessian matrix. There are a number of methods available for deriving bonded parameters from the QM Hessian matrix, but our recent adaptation of the Seminario method (which we name the modified Seminario method) is conceptually quite straightforward whilst yielding parameters that reproduce QM vibrational frequencies with a mean unsigned error of 49 cm -1 , below that of OPLS (59 cm -1 ). Collectively, we have named these methods the QUantum mechanical BEspoke (QUBE) force field. This name reflects the fact that force field parameters are derived by the user specifically for the small molecule under study, directly from QM calculations. We have released a software toolkit (QUBEKit) that facilitates the derivation of small organic molecule force field parameters, and also', 'emerges is that this first generation quantum mechanical bespoke force field is an improvement over legacy OPLS-AA and OPLS-AA/L force fields, but is out-performed by the most recent OPLS-AA/M force field for simulated dynamics of folded proteins in their native state. While we have previously shown that DDEC charges are not too dependent on small conformation changes, 28 further investigation is needed to establish the utility of QUBE for protein folding simulations.Hence, although we have outlined our roadmap to future improvements, a natural question is: where can the QUBE protein force field be used now (especially given the higher cost of parameterization compared to transferable force fields)? Importantly, it has been shown previously that the use of system-specific force field charges leads to improvements in binding energetics of small molecules, and reproduction of the QM electrostatic potential for both small molecules 27 and proteins. Therefore, although simulated protein backbone dynamics is an important test, we envisage the QUBE small molecule and protein force field being particularly important for the study of intermolecular interactions in the condensed phase.Indeed, QUBE was originally developed to provide, by construction, a compatible protein and small molecule force field for computer-aided drug design, where an accurate surface electrostatic potential of the protein is crucial. In this regard, the absolute binding free energies between the L99A mutant of T4 lysozyme and six benzene analogs have been recently computed using QUBE with a mean unsigned error of 0.85 kcal/mol, which compares very favorably with OPLS-AA/M (1.26 kcal/mol). Although further work is required to establish this accuracy across a significantly wider range of protein-ligand complexes, the promise of these initial biomolecular simulation', 'that facilitates the derivation of small organic molecule force field parameters, and also allows the user to derive the positions of off-site charges to model anisotropic electron density and to fit dihedral parameters to QM torsion scans. QUBE force fields have been derived for 109 small organic molecules, and yield mean unsigned errors of 0.024 g/cm 3 , 0.79 kcal/mol and 1.17 kcal/mol in computed liquid density, heat of vaporization and free energy of hydration. These results are competitive with standard transferable force fields, which have been extensively fit to properties such as these.To achieve our goal of employing the QUBE force field in computer-aided drug design applications, we require a compatible protein force field. Since the non-bonded parametrization strategy employed in QUBE is very different to that used in the standard biomolecular force fields (e.g. AMBER, OPLS, CHARMM), there is no reason to believe that they are compatible. However, by implementing the atoms-in-molecule non-bonded parameter derivation methods in the ONETEP linear-scaling density functional theory (DFT) software, we have shown that it is feasible to derive these charges and Lennard-Jones parameters for entire proteins. In this way, the number of fitting parameters is substantially reduced, and we have a consistent parametrization approach that can be applied to both small and large molecules, including entire biomolecular assemblies. Since, in this approach, all non-bonded parameters are derived from a single QM calculation, both the charge and Lennard-Jones parameters naturally include the native state polarization effects of the environment. Importantly, we have shown that protein charges derived using DDEC electron density partitioning recreate the underlying QM electrostatic potential with high accuracy,']","['Quantum and theoretical chemistry', 'Unclassified']",397,1,1,0,0.907652916,1.11E-16,['why']
"A range of weighting schemes has been previously used, including schemes that prioritize the lowest QM energies 1 or that prioritize regions that have been shown experimentally to be most populated by proteins. 3 Methods",Causal,Why have different weighting schemes been used that prioritize the lowest QM energies or regions most populated by proteins?,Answer not available from the given context. ,Negative,"['A range of weighting schemes has been previously used, including schemes that prioritize the lowest QM energies or that prioritize regions that have been shown experimentally to be most populated by proteins.']","[[0, 210]]","['Discussion and ConclusionThe assumption that biomolecular force fields must be parametrized against the experimental properties of small molecules has persisted since MM simulations began and remains in all force fields under widespread use. In this work, we look to challenge this assumption by deriving system-specific non-bonded parameters, from linear-scaling QM simulations, for consistency with the QUBE small molecule force field. These non-bonded terms were used here alongside libraries of (non-bespoke) bond and angle parameters, derived using the modified Seminario method, and newly reparametrized torsional terms.We have shown here that using system-specific non-bonded force field parameters can result in accurate conformational preferences for short peptides. Rotamer populations and simulated J couplings for the dipeptide molecules are in good agreement with experimental data and compare favorably with the latest OPLS force field. For longer peptide molecules, the problems associated with fitting torsional parameters to a system-specific force field became more apparent. Using regularization in the fitting process was shown to overcome these issues and resulted in a J coupling error of just 0.90 ± 0.03 for the alanine pentapeptide. Further work investigating disordered peptides will ascertain how general this fix is.The accuracy of the peptide simulations supports the use of our non-bonded and modified Seminario bonded parametrization strategies. In protein MD simulations, the RMSD of the backbone atoms relative to experimental structures remained low, below 2 Å, for two of the five proteins tested. The α-helices present in all of the proteins generally remained close to the experimental structures, but the β-sheets exhibited', 'density partitioning recreate the underlying QM electrostatic potential with high accuracy, and that charges derived for a NMR ensemble of BPTI protein structures are not too conformation-dependent (standard deviations per residue less than 0.04 e). This is in contrast to the performance of RESP charges, which have been shown to be significantly more conformation-dependent for an ensemble of polypeptide structures. Additional simulations demonstrated the feasibility and advantages of deriving bespoke parameters for a protein-ligand complex. The computed relative binding free energy of indole and benzofuran to the lysozyme protein using the environment-specific force fields (-0.4 kcal/mol) was in excellent agreement with experiment (-0.6 kcal/mol), and was substantially more accurate than standard force fields (-2.4 kcal/mol). However, the force field was in need of further development as the bespoke non-bonded terms were used in combination with standard OPLS-AA bonded parameters.The use of these parameters potentially limits the accuracy of the force field due to interdependency between the bonded terms, particularly the torsional parameters, and the non-bonded components of the force field. This issue is the subject of the current paper.In standard transferable force fields, the torsional component is typically parameterized using QM dihedral energy scans, with the difference between analogous MM and QM energy scans minimized by fitting the torsional parameters. Reparameterization of the torsional terms has been shown to be a crucial step in improving the accuracy of force fields and this has recently been demonstrated for AMBER ff15ipq, CHARMM36 and OPLS-AA/M. Bond and angle reparameterization has also been shown to be', 'wider range of protein-ligand complexes, the promise of these initial biomolecular simulation results indicate a viable pathway toward improved protein dynamics and interactions using quantum mechanical bespoke force fields.Figure 1 :1Figure 1: An alanine residue showing the atom naming convention for dihedral angles. The main dihedral angles reparameterized are φ(C-N-C α -C), φ (C-N-C α -C β ), ψ (N-C α -C-N) , ψ (C β -C α -C-N), χ 1 (N-C α -C β -X γ ), χ 1 (C-C α -C β -X γ ) and χ 2 (C α -C β -X γ -Y δ ).X γ and Y δ (not shown) are the neighboring heavy atoms in the side chains (if present).', 'Molecular Dynamics SimulationsFigure shows the steps required to set up a QUBE protein force field for a MD simulation. As in Section 2.1, the ONETEP linear-scaling DFT software is used to compute the ground state electron density of the five proteins, and assign the charge and Lennard-Jones parameters from the partitioned atomic electron densities. Consistent with the QUBE small molecule approach, every atom in the protein is assigned bespoke non-bonded parameters derived from the quantum mechanical electron density. To model polarization effects in the condensed phase, the electron density is computed first in vacuum, then using an implicit solvent model with a dielectric constant of 80. The iPol approach used in AMBER ff15ipq is then employed, with all non-bonded parameters set halfway between their vacuum and condensed phase values. The purpose of this approach, as well as overcoming issues associated with closing of the electronic band gap in large system sizes, is to account for electrostatics and induction in the condensed phase in an effective manner using a fixed point charge force field. Typical computational requirements for a QM calculation on a small protein (≈ 1000 atoms) are approximately 2000 cpuhrs. In order to provide a consistent and computationally efficient approach to assigning the non-bonded parameters, we recommend minimizing the experimental structure using a standard transferable force field in explicit water prior to the DFT calculation. In this study, we used the OPLS-AA/M force field for the initial minimization. Following non-bonded parameter assignment, bond, angle and torsion parameters were assigned as described in Section 2 based', 'is not just protein-protein interactions that determine structure, but also interactions with the water model. In particular, the balance between electrostatic and dispersive interactions has been shown to be crucial. Interactions between the QUBE force field and the TIP3P water model may be responsible for some of the instabilities in structure that we have observed, and development of a QUBE water model may lead to improved dynamics and computed free energies of hydration. An advantage of using a parametrization scheme that depends almost entirely on QM data is that alterations to the parametrization strategy or functional form can be readily inserted into the existing workflow. There is future scope for improvement in the choice of exchange-correlation functional used to derive non-bonded parameters, for example through the use of hybrid functionals, or the choice of electron density partitioning methods, 66 or the addition of off-center charges to model electron anisotropy effects. More fundamentally, we have the opportunity to investigate improvements to the functional form of the force field itself, for example, by adding higher order dispersion terms beyond the dipole-dipole interaction or by altering the short-range repulsion term. A future QUBE polarizable force field is also envisaged and, towards this goal, the derivation of accurate atoms-in-molecule atomic polarizabilities is under investigation. As presented in the Results section, the general picture that emerges is that this first generation quantum mechanical bespoke force field is an improvement over']","['Quantum and theoretical chemistry', 'Unclassified']",316,1,1,0,0.966249161,-2.22E-16,['why']
"production capacity of 2,900 of ammonia per day (Figure ) for the low capital cost scenario. For the high capital cost scenario, the optimal production and distribution network results in 92 regional production facilities with an average distribution distance of 1,200 km and an average regional production capacity of 10,500 metric tons of ammonia per day.A high discount rate, here considered to be 10%, results in an average ammonia cost of 680 USD/t N H 3 for the low capital cost scenario and 1,230 USD/t N H 3 for the high capital cost scenario (Figure ). The optimal ammonia production and distribution network consists of 241 regional production facilities (Figure ) with an average distribution distance of 660 km (Figure ) and an average regional production capacity of 4,000 metric tons of ammonia per day (Figure ) for the low capital cost scenario. For the high capital cost scenario, the optimal production and distribution network results in 75 regional production facilities with an average distribution distance of 1,400 km and an average regional production capacity of 13,000 metric tons of ammonia per day. Therefore, the selected discount rate is an important parameter in shaping strategies for decarbonizing and decentralizing ammonia production. On that account, it is essential for governments and entities to provide funding programs for building renewable ammonia production infrastructure. These funding opportunities, having lower discount rates, would allow for lower ammonia costs, distribution distances, and a more decentralized and resilient production and distribution network for wind and photovoltaic electricity-driven ammonia production systems. These conclusions serve as crucial insights for decisionmakers in the landscape of renewable energy-driven ammonia production.",Causal,Why is the selected discount rate considered an important parameter in shaping strategies for decarbonizing and decentralizing ammonia production?,Answer not available from the given context. ,Negative,"['A high discount rate, here considered to be 10%, results in an average ammonia cost of 680 USD/t N H 3 for the low capital cost scenario and 1,230 USD/t N H 3 for the high capital cost scenario. ', 'Therefore, the selected discount rate is an important parameter in shaping strategies for decarbonizing and decentralizing ammonia production.']","[[357, 561], [1127, 1269]]","[""ammonia production system are the system's energy efficiency, discount rate, electrolyzer economic parameters, and wind economic parameters. As the energy efficiency of a technology increases, the capacity for the system to operate in a decentralized manner increases. For example, low-efficiency 'Black Box' systems have an optimal production network with 124 regional production locations with a low capital cost scenario to 32 regional production locations with a high capital cost scenario. In this case, the average production cost for an optimized production and distribution network is between 1,000 USD/t N H 3 with a low capital cost scenario and 1,800 USD/t N H 3 with a high capital cost scenario (Figure ), the average transportation cost is between 90 USD/t N H 3 with a low capital cost scenario and 230 USD/t N H 3 with a high capital cost scenario (Figure ), and average transportation distance is between 1,000 km with a low capital cost scenario and 2,500 km with a high capital cost scenario (Figure ). A technology that may operate under these conditions is a nitrogen electrolysis cell. Considering the low performance and non-ideal centralized network, there are few gains from such a system.Medium-efficiency 'Black Box' systems have an optimal production network with 329 regional production locations with a low capital cost scenario to 92 regional production locations with a high capital cost scenario. This network size mirrors that of the Haber-Bosch process in terms of the degree of centralization. Here, the average production cost for an optimized production and distribution network is between 560 USD/t N H 3 with a low capital cost scenario and 1,000 USD/t N H 3 with a high capital cost scenario (Figure ), the average transportation cost is"", 'funding typically resulting in lower discount rates compared to private funding. Higher discount rates lead to higher ammonia costs, longer distribution distances, larger regional production capacities, and a lower number of production regions. Conversely, lower discount rates result in lower ammonia costs, shorter distribution distances, smaller regional production capacities, and a higher number of production regions. For instance, a low discount rate of 3% results in ammonia costs between 540 USD/t N H 3 and 950 USD/t N H 3 and distribution distances between 510 km and 1,020 km, while a high discount rate of 10% results in ammonia costs between 680 USD/t N H 3 and 1,230 USD/t N H 3 and distribution distances between 660 km and 1,400 km. To facilitate the transition towards renewable and decentralized ammonia production, it is crucial for governments and entities to offer funding programs with lower discount rates.We also address the complex interaction between the emerging wind and photovoltaic electricity-driven ammonia production industry and existing water infrastructure. Our results show that it is possible to create wind and photovoltaic electricity-driven ammonia production infrastructure to meet global fertilizer demand while maintaining competitive costs and low water stress. When prioritizing water over cost, it is possible to reduce the average water stress by 99% with only a 1.4% increase in ammonia costs.Our results highlight the benefits of a decarbonized and decentralized ammonia supply chain by showing that the decentralization of wind and photovoltaic electricity-driven ammonia production leads to reduced levels of price sensitivity. With the price of agricultural commodities rising rapidly, the current system of ammonia production places unnecessary strain on global food security due to its susceptibility to volatility in energy prices. The ammonia produced by the Haber-Bosch process is', 'effect, increasing the present value of future cash flows, leading to more decentralized systems that have higher capital costs but lower operating costs. An analysis of three capital cost scenarios evaluates the effect of the discount rate on the average ammonia cost, average distribution distance, optimal number of production regions, and average regional production capacity. Higher discount rates lead to higher ammonia costs, higher distribution distances, higher average regional capacity, and a lower number of production regions.A low discount rate, here considered to be 3%, results in an average ammonia cost of 540 USD/t N H 3 for the low capital cost scenario and 950 USD/t N H 3 for the high capital cost scenario (Figure ). The optimal ammonia production and distribution network consists of 1,015 regional production facilities (Figure ) with an average distribution distance of 510 km (Figure ) and an average regional production capacity of 950 metric tons of ammonia per day (Figure ) for the low capital cost scenario. For the high capital cost scenario, the optimal production and distribution network results in 127 regional production facilities with an average distribution distance of 1,020 km and an average regional production capacity of 7,600 tons of ammonia per day.A medium discount rate, here considered to be 7%, results in an average ammonia cost of 620 USD/t N H 3 for the low capital cost scenario and 1,100 USD/t N H 3 for the high capital cost scenario (Figure ). The optimal ammonia production and distribution network consists of 329 regional production facilities (Figure ) with an average distribution distance of 600 km (Figure ) and an average regional production capacity of 2,900 of ammonia per day (Figure ) for the low', ""scenario (Figure ), the average transportation cost is between 55 USD/t N H 3 with a low capital cost scenario and 110 USD/t N H 3 with a high capital cost scenario (Figure ), and average transportation distance is between 600 km with a low capital cost scenario and 1,200 km with a high capital cost scenario (Figure ). While 92 to 329 facilities are still centralized, the ability to distribute these facilities across the globe, rather than clustering the facil-ities, reduces the distance between manufacturing locations and farms by nearly three times when compared to current Haber-Bosch facilities, which has a minimum distance between Haber-Bosch locations and farms of 1,250 km. This would aid in increasing access, and would potentially reduce safety issues. An emerging technology that may be able to operate at these energy efficiencies is lithium-mediated electrochemical nitrogen reduction. High-efficiency 'Black Box' systems have an optimal production network with 795 regional production locations with a low capital cost scenario to 164 regional production locations with a high capital cost scenario. Here, the average production cost for an optimized production and distribution network is between 410 USD/t N H 3 with a low capital cost scenario and 710 USD/t N H 3 with a high capital cost scenario (Figure ), the average transportation cost is between 41 USD/t N H 3 with a low capital cost scenario and 80 USD/t N H 3 with a high capital cost scenario (Figure ), and average transportation distance is between 460 km with a low capital cost scenario and 880 km with a high capital cost scenario (Figure ) -which is up to three times"", ""Wind and photovoltaic electricity-driven ammonia and distribution uncertaintyWith increasingly uncertain oil prices and global distribution systems, the ammonia production infrastructure must be insensitive to changes in ammonia transportation costs. 52 The need for a more robust chemical supply chain has become evident with the increase in distribution costs and supply chain issues in the last two years. A decentralized production infrastructure results in shorter transportation distances and therefore lower distribution costs. Furthermore, decentralized production could lead to improved resiliency to the failure of production nodes.An analysis of six energy efficiency scenarios evaluates the correlation between decentralization level and ammonia production cost and distribution distance (Figure ).This analysis covers production and distribution networks between one and 6,000 global regional production locations. As the decentralization level increases, the ammonia production cost increases, and the average distribution distance decreases (Figure ). For low-efficiency 'Black Box' systems, the average ammonia production cost increases from a minimum of 1,270 USD/t N H 3 for one production region to a maximum of 1,930 USD/t N H 3 for 6,000 production regions. Similarly, in medium-efficiency 'Black Box' systems, the average ammonia production cost increases from a minimum of 670 USD/t N H 3 for one production region to a maximum of 1,010 USD/t N H 3 for 6,000 production regions. Finally, in high-efficiency 'Black Box' systems, the average ammonia production cost increases from a minimum of 465 USD/t N H 3 for one production region to a maximum of 700 USD/t N H 3 for 6,000 production regions. Decentralization has the opposite effect on the average distribution distance. Interestingly, all of the scenarios have the""]","['Energy', 'Renewable energy sources']",2006,1,1,0,0.94049316,0,['why']
"example, the two unpaired electrons can only interact directly through space in the absence of a linker.FIG. : Energy diagram of Li 2 (A) and natural orbitals with their occupations of 1 Σ + g and 1 Π g states (B) calculated using EOM-DEA-CCSD/aug-cc-pVTZ.The computed EOM-DEA energy diagram follows the expectations from Hückel's molecular orbital theory (Figure ). The weak through-space interaction in Li 2 splits the atomic 2 P state into four states: the pair of 1 Σ + u and 1 Σ + g states separated by 0.16 eV and the pair of 1 Π g and 1 Π u states separated by 0.09 eV. The difference in splitting in the two pairs of states is consistent with the different orbital overlap between the p-orbitals oriented parallel or perpendicular to the Li-Li axis. Figure shows frontier natural orbitals and their occupations in the 1 Σ + g and 1 Π g states as two representative examples. In the ground 1 Σ + g state, the occupation numbers are very close to those of a nearly perfect diradical (covalent) wavefunction yielding n u,nl = 1.99.The excited 1 Π g state is characterized by four half-filled orbitals giving rise to n u,nl = 2.25.The structure of the triplet manifold parallels the singlet states, with the singlet-triplet gaps in the range of 0.00-0.02 eV (Table in SI), further illustrating vanishing interaction between the two electrons. The electronic transitions in dimers or bi-chromophoric systems can be understood by using the exciton model , which describes the electronic states of the dimer as linear combinations of the monomeric states. When applied to a homosymmetric diradical, the model predicts that one of the states in g/u pair is dark and the other is bright, with the oscillator strength doubled relative to an",Causal,Why do the two unpaired electrons in Li2 only interact directly through space in the absence of a linker?,Answer not available from the given context. ,Negative,"['The two unpaired electrons can only interact directly through space in the absence of a linker. ', 'The weak through-space interaction in Li 2 splits the atomic 2 P state into four states: the pair of 1 Σ + u and 1 Σ + g states separated by 0.16 eV and the pair of 1 Π g and 1 Π u states separated by 0.09 eV.']","[[0, 104], [367, 757]]","['in g/u pair is dark and the other is bright, with the oscillator strength doubled relative to an isolated radical. As the ground state in Li 2 is of gerade symmetry, all g states are dark and u states are bright. The effective number of entangled states Z HE in these four lowest-energy transitions is 4.0 due to spin-and space-entanglement of electronic excitation, as compared to Z HE = 1.0 in an isolated Li atom and Z HE ≈ 2.0 in Li 2 around the equilibrium geometry. In addition to the singly excited states of covalent character, there are also higher-lying doubly excited states of covalent character, as well as the manifold of the singly and doubly excited ionic states.In a hypermetallic molecule of the ACCA type, one of the two valence electrons of each alkaline earth metals is transferred to the linker, giving rise to strongly ionic AC bonds and two unpaired electrons, each localized at the respective metal center, making ACCA analogous to the two alkali metals separated by a large distance. Below we examine the electronic structure of ACCH and ACCA with varied metal (A = Mg, Ca, Sr) and compare with electronic structure of Li 2 .Considering electronic structure of ACCH, in the ground X 2 Σ + state the unpaired electron is localized at the metal occupying the hybridized sσ-pσ orbital (see a representative example of the Dyson orbitals of MgCCH in Figure ). Upon excitation to the higher 1 2 Π and 2 2 Σ + states, the electron remains localized at the metal and occupies the hybridized pπ-dπ and pσdσ orbitals, respectively. The orbital hybridization arises due to the presence of the negatively charged ligand and can be reproduced by perturbatively adding a point-charge potential to the Hamiltonian of a hydrogen-like atom .While the electron remains largely localized at the metal, the minor leakage to the ligand is always present, leading to slightly non-diagonal', 'The strength of the interaction between the cycling centers can be tuned by using the linkers of varied length (Figure ). One should also keep in mind that the nature of the linker directly impacts the electronic structure of the molecule. In this context, lessons learned from studies of diradicals and polyradicals provide valuable insights . For example, the interplay between the (direct) through-space interaction between the two electrons and (indirect) through-bond interaction can strongly affect the electronic structure of the molecule. In a representative example of the para-benzene diradical a considerable through-bond interaction flips the ordering of the frontier orbitals relative to the one expected on the basis of through-space interactions and the formally anti-bonding orbital becomes lower in energy than the bonding one .In this Letter, we investigate the electronic structure of the hypermetallic molecules with two cycling centers connected by the acetyl linker: ACCB, where A and B are either the same or different alkaline earth metals (A, B = Mg, Ca, Sr). The main focus is on the strength of the interaction between the two unpaired electrons and how this interaction manifests itself in the underlying electronic structure and experimental observables, such as excitation energies, singlet-triplet energy gaps, excitonic splittings, and oscillator strengths. We also analyze underlying wavefunctions in terms of the number of effectively unpaired electrons and the effective number of entangled states.The main challenge in the first-principle calculations of this class of systems lies in their strong diradical character originating from the near-degeneracies of the frontier', 'type=""bibr"" target=""#b53"">54 .Finally, as in the case of Li 2 , we consider natural orbitals as a tool to interpret the electronic structures of ACCAs. Figure shows two frontier natural orbitals and their occupations for the ground X 1 Σ + g state of MgCCMg; natural orbitals of CaCCCa and SrCCSr are shown in Figure in the SI. In all three molecules, the antibonding natural orbital has a higher occupation number than the bonding orbital in contrast to the case of Li 2 , where, in the agreement with the molecular orbital theory, the bonding natural orbital lies below the antibonding orbital. Such an effect of the flipped orbital ordering has been observed in systems where the (indirect) through-bond interaction between electrons dominates a weak (direct) through-space interaction; for example, it is clearly seen in para-benzyne . Indeed, orbital hybridization induced by the negatively charged linker directs the distribution of the two electrons away from each other, thus minimizing the orbital overlap and through-space interaction.The occupation numbers in all three ACCAs are very close to those of a perfectly diradical wavefunction (i.e., n 1 = n 2 = 1) and, correspondingly, the Head-Gordon\'s indices are close to the limiting value of 2 (Table in SI). The observed small deviations from the perfect diradical values reflect that the interaction between two unpaired electrons is weak but is not negligible. As such, the electronic wavefunction of the X 1 Σ + g state in all three ACCA molecules is dominated by the covalent configuration with a small contribution from the ionic (chargeresonance) configuration. In contrast, the X 3 Σ + u state is, as expected, of a pure covalent character with the n u,nl = 2.00. The singlet-triplet energy gaps do not exceed 0.02', 'are several ways that can be used to compute an effective number of unpaired electrons from natural occupation numbers and here we rely on the indices introduced by Head-Gordon 56 ; specifically, n u,nln u,nl = i n 2 i (2 -n i ) 2 ,(2)which has been shown to reliably yield values that are consistent with chemical intuition.To visualize the states of the unpaired electrons we use Dyson orbitals and natural orbitals . Electronic transitions are analyzed using natural transition orbitals (NTOs) .The entanglement of the electronic transitions is quantified by the effective number of the entangled states 62 defined as:Z HE = 1/ i λ λ i i ,(3)where λ i are the renormalized squares of singular values of the one-particle transition density matrixλ i = (σ i ) 2 i (σ i ) 2(4)giving the weights of natural hole-particle configurations in each transition. All electronic structure calculations were performed using the Q-Chem package ; the wavefunction analysis was carried out using libwfa library . The computational details are described in the SI.Before proceeding to discuss the electronic structure of homosymmetric ACCA molecules, we first examine a simpler case of two weakly interacting Li atoms, sufficiently far apart such that the underlying wavefunction exhibits strong diradical character. In this pedagogical example, the two unpaired electrons can only interact directly through space in the absence of a', ""2h2p spin-flipping operators) for structures' optimizations .The extent of the interaction between the two unpaired electrons can be characterized by concrete physical observables: spectroscopically, by the energy gap between the lowest singlet and triplet state, structurally, by considering the distances between the two centers, or thermochemically, by computing the energy of a hypothetic reaction separating the two centers . Additional insight can be gained from the analysis of the underlying wave-functions , such as shapes and occupations of natural frontier orbitals and the effective number of unpaired electrons. Although not experimentally measurable, these quantities reflect the bonding patterns imprinted in the electronic structure and related to the structural, spectroscopic, and thermochemical observables. The definition of the effective number of unpaired electrons is grounded in the concept of natural orbitals . Natural orbitals are the eigenstates of the one-particle reduced density matrix, with the eigenvalues n i that are non-negative, less than 2, and add up to the total number of electrons; hence, they can be interpreted as orbital occupations. That is, natural orbitals with occupations close to 2 can be described as doubly occupied orbitals, those with small occupation numbers can be described as unoccupied orbitals, and orbitals with noticeable fractional occupations can be described as natural frontier orbitals. For example, in diradicals, one expects to find two orbitals with occupations close to 1; visualization of these orbitals provides a picture of the states of the unpaired electrons . There are several ways that can be used to compute an effective number of unpaired electrons from natural""]","['Quantum and theoretical chemistry', 'Quantum computing']",3495,1,1,0,0.923836472,3.33E-16,['why']
"two atoms due to quantum delocalization. Whereas the quantum mechanical picture (proton sharing) should dominate at low temperatures, our 50 K-and 300 K simulation results, along with the deuterated form simulation, strongly suggest that molecule-to-surface proton shuttling (classical mechanical picture) should be the prevailing mechanism at room conditions. These finding might help to shed further light on the behavior and reactive processes involving carboxylic species on TiO 2 surfaces. Moreover, this kind of strong HBs is crucial in several catalytic processes: for instance, short HBs with low barriers are considered essential in enhancing catalytic rates in enzymatic reactions (see, e.g. Refs. ). Strong HBs have been observed also at the surface of some inorganic materials and polymers upon interaction of surface (super)acid protons with adsorbed base molecules. The reactive surface. Therefore, our results could have also a broader impact extending concepts already established in the field of enzyme catalysis to surface catalytic processes.Figure 1 .1Figure 1. a-c: Snapshots from the 300 K simulation of monodentate HCOOH on TiO 2 (101); a) undissociated HCOOH hydrogen bonded to a surface oxygen O s ; b) a proton is shuttling between the formate moiety and the surface; c) O s is now protonated, and strongly hydrogen bonded to the formate. d) IR spectrum calculated from this trajectory. Frequencies were scaled using a scaling factor of 1.0678 (see SI).",Causal,Why should molecule-to-surface proton shuttling be the prevailing mechanism at room conditions?,Answer not available from the given context. ,Negative,"['Whereas the quantum mechanical picture (proton sharing) should dominate at low temperatures, our 50 K-and 300 K simulation results, along with the deuterated form simulation, strongly suggest that molecule-to-surface proton shuttling (classical mechanical picture) should be the prevailing mechanism at room conditions.']","[[0, 360]]","['Quantum vs Thermal effects in formic acid adsorption on (101) TiO 2 anatase surfaces Carboxylic acids adsorption on anatase TiO 2 is a key process in circular economy and sustainability. Yet, in spite of several decades of investigations, its intimate working mechanisms still remain elusive. In particular, the behavior of the acid proton and its localization -either on the molecule or on the surfaceare still open issues. By modeling the adsorption of formic acid on top of regular (101) anatase TiO 2 surfaces, we found that, in the 0 K limit, the acid proton is shared between a carboxylic oxygen and a surface oxygen. In this regime, the proton behavior is mainly governed by quantum delocalization effects in a single potential well. Nonetheless, as temperature is raised to room conditions, simulations evidenced a rapid ""classical"" shuttling of the proton due to the onset of a two-wells free energy profile separated by a free energy barrier of the order of kT. This picture, supported by the agreement between simulated and experimental IR spectra, shows that the titania surface acts like a protecting group for the carboxylic acid functionality. Such a conceptual insight might help rationalize the chemical processes of carboxylic species on TiO 2 surfaces.', 'Figure ). Hence, taken together, our results suggest that a ""classic"" proton-shuttling model may be eligible to describe the HCOOH adsorption on defect-free portions of anatase TiO 2 {101} surfaces at room temperature. A third remark, which is more chemical in nature, is that both the quantum and the classical picture predict that HCOOH on top of TiO 2 anatase is essentially a neutral moiety (see Bader charges in Table in the SI) with its acid functionality ""protected"" by the surface, owing to the presence of a strong hydrogen bond. Thus, its reactivity may be substantially different from that of a fully-dissociated formic acid -i.e. an adsorbed negatively charged formate and a Brønsted acid surface site formed upon protonation of TiO 2 (101) anatase. Indeed, the ""protecting-group"" role of the surface highlighted by our study might explain, for example, why, carboxylic acids pre-adsorbed on TiO 2 nanoparticles undergo amidation instead of salt formation upon addition of amines. Conclusions By using first principles approaches we propose a model for the adsorption of light carboxylic acids on regular {101} surfaces of TiO 2 -anatase: the adsorbate is bound to a Ti-Lewis acid centre via a carboxyl oxygen, and to a surface oxygen via a ""floating"" proton, with the surface acting like a protecting group for the carboxylic acid functionality, owing to the presence of a short hydrogen bond (HB). This model accounts for the peculiar reactivity of adsorbed carboxylic acids upon addition of amines. The novelty of this picture, which is consistent with spectroscopic experiments, is a dynamical model of the adsorbed moiety, involving either a rapid proton shuttling between a carboxylic and a surface oxygen, or a proton sharing between these two atoms due to quantum delocalization. Whereas the quantum mechanical picture (proton sharing)', 'Investigation of quantum effectsSo far we have discussed the thermal behavior of HCOOH on TiO 2 anatase in a purely classical mechanics frame, which highlighted a double well potential leading to a proton-shuttling mechanism. Actually it is well known that formic acid protons -and more in general proton transfer events -can be strongly influenced by quantum effects, in particular by zero point energies (zpe). To gather insight on such issue, we have optimized the structure of the activated complex at the PBE level (see SI for details).The harmonic frequency involving the ""shared"" proton resulted 1676 cm -1 (with an O s -O f distance of 2.395 Å), not surprisingly much lower than the wavenumbers obtained for the double well potential protonshuttling mechanism. By adding to the energy of the three optimized configurations the zpe, the barrier disappears, (see Figure ) indicating that the quantum approach predicts a shared-proton in a single-well at 0 K. Yet the energy differences still remain below the 1 kcal/mol, even upon inclusion of the zpe contribution. This result indicates that, in order to have a clear-cut answer to the question as to whether the molecule-to-surface proton transfer is governed by a single-well or a double-well potential, one should rest on electronic-structure calculations assuring at least 0.1 kcal/mol accuracy. Such a level of accuracy not only is beyond current DFT approximations, but, due to the size of the system, it is also not', 'Free energy profilesAs the molecule-surface proton-shuttling could be relevant for the overall reactivity of HCOOH on anatase, we calculated the free energy path for this process at 50 K and 300 K (Figure , including also data at 0 K, see below). In both cases we found two free energy minima, corresponding to the dissociated (Figure ) and nondissociated (Figure ) forms. In Figure , the same profiles are reported in units of kT as well. It emerges that at room temperature the shuttling barrier is of the order of kT, hence the shuttling process should be thermally accessible. Indeed, temperature does affect quantitatively the free energy profile: while at 50 K we obtain a free energy barrier of 0.84 kcal/mol, at 300 K the barrier is 1.17 kcal/mol. However, in terms of kT, the barrier amounts to 2.0 kT at 300K while it raises to 8.5 kT at 50 K: hence, overall the shuttling process would be favored upon increasing the temperature. Also, temperature copes to reduce the thermodynamic stability difference between the dissociated and undissociated forms (which is 6.4 kT at 50 K and 0.9 kT at 300 K).Starting from relevant configurations of the 50 K free energy profile, we calculated energy minima (at 0 K) by geometry optimizations at different levels of theory. At the PBE level we found modest energy differences between the two structures, with a preference for the undissociated HCOOH by 0.67 kcal/mol and a (0 K) barrier of 0.75 kcal/mol. We checked also for the effect of dispersion interactions by augmenting the PBE functional with the Grimme D2 correction , in this case the undissociated form is more stable by 0.48 kcal/mol and the shuttling barrier amounts', 'not only is beyond current DFT approximations, but, due to the size of the system, it is also not affordable via state-of-the-art wavefunction-based approaches.Nonetheless, although the single vs double-well issue still remains open, we gathered useful chemical insight on this system. A first remark is that the harmonic frequency associated to the optimized structure of the quantum mechanical minimum (1676 cm -1 ) falls in the region of strong hydrogen bonds -i.e., below the CH stretching modes and very close to the highest O-C-O mode of adsorbed HCOOH, as found for the ""classic"" proton shuttling at room-temperature (Figure ). Such a piece of information may help experimentalists in identifying shared or shuttling protons from the presence of low-wavenumber (and presumably very broad and weak) ν(OH) signals in vibrational spectra of adsorbed carboxylic acids. This model might explain also the reported STM acid proton ""invisibility"", as the carboxylate group conceals the proton from the tip. Secondly, earlier studies on nuclear quantum effects in molecular systems showed that, while quantum fluctuations and zero point motion dominate at very low temperature, the thermally activated (""classical"") behavior should prevail at room temperature. To explore this hypothesis, we simulated, at room temperature conditions, the adsorption of a species less sensitive than HCOOH to quantum delocalization effects : deuterated formic acid (DCOOD). Indeed, the 300 K simulation with deuterated formic acid revealed that even the acid deuteron shuttles between a TiO 2 surface oxygen (O s )and the carboxylic oxygen O f (See SI, Figure ). Hence, taken together, our results suggest that a ""classic""']","['Quantum and theoretical chemistry', 'Quantum effects']",2824,1,1,0,0.915282447,-2.22E-16,['why']
"alkenyl halides, showcasing the synthetic potential and advantages of triflates. Not only their synthetic accessibility, but also the reactivity of triflates in coupling reactions is appealing. In C-S couplings, palladium is the most represented catalyst. The reported methods commonly show only a limited scope of triflates (1-6 examples), utilize bidentate ligands such as Xantphos ((9,9-dimethyl-9H-xanthene-4,5-diyl) Then a variety of primary, secondary and tertiary thiols were coupled (Scheme 3). Alkyl thiols, including the sterically challenging diadamantanthiol 2d, as well as thiols with functional groups such as ether, ester and ketone were coupled in good to excellent yields to thioethers 3ab-3hg (72-99%). Selective C-S coupling providing 3hh in 55% yield was observed in the presence of a free hydroxyl group and 3hi in 53% yield in the presence of a protected cysteine. Thiocholesterol (2j), as another representative of bioactive thiols, could be coupled in 94% yield. In comparison, the related coupling with aryl chloride furnished 72%, showcasing the superior performance of triflates. Upscaling the reaction to 5 mmol in case of 3ac, while decreasing the catalyst loading to 2 mol% highlights the applicability of the low-cost catalytic system on a larger scale. Scheme 3. Substrate scope with respect to alkyl thiols a a Standard reaction conditions: 1a/1h (1.0 mmol or 0.5 mmol), 2 (1.1 equiv.), KOAc (1.5 equiv.), Ni (5 mol%), THF (3 mL), rt, 2 h. Yields of isolated products. b 1a (5 mmol), 2c (5.5 mmol), Ni (2 mol%).Next, the coupling of alkenyl triflates with adamantane thiol (2a) as model substrate was demonstrated (Scheme 4). The reaction products, alkenyl thioethers, are valuable synthetic intermediates and often present in biorelevant compounds. Various cyclic 6-membered alkenyl moieties, including",Causal,Why do triflates exhibit superior performance in coupling reactions compared to aryl chloride?,Answer not available from the given context. ,Negative,"['In comparison, the related coupling with aryl chloride furnished 72%, showcasing the superior performance of triflates.']","[[987, 1106]]","['Nickel Catalyzed Cross Coupling of Aryl and Alkenyl Triflates with Alkyl Thiols We report a nickel catalyzed C-S cross-coupling of aryl and alkenyl triflates with alkyl thiols. A variety of the corresponding thioethers were synthesized using an air-stable nickel precatalyst under mild reaction conditions with short reaction times. A broad substrate scope, including pharmaceutically relevant compounds, could be demonstrated.', 'Thioethers are common motifs in agrochemicals, 1 materials 2 and pharmaceutical compounds. They can be conveniently synthesized via a variety of transformations. One of the most prominent and versatile methods is the metal-catalyzed coupling of thiols with aryl and alkenyl (pseudo)halides, also referred to as Migita-coupling. Until recently aryl bromides and iodides were typically employed as electrophiles rather than the less reactive but abundant aryl chlorides. In comparison to aryl (pseudo)halides, alkenyl electrophiles have been much less systematically explored. One of the disadvantages of halides is the synthesis of not commercially available substrates, which may require multiple steps , forcing reaction conditions 10 restricting the functional group tolerance, as well as toxic chemicals (e.g. CCl4, 11 PCl5 12 ). In contrast, aryl and alkenyl triflates, representatives of pseudohalides, can easily be synthesized in a simple one step procedure from phenols and ketones, rendering them excellent alternative electrophiles. Phenols and ketones are both abundant, available as well as low-cost, and thus attractive building blocks, especially for more complex pharmaceutically active compounds. In particular alkenyl halides, for which even simple compounds are not widely commercially available, triflates are an excellent alternative. This point is supported by a variety of publications reporting the transformation of alkenyl triflates to the corresponding alkenyl halides, showcasing the synthetic potential and', 'precatalyst, and KOAc as base from our previous work could directly be employed for the coupling of triflates. The substrate scope and functional group tolerance were explored using the sterically challenging adamantanethiol as model nucleophile. First, various electron-neutral, -rich, as well as -deficient aryl triflates could be coupled in good to excellent yields (Scheme 2). Functional groups like nitrile, ester, trifluoromethyl, methoxy and amide were tolerated and thioethers 3ca-ga were furnished in excellent yield (89-97%).Electrophiles containing heterocyclic moieties, often present inbiologically active compounds for pharmaceutical oragrochemical applications, like pyridine, dioxole or 4-methyl-2H-chromen-2-one yielded the corresponding aryl thioethers3ia-3ka in good yields. In contrast to using aryl chlorides assubstrates, where sterically hindered electrophiles showed lowreactivity, ortho-methylsubstituted thioether 3la, and the1-naphthyl-based product 3ma were obtained via the couplingof aryl triflates in excellent yields. Additionally, a highchemoselectivity was observed for bis-electrophiles with chloroand tosyloxy groups providing the monocoupled products 3naand 3oa in excellent yields. Dithioether 3pa was obtained fromthe corresponding ditriflate.Moreover, the potential of the methodology for late stagesulfenylation of triflates synthesized from more complexbiorelevant phenols was', 'Scheme 1. Literature examples for the coupling of triflates 8j, 17c and our objectiveNickel catalyzed methods remain rare for aryl sulfonates in general, with limited examples for the coupling of aryl thiols with aryl tosylates 7c and mesylates, but no examples for aryl triflates. Regarding alkenyl electrophiles, only few reports were dedicated to the palladium catalyzed C-S coupling of tosylates 8f and triflates, 8e while nickel catalysed couplings are even more underrepresented. The most recent example is the electrochemically promoted coupling of alkenyl triflates with thiols employing air-sensitive Ni(cod)2 (15 mol%) reported by Pan and co-workers (Scheme 1b). 8j They demonstrated an extensive substrate scope for aryl thiols, but only a limited scope for alkyl thiols(3 examples) providing moderate yields. The inefficient coupling of alkyl thiols, especially tertiary ones is a typical limitation of many C-S coupling methodologies. Our group closed this gap in a study on cross-coupling of aryl chlorides with tertiary alkyl thiols. 7e A promising reactivity of triflates was observed in electrophile competition experiments, which led us to expand the scope of the methodology to aryl and alkenyl triflates (Scheme 1c). To the best of our knowledge this is the first nickel catalyzed coupling of aryl as well as alkenyl triflates with challenging tertiary alkyl thiols showing a wide scope as well as functional group tolerance under mild conditions without the need for high temperatures, additives, reducing agents, reactive organometallic bases, or electrochemistry. The mild reaction conditions (room temperature) and catalytic system consisting of (Xantphos)Ni(o-tolyl)Cl (Ni) as airstable precatalyst, and KOAc as base from our previous work could', 'compounds. Various cyclic 6-membered alkenyl moieties, including heterocycles were coupled yielding the corresponding thioethers 5aa-5da in 74-86% yields. The ester and amide functionalities in 5ba and 5ca were tolerated. Similar results were obtained for triflates with a fused benzene ring, such as 3,4-dihydronaphthalenyl triflates 5ea, 5fa and 2H-chromene derivative 5ga. Moreover, the 5-and 7-membered cycloalkenyl thioethers 5ha and 5ia as well as the acyclic compound 5ja could be synthesized in excellent yields. The successful coupling of a cholestane-3-one derived triflate 4k highlights the possibility to convert more complex biorelevant structures. (1.1 equiv.), KOAc (1.5 equiv.), Ni (5 mol%), THF (3 mL), rt, 2 h. Yields of isolated products. We showed in our previous work on the sulfenylation of aryl chlorides that the reaction most likely proceeds through a Ni(0)/Ni(II) mechanism and acetate-assisted deprotonation of thiols, which is also plausible for the reaction of triflates (Scheme 5). The activation of the precatalyst, which is structurally related to the product of the oxidative addition, occurs via the same steps as the catalytic reaction (coordination of thiol, deprotonation and reductive elimination of the thioether). Interestingly, the reaction progress comparison of different electrophiles showed that aryl triflates not only have the highest reaction rate, but also the shortest induction period < 5 minutes (Scheme 6). It indicates a fast catalyst activation, which might be explained by a substrate assisted reductive elimination. This underlines the superiority of aryl triflates as electrophiles in this reaction. The representative of alkenyl triflates was converted with lower efficiency, possibly due to higher sensitivity of the compound.']","['Catalysis', 'Homogeneous catalysis']",1557,1,1,0,0.743168662,0.693141652,['why']
" and ultraviolet spectroscopy of small aqueous solutes have been demonstrated, there has been no systematic investigation of whether VIEs themselves are sensitive to the presence of the air/water interface; the only detailed studies concern the rather unique case of the hydrated electron. It is known that the VIE of liquid water is largely unaffected by dissolved ions, shifting by < 0.2 eV over an 8 M concentration range, and the VIE of I -(aq) is similarly unaffected by concentration. It is not yet known whether VIEs of aqueous ions are sensitive to the air/water interface or not.That issue is examined here by computing bulk and interfacial VIEs for 16 common inorganic ions for which experimental data (from liquid microjets) are available, using a combination of MD simulations and electronic structure calculations. Long-range polarization makes a significant contribution to VIEs in water, and we incorporate this effect via dielectric continuum boundary",Causal,Why is it not yet known whether VIEs of aqueous ions are sensitive to the air/water interface?,Answer not available from the given context. ,Negative,"['there has been no systematic investigation of whether VIEs themselves are sensitive to the presence of the air/water interface; the only detailed studies concern the rather unique case of the hydrated electron. ', 'It is not yet known whether VIEs of aqueous ions are sensitive to the air/water interface or not.', 'That issue is examined here by computing bulk and interfacial VIEs for 16 common inorganic ions for which experimental data (from liquid microjets) are available, using a combination of MD simulations and electronic structure calculations.']","[[0, 289], [491, 588], [588, 827]]","['Probing Interfacial Effects on Ionization Energies: The Surprising Banality of Anion-Water Hydrogen Bonding at the Air/Water Interface Liquid microjet photoelectron spectroscopy is an increasingly common technique to measure vertical ionization energies (VIEs) of aqueous solutes, although the interpretation of these experiments is subject to questions regarding sensitivity to bulk versus interfacial solvation environments. Here, we compute aqueous-phase VIEs for a set of inorganic anions, some of which partition preferentially at the air/water interface, using a combination of molecular dynamics simulations and electronic structure calculations. The results are in excellent agreement with experiment, regardless of whether the simulation data are restricted to ions at the air/water interface or to those in bulk liquid water. Although the computed VIEs are sensitive to ion-water hydrogen bonding, we find that the short-range solvation structure is sufficiently similar in the bulk and interfacial environments that it proves impossible to discriminate between the two on the basis of the VIE, a conclusion that has important implications for the interpretation of liquid-phase photoelectron spectroscopy. More generally, analysis of the simulation data suggests that partitioning of soft anions at the air/water interface is largely a second (or third) solvation shell effect, arising from disruption of water-water hydrogen bonds and not from significant changes in first-shell anion-water hydrogen bonding.', 'side. This idea has been put forward previously with regard to I -(aq), 141 IO - 3 (aq), and SCN -(aq), 144 and in particular the structural anisotropy around I -(aq) that is reported in Ref. 141 is reproduced by the simulations reported here; see Fig. . As such, the airexposed configurations of the interfacial ion are not solvated very differently as compared to the same ion in bulk water. Other studies have also pointed to asymmetric solvation environments around anions (more so than cations), even in bulk water. Our results suggest that the solvation environments of various soft anions are asymmetric both in bulk water and at the air/water interface, leading to VIEs that are essentially indistinguishable.the VIEs of these species in water, is mostly performed at photon energies where the attenuation length of the outgoing photoelectron is 1-10 nm, suggesting that the experiments are more sensitive to solutes at the interface. However, there has been little prior investigation of whether the VIEs themselves are sensitive to interfacial solvation, which is an especially relevant question for soft anions that are known to partition preferentially at the air/water interface. Our calculations suggest that differences between bulk and interfacial VIEs are inconsequential, which we attribute to similarities in first-shell hydration structure in both environments. These striking similarities serve as a reminder that although the structure of the air/water interface may be modified by the presence of dissolved ions, the hydration shell around a given solute may or may not be different than what it is bulk aqueous solution. Whereas liquid microjet', 'solute may or may not be different than what it is bulk aqueous solution. Whereas liquid microjet photoelectron spectroscopy may be surface-sensitive, our results strongly suggest that the observable that it measures is not surface-sensitive.This work also reports a new computational protocol for aqueous VIEs. The existing conventional wisdom is that a prohibitively large number of explicit water molecules is needed to obtain converged VIEs in aqueous solution, but with an appropriate choice of continuum boundary conditions we find that convergence is achieved with two solvation shells. VIEs reported here are within 0.2-0.3 eV of experimental values, even for polyvalent anions. This is comparable to the accuracy of the best existing periodic DFT calculations of the same quantities, but without the complexities posed by the periodic treatment when the number of electrons changes. The protocol reported here is also readily extensible to wave function-based quantum chemistry.Rapid convergence of the VIE in our cluster-continuum protocol suggests that this quantity is mostly sensitive to short-range solvation structure, with the continuum boundary conditions making a large but non-specific contribution at longer range. Similarities in bulk and interfacial VIEs result from similarities in the short-range hydration environment. Our', 'Results and DiscussionA. Comparison to Experiment. By tuning the photon energy and thereby the kinetic energy of the ejected photoelectrons, 63 liquid microjet photoelectron spectroscopy has been used to measure the concentration profile (versus depth) of ions at the air/water interface. In other measurements, the concentration dependence of the photoelectron yield of aqueous aniline was found to correlate with the surface concentration inferred from surface tension measurements. If the ionwater hydrogen bonds are different at the interface as compared to those in bulk water, then the VIE might provide a probe of these structural changes. Indeed, comparison of the valence photoelectron spectra of the liquid and vapor phases of water suggests that spectral shifts engendered by hydrogen bonding are different depending on the orbital that is ionized, and the convergence tests VIEs for aqueous anions computed from bulk (isotropic) and interfacial (slab) simulations, in comparison to experimental VIEs from Ref. 86. The diagonal line indicates agreement between theory and experiment. Calculations were performed at the ωB97M-V level using nonequilibrium PEqS boundary conditions, and each data point represents an average over 51 snapshots extracted from the MD simulation. The corresponding numerical data are provided in Table .in Fig. indicate that the VIE is sensitive to short-range ion-water hydrogen bonding. There has been little effort to investigate interfacial effects on VIEs, however, except in the special case of e -(aq), and in one preliminary', 'in bulk and interfacial VIEs result from similarities in the short-range hydration environment. Our results are therefore consistent with the presumed surface-sensitivity of liquid microjet photoelectron spectroscopy, but also reveal that these values can likely be taken seriously as VIEs for bulk aqueous solutes. The latter are important parameters for the solution-phase theory of electron transfer. Observed similarities in the solvation structure of bulk versus interfacial anions sets up another interesting conundrum, namely, how to reconcile these observations with shifts in the O-H stretching band of water are detected (using surface-selective vibrational spectroscopy) when soft ions are present at the air/water interface. Our results suggest that this is likely a second-shell (or possibly third-shell) solvation effect, resulting from subtle changes in the network of waterwater hydrogen bonds that are induced by the presence of the ion, rather than resulting directly from changes in ion-water hydrogen bonds at the interface. The surface sensitivity of soft anions is itself known to be a rather subtle effect, difficult to ascribe to changes in any single energetic term in the interaction potential, and at least partly driven by entropic considerations. The present work supports the idea that surface activity is']","['Quantum and theoretical chemistry', 'Theoretical methods']",2683,1,1,0,0.966249161,0,['why']
"that observed at the anode, indicating more prevalent bubble formation at the cathode. At higher current densities, above the 200-300 mA cm -2 range, this difference in acoustic activity increases further with a higher gradient observed with the cathode relative to the anode (Figure (a)). This again matches well with results obtained from voltage fluctuation experiments. This difference between the higher acoustic activity observed with the cathode relative to the anode, particularly at current densities above 200-300 mA cm -2 is more clearly observed by studying the cumulative energy of the acoustic hits (Figure (b)). Thus far, the focus has been on the number of hits recorded, which gives a good indication of the acoustic activity but does not include all information. By looking at the cumulative energy, this not only takes into account the total number of hits but other factors associated with each hit such as the duration and frequency of each hit. Based on the cumulative energy the performance of the two electrodes is relatively similar, albeit with the cathode showing slightly higher energy, until approximately 1500 s. At this point, where the current density is increased beyond 200 mA cm - prevalent at the cathode and for higher current densities above ca. 200 mA cm -2 the effect is initially larger on the cathode than the anode.",Causal,Why is there a difference in acoustic activity between the cathode and anode at higher current densities?,Answer not available from the given context. ,Negative,"['At higher current densities, above the 200-300 mA cm -2 range, this difference in acoustic activity increases further with a higher gradient observed with the cathode relative to the anode (Figure (a)). ', 'This difference between the higher acoustic activity observed with the cathode relative to the anode, particularly at current densities above 200-300 mA cm -2 is more clearly observed by studying the cumulative energy of the acoustic hits (Figure (b)).']","[[87, 289], [374, 626]]","['Figure 5 .5Figure 5. Standard deviation (\uf073) of voltage as a function of current density, at room temperature (23 o C), of: (a) the cell, (b) the anode, and (c) the cathode, of a capillary-fed water electrolysis cell with a Pt/C/Nafion/CFP cathode (0.5 mg cm -2 Pt) and NiFeOx/PTFE/Ni mesh anode sandwiched in a zero-gap arrangement with a 8 µm PES membrane that fed 6 M KOH electrolyte to the electrodes from a reservoir at the base of the cell. (b). A similar trend is observed at the anode as the cathode; namely, at lower current densities there is limited acoustic activity, indicating low bubble formation, which gradually increases as the areal current density is increased. If the number of hits recorded at the anode (Figure6(b)) is compared to the number of hits recorded under the same conditions at the cathode (Figure6(a)), fewer hits are observed at each current density, suggesting lower acoustic activity indicating lower bubble formation. These results correlate with the data obtained from voltage fluctuation experiments, which indicated that bubble formation was more prevalent at the cathode than the anode. Figure 6 .6Figure 6. Acoustic emission data obtained from (a) cathode side and (b) anode side as current density (blue bars) (right axis) is increased and acoustic results (red dots) show the hit amplitude (left axis) and rate. Note that there are no acoustic hits in the current rest periods.', 'approximately 1500 s the number of acoustic hits increased more significantly. It is also observed that while there are hits just above the 25 dB threshold across the course of the experiment, increasing numbers of hits at higher acoustic amplitudes were observed as the current density increased.Notably, no acoustic activity is observed during any of the rest steps even at higher current densities, this indicated that the acoustic behavior is related to the operation of the electrolysis and not to any background effects. Tests were also repeated with the transducer in the same location but acoustically decoupled from the cell; no hits were detected during this test, ruling out any possible electromagnetic interference effects.This result suggests a change in behavior as the current density is increased, in line with the results observed from voltage fluctuation measurements. More acoustic activity is attributable to the formation of bubbles.The same experiment was repeated with the transducer placed on the anode of the electrolyser, these results are shown in Figure  In order to compare the acoustic activity at the anode and cathode at all current densities studied, the hit rate (number of hits per second) was calculated for all areal current values on both electrodes, the data from these calculations are shown in Figure range there is an increase in the rate of increase of acoustic hits per second with increasing current density, suggesting more bubble formation; this is a similar trend to that observed with the voltage fluctuation experiments. This increase in acoustic activity is observed with both the anode and the cathode. At current densities above ca.. 75 mA cm - the hit rate for the cathode is always higher than that observed at the anode, indicating more prevalent bubble formation at the cathode. At higher', ""Electrolysis Cell using the Acoustic Emission TechniqueIn addition to the voltage fluctuation measurements, acoustic emission testing was employed to monitor bubble formation on the anode and cathode sides of the cell separately.Although this work was conducted on a cell with a slightly different layout, as outlined in Section 2.1.1, results from both set-ups were found to match closely (See Figure SI 5).The results obtained from acoustic emission testing are summarized in Figure . The use of the highly acoustically attenuating EPDM gasket between the two halves of the electrolyser allowed for the acoustic effects from each of the electrodes to be effectively isolated from one another. However, the crossover between electrodes was shown to be minimal.Constant current steps (60 s) of increasingly high areal current density were conducted with 120 s rests between each value. The acoustic emission was monitored across the course of the experiment. The results in Figure indicated that every time an acoustic event (a 'hit') was detected, it was above the chosen threshold value of 25 dB. The amplitude of each hit is indicated in each plot.For the cathode (Figure (a)) very few acoustic hits were observed at low current densities (e.g. Only two hits were observed across the 1 min, 10 mA cm -2 period), this is an indication of exceptionally low bubble formation with very limited acoustic activity. This trend for low amounts of bubble formation at low areal current densities continued across the first few current densities tested, although notably as the current density increased there was an increase in the number of hits occurring in each constant current step. After approximately 1500 s the number of acoustic hits increased more significantly. It is also observed"", '(a). During periods of low areal current density, both the anode and the cathode show relatively low acoustic activity indicating low bubble formation, corroborating the data obtained in the voltage fluctuation measurements. However, when the current density is increased above the 200-300 mA cm-2   Figure 7 .7Figure 7. (a) The acoustic hit rate for both the anode and cathode at varying areal current densities. (b) the evolution of the cumulative energy across the course of the test for both the anode and cathode. Replication at University College London (UCL), of the Performance of the Capillary-Fed Electrolysis Cell, as reported in Nature Communications 2022, 13, 1304 (DOI: 10.1038/s41467-022-28953-x) by the University of Wollongong (UOW) For acoustic emission testing carried out at University College London (UCL) a different setup (as detailed in Section 2.2 of the manuscript) was utilised. In order to ensure that the data obtained from these tests was valid and matched data recorded at the University of Wollongong (UOW), previously reported experiments were repeated and the data compared. Figure SI 1 (a) shows a polarization curve obtained from the cell operating at 80 o C following the procedures outlined in Ref [1]. Figure SI 1 (b) shows a comparison of the data obtained in this work (measured at UCL) with the data reported previously in Ref [1]. The test was repeated at 85 o C with the results shown in Figure SI 2.', ""ConclusionsIn this work, we have detected and analyzed the incidence of gas bubble formation during operation, of the cathode and anode of a high-performing capillary-fed water electrolysis cell.A voltage fluctuation and an acoustic emission technique were adapted and applied in combination, while applying current densities of up to 1 A cm -2 to the cell. Very similar resultswere obtained for the two techniques, with little bubble formation observed up to 0.17-0.20 A cm -2 . At higher current densities, up to around 0.6 A cm -2 , bubbles were formed predominantly at the cathode. Given that commercial alkaline electrolysers typically operate at current densities up to 0.6 A cm -2 , this suggests that minimizing bubble formation at the cathode offers the key opportunity for further performance improvements in the capillary-fed cell. The cathode and anode produced bubbles at similar rates at still higher current densities, to 1 A cm-2. Even at 1 A cm -2 , the rate of bubble formation on the electrodes was substantially lower than in conventional, 'bubbled' electrolysis cells. In the course of this work, the previously reported high electrochemical performance of the capillary-fed cell was independently confirmed.    IndependentFigure 1 .1Figure 1. Exploded view of the transparent, acrylic second-generation test cell with its bottom cut off.""]","['Energy', 'Renewable energy sources']",1806,1,1,0,0.909097952,0.496244747,['why']
"60-100 sec. These settings ensured that there is a steady state build up of gas pressure in the sampling chamber (typically, 1 -5 × 10 -6 mbar) which is detected by the mass spectrometer.For thermal experiments, a stainless steel cup shaped holder for the catalyst bed with a cartridge type heater attached at the bottom (outside the reaction chamber) was used. A home-built temperature controller was used to control the catalyst bed temperature within 1 K of the set temperature over the entire course of measurements. Temperature was monitored using a K-type thermocouple tip (0.3 mm diameter) immersed in the catalyst bed. Thickness of the catalyst bed was 5 mm for thermal experiments and temperature difference over this thickness was measured to be less than 3 K. Reactant gases, H 2 and D 2 were allowed to mix for 20 to 30 min in the reaction chamber before heating was started. Sampling of gas mixture was started after a steady temperature was attained on catalytic sample. For the light driven reaction, second harmonic of pulsed Nd +3 :YAG laser (Spectra Physics, Ascend, pulse width:200ns, repetition rate: 1 kHz, wavelength: 532 nm) was used at different intensities. A collimated laser beam with 8 mm cross sectional diameter was made incident on the catalyst (1 mm thick bed) sample to excite the Au nanoparticles.For both thermal and light-induced reactions, sampling performed at initial stages of the reaction was used to determine the change in fraction of HD, using which initial rate and rate constants were calculated. In the case of light-induced reaction, measurement of temperatures is particularly challenging and error prone. Instead, we rely on a strategy where effective temperature of the reaction sites were estimated using the well-defined relationship among K eq and temperature as shown in figure (right panel). Here,",Causal,Why is measurement of temperatures particularly challenging and error prone in the case of light-induced reactions?,Answer not available from the given context. ,Negative,"['In the case of light-induced reaction, measurement of temperatures is particularly challenging and error prone.']","[[1543, 1654]]","['Results and discussionThermally-driven reaction fractions decrease along with an increase in HD fraction, ultimately reaching a steady value at longer times. The first two measurements (around t = 0 sec) were performed before the catalyst bed was heated (at room temperature) and is used to check the initial composition of the gas mixture in the reaction chamber. The arrow corresponds to the time point where a steady temperature of 458 K was achieved. (c)f 2 HD f H 2 f D 2as a function of time. Steady state value at longer times corresponds to the equilibrium constant under these reaction conditions. out (see SI-4 for details).A series of similar measurements were carried out at different temperatures ranging from (393 K to 473 K) and the quantity ∆f  p H 2 p D 2 d(p HD ) dt t=0 = k f (2)It can be seen that rate of formation of HD and the corresponding rate constants (slope) increase with temperature. Logarithm of the rate constants obtained at different tempera-tures are plotted in figure , right panel. Activation energy under thermally-driven conditions from this Arrhenius plot is determined to be 0.75 ± 0.02 eV.', 'Figure 2 :2Figure 2: (a) Partial pressure of H 2 , D 2 , and HD measured as a function of time using mass spectrometer for thermally driven reaction (dark) with the catalyst bed at 458 K and 1 bar pressure in the reaction chamber. (b) Partial pressure fraction of the individual components (using data in panel a) plotted as a function of time. As the reaction progresses, H 2 and D 2fractions decrease along with an increase in HD fraction, ultimately reaching a steady value at longer times. The first two measurements (around t = 0 sec) were performed before the catalyst bed was heated (at room temperature) and is used to check the initial composition of the gas mixture in the reaction chamber. The arrow corresponds to the time point where a steady temperature of 458 K was achieved. (c) HD   f H 2 f D 2 is2plotted as a function of time (figure 3, left panel). This quantity denotes the change in HD fraction in the reaction chamber normalized by H 2 and D 2 fractions to account for any variations in the starting concentrations of the reaction mixture. Assuming second order kinetics for this reaction, rate of change of this quantity at given temperature, in region of initial progress of the reaction, is approximately equal to the forward rate constant (k f ) at that temperature (equation 2).', 'Light-induced reactionFor the light-induced reaction, thickness of catalyst bed was reduced to 1 mm. In our experiments we observed that light absorption leads to heating of the catalyst bed, and hence a thinner sample was preferred to reduce the thermal contribution which could potentially obscure our results. Figure shows progress of the reaction measured at four different average laser intensities (7.1 W/cm 2 to 11.8 W/cm 2 ). As observed in case of thermally-driven reaction, the quantityf 2 HD f H 2 f D 2increases steadily with time and eventually reaches steady state yielding the equilibrium constant under these conditions. Since control experiments (in absence of Au nanoparticeles) already establish that reaction is mainly driven by the presence of Au nanoparticles, we interpret the temperature corresponding to the value of K eq at a given light intensity to be a measure of energy available to the reactants at the active site. We denote this quantity as an effective temperature (T eff ) of the reaction site.A closer look at these curves (figure ) shows that as laser intensity is increased, resulting value of K eq and hence T eff obtained increases systematically (see table ). Progress of initial part of the reaction, analogous to thermally-driven case, is depicted in figure . Quite clearly, as laser intensity (and hence T eff ) increases, rate of formation of HD and corresponding rate constants increase. Using rate constants obtained at different T eff , we estimate the activation energy in this case to be 0.21 ± 0.02 eV (figure ). Most significant point emerging from these observations is that, activation energy obtained in the case of', 'quantity f 2 HDf H 2 f D 2 plotted22Progress of a typical thermally-driven reaction is shown in figure2(458 K, 1 bar total pressure). Top panel depicts the partial pressures measured by mass spectrometer as the reaction progresses towards equilibrium. It can be clearly seen that with increasing time H 2 and D 2 are consumed and a corresponding increase is seen in HD. Middle panel shows the fraction of H 2 , D 2 and HD (f H 2 , f D 2 and f HD , respectively) in the gas mixture observed as a function of time. It is worth pointing out that fractional pressures are a more robust quantity than the partial pressures themselves since variations in sampling signal caused by changes in nozzle performance over time and overall pressure increase in the reaction chamber due to temperature increase gets cancelled out. It can also be seen that at longer times (greater than 20000 seconds, approximately) the system reaches a steady state and the change in fraction (concentration) of each component is very small. Bottom panel shows the as a function of time. Clearly, at longer times this quantity reaches steady state, which corresponds to the equilibrium constant. It should be noted that different gases have different sensitivity factors for detection by the mass spectrometer. In these thermal experiments, since steady state temperatures of the catalyst bed (measured using a thermocouple) and hence K eq are known quantities, these measurements are used to derive the gas dependent sensitivity factors. Using these gas sensitivity factors, evaluation of K eq values in case of light-induced experiments (where temperature is unknown) was carried', 'and temperature as shown in figure (right panel). Here, the blue curve depicts K eq evaluated using statistical thermodynamics over a range of temperatures (see SI-2 for details) and the points show values available in literature. From the variation in rate constants observed with temperature, activation energies were evaluated for both light and thermally-driven reactions. A comparison of these allows us to deduce signatures of different pathways in both these cases.In order to test the possibility of any spurious signal HD signal originating from catalytic activity of the metallic walls of the reaction chamber, control experiments were carried out with only the silica powder (Au nanoparticles absent). In case of thermally-driven reaction, HD fraction observed in absence of Au nanoparticles was smaller than 5% of the total HD produced (SI-3). For light-induced reaction, this quantity was several orders of magnitude smaller (SI-3). These observations establish that HD production in our system is mainly catalyzed by the presence of Au nanoparticles and contribution of any other part of the reaction chamber (such as stainless steel surface etc.) is relatively much smaller.Consequently, we have ignored this small fraction of HD in further analysis of our results.']","['Unclassified', 'Unclassified']",3859,1,1,0,0.898782442,1.11E-16,['why']
"here have VIEs that are smaller than that of liquid water (estimated at 11.2-11.7 eV), in a finite cluster X -(H 2 O) N it can nevertheless be the case that the frontier orbital of X - is not the highest-occupied molecular orbital (HOMO) of the cluster. As in previous work, we compute the VIE of X -using an initial guess corresponding to a superposition of fragment densities, with selective ionization of one fragment. The maximum overlap method is then used to relax the orbitals of a non-aufbau determi- Fig. : Vertical ionization energies (VIEs) of increasingly large NO - 3 (H2O)N clusters, measured either in terms of the cluster radius (lower horizontal axis) or else the average number of explicit water molecules, N (upper horizontal axis). All calculations were performed at the ωB97M-V/6-31+G* level and each data point represents an average over 25 snapshots extracted from an MD simulation. With equilibrium continuum conditions, both initial and final states are equilibrated using a continuum whose dielectric constant is ε0 = 78, whereas nonequilibrium boundary conditions polarize the final state using ε∞ = 1.8 instead. Vacuum boundary conditions include only the NO - 3 (H2O)N cluster but no continuum model The experimental VIE is 9.4 eV. nant corresponding to ionization below the HOMO. More robust convergence algorithms are available for difficult cases, 117 but we have not found them to be necessary here.",Causal,Why does using nonequilibrium boundary conditions with a dielectric constant of ε∞ = 1.8 polarize the final state differently compared to equilibrium conditions with ε0 = 78?,Answer not available from the given context. ,Negative,"['With equilibrium continuum conditions, both initial and final states are equilibrated using a continuum whose dielectric constant is ε0 = 78, whereas nonequilibrium boundary conditions polarize the final state using ε∞ = 1.8 instead.']","[[906, 1139]]","['and theoretical VIEs is complicated by the fact that the experiments may sample both bulk and interfacial ions, and the periodic slab calculations definitely sample both environments. Values reported in Table represent averages over the entire simulation cell, and certain ions (such as NO - 3 ) move readily between the bulk-like interior of the slab and the air/water interface. As such, it is not obvious which (if any) of the theoretical values should be compared directly to experiment, for a given ion, although this ambiguity is largely mitigated by the close agreement between isotropic and slab VIEs. Agreement with experiment is comparable to the best available periodic DFT calculations, which reported a mean absolute error of 0.1 eV using range-separated hybrid functionals. The present calculations, however, are free of issues related to the use of periodic electronic structure for ionization or redox processes. Having validated the accuracy of our computational protocol with respect to experimental data, we next turn to the most interesting aspect of the calculations, namely, the similarity between VIEs computed for isotropic versus slab simulations, for the same ion. These differences are < 0.3 eV for each of the ions in our data set, and often much smaller. For I -(aq) and SCN -(aq), both of which exhibit significant surface propensity, <ref type=""bibr""', 'of the atomistic solvent cluster. Conver-gence of the VIE for NO - 3 (aq) is examined in Fig. using atomistic solutes NO - 3 (H 2 O) N with an increasing number of explicit water molecules, comparing results using both equilibrium and nonequilibrium continuum boundary conditions as well as vacuum boundary conditions. For reasons of computational expedience, these convergence tests were performed not with PEqS but instead using a polarizable continuum model (PCM), as convergence properties are similar in both cases. Convergence to the experimental VIE of 9.4 eV 86 is obtained using nonequilibrium boundary conditions with approximately two solvation shells of explicit water molecules, corresponding N ≈ 40 water molecules or a cluster radius R ≈ 6.0 Å around the ion. Similar convergence has been observed in the case of e -(aq), which might be considered something of a worst-case scenario due to the delocalized nature of the ion. This is obviously much faster convergence as compared to the hundreds of water molecules suggested above, and indeed it is clear from Fig. that convergence is dramatically slower in the absence of dielectric boundary conditions. Using vacuum boundary conditions, the VIE of NO - 3 (H 2 O) N is 1.0 eV smaller than the experimental value even with N ≈ 70 explicit water molecules. Boundary conditions based on an equilibrium continuum model (using ε 0 only) push that value closer to experiment, but the nonequilibrium (ε ∞ -dependent) correction contributes 0.5 eV in this example and is necessary in order to obtain agreement with experiment. Notably, a ""microhydration"" approach, including only those water molecules that are directly hydrogen-bonded', ""solvent's optical dielectric constant, ε ∞ . For water, whose static dielectric constant (ε 0 = 78) is much larger than its optical dielectric constant (ε ∞ = 1.8), the use of conventional (equilibrium) continuum solvation methods in inappropriate for VIE calculations, as these methods implicitly assume immediate reorganization of the solvent upon ionization. The nonequilibrium correction removes this overpolarization in the final state, and can modify VIEs for aqueous ions by 1 eV. Additional details regarding the PEqS calculations can be found in Section S2.3 of the Supporting Information.Two of the radicals obtained upon ionization (namely, NO 2 and NO 3 ) exhibit artifactual symmetry breaking at the Hartree-Fock level, which precludes the straightforward use of correlated levels of wave function theory. For that reason, all of the calculations reported here were performed using density functional theory (DFT) with the ωB97M-V functional. Symmetry-breaking is often significantly mitigated by DFT, as confirmed in the present cases; see Section S2.2 for a detailed analysis. Basis-set effects are quite small, with double-and tripleζ VIEs differing by an average of < 0.1 eV (see Table ). Calculations reported below use the aug-cc-pVTZ basis set for the anion and the 6-31+G* basis set for the explicit water molecules, along with the SG-2 quadrature grid. (For Br -and I -, we use the aug-cc-pVTZ-PP basis set with the corresponding effective core potential.) Electronic structure calculations were performed using Q-Chem (v. 5.3). Although the ions considered here have VIEs that are smaller than that of liquid water (estimated at 11.2-11.7 eV), <ref"", 'B. Validation.Results from neutron and x-ray diffraction, and from chromatography, establish that even di-and trivalent ions typically disrupt the structure of water only into their second solvation shells, with ≤ 10 water molecules that are tightly bound to the ion. Even for exotic ions such as e -(aq), the disruption is limited to two solvation shells. Long-range polarization does change dramatically upon ionization, however, leading to very slow convergence of VIEs with respect to the number of explicit water molecules. Consideration of the Born ion model suggests ∼ R -1 convergence behavior, for an ion-water cluster of radius R, and in practice that may mean 500-1000 water molecules to obtain converged results. This problem is not unique to VIEs and is also encountered in pK a calculations. A solution to this conundrum is to use continuum boundary conditions to accelerate convergence with respect to the size of the atomistic solvent cluster. Conver-gence of the VIE for NO - 3 (aq) is examined in Fig. <ref', 'were performed using the Tinker-HP software. We use a ""cluster-continuum"" approach to compute VIEs within an electronic structure framework. Clusters of water molecules, encompassing approximately two solvation shells around the ion in question, are extracted at intervals along each MD trajectory. The VIE']","['Quantum and theoretical chemistry', 'Theoretical methods']",2692,1,1,0,0.869481806,1.403067439,['why']
"side. This idea has been put forward previously with regard to I -(aq), 141 IO - 3 (aq), and SCN -(aq), 144 and in particular the structural anisotropy around I -(aq) that is reported in Ref. 141 is reproduced by the simulations reported here; see Fig. . As such, the airexposed configurations of the interfacial ion are not solvated very differently as compared to the same ion in bulk water. Other studies have also pointed to asymmetric solvation environments around anions (more so than cations), even in bulk water. Our results suggest that the solvation environments of various soft anions are asymmetric both in bulk water and at the air/water interface, leading to VIEs that are essentially indistinguishable.the VIEs of these species in water, is mostly performed at photon energies where the attenuation length of the outgoing photoelectron is 1-10 nm, suggesting that the experiments are more sensitive to solutes at the interface. However, there has been little prior investigation of whether the VIEs themselves are sensitive to interfacial solvation, which is an especially relevant question for soft anions that are known to partition preferentially at the air/water interface. Our calculations suggest that differences between bulk and interfacial VIEs are inconsequential, which we attribute to similarities in first-shell hydration structure in both environments. These striking similarities serve as a reminder that although the structure of the air/water interface may be modified by the presence of dissolved ions, the hydration shell around a given solute may or may not be different than what it is bulk aqueous solution. Whereas liquid microjet",Causal,Why are the solvation environments of various soft anions asymmetric both in bulk water and at the air/water interface?,Answer not available from the given context. ,Negative,"['Our results suggest that the solvation environments of various soft anions are asymmetric both in bulk water and at the air/water interface, leading to VIEs that are essentially indistinguishable.']","[[521, 942]]","['Probing Interfacial Effects on Ionization Energies: The Surprising Banality of Anion-Water Hydrogen Bonding at the Air/Water Interface Liquid microjet photoelectron spectroscopy is an increasingly common technique to measure vertical ionization energies (VIEs) of aqueous solutes, although the interpretation of these experiments is subject to questions regarding sensitivity to bulk versus interfacial solvation environments. Here, we compute aqueous-phase VIEs for a set of inorganic anions, some of which partition preferentially at the air/water interface, using a combination of molecular dynamics simulations and electronic structure calculations. The results are in excellent agreement with experiment, regardless of whether the simulation data are restricted to ions at the air/water interface or to those in bulk liquid water. Although the computed VIEs are sensitive to ion-water hydrogen bonding, we find that the short-range solvation structure is sufficiently similar in the bulk and interfacial environments that it proves impossible to discriminate between the two on the basis of the VIE, a conclusion that has important implications for the interpretation of liquid-phase photoelectron spectroscopy. More generally, analysis of the simulation data suggests that partitioning of soft anions at the air/water interface is largely a second (or third) solvation shell effect, arising from disruption of water-water hydrogen bonds and not from significant changes in first-shell anion-water hydrogen bonding.', 'in which GDS -3 Å and also GDS -5 Å is used to separate the bulk and interfacial regions. Results from an isotropic simulation in a cubic unit cell serve as a fixed point of reference for bulk aqueous solution, and in every case the peak position from the isotropic simulation matches exactly with the bulk-like part of the periodic slab data. For SCN -(aq), the peak of the VIE distribution is also exactly the same when the data are restricted to the interfacial region, no matter how narrowly defined, whereas for I -(aq) the interfacial VIE peak is shifted to 0.2 eV lower in energy in the interfacial region, for each of the three aforementioned definitions of the interfacial layer. That shift, however, is smaller than the width of either the bulk or the interfacial VIE distribution. We therefore conclude that interfacial VIE distributions are essentially indistinguishable from their bulk counterparts, for both I -(aq) and SCN -(aq).C. Analysis of Short-Range Structure. We have documented that two solvation shells of explicit water molecules is enough to provide converged VIEs when appropriate boundary conditions are employed, and that VIEs computed for anions at the air/water interface differ from their bulk counterparts (if at all) by a shift that is comparable to (or smaller than) the inhomogeneous broadening of the VIE distribution. This implies that any shift in the VIE for X -(aq) between the bulk and interfacial environments is hardly distinguishable from thermal fluctuations. Taken together with the rapid convergence of the VIE with respect to explicit water, this would seem to suggest that the short-range ion-water hydrogen bonding around X -(aq) might not be that different at the air/water interface as compared to the bulk aqueous environment. That hypothesis is explored in this section, by examining various structural parameters extracted from the MD simulations.Figure shows the time evolution of', ""exhibit significant surface propensity, the difference between isotropic and slab VIEs is 0.1 eV and 0.2 eV, respectively. Note that for I -(aq), experimental VIEs are reported corresponding to either of two different spin-orbit states of the ionized species. Calculations reported here do not include spin-orbit coupling so we use [VIE( 2 P 1/2 ) + 2 VIE( 2 P 3/2 )]/3 as an estimate of the spinorbit-free experimental VIE. Convergence tests in Fig. suggest that two solvation shells of explicit water molecules, with nonequilibrium Poisson boundary conditions, is sufficient to afford converged VIEs, even for multiply-charged anions. This observation strongly suggests that the electronic structure of these aqueous ions depends only on short-range interactions. The similarity between VIEs computed in isotropic versus slab simulations suggests, in turn, that the short-range ion-water interactions might be very similar in both environments. This hypothesis is investigated in Section 3 C. Before that, we dissect the matter of bulk versus interfacial VIEs in more detail by considering the full ensemble distribution of VIEs, for two different anions that exhibit surface propensities: I -(aq) and SCN -(aq).B. Bulk Versus Interfacial VIEs. We next consider how an ion's position relative to the interface impacts its VIE, focusing specifically on I -(aq) and SCN -(aq). Both ions exhibit significant surface propensity and have become canonical examples of surface-active ions. VSFG experiments demonstrate that"", ' and ultraviolet spectroscopy of small aqueous solutes have been demonstrated, there has been no systematic investigation of whether VIEs themselves are sensitive to the presence of the air/water interface; the only detailed studies concern the rather unique case of the hydrated electron. It is known that the VIE of liquid water is largely unaffected by dissolved ions, shifting by < 0.2 eV over an 8 M concentration range, and the VIE of I -(aq) is similarly unaffected by concentration. It is not yet known whether VIEs of aqueous ions are sensitive to the air/water interface or not.That issue is examined here by computing bulk and interfacial VIEs for 16 common inorganic ions for which experimental data (from liquid microjets) are available, using a combination of MD simulations and electronic structure calculations. Long-range polarization makes a significant contribution to VIEs in water, and we incorporate this effect via dielectric continuum boundary', 'in bulk and interfacial VIEs result from similarities in the short-range hydration environment. Our results are therefore consistent with the presumed surface-sensitivity of liquid microjet photoelectron spectroscopy, but also reveal that these values can likely be taken seriously as VIEs for bulk aqueous solutes. The latter are important parameters for the solution-phase theory of electron transfer. Observed similarities in the solvation structure of bulk versus interfacial anions sets up another interesting conundrum, namely, how to reconcile these observations with shifts in the O-H stretching band of water are detected (using surface-selective vibrational spectroscopy) when soft ions are present at the air/water interface. Our results suggest that this is likely a second-shell (or possibly third-shell) solvation effect, resulting from subtle changes in the network of waterwater hydrogen bonds that are induced by the presence of the ion, rather than resulting directly from changes in ion-water hydrogen bonds at the interface. The surface sensitivity of soft anions is itself known to be a rather subtle effect, difficult to ascribe to changes in any single energetic term in the interaction potential, and at least partly driven by entropic considerations. The present work supports the idea that surface activity is']","['Quantum and theoretical chemistry', 'Theoretical methods']",2749,1,1,0,0.75671455,1.278844965,['why']
"IntroductionRecent joint advances in computational and experimental methods for synthesizing nitride materials have led to a rapid increase in the number of known ternary nitride phases. Unlike ordered and stoichiometric compounds, alloys represent a continuous compositional space. Isostructural alloys -solid solutions of two or more materials with the same underlying crystal structure -are the most common types of functional alloys. Iso-structural alloys as electronic materials have applications in photovoltaics (e.g., II-VI materials such as CdSe x Te 1-x and III-V-based multijunction technologies ), energy storage (e.g., Li 6 PS 5-x Se x (Cl,I), Li 3 Y 1-x In x Cl 3 ), and thermoelectrics (e.g., PbSe x Te 1-x 9 ), etc. Heterostructural alloys, in contrast, form between materials with different structures, such as alloys between wurtzite AlN and rocksalt ScN, wurtzite ZnO and rocksalt MnO, and orthorhombic SnS and rocksalt CaS. Beyond their functional properties, they also exhibit interesting thermodynamics of mixing not observed in their isostructural counterparts. Due to their exceptional optoelectronic, charge transport, and electromechanical properties, a large class of polar wurtzite AlN-based alloys is already enabling light emitting diodes (isostructural Al 1-x Ga x N ) and electromechanical resonators",Causal,Why do heterostructural alloys exhibit interesting thermodynamics of mixing not observed in their isostructural counterparts?,Answer not available from the given context. ,Negative,"['Heterostructural alloys, in contrast, form between materials with different structures, such as alloys between wurtzite AlN and rocksalt ScN, wurtzite ZnO and rocksalt MnO, and orthorhombic SnS and rocksalt CaS. ', 'Beyond their functional properties, they also exhibit interesting thermodynamics of mixing not observed in their isostructural counterparts.']","[[732, 1084], [732, 1084]]","['Synthesis and Calculations of Wurtzite Al 1-x Gd x N Heterostructural Alloys Al 1-x Gd x N is one of a series of novel heterostructural alloys involving rare earth cations with potentially interesting properties for (opto)electronic, magnetic and neutron detector applications. Using alloy models in conjunction with density functional theory, we explored the full composition range for Al 1-x Gd x N and found that wurtzite is the ground state structure up to a critical composition of x = 0.82. The calculated temperature-composition phase diagram reveals a large miscibility gap inducing spinodal decomposition at equilibrium conditions, with higher Gd substitution (meta)stabilized at higher temperatures. By depositing combinatorial thin films at high effective temperatures using radio frequency co-sputtering, we have achieved the highest Gd 3+ incorporation into the wurtzite phase reported to date, with single-phase compositions at least up to x ≈ 0.25 confirmed by high resolution synchrotron grazing incidence wide angle X-ray scattering. High resolution transmission electron microscopy 1 on material with x ≈ 0.13 confirmed a uniform composition polycrystalline film with uniform columnar grains having the wurtzite structure. Expanding our calculations to other rare earth cations (Pr and Tb) reveals similar thermodynamic stability and solubility behavior to Gd. From this and previous studies on Al 1-x Sc x N, we elucidate that both smaller ionic radius and higher bond ionicity promote increased incorporation of group IIIB cations into wurtzite AlN. This work furthers the development of design rules for new alloys in this materials family.', 'in AlN -such as bond ionicity -are underexplored. Given the recent interest in other AlN alloys for electrical and piezoelectric applications, as well as unique properties of Gd (such as possessing the largest known neutron capture cross section), Gd 3+ -substituted wurtzite AlN is an appealing material to study for possible functional applications.We describe here the first synthesis of Al 1-x Gd x N with Gd-cation fraction (x) at least up to ∼0.24 in a confirmed wurtzite structure. We present the results of our joint computational and experimental investigation into the solubility and stability of Gd 3+ in the AlN wurtzite structure. First-principles calculations of the mixing enthalpy reveal a high critical composition at which the ground state transitions from wurtzite to rocksalt. However, the calculated temperature-composition phase diagram indicates that high (effective) temperatures are needed to incorporate a large amount of Gd 3+ in a metastabilized wurtzite alloy with AlN. We confirm this experimentally by depositing combinatorial thin films of Al 1-x Gd x N with radio-frequency magnetron co-sputtering and performing structural and compositional characterization. Expanding our computational analysis to Pr 3+ and Tb 3+ allows us to elucidate the effects that govern the solubility of large 3+ cations in wurtzite AlN.', 'Thermodynamics of Al 1-x Gd x N AlloysWe calculated the thermodynamics of Al The ∆H m curves are obtained by fitting second-order polynomials to a set of data points computed at discrete x values. We find that wurtzite is the ground-state structure of Al 1-x Gd x N alloys up to a critical composition of x c = 0.82, beyond which the ground-state structure is rocksalt. We also considered a layered hexagonal-BN like structure of the alloys, but we find it to be energetically unfavorable as compared to the wurtzite and rocksalt structures over the full compositional range (Figure ). continuity in the spinodal line at x c is due to the incommensurate lattices of wurtzite and rocksalt, requiring a reconstructive phase transition. Beyond the unstable region is a region where single-phase alloys are metastable. The metastable region extends up to the binodal line, which can be obtained through the common tangent construction to ∆F m curves (not shown in Figure ). Above the binodal line, single-phase alloys are miscible and thermodynamically stable. We restrict our discussion to the unstable and metastable regions because accessible experimental conditions most likely fall within these regions.The large miscibility gap in the T (x) phase diagram at low temperatures (T < 1000 K)suggests that only small amounts of Gd can be alloyed with AlN under equilibrium conditions.Therefore, the key to synthesizing Gd-rich wurtzite Al 1-x Gd x N alloys is by accessing high (effective) temperatures under non-equilibrium conditions. Materials growth techniques involving highly energetic species such as sputtering, plasma-assisted growth, etc., can create non-equilibrium conditions with extremely high local effective temperatures. Such nonequilibrium growth techniques have been', 'in Al 1-x Yb x N. The use of the Yb pseudopotential, where the 4f electrons are treated as valence electrons, requires careful consideration of the magnetic ordering. We can conclude that a large family of M -rich wurtzite Al 1-x M x N heterostructural alloys can be realized at effective T that can be accessed with non-equilibrium growth techniques such as sputtering.', 'ConclusionHeterostructural alloys of wurtzite AlN and rocksalt M N are promising materials for a host of applications, including optoelectronic, ferroelectric, and neutron detection, among others.A fundamental understanding of the thermodynamics of alloy stability, phase transition, and solubility of M cations is, therefore, central to designing and optimizing Al 1-x M x N alloys. We have performed a joint computational and experimental study on the incorporation of Gd 3+ into AlN, creating a heterostructural alloy Al 1-x Gd x N between rocksalt GdN and wurtzite AlN. First-principles calculations using density functional theory in conjunction with SQS supercells reveal that the critical composition for a wurtzite to rocksalt phase transition is x c = 0.82. The calculated mixing free energy indicates that at equilibrium conditions and at temperatures below 1000 K, there is a large miscibility gap and only a few percent of Gd can be incorporated in AlN. Higher (effective) temperatures that can be accessed with non-equilibrium growth methods will enable higher Gd incorporation. By exploiting these non-equilibrium growth conditions experimentally via combinatorial RF co-sputtering, we have achieved significantly higher Gd concentrations in the wurtzite phase (x ≈ 0.25) than in previous thin film syntheses and therefore significantly expanded the range of alloys in this new materials system. Future growth optimization may be able to further increase the range of Gd that can be incorporated into AlN. Expanding our computational analysis to Pr 3+ and Tb 3+ , which show similar behavior to Gd 3+ , and comparing ionic size effects with electronegativity for all the cations that have been considered for substitution into AlN allows us to develop design rules for Al 1-x M x N alloys. We find that increased ionicity of the M -N bond aids in the substitution of larger M cations into wurtzite AlN, in which the']","['Advanced materials and nanotechnology', 'Nanomaterials']",2156,1,1,0,0.854152074,0,['why']
"Using BpyAla to generate Cu Artificial metalloenzymes: a catalytic and structural study Artificial metalloenzymes (ArMs) have emerged as a promising avenue in the field of biocatalysis, offering new reactivity. However, their design remains challenging due to the limited understanding of their protein dynamics and how the introduced cofactors alter the protein scaffold structure. Here we present the structures and catalytic activity of novel copper ArMs capable of (R)-or (S)-stereoselective control, utilizing a steroid carrier protein (SCP) scaffold. To incorporate 2,2'-Bipyridine (Bpy) into SCP, two distinct strategies were employed: either Bpy was introduced as an unnatural amino acid (2,2'-bipyridin-5-yl)alanine (BpyAla) using amber stop codon expression or via bioconjugation of bromomethyl-Bpy to cysteine residues. The resulting ArMs proved to be effective at catalysing an enantioselective Friedel-Crafts reaction with SCP_Q111BpyAla achieving the best selectivity with an enantioselectivity of 72% ee (S). Interestingly, despite using the same protein scaffold, different attachment strategies for Bpy at the same residue (Q111) led to a switch in the enantiopreference of the ArM.",Causal,Why did different attachment strategies for Bpy at the same residue lead to a switch in the enantiopreference of the artificial metalloenzyme?,Answer not available from the given context. ,Negative,"['Interestingly, despite using the same protein scaffold, different attachment strategies for Bpy at the same residue (Q111) led to a switch in the enantiopreference of the ArM.']","[[1024, 1199]]","[""Preparation of SCP-Cu artificial metalloenzymesThe steroid carrier protein type 2 like (SCP-2L) domain of the human multifunctional enzyme 2 (MFE-2) has previously been used as a protein scaffold for both regioselective and enantioselective reactions using covalent modification through the introduction of unique cysteine residues . A number of residues in the scaffold's apolar tunnel (V83, A100, Q111) have previously been identified as being amenable to mutation and modification . Their location along the apolar tunnel provides an ideal starting point for the introduction of bipyridine into the protein scaffold to create an active site within a protein pocket. Three different sterol carrier proteins, each containing a unique cysteine at position Q111C, A100C or V83C, were prepared as described previously . Briefly, pEHISTEV plasmids containing the SCP gene inserted after an N-terminal His6 tag with TEV cleavage site were transformed into Rosetta DE3 E. coli cells. His6-tagged proteins were expressed in production broth media and purified by Ni-affinity chromatography with the His6 tag subsequently removed using TEV protease; a further purification step by Ni-affinity chromatography gave the final proteins in good yields (20-70 mgL -1 of media). Bipyridine was introduced into the protein scaffold through bioconjugation of the cysteine residues with 10 equivalents of 5-bromomethyl-2,2'bipyridine 1 in HEPES buffer at pH 8 (Figure ). The optimal conversion was approximately 70-85% modified protein, with minimal secondary modification (<5 % secondary modification; the remaining mass balance is unreacted protein, see Figure and ESIa Fig. ).In comparison to"", ""explored to date, the most notable being the biotin-streptavidin (Sav) system . Bioconjugation of metal complexes via covalent attachment with unique reactive amino acid residues such as cysteine or azidophenylalanine is another widely used approach to prepare ArMs . In vivo ligand incorporation offers an attractive alternative where metal-binding unnatural amino acids such as (2,2'-bipyridin-5-yl)alanine (BpyAla) can be selectively introduced to the protein scaffold directly using genetic code expansion technologies, allowing for more streamlined enzyme engineering .Within these different approaches to ArM design, several scaffolds have been repeatedly used with various attachment strategies for transformation into novel catalysts. These scaffolds have been described as 'privileged' scaffolds, in a manner analogous with privileged ligands in homogeneous catalysis. The most prominent examples are the LmrR scaffold, which allows supramolecular, bioconjugation, and incorporation of unnatural amino acids 21 , and Sav, which has been explored in dative coordination , alongside the more common supramolecular approach . Despite these advances, few comparative studies have been conducted which included direct comparisons of the modification strategy for site-selective metal coordination. This makes it difficult to discern the role of protein modification upon ArM reactivity and predict the most effective route to ArM assembly for a desired application.The Kamer and Jarvis groups have extensively studied the human steroid carrier protein (SCP-2L) , a single-domain 13.5 kDa protein containing a hydrophobic tunnel, as a scaffold for ArM design. It has been exploited in the design of ArMs for"", 'Catalytic screeningThe catalytic activities of Bpy-containing SCP metalloenzymes were evaluated in the Cucatalysed Friedel-Crafts alkylation of 5-methoxy-1H-indole 3 with 1-(1-methyl-1H-imidazol-2yl)but-2-en-1-one 4, resulting in the product 5, the benchmark reaction for Cu(II) catalysis (Table ) . Enantioselective product formation was only observed in the presence of the Bpycontaining SCP-metalloenzymes. SCP ArMs with BpyAla showed a higher yield (42-45%) compared to the equivalent Cyscoupled Bpy SCP ArMs. Among the novel ArMs, SCP_Q111BpyAla displayed the greatest enantioselectivity with an e.r. of 20:80 (±1), favouring the S enantiomer, and a yield of 42% (Table , entry 9). The BpyAla moiety in this SCP ArM is situated at the centre of one side of the tunnel, in the middle of \uf061-helix 5 (Figure and 3A). By contrast, the ArMs with BpyAla situated at either end of the tunnel showed either no enantioselectivity in the case of SCP_A100BpyAla (Table , entry 7), or lower enantioselectivity with a preference for the R enantiomer (Table , entry 8). We hypothesise that the lower selectivity at the entries to the tunnel could be due to increased flexibility and space leading to less defined binding pocket, compared to position Q111 in the centre of the tunnel. While enantioselectivity towards the R enantiomer was observed with all three Cys mutants, it was limited with the best result observed for SCP_A100CBpy which gave a 66:34 ratio (Table , entries 4-6).Both enantiomers of 5 can be obtained in the Friedel-Crafts alkylation using SCP-ArMs with Bpy attached to residue 111, but by using different attachment strategies', 'ConclusionsUsing two different approaches to forming artificial metalloenzymes, a library of successful catalysts for the Cu-catalysed Friedel Crafts alkylation were obtained. Moderate activities and good enantiomeric ratios were observed with SCP_Q111BpyAla giving the highest e.r. of 14:86 in favour of the S enantiomer. In general, lower enantioselectivities were observed for the cysteine-modified catalysts and this is attributed to increased flexibility around the active site due to the additional S-CH2 linker. Changing from genetic incorporation of BpyAla at Q111 to bioconjugation of bipyridine through a cysteine, resulted in an unexpected change in the major isomer observed from S to R, albeit with a reduction in enantiomeric excess. This result is intriguing as a major challenge in enzyme catalysis is accessing the opposite product enantiomer. Crystallographic and computational studies confirm that changes in the structure of the active site led to the stabilisation of indole 3 on different sides of the bound enone 4, with the enantiomeric ratios observed correlating with the difference in the calculated transition state energies for the proR and proS SCP_Q111BpyAla and SCP_Q111CBpy Cu catalyst models. Based on these findings, future work should prioritize determining the most suitable modification method for the desired application of the ArM before proceeding with reaction screening and optimization, as subtle differences in protein structure can substantially change the stabilised transition state.The crystal structure obtained of SCP-Q111BpyAla_Cu is a rare example of a protein structure containing an unnatural amino acid. Our work shows that increasing our understanding of artificial metalloenzyme structures facilitates their development as catalysts, and moving forwards will be vital to enable future de novo design of metalloproteins.<figure xmlns=""http://www.tei-c.org/ns/1.0""', 'a hydrophobic tunnel, as a scaffold for ArM design. It has been exploited in the design of ArMs for selective hydroformylation using Rhphosphine organometallic complexes , which showed high activity and selectivity in the production of long chain linear aldehydes, under aqueous conditions. Moreover, engineering the scaffold for improved thermostability incurred a five-fold increase in TON compared to the wild type . This protein has also been used in ArMs for the selective oxidation of lignin model compounds , for enantioselective Cu-catalysed Diels-Alder reactions 24 , and artificial photoenzyme design . Other carrier proteins such as adipocyte lipid binding protein (ALBP) , ferric hydroxamate uptake protein component A (FhuA) , and maltose binding protein have been used in the design of ArMs suggesting that proteins with a carrier function may also serve as privileged scaffolds. In this work, the potential of SCP-2L to serve as a privileged protein scaffold is explored, through studying the copper-catalysed 1,4-addition of indole to enones. Bpy is a well-studied ligand for transition metals and is utilised in the coordination sphere of many catalytic complexes 29 . It can be introduced into a protein via the bioconjugation of maleimide or bromomethylbipyridines at cysteine residues (Figure ). Bpy is also one of very few metal ligands that has been incorporated into the genetic code by amber stop codon suppression. Here two methods for site-selective incorporation of bipyridine into the SCP-2L scaffold were compared, and the copper-catalysed 1,4-addition of indole to enones was used to analyse ArM activity. Differences in stereoselectivities were']","['Catalysis', 'Enzymatic catalysis']",1020,1,1,0,0.916102264,2.22E-16,['why']
"carboxylate functional groups in H3BTC, was 1.55 which is close to the expected stoichiometry of 2.0 between these species. Second, the ratio ""Free""-[Carboxy/CarbOxy]; referred to the quotient between the components ascribed to free carboxylate species, i. The calculated ratio was 0.57 which is close enough to the 0.5 ratio imposed by stoichiometry. The same kind of comparisons can be made for the rest of the ratios designated for the representative increased whereas the ratio between carbon and oxygen in the free carboxylates remained rather constant. On the other hand, the presence of surface species related to the formation of sulfate zirconium species and sulfonated organic moieties was evidenced (Table ) and the ratios between zirconium and sulfur (Zr-O-S/Zr-O-S) for the former and carbon and sulfur (C-S-O/O-S-C) for the latter estimated. The calculated value for the ratio Zr-O-S/Zr-O-S is close to the expected stoichiometric ratio of 2 in sulfated zirconia. Conversely, the value of the (C-S-O/O-S-C) ratio was fourfold higher than the one expected for sulfonated aromatic rings; ca. 0.17, hence suggesting that other kinds of carbon species are involved in this type of chemical bonding. According to these results, the modification process with sulfuric acid applied to the defective Zr-MOF synthesized herein causes a strong modification of the chemistry of the surface of the material. Furthermore, the chemical modification that it induces is far from being as selective as expected from works performed on fully crystalline Zr-MOFs since a mixture of zirconium sulfates, sulfonated organic moieties, and even free sulfur species were present at the surface of ZrBTC-114.6-S. The susceptibility of the surface of ZrBTC-114.6 to a chemical attack by sulfuric acid is coherent with the aforementioned changes in its thermal stability, porous structure,",Causal,Why does the modification process with sulfuric acid cause a strong modification of the chemistry of the surface of ZrBTC-114.6-S?,Answer not available from the given context. ,Negative,"['According to these results, the modification process with sulfuric acid applied to the defective Zr-MOF synthesized herein causes a strong modification of the chemistry of the surface of the material. ', 'Furthermore, the chemical modification that it induces is far from being as selective as expected from works performed on fully crystalline Zr-MOFs since a mixture of zirconium sulfates, sulfonated organic moieties, and even free sulfur species were present at the surface of ZrBTC-114.6-S.']","[[1209, 1409], [1410, 1875]]","['Synthesis and modification of zirconium-tricarboxylate MOFsThe solvothermal synthesis of Zr-MOFs was carried out in a 25 mL screw-capped glass jar by heating solutions containing the zirconium salt, the organic linker, and a modulator. ZrOCl2•8H2O (0.2417 g, 0.75 mmol) and the corresponding quantity of modulator were dissolved in 4 mL of dimethylformamide and stirred for 15 min. Trimesic acid (0.0525 g, 0.25 mmol) was dissolved in 4 mL of DMF and added dropwise to the initial solution. The mixture was stirred for additional 10 min. Later on, the mixture was sonicated for 20 min. Subsequently, the mixture was sealed and heated to 108° for 24 h. The as-synthesized Zr-MOFs were filtered and washed once with DMF and twice with both methanol and acetone. The resulting powder was dried at 80°C for 2 h. A selected Zr-MOF was post-synthetically modified adapting the procedure presented by Jiang et al. . Briefly, 50 mg of the synthesized material was treated with 50 mL of 0.05 M sulfuric acid (2.5 mmol) for 24 h. After that, the solution was solvent exchanged with 50 mL of water for three days; with the water being changed once a day, quickly exchanged with 50 mL of acetone and immersed in 50 mL of chloroform for three days. During this time, chloroform was exchanged once per day. Finally, all the synthesized materials were activated overnight at 110 °C under a vacuum pressure of 0.05 mbar. The nomenclature used for the materials followed the convention: ZrBTC-concentration of the modulator. For example, the sample synthesized with 114.6 equivalents of acetic acid; calculated on the basis of zirconium precursor, was denoted as ZrBTC-114.6. Assessment of the physicochemical properties of the materials', 'Table 2 .2C 1s, O 1s, Zr 3d, S 2p and N 1s peaks contributions concentration for ZrBTC-114.6 and ZrBTC-114.6-S materials. The species are coded as C-Ar: Carbon belonging to an aromatic ring, Ar-(C-O)-Zr, C-NH3: Carbon from the carboxylic acid group linked to the Zr cluster, Ar-Carboxy: carbon belonging to the carboxylic acid group of H3BTC, Aliph-Carboxy: Carbon from the carboxylic acid group linked to an aliphatic chain. Zr-O: oxygen linked to Zr in the inorganic cluster, R-(C=O)-OH: oxygen belonging to a carboxylic acid functional group, C-O-Zr: oxygen belonging to the C-O-Zr bonds. Zr-O: zirconium belonging to the inorganic cluster and, Zr-O-C: zirconium coordinated to an organic group through oxygen. For sulfated sample additional species are noted as C-S-O: Carbon belonging to the sulfonic group, Zr-O/ S-O, oxygen belonging to zirconium oxo-cluster or sulfate group, Zr-O-S, zirconium linked to the sulfate group and the sulfur species: S-O-Zr, O-S-C and S free that corresponds to sulfur belonging to the sulfate group, to the aromatic sulfonation and free sulfur, respectively.The decomposition of the C 1s, O1s, Zr 3d, N 1s, and S 2p peaks recorded for samples ZrBTC-114.6 and ZrBTC-114.6-S are displayed in Figure11. In general, strong peak widening was observed on all the high-Sample Table 3 .3Estimated molar ratios for the chemical species of ZrBTC-114.6 and ZrBTC-114.6-S MOFs.', 'CrystallinityAfter the post-synthetic modification process, the crystallinity of the treated material decreased by ca. 37% (Figure ). Indeed, almost all the peaks displayed by ZrBTC-114.6 disappeared from the diffractogram except for the one assigned to the (2 2 2) plane. This trend, along with the changes found for the thermal stability and porous structure of ZrBTC-114.6-S, suggests that the material was chemically attacked by sulfuric acid during PSM. In this regard, Trickett et al. determined that sulfate groups in MOF-808 are coordinated in both a bridging and chelating mode to the zirconium nodes in a similar fashion to previously reported sulfated zirconia .Scheme 1 Proposed structure of the sulfated material. The defective structure seems to be interconnected from the external surface to the second microporous distribution. However, the first microporous distribution seems to be isolated MOFs synthesized from high-valent metal ions such as zirconium and carboxylate ligands had been reported as stable materials in aqueous acidic conditions , nonetheless. It thus seems that the same cannot be said for defective microporous/mesoporous Zr-MOFs as those presented herein. One may argue that the defects of the material promote the degradation of their inner crystalline structure during the PSM process due to a competition between protons and metal ions for the coordination with the organic ligands . Furthermore, there is the probability that an additional sulfonation of the aromatic ligands may occur. In this sense, Hajipour et al. reported the sulfonation of aromatic', 'Molecular structureFTIR spectra for ZrBTC-114.6-S is shown in Figures 5 and Figure . As shown in Figure , after the post-synthetic modification process, the characteristic functional groups of the current Zr-MOFs were preserved. However, a decrease in the intensity of the bands assigned to the coordinated acetates was observed. Conversely, an additional band from 1000 to 1200 cm -1 was recorded for ZrBTC-114.6-S, Figure . This band was assigned to sulfate functional groups. Jiang et al. found evidence for metal-bound sulfate groups with bands observed between 800 and 1500 cm -1 in the spectra of sulfated MOF-808. On the other hand, Chen et al. obtained sulfonic acidfunctionalized MOFs and reported bands for the symmetric and asymmetric stretching modes of O=S=O at 1137 and 1294 cm -1, respectively. Therefore, FTIR spectra recorded for ZrBTC-114.6-S support the hypothesis of a chemical attack of the structure of the material leading to both sulfation and sulfonation.Fig. . Infrared spectra zoom-in between 1800 and 400 cm-1 of synthesized MOFs ZrBTC-114.6 before and after the PSM. Surface chemistryThe surface chemistry of the sulfated material was assessed by XPS and by the adsorption of pyridine.', 'Figure 9 (9Figure 9 (a)Argon adsorption-desorption isotherms of MOF ZrBTC-114.6 without and with PSM, in all range of the linear P/Po. (b) χ-method adsorption/desorption isotherms of the same materials. e. [(Ar-Carboxy)+Aliph-Carboxy]/[R-(C=O)-OH], was 0.63 which is also close enough to a stoichiometric ratio of 0.5 representative of the proportion between the carbon and oxygen atoms participating in a carboxylic acid functional group. Third, the [Ar-(C-O)-Zr]/[Ar-(C-O)-Zr, C-NH3] ratio; representing the proportion between zirconium and carbon in a coordinated cluster, corresponds to the quotient: [Ar-(C-O)-Zr]/{[Ar-(C-O)-Zr]-[2×C-NH]} where the contribution from the organic nitrogen species was subtracted after decomposing the N 1s peak. the synthesized Zr-MOF. After PSM, the molar ratios for the carbon atoms of the aromatic ring of H3BTC and those of the carboxylate functional groups in H3BTC (C-Ar/Ar-Carboxy), the zirconium and carbon ([Ar-(C-O)-Zr]/[Ar-(C-O)-Zr,C-NH3]) and oxygen ([Ar-(C-O)-Zr]/[Ar-(C-O)-Zr]) in a coordinated cluster, and the zirconium and oxygen (Zr-O/Zr-O) in the inorganic moieties of the studied MOF decreased. Meanwhile, the ratio between carbon and oxygen implicated in the organic coordinated zirconium clusters ([Ar-(C-O)-Zr]/[Ar-(C-O)-Zr])']","['Metal organic frameworks', 'Catalytic applications']",1307,1,1,0,0.943985907,0,['why']
"Figure 2 .2Figure 2. 2D conformational free energy surface (kcal mol -1 ) for the puckering of -1 ring in BMA at the active site of wild-type hLAMAN. Black points represent the possible conformations that the -1 ring in BMA could visit. Figure 3 .3Figure 3. (A) Defined collective variables CV1 (d1-d2, Å) and CV2 (d3-d4, Å) and (B) 2D-free energy surface for the catalyzed reaction by wild-type hLAMAN (DFTB3/ff19SB, kcal mol -1 ). The MFEP is indicated with black dots. (C) Detail of the structures of the enzyme-reactant (ER), enzyme-transition state (ETS), and enzyme-product (EP) complexes identified via Nudged Elastic Band method xTB/ff19SB, kcal mol -1 ). Distances d2 and dOn-C1' (Å) are highlighted, as well as the puckering conformation of BMA sugar -1 ring. Figure 4 .4Figure 4. (A) 2D-free energy surface (kcal mol -1 ) for the puckering of -1 ring in BMA at the active site of D74E hLAMAN at the same level of theory (DFTB3). (B) 2D-free energy reaction surface (kcal mol -1 ) for the catalyzed reaction by D74E-LAMAN mutant. (C) Detail of the NEB-optimized geometries of wildtype and D74E ER complexes. Position 74 labels are underlined. The octahedral Zn 2+ -coordination sphere ligands and the dihedral angle  ( o ) are highlighted with dotted black lines. The exchanged ligands from wild-type to D74E are shown as blue bold lines.",Causal,Why are the ligands exchanged from wild-type to D74E shown as blue bold lines?,Answer not available from the given context. ,Negative,"['The octahedral Zn 2+ -coordination sphere ligands and the dihedral angle \uf065 ( o ) are highlighted with dotted black lines. ', 'The exchanged ligands from wild-type to D74E are shown as blue bold lines.']","[[1153, 1274], [1275, 1349]]","['and Section S3). We ran a QM/MM metadynamics to explore the conformational free energy landscape (FEL) of the -1 ring in BMA in the ER complex. As collective variables we defined the periodic Cremer-Pople puckering coordinate \uf06a between 0 and 2\uf020\uf070 (CV1), and the non-periodic angle \uf071 between 0 and \uf070 (CV2). We found that the minimum of energy is located around an E5 conformation separated by 1-2 kcal mol -1 with the conformations 4 H5 and O H5. Other explored conformational regions show a local minimum in the 1 S3 space being 3 kcal mol -1 less favorable than the E5. The expected O S2 conformation reported to be the initial structure in GMII, is not energetically favorable in our case. The E5 conformation is in good agreement with the conformation of the -1 ring in mannose found in the experimental complex with the Golgi alpha-mannosidase II D341N acid-base catalyst mutant (PDB id. 3BUP, φ = 309º, θ = 54º, Q = 0.56). Furthermore, the E5 conformation has also been found in the crystal structure of the Michaelis complex for another metal-dependent α-mannosidase (GH92).  The accepted rate-limiting step of the hydrolytic mechanism of the family GH38 (i.e. GMII) implies the formation of a covalent glycosyl enzyme intermediate in a first step called glycosylation as shown in Figure . In hLAMAN, Asp196 acts as the nucleophile and Asp319 as the general acid/base catalyst. hLAMAN is a retaining glycosidase, so the released product (+1 ring) retains the absolute configuration on the anomeric', ""glycosidase, so the released product (+1 ring) retains the absolute configuration on the anomeric carbon. We defined two collective variables (CV1 and CV2) for the reaction mechanism (Figure ). CV1 is composed by the difference between d1 (distance between the center-of-mass -COM-of the carboxylic oxygen atoms in Asp319 and the proton Ha on the same residue) and d2 (distance between the former Ha atom and the glycosidic oxygen Og in BMA). CV2 is defined as the difference between d3 (distance between the Og oxygen of the +1 ring and the former C1' of the -1 ring) and d4 (distance between the anomeric carbon C1' and the COM of the carboxylate oxygen atoms in Asp196). In Figure , are shown our definition of CVs and the 2D-free energy landscape of the catalyzed reaction by the wild-type enzyme. The black line specifies the minimum free energy pathway (MFEP). The ER complex evolves to the EP complex via a transition state (ETS) with an QM/MM energy barrier ∆G ‡ of 7.2 kcal mol -1 . These energies were computed with DFTB3, a method that underestimates the energy barrier of the reaction. Thus, we recomputed the ETS for this reaction using the Nudged Elastic Band method (NEB) with GFN2-xTB (see Section S5). This DFT-semiempirical method includes dispersion corrections, something that was not present in the simulations with DFTB3. We obtained now an energy barrier of 19.8 kcal mol -1 , very close to the experimental value of the homologous enzyme GH38 from Aspergillus fischeri (activation energy barrier of 17.0 kcal mol -1 for the same substrate). In Figure , we show the structures of ER, ETS and EP"", 'CV1Additionally, the distances dHa-Og and dC1-On in the D74E ER complex slightly increase 0.12 and 0.08 Å, respectively (Table and Figure ). Overall, these changes in the Zn 2+ -coordination sphere and in the puckering of the reactant end up in significant increase in the energy barrier of the catalyzed reaction by the D74E variant. Furthermore, we wanted to look for other mutations on hLAMAN that may affect the conformation of the active site. To do this, we computed bond-to-bond propensities in the wild-type hLAMAN using the server ProteinLens to detect distal regions in the enzyme connected with the movement of the active site. In Figure and Table , we highlight the 50 residues identified to have a significant correlation with the active site within a 95 % quantile score. Interestingly, the algorithm detected two out of 26 known sequence positions related to catalytically-deficient hLAMAN variants: D159 and E402.Mutations in these positions drive to inactive variants (D159N and E402K) that, although they can fold and reach the lysosome, cannot process oligosaccharides. Visual inspection of our atomic model for wild-type hLAMAN indicates that the change D \uf0ae N on position 159 (at 10 Å from the active site) will prevent the dual interaction of the aspartic carboxylate with the amide hydrogens of A161 and A162 in the enzyme variant (Figure ). More critical is the change in position 402, where the introduction of a lysine residue in the position of a glutamic acid creates an electrostatic repulsion with the R403 amidinium group (located on the same helix) and a change in the orientation of the side chain of Q444, residue located close to one of', 'LAMAN (bLAMAN, PDB id. 1O7D) and Drosophila melanogaster Golgi alpha-mannosidase II (GM-II, PDB id. 3CZN) (see Figure and Section S1). The confidence obtained for the deeplearning model was extremely high for almost all residues in the structure of hLAMAN with exception of the N-terminal signal peptide (residues 1-49), which was thus removed in our simulations. We placed the substrate \uf061-D-mannopyranose-(1-6)-\uf062-D-mannopyranose (BMA) at the active site and ran classical molecular dynamics (MD) simulations on the \uf06ds-time scale to equilibrate, solvate and refine this complex (see Section S2). We applied distance restraints to preserve the key interactions for catalysis between the substrate BMA and both Asp196 and Asp319 residues. After equilibration, we gradually removed these constraints until we got a unrestrained system. As an outcome, we selected one snapshot of the final equilibrated system and ran quantum mechanics/molecular mechanics (QM/MM) metadynamics during 170 ps (Figure and Sections S3-S). The QM region definition included the coordination sphere of Zn 2+ (Asp196, Asp74, His72, and His445 side chains starting from the \uf062-carbon), the BMA substrate, and the side chain of the acid/base catalytic Asp319 (87 atoms in total, Figure ). We treated the QM region with the semiempirical tight-binding density functional theory DFTB3. Before simulating the enzyme-catalyzed reaction mechanism, we screened the puckering of the ring at the subsite -1 (-1 ring) in BMA for the enzyme-reactant (ER) complex (Figure and Section S3). We ran a QM/MM metadynamics to explore the conformational free energy', ""may be an additional ETS conformation in GHs. Table . Relevant distances (Å), puckering (φ, θ), conformations (Conf.) of the BMA -1 ring, and calculated energies (kcal mol -1 ) obtained via NEB (GFN2-xTB/ff19SB) for the wild-type hLAMAN system. Prompted by our findings, we were committed to understand the effect of some of the missense mutations with significant impact on hLAMAN activity. This is the case of the D74E variant, where one extra methylene group is inserted into the side chain of this Zn 2+ -coordination sphere residue. First, we found out that the puckering of the reactive ring in BMA shows a different conformational energy profile than when bound to the wild-type counterpart (Figure vs Figure ). Now, the E5 conformation is energetically unfavorable towards a B2,5 conformation. We simulated the reaction mechanism for the same substrate BMA. We obtained a DFTB3 energy barrier of 12.3 kcal mol -1 , 5.1 kcal mol -1 (+75 %) larger than for the wild-type (Figure ). The height of the barrier increases up to a value of 37.3 kcal mol -1 via the NEB method (GFN2-xTB/ff19SB, Table vs. Table ). For this D74E variant, the observed mechanism follows the itinerary B2,5 → B2,5 → 1 S5. Looking in detail at the structures along the MFEP, the major changes respect to the wild-type counterpart are observed in the Zn 2+ -coordination sphere in the ER and ETS complexes. The introduction of one extra methylene in the side chain of the acid residue in position 74 pushes apart the 2'-OH of the BMA -1 ring from the Zn 2+ -coordination sphere (Figure ). Now, the two carboxylic oxygen atoms of E74 coordinate the ion metal. This has as impact the change on the puckering in the BMA -1 ring for""]","['Quantum and theoretical chemistry', 'Quantum effects']",2955,1,1,0,0.977996892,2.22E-16,['why']
"in Al 1-x Yb x N. The use of the Yb pseudopotential, where the 4f electrons are treated as valence electrons, requires careful consideration of the magnetic ordering. We can conclude that a large family of M -rich wurtzite Al 1-x M x N heterostructural alloys can be realized at effective T that can be accessed with non-equilibrium growth techniques such as sputtering.",Causal,Why can a large family of M-rich wurtzite Al 1-x M x N heterostructural alloys be realized using non-equilibrium growth techniques such as sputtering?,Answer not available from the given context. ,Negative,['We can conclude that a large family of M -rich wurtzite Al 1-x M x N heterostructural alloys can be realized at effective T that can be accessed with non-equilibrium growth techniques such as sputtering.'],"[[167, 370]]","['radii beyond La is due to the well-known ""lanthanide contraction."" La has the the largest ionic size mismatch with Al and therefore, we would expect the transition to the rocksalt phase to happen at the smallest x c . However, this is not the case (x c = 0.95), which indicates that the ionic size mismatch is not the primary factor. We have demonstrated in this work that Gd-rich Al 1-x Gd x N compositions can be metastabilized with highly non-equilibrium thin-film growth techniques. From Figure (c), we find x in Al that effective temperatures of 3000-4000 K are needed to metastabilize Al 1-x Gd x N compositions with x > 0.3. Such high effective temperatures can be achieved only with nonequilibrium growth e.g., by bombardment of highly energetic atoms/ions (sputtering). Since the solubility of group-3 element M in wurtzite AlN phase is temperature-dependent, we use 4000 K as the reference T to compare the predictions between different alloys. Like Gd, we find that Tb and Pr exhibit relatively high solubilities in wurtzite AlN, with x = 0.42 and x = 0.28 achieved at T = 4000 K, respectively (Figures ). In comparison, other studies have computationally predicted x = 0.25 for Al 1-x Sc x N 10 and x = 0.1 -0.15 for Al 1-x Yb x N 61 at T = 4000 K. It is not clear why Yb solubility is significantly lower compared to other group-3 elements. From a DFT calculation perspective, Yb is a particularly challenging f -electron element that exhibits mixed valence (Yb 2+ , Yb 3+ ); Yb_3 pseudopotential is not available with VASP distribution, and Yb_2 is a valid choice only when Yb exists predominantly as Yb 2+ , which is not the case in Al 1-x Yb x N. The use of the Yb pseudopotential, where the 4f electrons are treated as valence', 'Synthesis and Calculations of Wurtzite Al 1-x Gd x N Heterostructural Alloys Al 1-x Gd x N is one of a series of novel heterostructural alloys involving rare earth cations with potentially interesting properties for (opto)electronic, magnetic and neutron detector applications. Using alloy models in conjunction with density functional theory, we explored the full composition range for Al 1-x Gd x N and found that wurtzite is the ground state structure up to a critical composition of x = 0.82. The calculated temperature-composition phase diagram reveals a large miscibility gap inducing spinodal decomposition at equilibrium conditions, with higher Gd substitution (meta)stabilized at higher temperatures. By depositing combinatorial thin films at high effective temperatures using radio frequency co-sputtering, we have achieved the highest Gd 3+ incorporation into the wurtzite phase reported to date, with single-phase compositions at least up to x ≈ 0.25 confirmed by high resolution synchrotron grazing incidence wide angle X-ray scattering. High resolution transmission electron microscopy 1 on material with x ≈ 0.13 confirmed a uniform composition polycrystalline film with uniform columnar grains having the wurtzite structure. Expanding our calculations to other rare earth cations (Pr and Tb) reveals similar thermodynamic stability and solubility behavior to Gd. From this and previous studies on Al 1-x Sc x N, we elucidate that both smaller ionic radius and higher bond ionicity promote increased incorporation of group IIIB cations into wurtzite AlN. This work furthers the development of design rules for new alloys in this materials family.', 'of the M -N bond aids in the substitution of larger M cations into wurtzite AlN, in which the Al-N bond is highly polar and covalent. The combination of higher bond ionicity and experimental access of non-equilibrium growth conditions provides a path forward for designing other heterostructural alloys within this family.Figure S2(a) and S2(b) respectively show the band structures of GdN computed with Gd pseudpotential', 'has showed that Er 3+ and Yb 3+ , much larger cations than Sc 3+ , were substituted successfully at x = 0.015 and up to x ≈ 0.15, respectively. In GaN, Yb 3+ can incorporate up to x ≈ 0.3, consistent with the larger radius of Ga 3+ (∼0.47 Å). Incorporating small amounts of Gd 3+ (∼0.94 Å) into wurtzite AlN and GaN has been investigated primarily for optoelectronic applications such as cathodoluminescence and fieldemission devices, given the sharp ultraviolet emission of Gd 3+ at approximately 320 nm and the AlN host lattice as an established optoelectronic material. While most studies utilized ion implantation, direct Gd 3+ substitution has been attempted with radio-frequency (RF) magnetron sputtering and molecular beam epitaxy (MBE) growth, yielding phasepure substitution up to x ≈ 0.06 by sputtering and reported incorporation at x ≈ 0.13 by MBE, although it is unclear if a phase-pure wurtzite structure is maintained up tox ≈ 0.13. In addition to the intriguing optical properties, there are indications that Gd 3+substituted AlN may display interesting and possibly functional magnetic properties. In addition to the limited synthesis space, the solubility, stability, and other properties of this alloy material -such as its electrical properties -have been relatively understudied. While ionic size effects are relatively straightforward, other variables that may affect solubility of large cations in AlN -such as bond ionicity -are underexplored. Given the recent interest in other AlN alloys', 'ConclusionHeterostructural alloys of wurtzite AlN and rocksalt M N are promising materials for a host of applications, including optoelectronic, ferroelectric, and neutron detection, among others.A fundamental understanding of the thermodynamics of alloy stability, phase transition, and solubility of M cations is, therefore, central to designing and optimizing Al 1-x M x N alloys. We have performed a joint computational and experimental study on the incorporation of Gd 3+ into AlN, creating a heterostructural alloy Al 1-x Gd x N between rocksalt GdN and wurtzite AlN. First-principles calculations using density functional theory in conjunction with SQS supercells reveal that the critical composition for a wurtzite to rocksalt phase transition is x c = 0.82. The calculated mixing free energy indicates that at equilibrium conditions and at temperatures below 1000 K, there is a large miscibility gap and only a few percent of Gd can be incorporated in AlN. Higher (effective) temperatures that can be accessed with non-equilibrium growth methods will enable higher Gd incorporation. By exploiting these non-equilibrium growth conditions experimentally via combinatorial RF co-sputtering, we have achieved significantly higher Gd concentrations in the wurtzite phase (x ≈ 0.25) than in previous thin film syntheses and therefore significantly expanded the range of alloys in this new materials system. Future growth optimization may be able to further increase the range of Gd that can be incorporated into AlN. Expanding our computational analysis to Pr 3+ and Tb 3+ , which show similar behavior to Gd 3+ , and comparing ionic size effects with electronegativity for all the cations that have been considered for substitution into AlN allows us to develop design rules for Al 1-x M x N alloys. We find that increased ionicity of the M -N bond aids in the substitution of larger M cations into wurtzite AlN, in which the']","['Advanced materials and nanotechnology', 'Nanomaterials']",2203,1,1,0,0.909446032,2.22E-16,['why']
"entropy, e.g., based only on the number of conformers N conf according to S conf ≈ R ln (N conf ). This approximation is used in some studies and is appealing due to its simplicity. However, while this formulation may be used for very simple molecules, it breaks down for more complex PES. Further discussion of this point is given in the Supporting Information.The sum in Eq. 8 is taken over all significantly populated, distinguishable structures representing a so-called generalized Boltzmann distribution. The problem of this procedure (also termed Gibbs-Shannon entropy based procedure) is that not only an almost complete conformer ensemble has to be found but additionally, it should be ""pure"", i.e., free of socalled rotamers. In this case for molecules with non-degenerate electronic ground states, all g i are unity. Rotamers are structures indistinguishable by any nuclear spin-independent quantum mechanical observable. They arise from rotation around covalent chemical bonds (or other inversion-type processes) that interchange nuclei belonging to the same group of nuclides, as for example the interchange of protons at a methyl group by rotation.In this work, we propose and implement for the first time an automatic algorithm that generates a theoretically proper ensemble of unique conformer structures required for the accurate computation of S conf . For the conformer search problem, we employ our recently described CREST program (abbreviated from Conformer-Rotamer Ensemble Sampling Tool), which is based on metadynamics simulations employing on-the-fly computed quantum mechanical tight-binding PES. We assume at this point that the conformer-rotamer ensembles (CRE) obtained from CREST are sufficiently complete and the",Causal,Why does the approximation of entropy based on the number of conformers break down for more complex potential energy surfaces?,Answer not available from the given context. ,Negative,"['This approximation is used in some studies and is appealing due to its simplicity. ', 'However, while this formulation may be used for very simple molecules, it breaks down for more complex PES.']","[[99, 181], [182, 289]]","['that the conformer-rotamer ensembles (CRE) obtained from CREST are sufficiently complete and the energies E i are accurate. If this is really the case for very flexible molecules (e.g. long alkanes) can be tested by comparison of computed and experimental entropies and heat capacities (see Sec. 4.2 and 4.3). Note that our approach works with any (on-the-fly computed) PES and hence, at least in principle, the errors introduced by the underlying method for the PES and the other approximations to the entropy problem could be decomposed.The CREST algorithms were originally developed to generate rotamer containing ensembles and the related nuclei-exchange information for the simulation of NMR spectra . Hence, it seems straightforward not only to identify rotamers, but to extend the algorithm to automatically compute the proper degeneracy number g i . However, as mentioned above, conformer ensembles (CE) must be free from the indistinguishable rotamers to be compatible with entropy calculations. Therefore, g i are treated as unity in the usual case.The only exception here are symmetrical molecules that can form ""enantiomeric"" (i.e., in principle distinguishable) conformers through rotation of bonds. A typical case is the gauche conformer of n-butane. These geometrical enantiomers are degenerate and would be falsely classified as rotamers in our previous implementation. Effectively, this introduces a factor of g i = {1, 2} instead of g i in the degeneracy, depending on if the formation of a geometrical enantiomer is possible. Our new apprach considers this problem for the first time in a correct and automated way. Inserting this into the standard entropy expression for degenerate states leads toS conf = R ln g i e -E i β + g i (E i β)e -E i β g i e -E i β .(10)The correct S msRRHO entropy is a population average over the', 'entropy S conf,est is determined. If no change (within a 2 % threshold) in S conf,est and the total number of unique conformers is observed, the final conformational entropy is calculated. Otherwise, a new iteration of 36 sMTDs is conducted using input structures and static bias structures determined from the updated ensemble. Furthermore, with each iteration the number of static bias structures is increased. This procedure is repeated until convergence is reached both with regards to S conf,est and the number of unique conformers in the ensemble. For the final calculation of S', 'Extrapolation to ensemble completenessFor very flexible systems (e.g. long alkanes), the number of accessible conformers Ω is roughly proportional to Ω ≈ 3 R , where R is the number of freely rotatable bonds (commonly associated with the number of sp 3 -sp 3 carbon single bonds). In principle, all conformers, i.e., the complete ensemble and the respective energies are required for the calculation of S conf but even for only moderately sized systems this number is prohibitively huge.Practically, the obtained ensemble quality depends mostly on the run time t of the (biased) molecular dynamics (MD) in CREST. Basically, it is the number of optimized snap-shot structures gathered over all runs and will converge to a complete CE with the length of the conformational search. On the other hand, the conformational entropy also exhibits predictable behavior with regard to increasing ensemble completeness. If the lowest energy conformer is known, adding higher-lying conformers to the ensemble can only increase the entropy. If many of the low-energy structures are already found, the entropy increase for additional states is smooth and it seems possible to extrapolate to completeness without explicit knowledge of all conformers. The pre-requisite for this is the generation of enough intermediate points, i.e., consecutive conformational ensembles with systematically improved quality. A smooth and continuous convergence of the entropy to its maximum value can only be observed if conformers are added consistently from all regions of the PES (see Sec. 4.2 for examples).In the implementation of the algorithm, information from incomplete CEs of consecutive iterations is used for an extrapolation of the entropy according toS conf (x) -S conf (0) = p 1 (1 -exp (p 2 x p 3 )) , (15<formula', 'and further anharmonicity effects mainly in the high-frequency part. The only two empirical parameters included are adjusted to reproduce experimental entropies for a benchmark set of mostly rigid molecules (see below). For better destinction this modified RRHO treatment is in the following denoted by S msRRHO (""s"" for scaled).The major aim of this work was to find a robust approximation to S conf which is already sigificant for medium flexible molecules (see section 4.4). We build upon the original idea of Gilson and co-workers termed ""minima mining"" or ""mixture of conformers"" strategy, which has later been applied to organic molecule entropy calculations by DeTar 31 and Guthrie .The basic formula readsS conf ≈ S mix = -R conf i p i ln p i(8)and approximates S conf by the conformer mixing entropy S mix summed over a conformer ensemble. The thermal populations p at absolute temperature T are given byp i = g i e -E i β g i e -E i β ,(9)where β = 1 kT , E i is the energy of the equilibrium structure of conformer i, and g i is a general state degeneracy. The conformational entropy depends on the level of theory through the calculated populations entering the Gibbs-Shannon entropy formulation in Eq. 8, which in turn depend directly on the equilibrium (free) energies. But also for other configurational entropy approaches, that are usually cited as being purely informational, there exists a bias towards the underlying method used for the generation of molecular structures, for example by MD simulations. This is especially problematic for very crude approximations of the conformational entropy, e.g., based only on the number of conformers N conf according to S conf ≈ R ln (N conf ).', 'better description of the PES. The modular partition of the absolute value into ro-vibrational and configurational parts enables a convenient replacement of the different methods, which provides a starting point for future studies. This also includes the extension to implicit solvation models that will allow to investigate molecular entropy differences between the gas-phase and solution or between different solvents.Molecular symmetry numbers are automatically determined for each conformer entering S msRRHO and should be also included in the DFT frequency evaluation. The few simple steps required for the calculation of the absolute entropy are 1. Run CREST in default mode on a starting structure to find the lowest conformer 2. Optimize the geometry of this conformer with DFT, compute the Hessian matrix from the DFT structure and use the HO vibrational frequencies to calculate S msRRHO 3. Run CREST in entropy mode on the lowest-energy conformer and employ the DFT reference structure for S msRRHO , resulting in S conf 4. Compute S = S msRRHO + S conf']","['Quantum and theoretical chemistry', 'Theoretical methods']",2536,1,1,0,0.880321928,1.11E-16,['why']
